"Speaker","Text","Page","speaker_id"
"Justus","Um uns zu täuschen. Um uns weis zu machen, die Kopie des Briefes sei gestohlen","10","2"
"Justus","worden. Und das war möglicherweise gar nicht der Fall.","10","2"
"Peter","Dann meinst Du also, den Mann mit der Sonnenbrille und dem schwarzen Bart hat es","10","3"
"Peter","gar nicht gegeben?","10","3"
"Justus","Wahrscheinlich nicht. Ich glaube, Mr.Rhandur aus Indien hat die Kopie des Briefes","10","2"
"Justus","Mr.Dwiggins abgekauft. Dwiggins durfte natürlich nicht verkaufen und deshalb hat er","10","2"
"Justus","versucht, uns zu täuschen.","10","2"
"Gus","Das klingt logisch Telephonklingeln Das würde auch erklären, warum Mr.Rhandur","11","-1"
"Gus","hierher kam. Er hat die Bedeutung der Botschaft entschlüsselt, daß ihm die","11","-1"
"Gus","Bedeutungen der Gipsfiguren klar wurde.","11","-1"
"Justus","Hach, das Telephon! Wieso geht Tante Mathilda nicht ran?","11","2"
"Peter","Vielleicht hört Sie's nicht.","11","3"
"Justus","Hach, ich geh' mal eben ran. Moment. Läuft zum Telephon/ -bimmeln","11","2"
"Justus","Hallo, Ja?","11","2"
"Mrs.Peterson","Hallo? Hier ist Mrs.Peterson. Ich wohne in Malibu Beach. Es tut mir leid, aber ich habe","11","-1"
"Mrs.Peterson","eine Reklamation. Gestern habe ich bei Ihrer Firma 2 Gipsbüsten als Gartenplastiken","11","-1"
"Mrs.Peterson","gekauft.","11","-1"
"Justus","Ja, bitte, Mrs.Peterson.","11","2"
"Mrs.Peterson","Nun ja, ich habe gemerkt, daß die Büsten keine Feuchtigkeit vertragen und das geht","11","-1"
"Mrs.Peterson","natürlich nicht. Es regnet ja schließlich auch ab und zu. Ich möchte sie zurückgeben.","11","-1"
"Justus","Wir erstatten Ihnen den Kaufpreis zurück, Mrs. Peterson. Darf ich fragen, welche","11","2"
"Justus","Büsten Sie gekauft haben?","11","2"
"Mrs.Peterson","So genau weiß ich das gar nicht. Musik setzt ein Aber ich glaube, eine ist August oder","11","-1"
"Mrs.Peterson","Augustus sowieso.","11","-1"
"Justus","Wir kommen sofort, Mrs.Peterson! Bitte, geben Sie mir die genaue Adresse!","11","2"
"Erzähler","Bob kehrte überraschend schnell von der Bibliothek zu der Zentrale der 3 Detektive","11","574"
"Erzähler","zurück. Er strahlte. Ihm war sofort anzusehen, daß er Erfolg gehabt hatte.","11","574"
"Bob","Hallo Freunde, da bin ich wieder!","11","4"
"REGIE","(Hin und wieder Papageiengekrächze)","11","0"
"Peter","Hallo Bob!","11","3"
"Bob","Denkt Euch, ich war nicht der Einzige, der etwas über das Feurige Auge lesen wollte.","11","4"
"Peter","Nicht der Einzige? Ja, wer war denn noch in der Bibliothek?","11","3"
"Gus","Schwarzbart mit Sonnenbrille!","11","-1"
"Justus","Hast Du ihn gesehen?","11","2"
"Bob","Nein, aber Mrs. Bennett, die Bibliothekarin, hat mir erzählt, daß er sich das Buch","11","4"
"Bob","ausgeliehen hat.","11","4"
"Justus","Vor Dir?","11","2"
"Bob","Natürlich vor mir. Er hat jetzt einen Vorsprung vor uns.","11","4"
"Allgemein","Oh! Verdammt!","11","-1"
"Bob","Das ist nicht mehr zu ändern. Leider.","11","4"
"Gus","Bob, was steht denn nun über das Feurige Auge in den Büchern?","11","-1"
"Bob","Hm, ich lese Euch mal am Besten vor, was ich aufgeschrieben habe.","11","4"
"Justus","Okay, aber nur das Wichtigste.","12","2"
"Bob","Das sowieso. Also raschelt mit Papier, also hört zu. Es gibt Edelsteine, die das Unheil","12","4"
"Bob","auf sich zu ziehen scheinen. Ein Besitzer nach dem anderen fällt dem Tod oder einer","12","4"
"Bob","Krankheit zum Opfer, Schicksalsschläge drohen, niemand ist vor ihnen sicher.","12","4"
"Gus","Hört sich ja schlimm an. So einen Stein möchte ich nicht.","12","-1"
"Peter","Kann ich verstehen.","12","3"
"Bob","Das Feurige Auge ist so ein Beispiel. Wenige, die es besaßen entgingen dem Unheil.","12","4"
"Bob","Bis der Stein schließlich als Zeichen der Muße von einem indischen Maharadscha","12","4"
"Bob","dem Tempel der Gerechtigkeit in dem entlegenen indischen Ort Pleshiva übergeben","12","4"
"Bob","wurde.","12","4"
"Gus","Ich sagte ja, wir sollten aufgeben.","12","-1"
"Bob","Ähm (raschelt), der Tempel der Gerechtigkeit ist das Heiligtum einer fanatischen","12","4"
"Bob","Gemeinde von Angehörigen eines kriegerischen Stammes. Das Kleinod wurde in die","12","4"
"Bob","Stirn der Tempelgottheit gesetzt. Dann kommt ein ganzer Roman über alles, was der","12","4"
"Bob","Stein kann und was er nicht kann.","12","4"
"Justus","Das müssen wir nicht unbedingt wissen.","12","2"
"Bob","Aber hier. Vor vielen Jahren verschwand der Stein auf geheimnisvolle Weise. Wo er","12","4"
"Bob","sich heute befindet, ist nicht bekannt. Obwohl die Gläubigen des Tempels der","12","4"
"Bob","Gerechtigkeit alles daran setzen, ihn wieder in ihren Besitz zu bringen. Gerüchte","12","4"
"Bob","behaupten, ein Tempeldiener habe den Stein herausgebrochen und verkauft. Viele","12","4"
"Bob","vermuten, daß der Stein mit den sterblichen Überresten jenes Mannes begraben","12","4"
"Bob","wurde, der ihn gekauft hat.","12","4"
"Justus","Irrtum!","12","2"
"Bob","Einer alten Legende zufolge soll das Feurige Auge geläutert sein und niemandem","12","4"
"Bob","mehr Unheil bringen, wenn es 50 Jahre lang ungesehen und unberührt blieb.","12","4"
"Bob","Allerdings muß es gekauft, gefunden oder geschenkt werden, es darf nicht geraubt","12","4"
"Bob","oder gestohlen sein. Diese 50 Jahre sind nun bald verstrichen. Das Risiko des","12","4"
"Bob","Fluches, der dem Stein nachgesagt wird Java-Jim-Musik setzt ein, würde auch heute","12","4"
"Bob","kaum ein Sammler auf sich nehmen.","12","4"
"Erzähler","Während Justus, Peter und Just nach Malibu Beach fuhren, um die Gipsbüsten von","12","574"
"Erzähler","Mrs.Petersen zu holen, erschien ein mittelgroßer Mann mit Sonnenbrille und Bart auf","12","574"
"Erzähler","dem Schrottplatz. Bob sah ihn kommen. Er erstarrte. Er wußte sofort, wen er vor sich","12","574"
"Erzähler","hatte.","12","574"
"Schwarzbart","Guten Abend, sind Sie Mrs. Jonas?","12","-1"
"Mathilda","Bin ich junger Mann. Was kann ich für Sie tun?","12","13"
"Schwarzbart","Ich interessiere mich für die Gipsbüsten. Haben Sie noch mehr davon?","12","-1"
"Mathilda","Das sind alle und als Gartenschmuck, kann ich sie Ihnen auch nicht verkaufen. Sie","12","13"
"Mathilda","lösen sich im Regen auf. Zwei müssen wir deshalb schon zurücknehmen.","12","13"
"Schwarzbart","Wirklich?","12","-1"
"Mathilda","Zwei kommen zurück. Und die anderen vielleicht auch.","12","13"
"Schwarzbart","Ich sammle solche Figuren. Ich möchte die fünf Ihnen abkaufen und alle, die noch","12","-1"
"Schwarzbart","zurückkommen. Sagen wir für 5$?","12","-1"
"Mathilda","Einverstanden! Aber sie könnten beschädigt sein, für den Fall, daß die Leute versucht","13","13"
"Mathilda","haben, sie abzuwaschen.","13","13"
"Schwarzbart","Das stört mich nicht.","13","-1"
"REGIE","Cassettenendemusik","13","0"
"Schwarzbart","Hier sind 35$ für diese fünf und die anderen zwei.","13","-1"
"Bob","Aber das geht doch nicht.","13","4"
"REGIE","Wagen fährt auf den Hof","13","0"
"Mathilda","Danke, die Büsten gehören Ihnen. Da kommt auch schon der Wagen mit den anderen","13","13"
"Mathilda","beiden Büsten.","13","13"
"Bob","Das sind doch ...","13","4"
"Mathilda","Was ist denn Bob? Was zappelst Du denn so rum?","13","13"
"Bob","Ich meine nur, Gus hätte gerne so eine Büste. Wo sie doch von seinem Großonkel","13","4"
"Bob","sind.","13","4"
"Mathilda","Zu spät, es sind alle verkauft.","13","13"
"Justus","Wir haben sie!","13","2"
"REGIE","Hundegebell","13","0"
"Schwarzbart","Das sind meine Büsten. Her damit!","13","-1"
"Justus","Kommt gar nicht in Frage! Wieso denn?","13","2"
"Schwarzbart","Weil ich sie gekauft und bezahlt habe.","13","-1"
"REGIE","Java-Jim-Musik setzt ein","13","0"
"Mathilda","Justus, was fällt Dir ein? Die Büsten gehören dem Herrn!","13","13"
"Justus","Nein!","13","2"
"Schwarzbart","Her damit!","13","-1"
"Justus","Ich gebe die Büste nicht ... ! Sie fällt zu Boden Oach!","13","2"
"Bob","Sie ist kaputt!","13","4"
"Mathilda","Jetzt hast Du sie runtergeworfen!","13","13"
"Schwarzbart","Danke, das genügt.","13","-1"
"Gus","Der Stein! Er hat den Stein!","13","-1"
"Justus","Der Stein gehört uns!","13","2"
"Schwarzbart","(lacht): Irrtum! Ich habe sie soeben gekauft.","13","-1"
"REGIE","Autotür schlägt zu","13","0"
"Peter","Aber, wir dürfen ihn doch nicht so einfach wegfahren lassen!","13","3"
"Justus","Wir haben keine andere Wahl. Was sollen wir denn tun?","14","2"
"Mathilda","Das habt Ihr Euch selbst zu zuschreiben.","14","13"
"Justus","Eben, wir hätten Tante Mathilda was sagen müssen. Jetzt ist es zu spät. Er hat das","14","2"
"Justus","Feurige Auge und er gibt es bestimmt nicht wieder her.","14","2"
"Erzähler","Niedergeschlagen diskutierten Gus und die 3 Detektive, was nun zu tun war. Der","14","574"
"Erzähler","Junge aus England war überzeugt davon, daß sein Erbe verloren war. Außerdem","14","574"
"Erzähler","wurde das Unbehagen über den unheilbringenden Stein immer größer. Was war zu","14","574"
"Erzähler","tun? Gab es überhaupt noch eine Möglichkeit das Feurige Auge zu retten? Da","14","574"
"Erzähler","erschien plötzlich wiederum ein Auto auf dem Schrottplatz. Es hielt direkt vor den 4","14","574"
"Erzähler","Jungen.","14","574"
"Bob","Himmel, schon wieder Dreipunkt!","14","4"
"REGIE","Vogelgezwitscher","14","0"
"Peter","Das gefällt mir gar nicht!","14","3"
"Rhandur","Guten Abend. Ich habe mir das hier angesehen. Da! Das sind offensichtlich die Reste","14","-1"
"Rhandur","der Augustusbüste. Äh, hatte ich nicht darum gebeten, mich anzurufen, wenn sie","14","-1"
"Rhandur","zurückgegeben werden?","14","-1"
"Justus","Gewiß, doch ist sie jetzt leider zerbrochen.","14","2"
"Rhandur","Mich würde ungemein interessieren, wie das passiert ist. Besonders aufschlußreich","14","-1"
"Rhandur","finde ich diese kleine Höhlung hier. In der Büste war etwas verborgen. Hundegebell","14","-1"
"Justus","Ein Kunde ließ die Büste fallen und da ist sie kaputt gegangen. Er hat etwas vom","14","2"
"Justus","Boden aufgehoben. Ich weiß nicht, was es war.","14","2"
"Rhandur","Dieser Kunde, war das ein Mann mit einer großen Sonnenbrille und einem schwarzen","14","-1"
"Rhandur","Bart?","14","-1"
"Justus","Ja.","14","2"
"Rhandur","Und das Ding, was er aus den Scherben geholt hat, hat das etwa so ausgesehen?","14","-1"
"Bob","Der Stein!","14","4"
"Justus","Ja!","14","2"
"Rhandur","Ihr habt wahrscheinlich alle von dem Feurigen Auge gehört? Und Ihr wißt, welches","14","-1"
"Rhandur","schreckliche Schicksal sein Besitzer ereilt, hm? Ich möchte Euch etwas zeigen.","14","-1"
"REGIE","Musik setzt ein","14","0"
"REGIE","zieht die Klinge","14","0"
"Justus","Aber an der Klinge ist ja ... .","14","2"
"Rhandur","Das war unachtsam. Ich habe die Klinge nicht genug gesäubert. Blut ist nicht gut für","14","-1"
"Rhandur","solch feinen Stahl. Nun, ja. Was meint Ihr, wie sich Stahl und das Feurige Auge","14","-1"
"Rhandur","miteinander vertragen? Mal sehen. Ich lasse den Stein jetzt fallen. So. Plumpsen Und","14","-1"
"Rhandur","jetzt gebe ich ihm den Stahl.","14","-1"
"Bob","Sie beschädigen ja den Edelstein!","14","4"
"Rhandur","Sieh mal an. Das ist ja interessant. Was siehst Du?","14","-1"
"Justus","Der Rubin hat einen Kratzer. Doch Rubine sind härter als Stahl. Stahl dürfte den Stein","15","2"
"Justus","nicht ritzen.","15","2"
"Rhandur","Sieh mal an. Also bist Du doch nicht so dumm, wie Du tust.","15","-1"
"Justus","Der Rubin wurde angekratzt, weil er nicht echt ist. Es ist eine Imitation, eine","15","2"
"Justus","Nachahmung.","15","2"
"Rhandur","Genau. Diese Nachbildung habe ich dem Herrn mit dem schwarzen Bart","15","-1"
"Rhandur","abgenommen. Das echte Feurige Auge müßte also noch zu finden sein. Da es in einer","15","-1"
"Rhandur","August- oder Augustusbüste versteckt ist, muß bei den Figuren noch ein anderer","15","-1"
"Rhandur","August versteckt sein.","15","-1"
"Bob","Ein anderer August? Nein, bestimmt nicht.","15","4"
"Rhandur","Ich verlasse mich darauf, daß Ihr ihn findet. Ruft mich an, wenn Ihr ihn gefunden habt.","15","-1"
"Rhandur","Aber ich rate Euch, vergeßt es dieses Mal nicht wieder, sonst ... , denkt an","15","-1"
"Rhandur","Schwarzbart.","15","-1"
"REGIE","Steigt ins Auto, startet den Motor und fährt weg","15","0"
"Peter","Er hat Schwarzbart umgebracht und ihm den Stein abgenommen. Er hat kaltblütig","15","3"
"Peter","gemordet. Woher wußte er bloß so schnell, daß Schwarzbart ihn hatte?","15","3"
"Justus","Es wird immer geheimnisvoller und verzwickter. Warum steckt Mr.August den falschen","15","2"
"Justus","Rubin in die Büste des August von Polen? Hat man ihn betrogen? Hat er nicht","15","2"
"Justus","gemerkt, daß es ein falscher Stein war? Oder gibt es doch noch einen August, von","15","2"
"Justus","dem wir nichts wissen?","15","2"
"Bob","Natürlich, Justus, es gibt noch einen!","15","4"
"Justus","Wirklich? Wen denn?","15","2"
"Bob","Gerade ist es mir eingefallen: Octavian. Er war ein römischer Kaiser. Und der wurde","15","4"
"Bob","Augustus genannt. Als Mr.August schrieb: ""August ist der Hüter Deines Glücks! Meinte","15","4"
"Bob","er bestimmt Octavian. Denn nach ihm ist unser Monat August benannt.","15","4"
"Justus","Wir müssen Octavian suchen!","15","2"
"REGIE","Szenenübergangsmusik","15","0"
"Erzähler","Die 4 Jungen zogen sich in die Zentrale zurück, um über den Fall zu beraten.","15","574"
"Peter","Also, ich finde wir sollten uns mit dem Feurigen Auge nicht mehr abgeben. Ja, wenn","15","3"
"Peter","es um Mord geht, müssen wir Schluß machen.","15","3"
"REGIE","Papageingekrächze","15","0"
"Gus","Peter hat recht. Ich glaube nicht, daß ich das Feurige Auge noch haben möchte, selbst","15","-1"
"Gus","wenn wir es fänden. Ich bleibe lieber arm, als mit so einem Ungeheuer zu leben.","15","-1"
"Justus","Wir haben das Feurige Auge noch nicht gefunden. Also können wir auch nicht in","15","2"
"Justus","Gefahr sein. Oder jedenfalls noch nicht.","15","2"
"Peter","Wir sollten abstimmen. Ich bin dafür, daß wir den Fall nicht weiter bearbeiten. Wer","15","3"
"Peter","damit einverstanden ist, sagt ja.","15","3"
"Blacky","Ja, ja, ja, ja. Tote reden nicht. Tote reden nicht. Ja, ja, ja, ja.","15","608"
"Peter","Ruhe da oben. Du hast nichts zu sagen, Black. Also, Ihr wollt weiter machen?","15","3"
"Justus","Natürlich!","16","2"
"Peter","Na, dann sollten wie die Polizei anrufen und den Mord an Schwarzbart melden.","16","3"
"Justus","Wir haben keine Beweise. Und ohne Beweise glaubt man uns nicht. Erst muß man","16","2"
"Justus","Schwarzbart finden.","16","2"
"Peter","Also, was tun wir?","16","3"
"Bob","Telephonlawine. Wir lassen die Lawine rollen.","16","4"
"Justus","Gut.","16","2"
"Bob","Es müßte mit dem Teufel zugehen, wenn wir auf diese Weise Octavian nicht finden.","16","4"
"Justus","Einverstanden. Wir fangen sofort an. Wer will zuerst?","16","2"
"Peter","Fang Du ruhig an, Justus.","16","3"
"Justua","Also gut, dann los.","16","2"
"REGIE","Telephonscheibe dreht sich","16","0"
"Erzähler","Die Telephonlawine rollte. Justus, Peter und Bob wußten allerdings aus Erfahrung,","16","574"
"Erzähler","daß erst am nächsten Tag mit Ergebnissen zurechnen war. Justus und Peter","16","574"
"Erzähler","beschlossen zum Haus von Mr.August im Mittagscanyon zu fahren, während Bob die","16","574"
"Erzähler","Telephonwache übernahm.","16","574"
"REGIE","Telephonläuten","16","0"
"Bob","Na, also. Hebt ab 3 Detektive, Bob Andrews am Apparat.","16","4"
"Tommy","Hallo?! Hier ist Tommy Farrell, ich habe eine Neuigkeit für Euch. Meine Schwester hat","16","-1"
"Tommy","im Altwarenhandel Jonas ein Figur gekauft, die steht jetzt im Garten.","16","-1"
"Bob","Was für eine denn? Ist es Octavian?","16","4"
"Tommy","Nein, nicht Octavian. Es ist Bismarck. Nützt Euch das was?","16","-1"
"Bob","Dank Dir schön, Tommy. Wir suchen nun mal Octavian. War aber nett, daß Du","16","4"
"Bob","angerufen hast.","16","4"
"Tommy","Gern geschehen.","16","-1"
"Bob","Schade, das war nichts. Ich werde mir jetzt mal aufschreiben, was ich über den Fall","16","4"
"Bob","""Feuriges Auge"" weiß.","16","4"
"REGIE","Spannt Papier in die Schreibmaschine, tippt,","16","0"
"REGIE","es klingelt","16","0"
"Bob","Ach! Hebt ab 3 Detektive, Bob Andrews am Apparat?!","16","4"
"REGIE","Musik setzt ein","16","0"
"Lisa","Bob? Bob Andrews? Ihr interessiert Euch doch für eine Büste von Octavian, oder?","16","48"
"Bob","Ja, genau die suchen wir.","16","4"
"Lisa","Meine Mutter hat sie. Sie wollte sie im Garten aufstellen. Aber jetzt meint sie, das Ding","16","48"
"Lisa","würde doch recht komisch aussehen. Sie sagt, sie würde sie einem Nachbar","16","48"
"Lisa","schenken.","16","48"
"Bob","Darf sie nicht, Du mußt eingreifen. Die Firma Jonas legt wert auf einen erstklassigen","17","4"
"Bob","Kundendienst. Wir kommen sobald wie möglich zu Euch und geben Deiner Mutter das","17","4"
"Bob","Geld zurück. Ich bring' Euch eine andere Figur mit, vielleicht gefällt Euch die besser.","17","4"
"Lisa","Gut, einverstanden.","17","48"
"Bob","Gib mir mal bitte Eure Adresse.","17","4"
"Lisa","Gut, schreib' auf!","17","48"
"Erzähler","Bob wartete auf Justus, Peter und Gus. Aber die kamen und kamen nicht. Daher faßte","17","574"
"Erzähler","Bob den Entschluß, die Octavianbüste allein zu holen. Mr.Jonas erlaubte Bob mit","17","574"
"Erzähler","Patrick, einem der Angestellten der Firma Jonas, in dem kleinen Laster der Firma","17","574"
"Erzähler","loszufahren. Auf der Fahrt drehte Bob sich immer wieder um. Bemerkte in dem","17","574"
"Erzähler","außerordentlich dichten Verkehr jedoch keine Verfolger.","17","574"
"REGIE","Lastwagenrattern","17","0"
"Bob","Hier ist es, Patrick.","17","4"
"Patrick","Wurde auch Zeit. Wir sind schon seit einer Stunde unterwegs. Ich nehme die Francis","17","81"
"Patrick","Bacon-Büste, die Du der Dame im Tausch anbieten willst.","17","81"
"Bob","Danke.","17","4"
"REGIE","Steigen aus, Türenklappern","17","0"
"Patrick","Da kommt schon jemand. Wir wurden also erwartet.","17","81"
"Lisa","Hallo, hallo! Bist Du Bob Andrews von den Detektiven?","17","48"
"Bob","Ja, ich bin Bob Andrews.","17","4"
"Lisa","Und Du bist hinter der Octavianbüste her? Dahinter steckt etwas Ungewöhnliches.","17","48"
"Lisa","Wahrscheinlich ein Geheimnis, nicht wahr?","17","48"
"Bob","Na ja.","17","4"
"Lisa","Mit Mühe und Not konnte ich meine Mutter davon abhalten, Octavian abzugeben.","17","48"
"Bob","Du hast sie also noch?","17","4"
"Lisa","Na ja, schließlich habe ich meiner Mutter erklärt, daß Octavian aus gefährlichem","17","48"
"Lisa","radioaktivem Material besteht. Und das Ihr vom Geheimdienst seit und ihn","17","48"
"Lisa","sicherstellen müßt. Kommt mit! Meine Mutter ist im Garten.","17","48"
"Bob","Danke. (Schritte)","17","4"
"Lisa","Hier, hinter dem Haus. Mutti? Das hier ist einer der 3 Detektive, von denen ich Dir","17","48"
"Lisa","erzählt habe. Er will die gefährliche Octavianbüste sicherstellen.","17","48"
"Mutter","Ach, nehmt Lisa bloß nicht ernst! Sie lebt in ihrer eigenen Welt der Spione. Ich glaube","17","49"
"Mutter","ihr kein Wort davon, daß Octavian radioaktiv ist, aber er macht sich hier wirklich nicht","17","49"
"Mutter","gut.","17","49"
"Bob","Ich nehme ihn gern zurück. Octavian wurde gewissermaßen aus Versehen verkauft.","17","4"
"Bob","Wenn Sie dafür gerne eine andere Büste hätten, können Sie Francis Bacon haben.","17","4"
"Bob","Das ist er.","17","4"
"Mutter","(lacht) Nein, nein, danke.","17","49"
"Bob","Dann zahlen wir Ihnen das Geld zurück. knistert mit Geld Hier sind 5$.","18","4"
"Mutter","Das ist wirklich sehr anständig. Ihr könnt Octavian mitnehmen.","18","49"
"Bob","Kannst Du beide Büsten tragen, Patrick?","18","4"
"Patrick","Ich habe zwei Hände, dann werde ich auch zwei Büsten tragen können. Das ist doch","18","81"
"Patrick","kinderleicht. So, und was jetzt?","18","81"
"Bob","Wir tragen Octavian heraus und packen ihn in den Karton. Gut verschnürren müssen","18","4"
"Bob","wir ihn auch.","18","4"
"Lisa","Och, müßt Ihr denn schon wieder gehen? Ich bin nämlich noch nie einem richtigen","18","48"
"Lisa","Detektiv begegnet und ich möchte ihn am liebsten hundert Sachen fragen.","18","48"
"Bob","Na ja, Patrick, sei so nett, geh' schon mal voraus und pack Octavian ein. Ich komm'","18","4"
"Bob","gleich nach.","18","4"
"Patrick","Na klar, Bob.","18","81"
"Erzähler","Patrick ging zum Wagen zurück und verpackte eine der beiden Büsten im Karton.","18","574"
"Erzähler","Dann wartete er. Als Bob nach einigen Minuten noch immer nicht kam, ging Patrick in","18","574"
"Erzähler","den Garten und erinnerte ihn daran, daß Mrs. Jonas um Beeilung gebeten hatte. Bob","18","574"
"Erzähler","verabschiedete sich von der redseligen Lisa und stieg mit Patrick in den Wagen und","18","574"
"Erzähler","fuhr los. Weder Patrick noch er dachten daran (Musik setzt ein), nach hinten auf den","18","574"
"Erzähler","Wagen zu sehen. Hätten sie das getan, wäre ihnen fraglos aufgefallen, daß der Karton","18","574"
"Erzähler","mit der Büste verschwunden war. Ja, die Schwarzbart-Bande war aufmerksamer","18","574"
"Erzähler","gewesen als Bob und Patrick.","18","574"
"REGIE","Lastwagenknattern","18","0"
"Patrick","So, das hätten wir geschafft!","18","81"
"Bob","Justus, Peter und Gus sind auch schon da! Na, die werden Augen machen. Vielen","18","4"
"Bob","Dank, Patrick!","18","4"
"Patrick","Nichts zu danken, Bob.","18","81"
"Bob","Ich hol' Octavian von der Ladefläche. Ich kann ... nein, nein, das ist nicht wahr! So eine","18","4"
"Bob","Gemeinheit! Ich glaube es nicht! Nein, nein, nein!","18","4"
"Patrick","Was ist denn, Bob?","18","81"
"Bob","Der Karton ist weg! Man hat uns Octavian wieder geklaut!","18","4"
"Justus","(kommt mit den anderen angerannt): He, Bob, was ist denn los?","18","2"
"Bob","Ich hatte Octavian und jetzt ist er wieder weg!","18","4"
"Patrick","Das tut mir leid, Bob. Ich habe nichts bemerkt.","18","81"
"Bob","Schon gut, Du kannst nichts dafür. Ich hätte aufpassen müssen. Ich hätte Octavian","18","4"
"Bob","keine Sekunde aus den Augen lassen dürfen. Aber ich mußte ja unbedingt mit dieser","18","4"
"Bob","blöden Kuh reden.","18","4"
"Patrick","Wo soll ich die Figur hinstellen?","18","81"
"Bob","Stell sie da auf die Bank.","18","4"
"Patrick","Okay.","18","81"
"Bob","Es ist Francis Bacon. Für den Fall, daß die Dame ihn gegen Octavian eintauschen","19","4"
"Bob","wollte. Sag' mal, Just, wo wart Ihr eigentlich so lange?","19","4"
"Justus","Beim Haus im Mittagascanyon. Wir hatten eine unangenehme Begegnung mit den","19","2"
"Justus","Schwarzbärten.","19","2"
"Peter","He, kommt doch mal her!","19","3"
"Bob","Was ist denn, Peter?","19","4"
"Peter","(lachend): Kommt her und sagt mir, ob ich recht sehe!","19","3"
"Gus","Mensch! Das ist ja gar nicht Francis Bacon! Das ist ja Octavian!","19","-1"
"Bob","Was? Das gibt's doch gar nicht!","19","4"
"Gus","Doch! Es ist Octavian! Man hat Dir die falsche Büste geklaut!","19","-1"
"Bob","Patrick hat die falsche Figur eingepackt. Ich habe nicht mehr darauf geachtet und die","19","4"
"Bob","Diebe auch nicht. Sie haben die mitgenommen, die eingepackt war.","19","4"
"Peter","Kinder, das ist das Verrückteste, was ich je erlebt habe.","19","3"
"Justus","Einen Hammer, Patrick, einen Hammer. Wir müssen Octavian aufschlagen, dann","19","2"
"Justus","verstecken wir das Feurige Auge an einem sicheren Platz und gehen kein Risiko mehr","19","2"
"Justus","ein.","19","2"
"Patrick","Hammer? Auch das. Bitte schön. Hier ist einer.","19","81"
"Justus","Danke.","19","2"
"Peter","Seht doch mal! Da hat jemand ein Loch in den Schädel gebohrt. Etwas hineingefüllt","19","3"
"Peter","und das Loch wieder mit Gips gefüllt. Jetzt bin ich sicher, daß wir das Feurige Auge","19","3"
"Peter","haben.","19","3"
"Bob","Los, Just, schlag' zu!","19","4"
"Justus","Nichts tu ich lieber als das. Hau ruck.","19","2"
"REGIE","Die Büste zersplittert","19","0"
"Gus","Sie zerbricht!","19","-1"
"Bob","Da! Da ist eine kleine Holzdose.","19","4"
"Peter","Ich hab' sie. Hier Just, mach' Du sie auf. Du bist der Chef.","19","3"
"Justus","Danke, Peter.","19","2"
"Peter","Mach' sie auf, Just! Zeig' uns den Rubin, der 50 Jahre lang darin versteckt war.","19","3"
"Bob","Mach' schon!","19","4"
"Peter","Du, worauf wartest Du noch? Hast Du etwa Angst vor dem Fluch?","19","3"
"Justus","Nein. Die Dose erscheint mir nur nicht schwer genug. Aber, ich schraube sie auf.","19","2"
"Justus","Schraubt die Dose auf","19","2"
"Bob","Was ist drin? Nun zeig' doch schon!","19","4"
"Gus","Just, was ist es?","20","-1"
"Justus","Ein Zettel. Nichts weiter als ein Zettel Musik setzt ein Nichts weiter als ein Zettel.","20","2"
"Peter","Ja, und was steht drauf?","20","3"
"Justus","Mal sehen. Eine Botschaft: Du mußt tiefgründiger forschen. Nutze die Zeit.","20","2"
"REGIE","Szenenübergangsmusik","20","0"
"Erzähler","Gus und die 3 Detektive fanden keine Ruhe in dieser Nacht. Immer wieder mußten sie","20","574"
"Erzähler","über das Geheimnis nachdenken, welches das Erbe des Mr.August umgab. Was","20","574"
"Erzähler","bedeuteten seine rätselhaften Worte? Am nächsten Tag kamen sie wieder in der","20","574"
"Erzähler","Zentrale zusammen.","20","574"
"Justus","Lesen wir den Brief, wenigstens zum Teil, noch einmal.","20","2"
"REGIE","Musik dudelt im Hintergrund","20","0"
"Peter","Gute Idee, Just. Ich weiß gar nicht mehr genau, was drin steht.","20","3"
"Justus","August bist Du genannt, August macht Dich bekannt und August ist der Hüter Deines","20","2"
"Justus","Glücks. Wie ein Berg türmt es sich vor Dir auf. Laß' Dich vor Hindernissen nicht","20","2"
