"Speaker","Text","Page","speaker_id"
"Peter","[erstaunt]: Nussknacker ist vom Zoll. Mann, das haut mich um!","20","3"
"Bob","Mich aber auch.","20","4"
"Olsen","Zollfahnder müssen manchmal eigenartige Wege gehen Jungs. Wie ich sehe habt","20","116"
"Olsen","ihr die Steine gefunden, in den Eisenstäben des Käfigs.","20","116"
"Justus","Wir sind Doc Dawson gerade noch rechtzeitig auf die Schliche gekommen. Ich","20","2"
"Justus","verstehe nur eins nicht, Doc Dawson kann doch den Löwen George nicht mit einem","20","2"
"Justus","Messer verletzt haben.","20","2"
"Doc Dawson","Nein, diese Verletzung stammte auch nicht von einem Messer. George hat","20","118"
"Doc Dawson","sich an einem Dorn verletzt.","20","118"
"Peter","Und Hank Murphy? Wieso geisterte der hier immer herum?","20","3"
"Doc Dawson","[zögernd]: Nun ja, jetzt kommt es wohl nicht mehr drauf an. Er wurde","20","118"
"Doc Dawson","entlassen, weil ich für die entsprechenden Gründe gesorgt habe. Er war mir ein wenig zu","20","118"
"Doc Dawson","neugierig geworden.","20","118"
"Justus","Und er war einige Male hier, um sie dazu zu veranlassen, dass er wieder","20","2"
"Justus","eingestellt wird.","20","2"
"Peter","Na immerhin hat Hank Murphy uns mit einem rasenden Löwen alleine gelassen.","20","3"
"Mike","Mit einem rasenden Löwen? Aber Hank Murphy wusste doch gar nicht, dass","21","764"
"George","verletzt war. Für ihn war George immer noch ein harmloser alter Bursche.","21","820"
"Peter","Jetzt möchte ich nur noch wissen, wer den Gorilla aus dem Käfig gelassen hat?","21","3"
"Justus","Der gleiche Mann, der auch den Eisenstab aus dem Käfig entfernt hat. [ Einwurf","21","2"
"Justus","von Peter: Na?] Doc Dawson, auf der Suche nach den Diamanten, allerdings hat er wohl","21","2"
"Justus","nicht geglaubt, dass der Gorilla ausbrechen würde.","21","2"
"Doc Dawson","[sauer]: Verfluchte Bande! Der Gorilla hat getobt, als ich den Käfig","21","118"
"Doc Dawson","untersuchte, ich wollte ihn mit einem Schuss aus dem Gewehr betäuben und deshalb","21","118"
"Doc Dawson","ging ich weg, um das Gewehr zu holen.","21","118"
"Justus","[ergänzend]: Und als sie zurückkamen, war der Gorilla ausgebrochen.","21","2"
"Doc Dawson","[zustimmend]: So war es.","21","118"
"Olsen","[munter]: Ist ja auch nicht besonders angenehm hinter Gittern zu sitzen. Das wird","21","116"
"Doc Dawson","den Tieren bald nachfühlen können.","21","118"
"Doc Dawson","[verärgert]: Detektive nennt sich so was! Man sollte Kindern verbieten,","21","118"
"Doc Dawson","Detektiv zu spielen!","21","118"
"Mr. Hall","[amüsiert/lachend]: Ja, damit Schmuggler wie sie es leichter haben, was Doc?","21","-1"
"Mr. Hall","Nein, nein, nein, dass war schon ganz gut so! Ich hoffe die drei spielen noch recht lange","21","-1"
"Mr. Hall","Detektiv und mein sauberer Bruder Cal wird sich wundern, wie weitreichend die Wirkung","21","-1"
"Mr. Hall","ihrer Tätigkeit ist, was Jungs?!","21","-1"
"Peter","Klar Mensch, das schlägt bis nach Afrika durch!","21","3"
"REGIE","[Justus, Peter, Bob lachen]","21","0"
"Justus","[fröhlich]: Das schockt ey!","21","2"
"Bob","[fröhlich]: Das ist ja ne Wucht!","21","4"
"Peter","[fröhlich]: Das hätte ich nie gedacht.","21","3"
"Justus","[fröhlich]: Das finde ich ja gut.","21","2"
"REGIE","[Musik]","21","0"
"REGIE","ENDE","21","0"
