"Speaker","Text","Page","speaker_id"
"Justus","in China wäre die Figur fraglos geprüft worden. Deshalb musste sie hier","24","2"
"Justus","vor mehreren Zeugen vernichtet werden, damit niemand erfuhr, dass er","24","2"
"Justus","der echte tanzende Teufel noch existiert.","24","2"
"Clay","Quail, das werden Sie mir büßen!","24","-1"
"Justus","Jim nicht Quail!","24","2"
"Peter","(verwundert) Jim?","24","3"
"Justus","Er wusste die ganze Zeit über, was vorging. Aber er war nicht","24","2"
"Justus","verantwortlich, nicht wahr, Jim? (ausdrücklich) Jim ist der tanzende","24","2"
"Justus","Teufel!","24","2"
"Peter","(verwundert) Wieso?","24","3"
"Jim","(verwundert) Ich? (erheitert) Du bist ja wahnsinnig!","24","871"
"Justus","Und Jim ließ auch die Imitation anfertigen. Von dem Mann, der die","24","2"
"Justus","vielen Koffer gestohlen hat. Weil die Figur abhanden gekommen war.","24","2"
"Jim","Das ist alles erlogen! Ich war ja hier eingesperrt.","24","871"
"Justus","Als ich hinter diese Hütte ging fand ich die losen Bretter, die Sie","24","2"
"Justus","wegnahmen, um nach Ihrem Auftritt als tanzender Teufel wieder in die","24","2"
"Justus","Hütte zu kommen.","24","2"
"REGIE","Schritte","24","0"
"Justus","Das hier hab ich im Kostüm entdeckt.","24","2"
"REGIE","Knistern","24","0"
"Peter","Ein kleiner Beutel.","24","3"
"Justus","Mit Kreide darin, die Jim brauchte um die Fragezeichen und die Pfeile zu","24","2"
"Justus","malen, damit wir ihn ja nicht verfehlen.","24","2"
"Jim","(Seufzt) Ich habs für dich getan, Papa. Damit du den tanzenden Teufel","24","871"
"Jim","behalten kannst, damit ihn dir die Chinesen nicht wegholen!","24","871"
"Clay","(enttäuscht) Jim, wie konntest du nur! Darüber werden wir noch zu","24","-1"
"Clay","reden haben.","24","-1"
"Wilkes","Und in seinem Übermut musste er die Jungen auch noch herausfordern,","25","-1"
"Wilkes","indem er als Schamane auftrat.","25","-1"
"Justus","Da hat er sich nicht viel anders verhalten als Sie, Mr. Wilkes. Sie hätten","25","2"
"Justus","lieber die Zusammenarbeit mit uns suchen sollen.","25","2"
"Wilkes","(genervt) Ach, du nervst mich, junger Mann!","25","-1"
"Peter","(seufzt, erheitert) Das versteh ich, Mr. Wilkes. Justus ist mit seinem","25","3"
"Peter","kriminalistischen Genie schon schlimm genug. Da sollte einen","25","3"
"Peter","wenigstens mit guten Ratschlägen in Ruhe lassen.","25","3"
"Wilkes","Das will ich meinen.","25","-1"
"REGIE","(lachen)","25","0"
"REGIE","Musiksequenz","25","0"
