"Speaker","Text","Page","speaker_id"
"REGIE","Die   drei  ???   und   der  verschwundene          Schatz","1","0"
"REGIE","-Hörspielskript von Pyramus -","1","0"
"REGIE","Titelmusik","1","0"
"REGIE","Erzähler  Als in Rocky Beach eine Ausstellung kostbarer Edelsteine und Schmuckstücke","1","0"
"REGIE","stattfand, ließen die drei Detektive sich dieses Ereignis schon deshalb nicht","1","0"
"REGIE","entgehen, weil die ausgestellten Kostbarkeiten mit ungewöhnlichem Aufwand","1","0"
"REGIE","gesichert wurden.","1","0"
"REGIE","Schritte, Stimmen","1","0"
"REGIE","Justus    Die Kollektionen sind Millionen wert.","1","0"
"REGIE","Bob       Allein schon dieser Gürtel. Was der wert ist?","1","0"
"REGIE","Peter     Welcher, Bob?","1","0"
"REGIE","Bob       Der da drüben in der Vitrine an der Treppe, Peter. In der Zeitung stand, dass er","1","0"
"REGIE","über 6 Kilo wiegt.","1","0"
"REGIE","Peter     (erstaunen)","1","0"
"REGIE","Bob       Früher war er im Besitz des japanischen Kaiserhauses.","1","0"
"REGIE","Justus    Wenn den jemand stehlen würde ...","1","0"
"REGIE","Peter     Na, das kann niemand, Justus. Bei den Sicherheitseinrichtungen ist das","1","0"
"REGIE","unmöglich.","1","0"
"REGIE","Bob       Wer weiß?","1","0"
"REGIE","eilige Schritte","1","0"
"REGIE","Rawley    Lasst mich mal vorbei, Jungs.","1","0"
"REGIE","Peter     (Entrüstung)","1","0"
"REGIE","Bob       (Entrüstung)","1","0"
"REGIE","Justus    Bitte.","1","0"
"REGIE","Bob       Wer war das denn?","1","0"
"REGIE","Peter     Keine Ahnung. He, seht mal. Die Pfadfinder sind auch da.","1","0"
"REGIE","Bob       Die überlegen vielleicht, ob ein Kunstraub die gute Tat des Tages sein könnte.","1","0"
"REGIE","allgemeines Lachen der Drei","1","0"
"REGIE","Justus    (belustigt) Hör bloß auf Bob.","1","0"
"REGIE","Schritte","2","0"
"REGIE","Mr. Frank Hob, da hätte ich euch zwei ja fast umgerannt. Entschuldigung.","2","0"
"REGIE","Justus    (leicht lachend) Oh, guten tag, Mr. Frank.","2","0"
"REGIE","Mr. Frank Ach, das ist ja Justus. Das Pummelchen von unserem gemeinsamen Film. Na,","2","0"
"REGIE","so was. Aber ein Pummelchen bist du jetzt nicht mehr.","2","0"
"REGIE","Peter     (spitz) Finden Sie?","2","0"
"REGIE","Justus    (fast wütendes Schnauben)","2","0"
"REGIE","Peter     (lacht)","2","0"
"REGIE","Bob       Sei doch nicht so gehässig Peter.","2","0"
"REGIE","Mr. Frank Ich würde gerne mit dir noch ein bisschen plaudern, aber es ist Zeit für meinen","2","0"
"REGIE","Auftritt.","2","0"
"REGIE","Justus    Was für ein Auftritt?","2","0"
"REGIE","Mr. Frank Ja, passt nur auf. Das gibt ein riesen Spaß. Da ist der Aufseher. Den muss ich","2","0"
"REGIE","auf mich aufmerksam machen.","2","0"
"REGIE","Schritte","2","0"
"REGIE","Mr. Frank Oh, Herr Inspektor.","2","0"
"REGIE","Wachmann  Ja? Was ist denn?","2","0"
"REGIE","Mr. Frank Mir ist so schlecht. Äh, bitte, kann ich etwas Wasser haben?","2","0"
"REGIE","Wachmann  Wasser? Aber ja doch.","2","0"
"REGIE","Mr. Frank Ach ja, das ist ...","2","0"
"REGIE","Wachmann  Was ist denn das?","2","0"
"REGIE","Mr. Frank Was denn? Ach ...","2","0"
"REGIE","leichtes Geklimper","2","0"
"REGIE","Wachmann  Ein Edelstein. Warten Sie mal. Nein, bleiben Sie hier!","2","0"
"REGIE","Mr. Frank Ich werde ...","2","0"
"REGIE","Wachmann  Alarm!","2","0"
"REGIE","Mr. Frank Lassen Sie mich los!","2","0"
"REGIE","Wachmann  Alarm!","2","0"
"REGIE","Pfeifen, Musik setzt ein, Schritte, Stimmen: ""Ein Überfall""","3","0"
"REGIE","Wachmann  Zwei Mann zum Mittelkasten. Schnell.","3","0"
"REGIE","heftiges Scheibengeklirr, Stimmengewirr, Schreie","3","0"
"Justus.","Bob. Ein Überfall auf die Juwelen.","3","2"
"Justus.","Bob       Da! Alarm.","3","2"
"Justus.","Justus    Natürlich Peter. Das ist ein gut organisierter Juwelenraub!","3","2"
"Justus.","Mr. Togati Alle nach draußen. Gehen sie nach draußen. Aber bleiben sie im Vorgarten.","3","2"
"Justus.","Niemand darf sich entfernen.","3","2"
"Justus.","Justus    Das ist der Oberwärter. Ein Japaner glaube ich.","3","2"
"Justus.","Stimme    Kinder, hierher. Zu mir.","3","2"
"REGIE","heftiges Stimmengewirr, Kinderstimmen","3","0"
"REGIE","Mr. Togati Beruhigen sie sich, bitte. Beruhigen sie sich doch.","3","0"
"REGIE","Erzähler  Doch der japanische Oberaufseher konnte die Menge nicht beruhigen. Der","3","0"
"REGIE","Schreck sass allen in den Gliedern. Alles drängte nach draußen, obwohl","3","0"
"REGIE","niemand in Gefahr war. Die drei Detektive gehörten zu den Letzten, die sich im","3","0"
"REGIE","Saal aufhielten.","3","0"
"REGIE","Musik setzt aus","3","0"
"REGIE","Justus    Na so was. Warum haben sie ausgerechnet den ollen Prachtgürtel geklaut?","3","0"
"REGIE","Den kann doch niemand unter seinen Kleidern verstecken, der ist viel zu lang","3","0"
"REGIE","und unhandlich.","3","0"
"REGIE","Bob       Die Pfadfinder. Die hätten den Kasten mit ihrer Axt einschlagen und den Gürtel","3","0"
"REGIE","in ihren Rucksack stopfen können. Vielleicht sind das verkleidete Juwelen-","3","0"
"REGIE","diebe?","3","0"
"REGIE","Justus    Ach, das wäre zu auffallend.","3","0"
"REGIE","Peter     (zustimmender Laut)","3","0"
"REGIE","Justus    Die werden bestimmt gleich durchsucht. Ich möchte wetten, dass man den","3","0"
"REGIE","Gürtle nicht findet.","3","0"
"REGIE","Mr. Togati He, he ihr da! Was steht ihr da noch rum?","3","0"
"REGIE","Justus    Entschuldigen Sie, Sir. Wir sind Detektive, hier unsere Karte.","3","0"
"REGIE","Mr. Togati Aha. Die drei Detektive. Erster Detektiv Justus Jonas. Zweiter Detektiv Peter","3","0"
"REGIE","Shaw.","3","0"
"REGIE","Peter     Mh, das bin ich.","4","0"
"REGIE","Mr. Togati Recherchen und Archiv Bob Andrews.","4","0"
"REGIE","Justus    Die drei Fragezeichen sind unser Symbol und Firmenzeichen. Wir sind bemüht","4","0"
"REGIE","Mr. Togati Dumme amerikanische Jugend! Ich, Saito Togati, Sicherheitsbeauftragter der","4","0"
"REGIE","Nagasami-Juwelen-Vertriebsgesellschaft, habe zugelassen, dass der ""goldene","4","0"
"REGIE","Gürtel"" gestohlen wurde!","4","0"
"REGIE","Justus    Nicht zugelassen, Sir, Sie ...","4","0"
"REGIE","Mr. Togati Meine Ehre ist verloren. Und drei dumme Jungen kommen mir mit sowas. Nun","4","0"
"REGIE","geht, geht, geht, geht, verschwindet!","4","0"
"REGIE","Musik","4","0"
"REGIE","Erzähler  Am nächsten Tag waren die Zeitungen voll mit Berichten von dem rätselhaften","4","0"
"REGIE","Überfall und dem Diebstahl bei der Ausstellung. Dazu lieferten sie zahlreiche","4","0"
"REGIE","Informationen, die der Polizei jedoch offensichtlich nicht weiterhalfen. In der","4","0"
"REGIE","Zentrale debattierten die drei Detektive über das Verbrechen.","4","0"
"REGIE","Schrottplatzgeräusche, während der gesamten Szene ist Blacky zu hören","4","0"
"REGIE","Justus    Mr. Frank hat bestimmt nichts damit zu tun.","4","0"
"REGIE","Bob       Es passierte nachdem dieser Mr. Frank den Edelstein verloren hatte und der","4","0"
"REGIE","Wärter ihn beschuldigte, etwas gestohlen zu haben.","4","0"
"REGIE","Justus    Genau. Damit sollte Mr. Frank ablenken. Ich muss daraus schließen, das die","4","0"
"REGIE","Haupttäter im Schutz dieser ablenkenden Situation ihren Coup unbemerkt","4","0"
"REGIE","vorbereitet haben.","4","0"
"REGIE","Peter     Vorbereitet haben?","4","0"
"REGIE","Telefonklingeln","4","0"
"REGIE","Peter     Wieso das?","4","0"
"REGIE","Justus    Moment, Telefon. Ich schalte den Lautsprecher ein.","4","0"
"REGIE","Telefonhörer wird abgenommen","4","0"
"Justus","Jonas von den drei Detektiven. Ja, bitte?","4","2"
"Justus","Hitchcock Hallo? Jonas Junior? (leichtes Lachen) Habt ihr gerade einen Fall in Arbeit?","4","2"
"Justus","Justus    Nein, Mr. Hitchcock. Das heißt, wir haben dem Peterson-Museum unsere Hilfe","4","2"
"Justus","angeboten, aber man wollte sie nicht.","4","2"
"Justus","Hitchcock Die hätten euch ruhig ranlassen sollen. Sagt mal, könntet ihr einer alten","5","2"
"Justus","Freundin von mir helfen, einer Schriftstellerin. Sie wird von Gnomen belästigt.","5","2"
"Justus","Justus    Von Gnomen, Sir? Sagten Sie wirklich, Gnomen?","5","2"
"Justus","Hitchcock Ja, davon hat jedenfalls Mrs. Agawam gesprochen, junger Freund. Gnomen, ja.","5","2"
"Justus","Kleine Erdgeister, verwandt mit Kobolden und Elfen, die sich in Leder kleiden,","5","2"
"Justus","und unterirdisch als Schatzgräber hausen.","5","2"
"Justus","Justus    Ja, Sir. Wir wissen schon, was Gnome sind. Das heißt, falls es sie wirklich gibt.","5","2"
"Justus","Hitchcock Nun, meine Bekannte behauptet, sie seien leibhaftig da. Sie schleichen sich","5","2"
"Justus","nachts in ihr Haus und stellen dort allerlei Unsinn an. Also, was meinst du?","5","2"
"Justus","Werdet ihr helfen?","5","2"
"Justus","Justus    Jedenfalls wollen wir's versuchen, Sir. Den Fall ""goldener Gürtel"" haben wir","5","2"
"Justus","nicht bekommen. Aber, ich denke es hat noch nie ein Detektiv den Auftrag","5","2"
"Justus","erhalten, nach Gnomen zu suchen.","5","2"
"Justus","Hitchcock Das denke ich auch. (Lachen)","5","2"
"REGIE","Telefonhörer wird aufgelegt","5","0"
"REGIE","Musik","5","0"
"REGIE","Erzähler  Miss Agathe Agawam wohnte nahe der Innenstadt von Los Angeles. Die drei","5","0"
"REGIE","Detektive ließen sich von Patrick dorthin fahren. Ein kleines Stück mussten sie","5","0"
"REGIE","allerdings zu Fuß gehen.","5","0"
"REGIE","Schritte, Verkehrsgeräusche, Vogelgezwitscher","5","0"
"REGIE","Peter     Ich habe auf der Ausstellung eine Frau mit Perücke gesehen. Sie hatte so eine","5","0"
"REGIE","aufgebauschte Frisur. Vielleicht hatte sie den ""goldenen Gürtel"" darunter","5","0"
"REGIE","versteckt?","5","0"
"REGIE","Justus    (leichtes Kichern)","5","0"
"REGIE","Bob       Ja, und da war ein alter Mann mit einem Stock. Vielleicht war der hohl?","5","0"
"REGIE","Justus    Wer, der alte Mann?","5","0"
"REGIE","Peter     (leichtes Kichern)","5","0"
"REGIE","Justus    Perücke, Spazierstöcke. Das wären Verstecke für Juwelen, nicht aber für einen","5","0"
"REGIE","schweren goldenen Gürtel. Fällt euch nichts anderes ein?","5","0"
"REGIE","Peter     Nein. Ich bin vom Nachdenken schon ganz erschöpft.","5","0"
"REGIE","Bob       Mmh, ich auch. Reden wir lieber von unserem Fall. Ich habe im Lexikon nach-","5","0"
"REGIE","gesehen.","5","0"
"REGIE","Justus    Gut, Bob. Und was stand da?","5","0"
"REGIE","Bob       Also. Gnome sind zwergenhafte Geschöpfe, die nach der Sage im Erdinneren","6","0"
"REGIE","leben. Sie sind oft missgestaltet und hässlich, und treiben gerne bösen","6","0"
"REGIE","Schabernack.","6","0"
"REGIE","Peter     Da ist das Haus von Miss Agawam. Das hier jemand freiwillig wohnt, ist mir ein","6","0"
"REGIE","Rätsel. Hier ist es ja sogar am Tag unheimlich.","6","0"
"REGIE","Bob       Was steht denn da an der Tür?","6","0"
"REGIE","Peter     (liest vor) A. Agawam. Bitte läuten. Gnome, Elfen und Zwerge bitte pfeifen.","6","0"
"REGIE","Just, kannst du mir vielleicht erklären, was das heißen soll?","6","0"
"REGIE","Justus    Hm, das hört sich so an, als glaubte Miss Agawam wirklich an Gnome. Du","6","0"
"REGIE","kannst am besten pfeifen, Peter, also pfeife.","6","0"
"REGIE","Peter     Warum soll alles immer so schwer sein? (Peter pfeift) Gut so?","6","0"
"REGIE","Justus    Ausgezeichnet, Peter.","6","0"
"REGIE","Agawam    (metallischer Klang) Ja, bitte? Wer ist da?","6","0"
"REGIE","Bob       (erstaunt) Die Stimme kommt aus dem Vogelhäuschen dort.","6","0"
"REGIE","Justus    (mit erhobener Stimme) Guten Tag, Misses Agawam. Wir sind die drei","6","0"
"REGIE","Detektive. Mr. Hitchcock hat uns gebeten, Ihnen behilflich zu sein.","6","0"
"REGIE","Agawam    (metallischer Klang) Oh, natürlich. Ich mache gleich auf.","6","0"
"REGIE","Peter     Mmh, eine Gegensprechanlage im Vogelhäuschen, nicht schlecht.","6","0"
"REGIE","Tür geht auf","6","0"
"REGIE","Bob       Da kommt sie schon.","6","0"
"REGIE","Agawam    Bitte kommt herein. Wir gehen ins Arbeitszimmer. Ach, ich bin wirklich froh,","6","0"
"REGIE","dass Ihr nach den Gnomen suchen wollt. Sie treiben es wirklich zu toll. Ja, nun","6","0"
"REGIE","kommt.","6","0"
"REGIE","Tür geht zu, Schritte","6","0"
"REGIE","Agawam    Habe ich erzählt, dass sie sogar im Haus waren und alle meine Bücher aus den","6","0"
"REGIE","Regalen gerissen haben?","6","0"
"REGIE","unheilverkündende Musik setzt ein","6","0"
"REGIE","Bob       Da am Fenster! Was is'n das? Ein Gnom, er belauscht uns.","6","0"
"REGIE","Peter     (mit Angst in der Stimme) Tatsächlich ein Gnom. Ich habe ihn gesehen. Jetzt","6","0"
"REGIE","ist er weg.","6","0"
"REGIE","Bob       Schnell, hinterher! Vielleicht erwischen wir ihn noch.","6","0"
"REGIE","Peter     Ja.","7","0"
"REGIE","Schritte,","7","0"
"REGIE","Musik setzt aus","7","0"
"REGIE","Erzähler  Die drei Detektive rannten zu dem Fenster, an dem sie den Kobold gesehen","7","0"
"REGIE","hatten, doch der Gnom war verschwunden. Sie durchsuchten den ganzen","7","0"
"REGIE","Garten, entdeckten jedoch nicht die geringste Spur von ihm.","7","0"
"REGIE","Justus    Noch nicht einmal Fußspuren. Dafür ein neues Rätsel.","7","0"
"REGIE","Bob       Was für ein Rätsel?","7","0"
"REGIE","Justus    Der Gnom war an dem Fenster dort. Seht doch mal, wie hoch es über dem","7","0"
"REGIE","Boden ist. Wie kann ein Zwerg in das Fenster sehen?","7","0"
"REGIE","Bob       Ja. Das weiß ich auch nicht. Auf jeden Fall war es ein richtiger Gnom. Er war","7","0"
"REGIE","etwa ein Meter groß, hatte eine Zipfelmütze auf und trug einen langen Bart, ach","7","0"
"REGIE","ja, und in den Händen hielt er eine Spitzhacke. Er schien furchtbar wütend zu","7","0"
"REGIE","sein.","7","0"
"REGIE","Justus    Aber wie kann so ein Winzling durch so ein hohes Fenster schauen?","7","0"
"REGIE","Peter     Vielleicht kann er zaubern?","7","0"
"REGIE","Bob       (verächtlich) Ach.","7","0"
"REGIE","Justus    Wir fragen am besten Miss Agawam. Kann sein, dass sie uns mehr sagen","7","0"
"REGIE","kann.","7","0"
"REGIE","Erzähler  Verwirrt kehrten sie zu Miss Agawam zurück, die vor dem Haus auf sie wartete.","7","0"
"REGIE","Bob       Wir haben den Zwerg nicht erwischt, Miss Agawam, leider.","7","0"
"REGIE","Agawam    Das ist auch nicht so leicht. So ist das eben mit Gnomen.","7","0"
"REGIE","Peter     (verwirrt, fast hilfesuchend) Ähh, Just ...","7","0"
"REGIE","Agawam    Wir werden Tee trinken.","7","0"
"REGIE","Drei ???  Danke.","7","0"
"REGIE","Schritte, Teetassengeklimper","7","0"
"REGIE","Agawam    Ach, das erinnert mich an früher. Damals verging nicht eine Woche in der ich","7","0"
"REGIE","nicht alle meine Gnome, Elfen und Zwerge zum Tee einlud.","7","0"
"REGIE","Justus    Äh, sie meinen, sie haben die Kinder aus der Nachbarschaft zum Tee","7","0"
"REGIE","eingeladen? Und sie nannten sie ihre Gnome, Elfen und Zwerge?","7","0"
"REGIE","Agawam    Genau das, mein Junge. Wie hast du das nur erraten?","7","0"
"REGIE","Justus    Ganz einfach. Hier hängen viele Kinderbilder, und einige haben eine Widmung.","8","0"
"REGIE","Sehen Sie hier, da steht: ""Von ihren sieben Kobolden"". Sicher haben Sie den","8","0"
"REGIE","Kindern vorgelesen und sie zum Scherz so genannt.","8","0"
"REGIE","Agawam    Ja, ja, das ist richtig. Oft habe ich aus diesem Buch vorgelesen. Es ist aus dem","8","0"
"REGIE","Schwarzwald. Seht ihr?","8","0"
"REGIE","Bob       Da, dieser Kobold sieht genauso aus, wie der, der am Fenster war.","8","0"
"REGIE","Justus    (zustimmender Laut)","8","0"
"REGIE","Agawam    Der Erzähler nennt ihn den ""bösen Gnomenkönig"". Ja, meine Geschichten","8","0"
"REGIE","wurden damals viel gelesen. Aber das ist lange her.","8","0"
"REGIE","Justus    Und ihre Zuhörer von damals sind groß, nicht wahr?","8","0"
"REGIE","Agawam    Ja, jetzt kommen keine Kinder mehr zum Zuhören. Ich sollte vielleicht doch","8","0"
"REGIE","wegziehen. Mr. Jordan von nebenan, der das Theater abreißen und ein","8","0"
"REGIE","Bürohochhaus bauen will, der möchte mir das Haus abkaufen.","8","0"
"REGIE","Justus    Aber sie wollen hier bleiben?","8","0"
"REGIE","Agawam    Allerdings. Hier habe ich mein ganzes Leben gelebt.","8","0"
"REGIE","Justus    Das verstehen wir.","8","0"
"REGIE","Agawam    Normalerweise habe ich einen tiefen Schlaf, aber in den letzten Nächten höre","8","0"
"REGIE","ich Geräusche. Es klingt, als ob jemand tief im Boden unter meinem Haus mit","8","0"
"REGIE","einer Hacke im Gestein arbeitet.","8","0"
"REGIE","Justus    Mit einer Hacke? Um Mitternacht?","8","0"
"REGIE","Peter     Gnome?","8","0"
"REGIE","Agawam    Ganz richtig. Ich habe sie am Fenster und im Garten gesehen. Natürlich habe","8","0"
"REGIE","ich die Polizei informiert, aber dort glaubt man mir kein Wort. Ach, ... vielleicht","8","0"
"REGIE","sollte ich doch wegziehen, so wie Roger, mein Neffe, es mir empfohlen hat.","8","0"
"REGIE","Justus    Nun gut, Miss Agawam, wir werden dem Gnom eine Falle stellen.","8","0"
"REGIE","Agawam    Das gefällt mir.","8","0"
"REGIE","Peter     Was für eine Falle, Just?","8","0"
"REGIE","Justus    Nun, der Mutigste und Schnellste von uns müsste eine Nacht hier verbringen,","8","0"
"REGIE","um den Gnomen aufzulauern, ich dachte an dich, Peter.","8","0"
"REGIE","Tassengeklimper","8","0"
"REGIE","Peter     An mich? Ausgerechnet an mich? Warum bleiben wir nicht alle hier? Sechs","8","0"
"REGIE","Augen sehen mehr als zwei.","8","0"
"REGIE","Bob       (stotternd) Also ich kann wirklich nicht, ähm, ich, ich muss zu meiner Tante.","9","0"
"REGIE","Justus    Nun gut, wir bleiben alle drei.","9","0"
"REGIE","Bob       Aber ich sagte doch, dass ich zu meiner Tante muss.","9","0"
"REGIE","Justus    Wenn wir gemeinsam beschlossen haben zu bleiben, müssen wir uns diesem","9","0"
"REGIE","Wunsch auch beugen.","9","0"
"REGIE","Bob, Peter (entnervtes Stöhnen)","9","0"
"REGIE","Musik","9","0"
"REGIE","Erzähler  Am Abend des gleichen Tages als es schon dunkel geworden war, durch-","9","0"
"REGIE","suchten die drei Detektive die nähere Umgebung des Hauses, in dem Miss","9","0"
"REGIE","Agawam wohnte. Als sie bei dem stillgelegten Theater waren, vernahmen sie","9","0"
"REGIE","gedämpfte Stimmen.","9","0"
"REGIE","unverständliche Stimmen im Hintergrund","9","0"
"REGIE","Justus    Komisch, an der Vorderfront dieses Theaters steht: ""Geschlossen, Zutritt","9","0"
"REGIE","strengstens verboten"", und hier hinten gibt es eine offene Tür.","9","0"
"REGIE","Peter     Wie es wohl drinnen aussieht?","9","0"
"REGIE","Justus    (flüsternd) Psst, da spricht doch jemand?","9","0"
"REGIE","Rawley    (stark gedämpft) Vor allem das goldene Gitter. Wie im Museum.","9","0"
"REGIE","Bob       (flüsternd) Hört ihr, es geht um den ""goldenen Gürtel"". Meinst du ...","9","0"
"REGIE","Justus    Psssst. Ich habe Museum verstanden.","9","0"
"REGIE","Peter     Mensch, vielleicht haben wir das Versteck der Diebe gefunden?","9","0"
"REGIE","Justus    Los, noch etwas dichter ran.","9","0"
"REGIE","Schritte","9","0"
"REGIE","Justus    Vorsicht!","9","0"
"REGIE","Tür quietscht","9","0"
"REGIE","Rawley    Ja das ... Was habt ihr hier zu suchen?","9","0"
"REGIE","Peter     (panisch) Justus lauf, ich hol Patrick!","9","0"
"REGIE","Bob       (stöhnt)","9","0"
"REGIE","Rawley    Bleibst du hier!","9","0"
"REGIE","Justus    Nein, ich laufe nicht.","9","0"
"REGIE","Rawley    Mr. Jordan rufen Sie die Polizei. Ich habe Einbrecher erwischt.","10","0"
"REGIE","Justus    Sir, Sie machen einen großen Fehler. Da wir aus einem leerstehendem","10","0"
"REGIE","Gebäude Stimmen hörten, drängte sich uns der Eindruck auf, dass sich hier","10","0"
"REGIE","Unbefugte Zutritt verschafft haben.","10","0"
"REGIE","Rawley    Äh, was? Wie? Was war das?","10","0"
"REGIE","Jordan    Immer mit der Ruhe, Rawley. Der Junge meint nur, wir hätten hier nichts zu","10","0"
"REGIE","suchen.","10","0"
"REGIE","Rawley    Ja, wenn er das meint, warum sagt er es dann nicht so?","10","0"
"REGIE","Jordan    Ich bin Frank Jordan, der Besitzer dieses Gebäudes. Ich will es abreißen, um","10","0"
"REGIE","hier Bürogebäude errichten zu lassen. Das ist Mr. Rawley, mein Nachtwächter.","10","0"
"REGIE","Und nun erklärt mir bitte, wieso wir einen verdächtigen Eindruck gemacht","10","0"
"REGIE","haben?","10","0"
"REGIE","Justus    Normalerweise wäre dieser Bau überall abgeschlossen.","10","0"
"REGIE","Peter     Wir haben gehört, wie sie über den ""goldenen Gürtel"" gesprochen haben. Und","10","0"
"REGIE","das Museum haben sie auch erwähnt.","10","0"
"REGIE","Rawley    Mr. Jordan, halten Sie sich doch nicht mit diesen Burschen auf, rufen Sie die","10","0"
"REGIE","Polizei.","10","0"
"REGIE","Jordan    Hier bestimme ich Rawley. Eine ""goldener Gürtel""? (kleine Pause) Mmh, jetzt","10","0"
"REGIE","weiß ich was ihr meint. Ich habt euch verhört. Ich habe gesagt: ""Das Innere des","10","0"
"REGIE","Theaters sei so schön mit all den Vergoldungen."" Das es eigentlich zu schade","10","0"
"REGIE","ist es abzureißen. (Lachen) Möchtet ihr euch da drinnen mal umsehen?","10","0"
"REGIE","Justus    Sehr gern, Sir.","10","0"
"REGIE","Jordan    Na dann kommt doch rein. Rawley, schalten Sie die Scheinwerfer an.","10","0"
"REGIE","Rawley    Sofort, Sir.","10","0"
"REGIE","Jordan    Dann kommt.","10","0"
"REGIE","Drei ???  (zustimmende Töne)","10","0"
"REGIE","Schritte","10","0"
"REGIE","Bob       (flüsternd) Just.","10","0"
"REGIE","Justus    (flüsternd) Ja, Bob, was ist?","10","0"
"REGIE","Bob       (flüsternd) Du, ich glaub, den Rawley hab ich schon irgendwo schon mal","10","0"
"REGIE","gesehen. Seine Stimme kommt mir so bekannt vor.","10","0"
"REGIE","Justus    (flüsternd) Mir auch. Ich weiß nur nicht, wo ich ihm schon mal begegnet bin.","10","0"
"REGIE","Bob       (flüsternd) Das müssen wir herausfinden.","11","0"
"REGIE","Tür wird geöffnet","11","0"
"REGIE","Jordan    So, kommt rein. Das Licht brennt.","11","0"
"REGIE","Musik","11","0"
"REGIE","Erzähler  In dem alten Theater fand sich tatsächlich nichts, was den drei Detektiven","11","0"
"REGIE","irgendwie verdächtig vorkam. So fuhren sie schließlich nach Rocky Beach","11","0"
"REGIE","zurück, ohne einen Schritt weitergekommen zu sein. Sie hatten beschlossen,","11","0"
"REGIE","dass Justus und Peter die Nacht im Hause von Miss Agawam verbringen","11","0"
"REGIE","sollten, da sie hofften, den Gnomen auf die Spur zu kommen, sobald diese dort","11","0"
"REGIE","auftauchten. Vielleicht konnten sie sogar einen fangen. Als sie zum Schrottplatz","11","0"
"REGIE","kamen, wartete Besuch auf sie.","11","0"
"REGIE","Schrottplatzgeräusche, Hundegebell","11","0"
"REGIE","Peter     Ein kleiner japanischer Junge, was hat das zu bedeuten?","11","0"
"REGIE","Justus    Hm, wir fragen ihn mal.","11","0"
"REGIE","Schritte","11","0"
"REGIE","Peter     Hm, bin ja gespannt.","11","0"
"Justus","Jonas, hier ist Besuch für dich.","11","2"
"Justus","Taro      Es freut mich sehr Justus kennen zu lernen. Und Bob und Peter. Ich bin Taro,","11","2"
"Justus","der gehorsame Sohn von Saito Togati, Chefdetektiv der Nagasami-","11","2"
"Justus","Gesellschaft.","11","2"
"Justus","Justus    Hallo Taro. Mit deinem Vater haben wir gestern gesprochen.","11","2"
"Justus","Taro      Ja, ich weiß. Ich fürchte mein ehrenwerter Vater war böse. Ich habe eure","11","2"
"Justus","Visitenkarte gefunden. Mein Vater bittet euch um Entschuldigung. Er war sehr","11","2"
"Justus","aufgeregt, wegen des Diebstahls.","11","2"
"Justus","Justus    Hat dein Vater den ""goldenen Gürtel"" inzwischen schon gefunden?","11","2"
"Justus","Taro      Nein, Justus. Es gibt keine Spuren. Mein Vater ist tief beschämt. Der ""goldene","11","2"
"Justus","Gürtel"" wurde vor seiner Nase gestohlen. Wenn er ihn nicht zurückholt, wird er","11","2"
"Justus","unehrenhaft aus seinem Amt entlassen.","11","2"
"Justus","Bob       Das ist schlimm, Taro.","11","2"
"Justus","Justus    Was ist mit Mr. Frank, der den unechten Edelstein fallengelassen hat?","11","2"
"Justus","Taro      Eine Frau hat ihm telefonisch den Auftrag erteilt, ins Museum zu gehen, und","11","2"
"Justus","dort um genau zwölf Uhr mittags den imitierten Stein fallenzulassen. Sie hat","11","2"
"Justus","gesagt es geht um Werbung.","11","2"
"Justus","Justus    Da ist der arme Mr. Frank wohl reingefallen.","12","2"
"Justus","Taro      Zur Diebesbande gehört er jedenfalls nicht.","12","2"
"Justus","Justus    Das habe ich mir gedacht. Mittlerweile ist wohl auch klar, dass die Bande den","12","2"
"Justus","Kindertag im Museum als idealen Zeitpunkt für den Raub zu gewählt hat.","12","2"
"Justus","Taro      Ja, aber für meinen Vater ist es immer noch ein Rätsel, wie die Bande den","12","2"
"Justus","""goldenen Gürtel"" nach draußen gebracht hat.","12","2"
"Justus","Justus    Hm, der ""goldenen Gürtel"" (kleine Pause) ... der wurde gar nicht nach draußen","12","2"
"Justus","geschafft. Er ist noch immer im Museum.","12","2"
"Justus","Peter     Was?","12","2"
"Justus","Bob       Was? Noch immer im Museum?","12","2"
"Justus","Taro      Aber das Museum wurde durchsucht, von oben bis unten.","12","2"
"Justus","Justus    Der Gürtel muss irgendwo versteckt sein. Vielleicht hinter einem Bild? Du","12","2"
"Justus","weißt, die Bilder hängen an langen Schnüren von der Decke. Zwischen ihnen","12","2"
"Justus","und der Wand ist genügend Platz.","12","2"
"Justus","Taro      Das wäre eine Idee. Ich werde es meinem Vater sagen. Ich danke dir, Justus.","12","2"
"Justus","Justus    Nichts zu danken, Taro.","12","2"
"REGIE","Musik","12","0"
"REGIE","Erzähler  Bald darauf machten Justus und Peter sich auf den Weg zu Miss Agawam. Sie","12","0"
