"Speaker","Text","Page"
"Peter","(ungeduldig) Ja warum denn, Just?","19"
"Bob","(ungeduldig) Jetzt spann uns doch nicht auf die Folter, Just!","19"
"Justus","Erinnert ihr euch an den Topf mit schwarzer Farbe?","19"
"Peter","(zustimmend) Mhm.","19"
"Justus","Mit dieser Farbe hat Don Sebastián nicht nur die Botschaft an die Wand","19"
"Justus","der Höhle geschrieben, er hat auch das Schwert schwarz angemalt. Und dann hat er","19"
"Justus","es nicht im Standbild versteckt – sondern an dem Standbild!","19"
"Peter","(verwirrt) An dem Standbild? Also ich seh nur ’n Holzschwert!","19"
"Justus","Das ist aber kein Holzschwert! Es sieht nur so aus. (angestrengt) Man kann","19"
"Justus","es ... abreißen. (stöhnt) [abreißendes Geräusch] Hier! Das ist das Aztekenschwert!","19"
"Justus","Bob, kratze bitte etwas Farbe mit deinem Messer ab.","19"
"Bob","Sofort, Just! Ah – tatsächlich! Darunter ist Gold!","19"
"Peter","(ungläubig) Was?","19"
"Diego","(aufgeregt) Das Aztekenschwert, wir haben es gefunden! Hurra!","19"
"Bob","(ehrfürchtig) Das Aztekenschwert – nicht zu glauben!","19"
"Peter","Justus, du bist ein Genie!","19"
"Bob","(leise) Wir haben es!","19"
"Peter","Die Alvaros sind gerettet! Jetzt haben sie genug Geld, die Ranch von","19"
"Peter","Skinnys Vater auch noch zu kaufen!","19"
"Justus","Das Schwert des Cortez. Wir haben es!","19"
"Erzähler","Justus hatte das Schwert tatsächlich gefunden. Und damit waren die","19"
"Erzähler","Probleme der Alvaros mit einem Schlage gelöst. Sie konnte das Schwert zu einem","19"
"Erzähler","sehr, sehr guten Preis an die mexikanische Regierung verkaufen. Für Cody und die","19"
"Erzähler","drei Cowboys aber kamen böse Zeiten. Sie mussten sich für das Feuer verantworten,","19"
"Erzähler","in dem die Hacienda der Alvaros verbrannt war, und mit ihr viele wertvolle","19"
"Erzähler","Gegenstände. Die drei Fragezeichen aber machten sich auf den Weg um Mr","19"
"Hitchcock","wie üblich von ihrem Abenteuer zu berichten.","19"
"Hitchcock","[Schlussmusik]","19"
