"Speaker","Text","Page","speaker_id"
"Justus","Soll das heißen, sie kennen Sie gar nicht?","23","2"
"Manny","Nein, die kennen wir nicht. Ist dass die Alte, bei der wir ein Brot","23","209"
"Manny","""gefunden"" haben?","23","209"
"Thurgood","Ich sag's doch: Der Junge spinnt.","23","206"
"Justus","Oh, ich Idiot! Ich dachte Mrs. Macomber ist verschwunden, weil sie","23","2"
"Justus","etwas mit dem Überfall zu tun hatte, aber das ist es nicht. Sie ist nicht","23","2"
"Justus","da, weil sie Thurgood durchschaut hat! Was ist mit ihr passiert,","23","2"
"Justus","Thurgood?","23","2"
"Thurgood","Woher soll ich das wissen?","23","206"
"Sheriff","Lasst Thurgood nicht aus den Augen. Wir anderen gehen in die Mine.","23","183"
"Sheriff","Eine Lampe!","23","183"
"Bob","Hier ist eine, Sheriff.","23","4"
"Sheriff","Danke Bob. Na, dann wollen wir mal sehen.","23","183"
"REGIE","Musik beginnt.","24","0"
"Justus","Vorsicht!","24","2"
"Sheriff","Mrs. Macomber! Sie liegt gefesselt und geknebelt unten im Schacht.","24","183"
"REGIE","Musik","24","0"
"Erzähler","Als Mrs. Macomber befreit war und ins freie trat, fuhr sie wütend auf","24","574"
"Erzähler","Wesley Thurgood zu.","24","574"
"Mrs. Macomber","Dieser Kerl hat mich gefesselt!","24","207"
"Sheriff","Thurgood! Dafür werden sie sich zu verantworten haben!","24","183"
"Mrs. Macomber","Das ist nicht Thurgood! Mir ist gerade noch rechtzeitig eingefallen, was","24","207"
"Mrs. Macomber","an Thurgood als Baby so besonderes war!","24","207"
"Sheriff","Erzählen sie.","24","183"
"Mrs. Macomber","Als er auf die Welt kam, hatte er braune Augen. Dabei haben die","24","207"
"Mrs. Macomber","meisten Babys blaue Augen und die können ihre Farbe im Laufe der","24","207"
"Mrs. Macomber","Jahre ändern: von blau zu braun. Thurgood hatte aber von Anfang an","24","207"
"Mrs. Macomber","braune Augen, und die wechseln die Farbe nie mehr!","24","207"
"Justus","Das haben sie ihm wahrscheinlich auf den Kopf zugesagt, da dieser","24","2"
"Justus","Mann hier blaue Augen hat.","24","2"
"Mrs. Macomber","Ich habe ihn gefragt, was er vorhat und dann ist er mit der Schrotflinte","24","207"
"Mrs. Macomber","auf mich los.","24","207"
"Sheriff","Wie heißen sie wirklich, Mister? - Na gut, wenn sie es nicht sagen","24","183"
"Sheriff","wollen, wir finden es auch so heraus. Führt ihn ab Leute. Und jetzt zu","24","183"
"Sheriff","euch Jungs.","24","183"
"Justus","Ja, Sheriff?","24","2"
"Sheriff","Manny und Gasper nehmen wir uns später vor. Sobald wir das Geld","24","183"
"Sheriff","gefunden haben, wird es leicht sein, ihnen die Beteiligung an dem","24","183"
"Sheriff","Raubüberfall zu weisen. Falls wir das nicht schon mit Hilfe ihrer","24","183"
"Sheriff","Fingerabdrücke tun können.","24","183"
"Allie","Aber, wo ist das Geld?","24","196"
"Justus","Wir müssen es suchen. Thurgood hat es bestimmt nicht. Musik beginnt","24","2"
"Justus","leise im Hintergrund. Denn dann hätte er einen so billigen Betrug nicht","24","2"
"Justus","mehr nötig gehabt.","24","2"
"Sheriff","Also gut, suchen wir.","24","183"
"REGIE","Musik","24","0"
"Erzähler","Der Sheriff, die Hilfssheriffs, Onkel Harry, Mrs. Macomber, Allie, die","24","574"
"Erzähler","drei Detektive und noch viele mehr suchten nach dem Geld.","24","574"
"Erzähler","Währenddessen gestanden Manny und Gasper ihre Beteiligung an","24","574"
"Erzähler","dem Raubüberfall ein. Sie erklärten auch, dass der Tote Gilbert","25","574"
"Erzähler","Morgen daran beteiligt gewesen war und den Auftrag gehabt hatte,","25","574"
"Erzähler","vorübergehend das Geld in der Mine zu verstecken, weil diese","25","574"
"Erzähler","verschlossen werden sollte. Doch da war das Geld nicht. Ja, wo war","25","574"
"Erzähler","es dann?","25","574"
"Peter","Also wenn die 250000 Dollar nicht hier in der Scheune von deinem","25","3"
"Peter","Onkel Harry sind, dann weiss ich nicht mehr, wo ich noch suchen soll.","25","3"
"Bob","Ich auch nicht.","25","4"
"Allie","Vielleicht hatte Morgen das Geld ja gar nicht bei sich als er nach Twin","25","196"
"Allie","Lakes kam.","25","196"
"Justus","Das ist möglich, er könnte sich die Mine einfach nur mal so angesehen","25","2"
"Justus","haben und ist dabei verunglückt.","25","2"
"Allie","Schau mal dieses alte Auto hier, ob es noch fährt?","25","196"
"Sheriff","Da musst du deinen Onkel fragen, Allie.","25","183"
"Allie","Muss ich gleich mal ausprobieren. Sheriff, der Sitz ist ja gar nicht","25","196"
"Allie","festgestellt. Der wackelt.","25","196"
"Justus","Der Sitz? Steig mal aus Allie!","25","2"
"Allie","Himmel, willst du den Sitz festmachen?","25","196"
"Justus","Nein. Peter fass mal mit an. Los, das Sitzpolster hochheben.","25","2"
"Peter","Gut, hoch damit.","25","3"
"REGIE","Musik beginnt leise im Hintergrund.","25","0"
"Justus","Da steckt das Zeug!","25","2"
"Allie","Ah, das Geld! Wir haben das Geld gefunden.","25","196"
"Bob","Na endlich!","25","4"
"Sheriff","Tatsächlich, da ist es!","25","183"
"Peter","Wie lange braucht man wohl um 250000 Dollar zu zählen?","25","3"
"Sheriff","Sicher 'ne ganze Weile Peter. Ich werde mir schön viel Zeit lassen,","25","183"
"Sheriff","beim Zählen.","25","183"
"REGIE","Gelächter","25","0"
"REGIE","Musik","25","0"
"REGIE","Ende","25","0"
