"Speaker","Text","Page"
"Leutnant Ferrante","Bones! Suche Mrs. Barron. Mir gefällt nicht, dass sie nicht hier","27"
"Leutnant Ferrante","ist. Los doch, beeil dich!","27"
"Mr. Barron","Bones wird meine Frau nicht finden.","27"
"Leutnant Ferrante","Ach, tatsächlich nicht?","28"
"Mr. Barron","Nein! Hören sie die Polizeisirene nicht?","28"
"Mr. Barron","Polizeisirenen","28"
"Leutnant Ferrante","Verdammt! Was ist das?","28"
"Justus","Mrs. Barron kommt mit einem Polizeiaufgebot. Das hört sich nach","28"
"Justus","wenigstens 5 Streifenwagen an.","28"
"Leutnant Ferrante","Barron, das werden sie mir büßen! Ich werde…","28"
"Leutnant Ferrante","Reifen quietschen","28"
"Mr. Barron","unterbricht Sie werden ganz vernünftig sein Mr. Ferrante. [","28"
"Mr. Barron","Stimmenwirrwarr setzt ein ] Sie sitzen in der Falle, und das wissen sie genau!","28"
"Mr. Barron","Ein Auto hält quietschend; erneutes Gewirr an Stimmen","28"
"Reynolds","Was ist hier los? Legen sie die Waffe weg, Mann!","28"
"Justus","Leutnant Ferrante, Waffen weg! Oder glauben sie wirklich, dass sie es mit","28"
"Justus","mehr als 20 Polisten aufnehmen können?","28"
"Mr. Barron","Ernestine!","28"
"Mrs. Barron","Charles! Oh, Charles ist alles in Ordnung?","28"
"Mr. Barron","Eigentlich nicht Ernestine. Wir haben auf Besuch vom Planeten Omega","28"
"Mr. Barron","gewartet und Polizei ist gekommen. Das Raumschiff da hinten ist wohl nicht mehr als","28"
"Mr. Barron","ein großer Luftballon, der über ein Drahtgestell gezogen wurde und auch sonst.","28"
"Mrs. Barron","Justus, Bob, Peter! Ich bin euch ja so dankbar, dass ihr uns die","28"
"Mrs. Barron","Augen geöffnet habt. Beinahe wäre ich auf diese Schwindler hereingefallen.","28"
"Justus","lacht Es freut mich Mrs Barron, dass sie von ihrem Omegaglauben geheilt","28"
"Justus","sind.","28"
"Mrs. Barron","überrascht Omegaglauben? Geheilt? [ Reifen quietschen; Musik","28"
"Mrs. Barron","setzt ein ] Wie meinst du das?","28"
"Justus","Na, es war doch alles nur ein Schwindel!","28"
"Mrs. Barron","Ja Justus, dieser Überfall von Ferrante und seinen Leuten, das ja,","29"
"Mrs. Barron","aber das ändert doch nichts daran, dass der Erde eine Katastrophe droht, und dass","29"
"Mrs. Barron","die Wesen von Omega kommen werden, um uns zu erretten.","29"
"Justus","ungläubig Mrs. Barron, ich..","29"
"Mrs. Barron","Sieh mal Justus, dass musst du ganz anders sehen.","29"
"Justus","irritiert Äh, Mrs. Barron!","29"
"Mrs. Barron","unterbricht und setzt fort Die Omeganer werden","29"
"Justus","ungläubig Also das ist, Mrs.","29"
"Mrs. Barron","unterbricht erneut Also ganz bestimmt","29"
"Justus","stöhnt kurz auf","29"
"Peter","lacht","29"
"Justus","lacht","29"
"Justus","Musik","29"
