"Speaker","Text","Page"
"REGIE","Die   drei   ???    und    die   Perlenvögel","1"
"REGIE","Hörspielskript von Graf Zahl","1"
"REGIE","Anmerkungen: Die Japaner sprechen mit asiatischem Akzent. Miss Melodys Sprechweise ist zwitschernd (lt. Buch singend).","1"
"REGIE","Titelmusik","1"
"Erzähler","Justus, Bob und Peter, die drei Detektive, machten nach einem langen Badetag Pause in dem klei-","1"
"Erzähler","nen Restaurant Seahorse. Ein Mann saß an der Theke. Er hielt einen mit Verbandsmull umwickelten","1"
"Erzähler","Kasten im Arm und zwinkerte alle paar Augenblicke. Unwillkürlich lächelte Justus ihm zu, was zur","1"
"Erzähler","Folge hatte, daß der Mann zu ihm, Peter und Bob an den Tisch kam. Die Kiste brachte er mit","1"
"REGIE","Musik","1"
"REGIE","Stimmengewirr","1"
"REGIE","Schritte","1"
"REGIE","Stühlerücken","1"
"Blinky","Na, seid ihr beim Schwimmen gewesen, im Ozean?","1"
"Peter","Ja, oben bei Wills Beach.","1"
"Blinky","So? Na, kein Wunder, daß ihr Hunger habt. Ach, ähm, ich heiße Stan.","1"
"Justus","Und wir sind Bob, Peter und Justus. Das ist Bob, das ist Peter.","1"
"Peter","Ja, und und er ist Justus, klar? (lacht)","1"
"Blinky","Eigentlich heiße ich ja Stanley. Stan ist nur die Abkürzung. Aber alle nennen mich Blinky. Warum ist","1"
"Blinky","ja wohl klar. Ich habe ein nervöses Leiden, ich muß immer blinzeln. Ich bezahle alles zusammen, ja?","1"
"Justus","(erfreut) Oh, Dankeschön.","1"
"Bob","Wie kommen wir zu der Ehre?","1"
"Bob","Rascheln von Geldscheinen und Klappern von Münzen","1"
"Peter","Ja.","1"
"Justus","Das ist sehr nett.","1"
"Justus","Wohnen sie gern in Santa Monica, Blinky?","1"
"Kellnerin","(leise) Ja, danke.","1"
"Blinky","Woher weißt du denn, wo ich wohne, Justus?","1"
"Justus","Och, ich hatte nicht vor, Sie zu erschrecken. Das ist nur ein Spiel, mit dem ich mir manchmal die Zeit","1"
"Justus","vertreibe. Auf dem Parkplatz stehen nur drei Autos. In einem liegt ein Teddybär auf dem Beifahrer-","1"
"Justus","sitz und das zweite hat ein Surfbrett auf dem Dach. Beides sind wohl nicht ihre Wagen.","1"
"Blinky","Das ist allerdings richtig.","1"
"Justus","Am dritten Auto steht unter dem Nummernschild der Name eines Händlers aus Santa Monica. Also","1"
"Justus","schloß ich daraus, daß das nur ihr Wagen sein kann.","1"
"Blinky","Aha, Aha. Alle Achtung. Das ist ja wie Detektivspielen.","1"
"Justus","Wir sind Detektive: die drei Fragezeichen. Hier Karte wird herausgesucht unsere Karte.","1"
"Blinky","Was? (erstaunt) Was, eine Karte habt ihr auch? Hmhm, die drei Detektive, drei Fragezeichen. Wir","1"
"Blinky","übernehmen jeden Fall. Erster Detektiv: Justus Jonas. Ah, das bist Du.","1"
"Justus","Genau.","2"
"Blinky","Zweiter Detektiv: Peter Shaw, Recherchen und Archiv: Bob Andrews. Das bist du, Bob. Aha, Aha.","2"
"Blinky","Und das ist eure Telefonnummer? Was bedeuten denn die drei Fragezeichen?","2"
"Justus","Sie sind unser Markenzeichen. Und sie sind das Symbol für das unerforschte. Für unerforschte Ge-","2"
"Justus","heimnisse und ungelöste Rätsel.","2"
"REGIE","Aufstehen, Schritte","2"
"Bob","Aber, Blinky, wo wollen Sie denn hin?","2"
"Peter","Warten Sie doch, Sie haben ihren Kasten vergessen!","2"
"Bob","Sowas.","2"
"Justus","Ja, also wirklich.","2"
"Bob","Haut einfach ab. Ob er hinter dem grünen Transporter mit dem Japaner am Steuer her ist? Na ja, wir","2"
"Bob","können den Kasten ja bei der Kellnerin abgeben.","2"
"Peter","Hm.","2"
"Bob","Blinky kommt bestimmt wieder her und fragt danach.","2"
"Justus","Nein. Ich bin dafür, daß wir die Kiste in die Zentrale mitnehmen. Wir bewahren Sie für Blinky auf, bis","2"
"Justus","er sich bei uns meldet. Er hat ja unsere Karte mit der Telefonnummer.","2"
"Peter","Ja, stimmt.","2"
"Justus","Außerdem hat er sie nicht bei der Kellnerin gelassen, sonder bei uns, hm?","2"
"Bob","M-hm.","2"
"REGIE","Musik","2"
"Erzähler","Eine halbe Stunde später waren die drei Detektive in ihrer Zentrale auf dem Schrottplatz. Sie be-","2"
"Erzähler","schlossen, die Kiste zu öffnen, nachdem sie darin ein seltsames Geräusch wahrgenommen hatten.","2"
"REGIE","Blacky","2"
"REGIE","Blättern","2"
"Bob","Das hört sich an, als ob darin irgendwas flattert.","2"
"Peter","Du meinst, es könnte ‚‘n Vogel drin sein?","2"
"Peter","Justus, Bob Ja.","2"
"Justus","Mach doch mal das Klebeband ab, Peter.","2"
"Peter","Hm, gut. So! (angestrengt)","2"
"REGIE","Gurren","2"
"Peter","(überrascht, erfreut) Hey, eine Taube! Im Kasten ist 'ne Taube! Eine sehr schöne Taube, finde ich.","2"
"Justus","An der mir vor allem auffällt, daß sie am rechten Fuß drei Zehen hat und am linken nur zwei.","2"
"Peter","Ja, also in so einem engen Käfig können wir sie nicht sitzen lassen. Die braucht 'nen größeren.","2"
"Justus","Den bauen wir für sie.","3"
"Peter","Ja.","3"
"Justus","Kommt. Das ist kein Problem. Das Material dazu haben wir schnell zusammengesucht.","3"
"Erzähler","Justus, Bob und Peter machten sich an die Arbeit. Material war auf dem Schrottplatz wirklich genü-","3"
"Erzähler","gend vorhanden. Und bald war eine schöne große Kiste für die Taube fertig. Am nächsten morgen","3"
"Erzähler","trafen sich die Detektive erneut auf dem Schrottplatz.","3"
"REGIE","Typische Schrottplatzgeräusche (Säge, Hundegebell)","3"
"Bob","Es ist eine Belgische Brieftaube. Ein ganz schnelle Rasse.","3"
"Justus","Und es ist ein wahres Wundertier.","3"
"Peter","Wieso?","3"
"Justus","Ihm ist über Nacht eine Zehe nachgewachsen. Seht euch das an! Sie hat an beiden Füßen drei Ze-","3"
"Justus","hen.","3"
"Bob","(erstaunt) Was? Dann hat doch jemand die Tauben ausgetauscht.","3"
"Justus","Genau das, Bob. Was hast du über Belgische Brieftauben herausgefunden? Ich darf doch wohl an-","3"
"Justus","nehmen, daß du als für Recherchen zuständiger Detektiv dich um diese Fragen gekümmert hast.","3"
"Bob","Na klar habe ich das, Justus. Es ist unglaublich! Die Leute nehmen die Tauben, fahren mit ihnen","3"
"Bob","weite Strecken, manchmal bis zu tausend Kilometer, und dann lassen sie die Tauben frei. Die Tau-","3"
"Bob","ben finden pfeilgerade bis zu ihrem Schlag zurück.","3"
"Justus","Ach!","3"
"Bob","Kein einziger Vogel verirrt sich.","3"
"Peter","(begeistert) Da ist ja phantastisch!","3"
"Justus","Ja!","3"
"Bob","Man bindet den Tauben einen zusammengerollten Brief ans Bein. Die Vögel überbringen die Nach-","3"
"Bob","richt. Und das hat man schon so im Altertum gemacht.","3"
"Peter","(staunender Laut)","3"
"Justus","Ja, Bob, das stimmt. Ich frage mich nur, warum ...","3"
"Peter","Warum? Warum, warum was? Wovon redest du denn, Justus?","3"
"Justus","Ich frage mich, warum man heute Nacht die Tauben vertauscht hat. Woher wußte der Unbekannte,","3"
"Justus","daß die Taube mit den beiden Zehen hier war. Und wozu die Umtauchaktion? Das, das ... das muß","3"
"Justus","doch einen Sinn haben.","3"
"REGIE","Taubengurren","3"
"Peter","Keine Ahnung, Justus. Also wir sollten die Taube Caesar nennen, okay?","3"
"Bob","(murmelt) Hm, Ceasar.,","3"
"Peter","(zur Taube) Caesar!","3"
"Justus","Also, Möglichkeit Nummer Eins: Blinky selbst hat die Tauben vertauscht. Er hatte unsere Karte und","3"
"Justus","konnte herausfinden, wo wir sind. Jeder in Rocky Beach hätte es ihm sagen können.","3"
"Peter","Jeder, Justus? Ich glaube, du übertreibst. Sagen wir fast jeder. So bekannt sind wir nun auch nicht.","4"
"REGIE","Taubengurren","4"
"Justus","Also Möglichkeit Nummer Zwei: Es war der Japaner im grünen Transporter, dem Blinky nachgefah-","4"
"Justus","ren ist. Er könnte zufällig gesehen haben, daß wir die Kiste hierher gebracht haben. (überlegt) Hm,","4"
"Justus","wir haben nur einen Punkt, der uns weiterführen könnte.","4"
"Peter","Und der wäre?","4"
"Justus","Tauben, Peter. Keine gewöhnlichen Tauben, sondern fachmännisch gezüchtete, sorgfältig ausgebil-","4"
"Justus","dete Brieftauben. Für so etwas gibt es Clubs oder Vereine. Bob, sieh doch mal im Telefonbuch nach.","4"
"REGIE","Blättern","4"
"Bob","Na, da habe ich einen anderen Vorschlag: Miss Melody.","4"
"REGIE","Poltern","4"
"Justus","Miss Melody? Wer ist Miss Melody?","4"
"Bob","Blättern Ich finde keinen Club oder Verein im Telefonbuch. Bleibt nur Miss Melody. Und das ist eine","4"
"Bob","Frau, die manchmal in der Bücherei vorbeikommt. Daher kenne ich sie. Eine Vogelnärrin! Sie ist die","4"
"Bob","Vorsitzende des Vereins ""Unsere gefiederten Freunde"".","4"
"Peter","Aha.","4"
"Justus","Aha! Ist immerhin eine Chance. Wenn es hier in der Gegend Taubenexperten gibt, kennt sie sie","4"
"Justus","vielleicht. Weißt du, wo sie wohnt, Bob?","4"
"Bob","Natürlich, Justus. Nicht weit von hier: Alto Drive. Wir können mit dem Fahrrad dorthin fahren. Es sind","4"
"Bob","nur drei Kilometer oder so.","4"
"Justus","Na, also. Worauf warten wir dann noch. Caesar nehmen wir vorsichtshalber mit, damit er nicht","4"
"Justus","nochmal umgetauscht wird. Gegen Cleopatra oder wer weiß gegen wen.","4"
"Justus","Peter, Justus (lachen)","4"
"REGIE","Musik","4"
"Erzähler","Alto Drive lag im Osten von Rocky Beach. Bis dorthin war es wirklich nicht weit. Als die drei Detekti-","4"
"Erzähler","ve das Grundstück betraten, auf dem das Haus von Miss Melody stand, fühlen sie sich wie in einem","4"
"Erzähler","Vogelpark. Die Luft war erfüllt von dem Gezwitscher zahlloser Vögel.","4"
"REGIE","Lautes Vogelzwitschern","4"
"Peter","Vögel. Hier ist ja alles voller Vögel!","4"
"REGIE","Schritte","4"
"Bob","Ah, hier. Da kommt Miss Melody. (erstaunt) Ach du meine Güte. Die sieht ja mal wieder toll aus.","4"
"Bob","Bunt wie ein Kanarienvogel.","4"
"Peter","(lacht)","4"
"Bob","Genauso bunt wie die beiden Vögel auf ihrem Hut.","4"
"Bob","Justus, Bob (lachen)","4"
"Bob","Ms. Melody Ach, drei Jungen in meinem Garten. Was wollen sie wohl von mir?","4"
"Peter","Oh. Ach du meine Güte! Spinnt die?","5"
"Peter","Ms. Melody Kommt meinetwegen näher. Aber laßt meine Vögel in Ruhe. Was wollt ihr von mir?","5"
"Justus","Wir suchen die Herrin des Hauses. Sind Sie Miss Maureen Melody?","5"
"Justus","Ms. Melody Da seid ihr bei mir richtig. Ich bin Miss Melody.","5"
"Bob","Verzeichen Sie dir Störung, Miss Melody, haben Sie eine Moment Zeit für uns? Wir haben gehört,","5"
"Bob","daß ...","5"
"Bob","Ms. Melody Glory, Glory, Halleluja, Glory Glory Halleluja. Die Belohnung ist für euch.","5"
"Justus, Peter","(verlegenes Lachen)","5"
"Justus","Die Belohnung? Nein, nein, die Tauben gehört und nicht. Wir wollten sie Ihnen nicht bringen. Bitte,","5"
"Justus","könnten wir nicht im Haus darüber reden? Ich wüßte das sehr zu schätzen.","5"
"Justus","Ms. Melody Aber gerne. Kommt!","5"
"REGIE","Schritteauf Kies","5"
"REGIE","Tür","5"
"REGIE","Papagei (gesamt Szene in regelmäßigen Abständen)","5"
"Justus","Miss Melody ...","5"
"Justus","Ms. Melody Ach, wollt ihr die Taube freilassen? Ich zahle jedem eine Belohnung von 20 Dollar, der einen Vogel","5"
"Justus","aus seinem Käfig freiläßt. Ich ertrage es nicht, Vögel in Käfigen zu sehen.","5"
"Papagei","Grausam, grausam.","5"
"Peter","Die Taube ist nur durch besondere Umstände zu uns gekommen. Und wir möchten sie dem Besitzer","5"
"Peter","zurückgeben. Aber wir wissen nicht, wo er wohnt. Und da dachten wir, Sie wüßten vielleicht, ob es","5"
"Peter","hier irgendwo einen Brieftaubenzüchter gibt.","5"
"Peter","Ms. Melody Entschuldigt, ich will die Elster hereinlassen. Sie kommt immer durch diese Glasluke herein.","5"
"Peter","Eine zutrauliche Elster?","5"
"Peter","Ms. Melody Jaaa, ja, und so klug! Ich nenne ihn Edgar Allan Poe. Ich weiß, daß Poes Vogel ein Rabe war, aber","5"
"Peter","das nehmen wir nicht so genau.","5"
"Peter","Sagt man nicht, daß Elstern diebische Vögel sind?","5"
"Peter","Ms. Melody Oh ja, das sagt man. Aber Edgar Allan Poe ist es nicht. Im Gegenteil. Er schenkt mir immer etwas.","5"
"Peter","Sehr doch mal. Heute hat er mir eine Perle mitgebracht. Eine richtige Perle. Ja, ja, geh du nur in den","5"
"Peter","Graten zurück.","5"
"REGIE","Öffnen der Luke","5"
"Peter","Oh ja, das ist eine sehr große, schöne Perle, Miss Melody.","5"
"Peter","Ms. Melody Das ist schon die dritte Perle, die er mir in diesem Monat mitgebracht hat. Ich habe keine Ahnung,","5"
"Peter","woher er sie hat. Ich liebe Perlen über alles! Perlen und Vögel.","5"
"Peter","Hm, ja, wegen der Brieftaube. Kennen Sie zufällig einen Züchter?","5"
"Peter","Ms. Melody Einen Taubenzüchter? Nein. Nein, das tut mir leid.","5"
"Peter","Na, vielleicht erinnern sie sich doch noch an einen. Hier ist unsere Karte. Und vielen Dank. Es war","5"
"Peter","nett, daß Sie Zeit für uns hatten.","5"
"Peter","Ms. Melody Ach, da fällt mir etwas ein. Ich habe einen guten Bekannten in der Stadt. Er heißt Parker Frisbee. Er","6"
"Peter","hält Brieftauben. Ach, das hatte ich ganz vergessen. Besucht ihn doch mal.","6"
"Peter","Parker Frisbee, der Juwelier. Schritte Ja Dankeschön, vielen Dank.","6"
"REGIE","Musik","6"
"REGIE","Musik","6"
"Erzähler","Parker Frisbee war der beste und teuerste Juwelier in Rocky Beach. Ein gewaltiger Vollbart be-","6"
"Erzähler","deckte den größten Teil seines Gesichts, so daß eigentlich nur die Augen zu sehen waren. Justus,","6"
"Erzähler","Bob und Peter suchten ihn in seinem Geschäft auf und erzählten ihm, jemand habe die Brieftaube","6"
"Erzähler","auf den Hof der Schrotthandlung abgestellt.","6"
"REGIE","Gurren der Taube","6"
"REGIE","Tickende Uhren (gesamte Szene)","6"
"Frisbee","Oh, ich bin kein Experte. Ich habe auch schon lange keine Tauben mehr. Ist das der Vogel, um den","6"
"Frisbee","es geht?","6"
"Peter","Ja, das ist er, Mr. Frisbee.","6"
"Frisbee","Ja, das ist ... ähm ... eine Belgische Brieftaube. Das heißt, es ist kein Tauber sondern ein Weibchen.","6"
"Frisbee","Und für den Flug nimmt man eigentlich keine Weibchen.","6"
"Justus","Und Sie könnten dich nicht denken, wem diese Taube gehören könnte?","6"
"Frisbee","Wem sie gehört? Oh, du meine Güte. Also ich weiß das wirklich nicht. Es tut mir leid, daß ich Euch","6"
"Frisbee","nicht weiterhelfen kann. Bitte richtet Miss Melody schöne Grüße aus.","6"
"Justus","Ja, Danke. Machen wir, Mr. Frisbee Und nichts für ungut. Wiedersehen!","6"
"Frisbee","Wiedersehen, Jungs. Kommt ruhig wieder, wenn ihr Fragen habt. Ich will euch gern behilflich sein.","6"
"Frisbee","Vielleicht möchtet ihr wissen, was der Unterschied zwischen Diamanten und Brillianten ist? Nein?","6"
"REGIE","Musik","6"
"REGIE","Musik","6"
"Erzähler","Die drei Detektive verließen den Juwelierladen und gingen zu ihren Fahrrädern. Justus wollte gleich","6"
"Erzähler","losfahren, aber Bob hatte noch etwas zu bereden.","6"
"REGIE","Fahrradgeräusche","6"
"REGIE","Entfernte Stimmen von der Straße (gesamte Szene)","6"
"Justus","Was gibt es denn noch, Bob?","6"
"Bob","Ich bin mir nicht ganz sicher Just. Jedenfalls versteht Parker Frisbee entweder nicht viel von Brief-","6"
"Bob","tauben, im Klartext rein gar nichts, oder er hat uns angelogen.","6"
"Justus","(verständnislos) Was?","6"
"Peter","Warum soll er das getan haben? Der Mann ist ein angesehener Juwelier.","6"
"Bob","Was weiß ich. In dem Buch, das ich mir in der Bücherei geholt habe steht, daß auch Weibchen bei","6"
"Bob","Brieftaubenwettbewerben aufgelassen werden. Unter den preisgekrönten Fliegern gab's schon öfter","6"
"Bob","welche.","6"
"Peter","Und noch etwas. Seht nicht hin! Drüben auf der anderen Seite steht der grüne Transporter. Zwei","7"
"Peter","Japaner sitzen drin. Siehst Du?","7"
"Justus","Gut beobachtet, Kollege!","7"
"Bob","Nicht schlecht, Peter.","7"
"Justus","Über diese zwei Punkte müssen wir miteinander reden. Ich schlage vor, daß wir zur Zentrale fahren.","7"
"Justus","Kommt, Freunde. Die Sache wird interessant!","7"
"REGIE","Musik","7"
"Erzähler","Justus, Bob und Peter kehrten in die Zentrale zurück. Ein Licht am automatischen Telefonanrufbe-","7"
"Erzähler","antworter zeigte an, daß inzwischen jemand angerufen hatte.","7"
"REGIE","Öffnen der Tür","7"
"REGIE","Blacky (gesamte Szene)","7"
"Justus","Hey, jemand hat angerufen!","7"
"Peter","Ja, Blinky. Das wird Blinky gewesen sein. Wegen Caesar. Er will seine Taube wiederhaben.","7"
"Justus","Ich schalte mal ein. Dann wissen wir es gleich.","7"
"Peter","Ja.","7"
"Justus","Achtung.","7"
"REGIE","Einschalten","7"
"Justus","Ms. Melody (verzweifelt, um Fassung bemüht, unterbrochen von Kommentaren der drei ??? wie ""Oh Gott"" etc.)","7"
"Justus","Hilfe! Ich brauche Eure Hilfe! Ein Mörder geht um! Ich ging soeben in den Garten und fand den ar-","7"
"Justus","men kleinen Körper – tot! Er ist tot! Tot!","7"
"Peter","Das ist Miss Melody!","7"
"Peter","Ms. Melody Tot! Und dann fand ich noch ein Opfer. Einen meiner herrlichen Habichte. (schluchzt) Oh helft mir!","7"
"Peter","Bitte, bitte helft mir! Ein Mörder raubt mir meine Vögel!","7"
"REGIE","Knacken (Gesprächsende)","7"
"Justus","Ja, das war Miss Melody.","7"
"Peter","Ja.","7"
"Justus","Da ist was passiert. Los, nichts wie hin, Kollegen. Ich bin sicher, daß dieser Vorfall etwas mit Blinky,","7"
"Justus","der Taube Caesar und den Japanern im grünen Transporter zu tun hat. Es gibt einen Zusammen-","7"
"Justus","hang. Und wir werden ihn rausfinden!","7"
"REGIE","Musik","7"
"Erzähler","Die drei Fragezeichen fuhren sofort zu Miss Melody, die schon auf sie wartete. Niedergeschlagen","7"
"Erzähler","führte sie sie ins Haus. Und in ihrer Trauer sang sie nicht, sondern sprach ganz normal mit ihren Be-","7"
"Erzähler","suchern.","7"
"Erzähler","Papagei (gesamte Szene)","7"
"Erzähler","Ms. Melody (traurig, schluchzend) Als ich Eure Karte sah und begriff, daß ihr Detektive seid, da kam es mir vor","8"
"Erzähler","wie eine Himmelsbotschaft. Die Polizei ... die Polizei wollte ich nämlich nicht rufen. Ich habe nämlich","8"
"Erzähler","schon öfter Schwierigkeiten gehabt, weil sich Nachbarn über meine gefiederten Lieblings beschwert","8"
"Erzähler","haben.","8"
"Justus","Wo sind die toten Vögel?","8"
"Justus","Ms. Melody Dort, auf dem Tisch liegen sie. Auf dem Tuch.","8"
"Justus","(betrübt) Ah ja, ich sehe. Hm. Der Schädel der Elster ist richtiggehend zertrümmert.","8"
"Peter","Wie von einem Knüppelschlag.","8"
"Bob","Der Habicht ist unverletzt. Ob er vergiftet worden ist?","8"
"Papagei","Vergiftet, vergiftet.","8"
"Justus","Wo haben Sie die Vögel gefunden, Miss Melody?","8"
"Justus","Ms. Melody Draußen, Justus. Wo ich sie immer füttere.","8"
"Justus","Könnten wir uns die Stelle mal ansehen?","8"
"Justus","Ms. Melody Natürlich. Wartet, ich hole eben eine Taschenlampe.","8"
"Justus","Nicht nötig, Miss Melody. Haben wir selbst dabei. Wenn Sie uns die Stelle zeigen, können wir von","8"
"Justus","dort aus systematisch das Gelände absuchen.","8"
"Justus","Ms. Melody Ah, ist gut. Kommt, ich zeige es euch.","8"
"Justus","Dankeschön.","8"
"REGIE","Türöffnen","8"
"REGIE","Nachtvögel","8"
"REGIE","Schritte auf Kies","8"
"Peter","Das ist sicher der Futterplatz.","8"
"Peter","Ms. Melody Ja, genau. Und hier starb Edgar Allan Poe. Und der Habicht, der Habicht der lag da drüben.","8"
"Peter","(schniefen) Und jetzt entschuldigt mich bitte. Mir geht es nicht so gut. Ich ... ich möchte mich einen","8"
"Peter","Moment hinlegen.","8"
"Justus","Och, wir kommen schon allein klar, Miss Melody. Falls etwas ist, können wir uns ja melden.","8"
"REGIE","Schritte auf Kies","8"
"Justus","Ms. Melody Ja, ja, macht das. Ja. (entfernt sich)","8"
"Justus","Bob, Peter!","8"
"Peter","Ja?","8"
"Justus","Wir trennen uns! Bob, du übernimmst diese Seite des Waldes.","8"
"Bob","Okay.","8"
"Justus","Und du Peter, gehst auf die andere. Ich nehme mir die Mitte vor. Alles klar?","8"
"Peter","Mhm, ja, alles klar. Aber eins möchte ich noch von dir wissen, Justus.","8"
"Justus","Ja, was denn, Peter?","8"
"Peter","Was suchen wir?","9"
"Justus","Fußspuren. Die Fußspuren des Mannes, der die Vögel getötet hat.","9"
"Peter","Ja, großartig. Und wie sehen die aus?","9"
"Justus","(seufzend) Peter! Ich denke zum Beispiel an Blinky. Sind dir seine Schuhe nicht aufgefallen?","9"
"Peter","Nein.","9"
"Justus","Sie waren ziemlich groß und vorne spitz, sehr spitz. Kapierst du jetzt?","9"
"Peter","(genervt) ja, alles klar. Also, wenn Blinky hiergewesen sein sollte, werde ich seine Spur erkennen.","9"
"Peter","Und wenn wir eine Spur finden und die paßt nicht zu Blinky, wissen wir, daß er es nicht war, der die","9"
"Peter","Vögel umgebracht hat, oder?","9"
"Justus","Und sehr euch vor. Wer weiß, ob dieser Vogelmörder sich noch hier irgendwo herumtreibt.","9"
"Peter","Ja, und was machen wir, wenn wir was finden?","9"
"Justus","(überlegt) Dreimal mit der Taschenlampe blinken, Peter.","9"
"Peter","Okay.","9"
"Justus","Alles klar? Dann los, Jungs.","9"
"REGIE","Schritte auf Kies","9"
"Erzähler","Die drei Detektive nahmen die Suche auf, und nach einiger Zeit entdeckte Justus etwas in einem","9"
"Erzähler","Gebüsch. Ein kleines Bündel. Justus ging näher heran.","9"
"Justus","Moment. Da ist doch was. Ja, das könnte ... (schreit) Au! (stöhnt) Nein, nicht! Nicht schlagen!","9"
"Justus","(schreit) Ahhh (stöhnt)","9"
"Peter","(ruft aufgeregt) Justus! ... Just!","9"
"REGIE","Schritte auf Kies","9"
"Justus","(stöhnt)","9"
"Peter","Justus, was ist denn los? War hier jemand?","9"
"Justus","(stöhnt) Jemand ... jemand hat mich niedergeschlagen.","9"
"Peter","Oh Gott!","9"
"REGIE","Musik setzt ein","9"
"Justus","Ich glaube, es war Parker Frisbee! Er hatte einen Bart und trug eine dunkle Brille! (stöhnt) Er wollte","9"
"Justus","mir den Knüppel über den Kopf ziehen. Zum Glück konnte ich ihn mit der Taschenlampe blenden","9"
"Justus","und er hat mich nur an der Schulter erwischt. Dort hinüber ist er gelaufen!","9"
"Peter","Ja, dann ist er weg! Aber ... aber was wolltest du denn hier in dem Gebüsch?","9"
"Justus","Ich habe etwas gefunden, oh.","9"
"Peter","Was denn?","9"
"Justus","(mitleidig) Eine tote Taube.","9"
"Justus","Ah, da kommt Bob. (ruft) Bob, hierher!","9"
"Bob","(aufgeregt) Justus, was war denn los?","9"
"Peter","Parker Frisbee war hier. Er hat Justus ein mit dem Knüppel rübergezogen.","10"
"Justus","(bestätigend) Hm.","10"
"Peter","Eine tote Taube haben wir auch gefunden. Etwas hat ihr den Kopf abgerissen.","10"
"Bob","Es ist die mit den zwei Zehen!","10"
"Justus","Seht mal. Sehr doch mal, sie hat eine Metallfolie am Bein. Aha, da steckt ein Stückchen Papier drin.","10"
"REGIE","Papierknistern","10"
"Justus","Es ist beschriftet.","10"
"Peter","(interessiert) Ja, was steht drauf?","10"
"Justus","Moment, nicht so schnell. Das ... also da steht ... Also das ist vielleicht ein Geschmiere.","10"
"Peter","(ungeduldig) Oh, mach zu!","10"
"Justus","Das kann man ja kaum lesen.","10"
"Bob","Zeig mal, zeig mal","10"
"Justus","Ich würde sagen, es heißt ...","10"
"Bob","Das heißt: ""Heute keine Perlen."". Ja, genau, es heißt: ""Heute keine Perlen.""","10"
"Justus","Perlen? Die Kommen in diesem Fall ja reichlich vor.","10"
"Peter","Ja, genau wie Tauben. Mit zwei Zehen, mit drei Zehen. Lebendig und tot.","10"
"Justus","(überlegt) Perlen ... In dieser Nachricht heißt es: ""Heute keine Perlen."" Miss Melody begeistert sich","10"
"Justus","für Perlen. Sie hatte eine Elster, die ihr immer wieder Perlen brachte.","10"
"Peter","Ja.","10"
"Bob","Edgar Allan Poe.","10"
"Justus","Ja.","10"
"Bob","Er kam mit einer Perle im Schnabel ins Haus, als wir dort waren. Und Miss Melody sagte .. sie sagte","10"
"Bob","""Das ist schon die dritte Perle, die er mir ihn diesem Monat gebracht hat."", genau.","10"
"Justus","Und dann hat jemand Edgar Allan Poe getötet. Vermutlich Frisbee. Und Frisbee ist ein Juwelier, der","10"
"Justus","Perlen kauft und verkauft.","10"
"Peter","Mh-hm.","10"
"REGIE","Musik setzt ein","10"
"Justus","Wenn also Perlen das Hauptmotiv sind, dann müssen wir uns fragen: was haben die Tauben damit","10"
"Justus","zu tun? Wo ist das Bindeglied, Kollegen?","10"
"Justus","Erzäher   Wo war das Bindeglied? Das fragten sich die drei Fragezeichen immer wieder. Es gab nur eine Mög-","10"
"Justus","lichkeit, das herauszufinden. Sie mußten da ansetzen, wo alles angefangen hatte: Bei dem Restau-","10"
"Justus","rant Seahorse, wo sie Blinky begegnet waren. Am nächsten Morgen warteten sie vor dem Seahorse","10"
"Justus","auf den grünen Transporter und der kam. Viel schneller sogar als erhofft. Sie folgten ihm bis in einen","10"
"Justus","Stadtteil von Rocky Beach, der Klein-Tokio genannt wurde.","10"
"REGIE","Straßenlärm (gesamte Szene)","11"
"REGIE","Motorengeräuch des Transporters","11"
"Justus","(erleichtert) Ah, endlich. Der Transporter hält an. Vorsichtig jetzt.","11"
"Bob","Er hält vor dem Holzhaus.","11"
"Peter","Ja, am besten stellen wir die Räder hier ab.","11"
"Justus","Da! Zwei Japaner steigen aus und gehen ins Haus. Jetzt sollten wir wissen, ob ein Name am Brief-","11"
"Justus","kasten steht.","11"
"Bob","Das ist mein Fachgebiet, Justus. Recherchen. Ich sehe nach, ob ein Name dran ist.","11"
"Justus","Okay. Laß dir Zeit, Bob.","11"
"Bob","Keine Sorge, Justus. Du kannst dich erstmal ausruhen.","11"
"Peter","(lacht)","11"
"Bob","War ja auch anstrengend genug, diese Verfolgungsjagd. Ein Glück, daß der alte VW nicht mehr so","11"
"Bob","schnell fahren kann.","11"
"REGIE","Schritte","11"
"Frisbee","(entfernt) Hallo, du da!","11"
"Bob","(leise) Verflixter Mist. Parker Frisbee. Der meint mich.","11"
"Frisbee","Trifft sich gut, daß wir uns begegnen, Junge. Ich wollte nämlich mit dir und deinen Freunden reden.","11"
"Frisbee","Ach da drüben sind sie ja. Komm, gehen wir doch gleich zu ihnen hin.","11"
