"Speaker","Text","Page","speaker_id"
"Bob","worden ist, die ihm etwas heimzahlen wollen. Sonst hätte ja der anonyme Brief","22","4"
"Bob","mit dem ""Auge um Auge, Zahn um Zahn"" überhaupt keinen Sinn. Wenn also","22","4"
"Bob","diese sechs Verdächtigen ausscheiden und die anderen sechs auf Justus' Liste laut","22","4"
"Bob","Dr. Ferguson ebenfalls, dann muss Justus einen Fehler gemacht haben.","22","4"
"Kelly","Zeig mal her die Liste.","22","359"
"Bob","Hier.","22","4"
"Kelly","Mhm. Du meinst, der Entführer befindet sich zwar in eurer Fallsammlung, aber","22","359"
"Kelly","aus irgendeinem Grunde hat Justus ihn weggelassen.","22","359"
"Bob","Ja, ganz genau. Ich schalt mal den Computer ein. So. Moment. Ah, da haben wir's","23","4"
"Bob","schon. Aha.","23","4"
"Kelly","Hat Justus auch bestimmt alle Fälle erfasst? Oder kann es auch sein, dass er mal","23","359"
"Kelly","einen Fall vergessen hat einzugeben?","23","359"
"Bob","Nein. Ausgeschlossen. Unser Erster vergisst bekanntlich nie etwas.","23","4"
"Kelly","Dann können wir also ziemlich sicher sein, dass Peters Entführer hier auftaucht.","23","359"
"Bob","Ja.","23","4"
"Kelly","Die sechsunddreißig Fälle, die Justus aus der Sammlung herausgeholt hat, waren","23","359"
"Kelly","alles solche, bei denen die Täter ins Gefängnis mussten?","23","359"
"Bob","Ja. Richtig. Weil es Gerichtsverfahren gab, in denen sie verurteilt wurden. Ja und","23","4"
"Bob","genau da könnte der Fehler liegen.","23","4"
"Kelly","Aber wo?","23","359"
"Bob","Schon mal was von Freispruch gehört?","23","4"
"Kelly","Aber warum sollte jemand Peter entführen, der freigesprochen worden ist? Der","23","359"
"Kelly","hat doch dann überhaupt kein Motiv.","23","359"
"Bob","""Auge um Auge, Zahn um Zahn."" Na, ist endlich der Groschen gefallen?","23","4"
"Kelly","Du denkst an Leute, die vor Gericht gestanden haben und dann frei den","23","359"
"Kelly","Gerichtssaal verlassen haben.","23","359"
"Bob","Ja. Richtig. Weil sie zwar verurteilt wurden, aber der Richter entschieden hat,","23","4"
"Bob","dass die Strafe mit der Untersuchungshaft verbüßt ist. Aber an die denke ich gar","23","4"
"Bob","nicht, denn die müssten streng genommen auch zu Justus' sechsunddreißig Fällen","23","4"
"Bob","gehören. Verurteilt ist verurteilt.","23","4"
"Kelly","Bleiben also die Freisprüche.","23","359"
"Bob","Genau.","23","4"
"Kelly","Da gibt es bekanntlich aber wieder zwei Sorten. Die wegen erwiesener Unschuld","23","359"
"Kelly","und die aus Mangel an Beweisen.","23","359"
"Bob","Durch uns ist garantiert noch niemand in Untersuchungshaft und dann vor Gericht","23","4"
"Bob","gekommen, der unschuldig war.","23","4"
"Kelly","Bist du sicher?","23","359"
"Bob","Ach, ganz sicher. Das hätten wir erfahren und darüber hätten wir gesprochen. Das","23","4"
"Bob","kannst du vergessen.","23","4"
"Kelly","Also, wenn das alles stimmt, was wir jetzt überlegt haben, ist die Sache ganz","23","359"
"Kelly","einfach. Wir suchen jemanden, den ihr habt auffliegen lassen.","23","359"
"Bob","Ja.","23","4"
"Kelly","Der dann in Untersuchungshaft gesessen hat und vom Gericht wegen Mangel an","24","359"
"Kelly","Beweisen freigesprochen wurde.","24","359"
"Bob","Das haben wir gleich. Davon wird's ja nicht so viele geben. Wenn es überhaupt","24","4"
"Bob","welche gibt. Erinnern kann ich mich an keinen solchen Fall. Warte mal. Reich mir","24","4"
"Bob","den Computer noch mal her.","24","4"
"Kelly","Es bleibt uns nichts anderes übrig, als die ganze Sammlung noch einmal","24","359"
"Kelly","durchzusehen.","24","359"
"Bob","Na klar. Warte mal","24","4"
"Kelly","Nicht so schnell.","24","359"
"Bob","Was denn? Was denn? Ach, was ist das denn hier? Zweieinhalb Jahre für den","24","4"
"Bob","Hauptangeklagten wegen Betrug, Diebstahl und Urkundenfälschung. Na, der","24","4"
"Bob","scheidet aus. Weiter. Key page down. Nichts. Und hier? Auch nichts.","24","4"
"Kelly","Sieh mal da.","24","359"
"Bob","Urteil: Freispruch, weil Matt Brady die Tat nicht mit der notwendigen Sicherheit","24","4"
"Bob","nachgewiesen werden konnte. Aber vorher hat er fast acht Monate hinter Gittern","24","4"
"Bob","gesessen! Das könnte unser Mann sein!","24","4"
"Kelly","Passt genau!","24","359"
"Bob","Der Name sagt mir gar nichts. Lass mal sehen, worum es da ging. Okay.","24","4"
"Kelly","Ja. Herman Spencer. Geschäftsinhaber, entfernter Verwandter von Onkel Titus,","24","359"
"Kelly","wird erpresst.","24","359"
"Bob","Ja.","24","4"
"Kelly","Sollte 300.000 Dollar zahlen, andernfalls würde die Öffentlichkeit pikante Dinge","24","359"
"Kelly","über ihn erfahren.","24","359"
"Bob","Ja natürlich, jetzt erinnere ich mich. Aber nur an den Fall. Den haben Peter und","24","4"
"Bob","Justus allein gelöst. Das war in dem Sommer, als ich mit meinen Eltern","24","4"
"Bob","Verwandtenbesuche in Texas gemacht habe. Als ich zurückkam, war alles vorbei.","24","4"
"Bob","Also ich bin diesem Brady nie begegnet.","24","4"
"Kelly","Das gibt's doch nicht.","24","359"
"Bob","Warte mal, hier steht: Die Spur führt zu Charly Ross, ebenfalls Geschäftsmann in","24","4"
"Bob","Rocky Beach. Ross gesteht, belastet seinem Partner Matt Brady, kommt gegen","24","4"
"Bob","Kaution von 200.000 Dollar auf freien Fuß und verschwindet auf","24","4"
"Bob","Nimmerwiedersehen. Prozess nur gegen Brady. Urteil: Freispruch - und so weiter","24","4"
"Bob","und so weiter.","24","4"
"Kelly","Na bitte. Wenn das kein Motiv ist.","24","359"
"Bob","Anders als dieser Ross, der Geld genug hatte für eine Kaution, schmort Brady","25","4"
"Bob","acht Monate hinter Gittern. Womöglich war sein Geschäft ruiniert, als er wieder","25","4"
"Bob","herauskam.","25","4"
"Kelly","Stell dir vor, er wäre doch unschuldig gewesen und er wäre bloß das Opfer einer","25","359"
"Kelly","Intrige von diesem Ross geworden und hatte mit der Erpressung von Spender","25","359"
"Kelly","überhaupt nichts zu tun.","25","359"
"Bob","Das stelle ich mir lieber nicht vor. Dann hätten wir nämlich geholfen, sein Leben","25","4"
"Bob","zu ruinieren.","25","4"
"Kelly","Hier, ganz am Ende stehen die Daten.","25","359"
"Bob","Ja. Matt Brady, 1942 in Dallas geboren. Texas. Als Justus und Peter gegen ihn","25","4"
"Bob","ermittelten, wohnte er in Los Angeles, Pacific Road.","25","4"
"Kelly","Wenn unsere Parkplatztheorie stimmt -","25","359"
"Bob","Ja?","25","4"
"Kelly","- dann hat der Entführer einen Helfer gehabt. Und wenn Matt Brady unser Mann","25","359"
"Kelly","ist -","25","359"
"Bob","Ja?","25","4"
"Kelly","- wer ist dann dieser nicht besonders intelligente Kettenraucher?","25","359"
"Bob","Das werden wir feststellen, wenn wir dort sind. Äh, gib mir mal das Telefonbuch!","25","4"
"Kelly","Ähm, dieses hier?","25","359"
"Bob","Ja, genau. So. Also. *blättert im Telefonbuch* Ich such jetzt Brady. Brady - hier.","25","4"
"Bob","Brady ... Brady ... Brady ... Matt! Der wohnt noch immer in der Pacific Road.","25","4"
"Bob","Ich könnte ihn anrufen, um zu sehen, ob er da ist.","25","4"
"Kelly","Da ... das solltest du auf keinen Fall tun. Denn dann musst du entweder gleich","25","359"
"Kelly","wieder auflegen, sobald er sich meldet. Oder du musst irgendeine komische","25","359"
"Kelly","Ausrede finden. Also in jeden Fall könnte er merken, dass etwas im Busch ist.","25","359"
"Kelly","Wir haben jetzt halb acht. Ich schlage vor, dass wir Mr Brady einen Besuch","25","359"
"Kelly","abstatten.","25","359"
"Bob","Wann? Jetzt gleich?","25","4"
"Kelly","Wann denn sonst? Wenn er der Kidnapper ist, dann sehe ich nicht ein, warum","25","359"
"Kelly","Peter auch nur eine Minute länger in seinem Keller sitzen muss als nötig.","25","359"
"Bob","Mit Justus wären wir zu dritt.","25","4"
"Kelly","Und ohne ihn sind wir zu zweit. Wir haben doch keine Ahnung, wann er nach","25","359"
"Kelly","Hause kommt. Wir hinterlassen ihm einfach einen Zettel. Dann weiß er, wo wir","25","359"
"Kelly","sind. Dann kann er entweder nachkommen oder auf uns warten oder -","25","359"
"Bob","Oder was?","26","4"
"Kelly","- die Polizei anrufen, wenn wir nicht rechtzeitig zurück sind.","26","359"
"Bob","Okay. Welche Frist setzten wir uns?","26","4"
"Kelly","Bis Mitternacht. Wo steht der Kopierer?","26","359"
"Bob","Da in der Ecke. Wozu brauchst du den denn?","26","4"
"Kelly","Naja, vielleicht kommt Justus gar nicht mehr hierher, wenn er mit seinem Onkel","26","359"
"Kelly","aus der Stadt kommt. *Bob lacht* Also müssen wir eine Kopie dieser Nachricht","26","359"
"Kelly","drüben an die Hauswand pinnen.","26","359"
"Bob","Ja, du denkst aber auch an alles.","26","4"
"Kelly","Tja.","26","359"
"REGIE","*Zwischenmusik*","26","0"
"Erzähler","Neunzig Minuten später standen die beiden in der Pacific Road in Los Angeles,","26","574"
"Erzähler","vier Häuser von Matt Bradys Adresse entfernt. Dort wo die Häuser und Bäume","26","574"
"Erzähler","den Blick freigaben, konnten sie die untergehende Sonne sehen, die sich als","26","574"
"Erzähler","glutroter Feuerball dem Horizont näherte.","26","574"
"Kelly","Am besten bleibst du hier. Ich gehe unauffällig vorbei und sehe nach, ob Mr","26","359"
"Kelly","Brady dort wirklich wohnt.","26","359"
"Bob","*flüstert* Einverstanden. Aber sie vorsichtig.","26","4"
"Kelly","*flüstert auch* Ja.","26","359"
"REGIE","*Schritte*","26","0"
"Kelly","Auf dem Schild steht ein einziger Name. Matt Brady.","26","359"
"Bob","Ja.","26","4"
"Kelly","Und in einem Zimmer brennt schon Licht.","26","359"
"Bob","Wie sieht es mit den Eingängen aus?","26","4"
"Kelly","An der Straße ist ein Tor. Von dort führt ein Weg zur Haustür.","26","359"
"Bob","Ähm, ist die Haustür zur Straße hin oder zur Seite?","26","4"
"Kelly","An der Seite. Ist das wichtig?","26","359"
"Bob","Ich will nur wissen, was uns erwartet. Ich schlage vor, dass wir ihn überlisten.","26","4"
"Kelly","Und wie stellst du das an?","26","359"
"Bob","Ein gewisses Risiko müssen wir eingehen. Ich seh mir jetzt erstmal die","26","4"
"Bob","Umgebung an. Denn da drüben ist eine ganz gute Stelle. Dort kann ich ungesehen","26","4"
"Bob","über die Mauer klettern. Mache einen kurzen Kontrollgang um das Haus und","26","4"
"Bob","verstecke mich dann in der Nähe der Haustür.","26","4"
"Kelly","Toll. Und was tue ich?","26","359"
"Bob","Du lässt mir eine Minute Vorsprung. Wenn alles ruhig bleibt, kommst du und","27","4"
"Bob","klingelst ganz brav vorne am Tor.","27","4"
"Kelly","Und dann?","27","359"
"Bob","Wird Mr Brady vermutlich zur Tür kommen und dich auf der Straße stehen sehen.","27","4"
"Bob","Du wirst ihm zurufen, dass du ihn sprechen möchtest. Danach gibt es zwei","27","4"
"Bob","Möglichkeiten: Entweder er will dich abwimmeln, dann muss ich irgendwie","27","4"
"Bob","versuchen, an ihm vorbei ins Haus zu kommen, bevor er die Tür zumacht.","27","4"
"Kelly","Oder er kommt zu mir ans Tor.","27","359"
"Bob","Genau.","27","4"
"Kelly","Und du schlüpfst inzwischen hinter seinem Rücken ins Haus.","27","359"
"Bob","Erraten.","27","4"
"Kelly","Was sage ich ihn denn, wenn er dann draußen am Tor abfertigen will? Ich mein,","27","359"
"Kelly","wie komm ich dann hinein?","27","359"
"Bob","Du ... du sagst, es gehe um eine wichtige Angelegenheit und ob ihr die nicht im","27","4"
"Bob","Haus besprechen könnt. Genau.","27","4"
"Kelly","Wie gehen wir denn überhaupt vor, wenn wir da drin diesem Matt Brady","27","359"
"Kelly","gegenüberstehen?","27","359"
"Bob","Tja, dass Beste wird sein, wir nutzen unseren Überraschungsvorteil aus. Notfalls","27","4"
"Bob","sagen wir ihm gleich auf den Kopf zu, dass er Peter entführt hat. Ganz einfach.","27","4"
"Kelly","Ja, aber wenn das alles Unsinn ist, was wir uns da zusammengereimt haben?","27","359"
"Bob","Dann werden wir das an seiner Reaktion schnell merken. Wir müssen ihn eben","27","4"
"Bob","genau beobachten. Sollte er mit der ganzen Sache gar nichts zu tun haben,","27","4"
"Bob","entschuldigen wir uns und gehen wieder. Dann ist Mr Brady halt sauer auf uns.","27","4"
"Bob","Okay. Solange ihm und uns nichts Schlimmes passiert, geht es allen Beteiligten","27","4"
"Bob","prima. Gut, bis auf Peter.","27","4"
"Kelly","Wie müssen es versuchen.","27","359"
"Erzähler","Als Bob aus seinem Versteck hinter dem Haus beobachtete, dass Kelly mit einem","27","574"
"Erzähler","jungen Mann verhandelte, spürte er ein flaues Gefühl im Magen. Das da vorn ist","27","574"
"Erzähler","nicht Mr Brady, dachte er, der müsste doch viel älter sein! Aber es blieb ihm","27","574"
"Erzähler","keine Zeit. Kurz entschlossen schlüpfte er hinter dem Rücken des Mannes ins","27","574"
"Erzähler","Haus. Die Räume waren leer. Plötzlich waren auf dem Flur Schritte zu hören. Als","27","574"
"Erzähler","Bobs Blick an einem drehbaren Sessel hängen blieb, kam ihm ein verrückter","27","574"
"Erzähler","Einfall. Er setzte sich hinein und drehte ihn mit dem hohen Rücken zur Tür.","27","574"
"REGIE","*Schritte*","27","0"
"Kelly","Ähm, wir beide könnten uns ein wenig unterhalten.","28","359"
"John","Worüber denn?","28","274"
"Kelly","Es gäbe da eine Menge sehr interessanter Themen.","28","359"
"John","Aber das ändert auch nichts daran, dass mein Vater nicht da ist.","28","274"
"Bob","Guten Tag, Mr Brady junior.","28","4"
"Kelly","Sein Vorname ist John.","28","359"
"Bob","Wo wir gerade beim Vorstellen sind. Das ist Kelly und ich heiße Bob.","28","4"
"John","Was soll das Ganze?","28","274"
"Kelly","Ähm, während wir uns unterhalten und auf deinen Vater warten, könnten wir uns","28","359"
"Kelly","einen Glimmstängel leisten, findest du nicht? Oder darf man hier nicht rauchen?","28","359"
"John","Qualm, so viel du willst. Aber ich möchte jetzt endlich wissen, was hier los ist.","28","274"
"Kelly","Wo ist denn meine Schachtel? *Reisverschluss wird geschlossen* Vergessen.","28","359"
"John","Da kann ich dir nicht helfen. Ich rauche nicht. Und wenn ich jetzt nicht endlich","28","274"
"John","erfahre, was ihr hier verloren habt, dann rufe ich die Polizei.","28","274"
"Kelly","Das glaube ich nicht. Was soll dein Vater denken, wenn er heimkommt und du","28","359"
"Kelly","hast ihm ausgerechnet die Polizei ins Haus geholt?","28","359"
"John","Wie meinst du das?","28","274"
"Kelly","Sagt dir der Name Peter Shaw etwas?","28","359"
"John","Peter Shaw? Nie gehört. Und selbst wenn, was geht euch das an?","28","274"
"Bob","Wann kommt denn eigentlich dein Vater?","28","4"
"John","Das hab ich der doch schon gesagt. Eigentlich müsste er längst wieder da sein.","28","274"
"John","Und wenn er wieder da ist, fliegt ihr hier im hohen Bogen raus, darauf könnt ihr","28","274"
"John","Gift nehmen.","28","274"
"Kelly","Mann.","28","359"
"Bob","Du solltest den Mund nicht zu weit aufreißen.","28","4"
"REGIE","*Schritte, Tür wird geöffnet*","28","0"
"Mr Brady","Aber er hat vollkommen Recht.","28","-1"
"Kelly","Mist.","28","359"
"Mr Brady","Hände hoch!","28","-1"
"Bob","Sir, nehmen Sie das Gewehr herunter!","28","4"
"Mr Brady","Irrtum, Junge. Der Lauf zielt direkt auf deinen Kopf. Warum spioniert ihr hier","28","-1"
"Mr Brady","herum?","28","-1"
"Bob","Wir spionieren nicht herum, Mr Brady. Wir stellen Ermittlungen an im","28","4"
"Bob","Zusammenhang mit dem Verschwinden eines gewissen Peter Shaw.","28","4"
"Mr Brady","Diesen Namen habe ich schon gehört, als ich von dahinten miterleben musste, wie","29","-1"
"Mr Brady","ihr versucht habt meinen Sohn aufs Kreuz zu legen. Er hat den Namen noch nie","29","-1"
"Mr Brady","gehört. Stimmt's John?","29","-1"
"John","Ich habe denen schon gesagt, dass ich ihn nicht kenne, Dad.","29","274"
"Mr Brady","Setzt euch da drüben hin! Alle beide! *Schritte* Und keine Dummheiten. Und","29","-1"
"Mr Brady","glaubt bloß nicht, dass ich nicht schießen würde! Los, aufs Sofa! Und jetzt","29","-1"
"Mr Brady","möchte ich hören, warum ihr auf der Suche nach diesem Peter Shaw hierher","29","-1"
"Mr Brady","gekommen seid.","29","-1"
"Bob","Ja, ähm, Peter ist seit einigen Tagen spurlos verschwunden. Ein Freund von uns","29","4"
"Bob","hat einen anonymen Brief bekommen, in dem es heißt: Auge um Auge, Zahn um","29","4"
"Bob","Zahn. Wir vermuten, dass Peter entführt worden ist.","29","4"
"Mr Brady","Tut mir leid für ihn. Und was soll ich damit zu tun haben? Oder mein Sohn?","29","-1"
"Bob","Ja, ihr Sohn hat ja schon erklärt, dass ihm dieser Name nichts sagt. Bloß von","29","4"
"Bob","Ihnen haben wir das noch nicht gehört.","29","4"
"Kelly","Übrigens, Mr Brady, es hat keinen Sinn, uns hier festzuhalten. Wir werden bis um","29","359"
"Kelly","spätestens Mitternacht zurückerwartet. Unsere Freunde haben Ihre Adresse und","29","359"
"Kelly","wissen, dass wir hier sind.","29","359"
"Bob","Kelly!","29","4"
"Kelly","Sollten wir nicht rechtzeitig zurück sein, wird die Polizei hier aufkreuzen.","29","359"
"Mr Brady","So ist das also. John, geh runter in den Waschkeller. Bring zwei Wäscheleinen.","29","-1"
"John","Muss ich wirklich?","29","274"
"Mr Brady","Nun mach schon!","29","-1"
"John","*eingeschüchtert* Ja.","29","274"
"Bob","Was haben Sie denn vor?","29","4"
"REGIE","*Tür knarrt*","29","0"
"Mr Brady","Die Fragen stelle ich und niemand sonst! *aufgebracht* Ich will jetzt wissen, was","29","-1"
"Mr Brady","ich mit diesem Peter Shaw zu tun haben soll.","29","-1"
"Kelly","Wenn ich die Hände herunter nehmen kann, verrat ich's Ihnen.","29","359"
"Mr Brady","Also los.","29","-1"
"Kelly","Wir haben eine Liste von Leuten aufgestellt, die möglicherweise ein Motiv hatten,","29","359"
"Kelly","sich an den drei ??? zu rächen.","29","359"
"Mr Brady","Drei Fragezeichen? Was ist das für ein Kinderei?","29","-1"
"Kelly","Das sind sehr erfolgreiche Detektive aus Rocky Beach.","29","359"
"REGIE","*Tür knarrt erneut, Schritte*","29","0"
"Kelly","Es gibt eine ganze Reihe von Leuten, die durch ihre Ermittlungen im Gefängnis","30","359"
"Kelly","gelandet sind.","30","359"
"John","Hier, Dad.","30","274"
"Mr Brady","Du wirst jetzt einen Strick zu den beiden hinüber. Und du, du bindest deinem","30","-1"
"Mr Brady","Freund die Hände auf dem Rücken zusammen. *nachdrücklich* Ist das klar?","30","-1"
"Kelly","Habe verstanden.","30","359"
"Mr Brady","Wir machen einen kleinen Ausflug. John, du gehst jetzt rauf in mein","30","-1"
"Mr Brady","Schlafzimmer. Bring die beiden Koffer runter.","30","-1"
"John","Ja, Dad. Und du fängst jetzt endliche an, deinen Freund zu fesseln.","30","274"
"John","*nachdrücklich* Ist das klar?","30","274"
"REGIE","*Kelly fesselt Bob*","30","0"
"John","Ich möchte nicht mitfahren.","30","274"
"Mr Brady","Du tust, was ich dir sage! Du fährst mit. Wenn das hier erledigt ist, kannst du","30","-1"
"Mr Brady","abhauen. Dann brauchen wir dich nicht mehr.","30","-1"
"John","In Ordnung.","30","274"
"Mr Brady","Du gehst voraus! Nimm die Koffer mit! Und dann kommt ihr beide! Los jetzt!","30","-1"
"REGIE","*Musik*","30","0"
"Mr Brady","Autotür auf! Und jetzt rein!","30","-1"
"REGIE","*Zwischenmusik*","30","0"
"Erzähler","Als Justus zusammen mit Onkel Titus nach Hause kam, führte ihn sein erster Weg","30","574"
"Erzähler","zum Wohnwagen. Auf dem Tisch lag unübersehbar der weiße Zettel von Kelly","30","574"
"Erzähler","und Bob. Hastig überflog er die Nachricht. Dann klatschte seine Flache Hand","30","574"
"Erzähler","gegen die Stirn.","30","574"
"Justus","Ach, ich Idiot!","30","2"
"REGIE","*Telefon klingelt*","30","0"
"Blacky","Telefon, Telefon.","30","608"
"Justus","Justus Jonas von den drei Fragezeichen.","30","2"
"Mrs Fiedler","Erna Fiedler, die Bettnachbarin deiner Tante im-","30","521"
"Justus","Ich weiß.","30","2"
"Mrs Fiedler","Ich muss dringend mit dir sprechen. Es ist äußerst wichtig.","30","521"
"Justus","Schießen Sie los. Es geht um Peter, nehme ich an. Weiß Ihre Kugel jetzt, wo er","30","2"
"Justus","ist?","30","2"
"Mrs Fiedler","Ach, vergiss doch die blöde Kugel!","30","521"
"Justus","*erstaunt* Was soll ich?","30","2"
"Mrs Fiedler","Ich mache mir große Sorgen. Nach allem, was ich von dir und deiner Tante gehört","31","521"
"Mrs Fiedler","habe, muss ich annehmen, dass-","31","521"
"Justus","Was müssen Sie annehmen, Mrs Fiedler?","31","2"
"Mrs Fiedler","Ja, ich muss annehmen, dass ... ich meine, ich fürchte, dass dein Freund Peter von","31","521"
"Mrs Fiedler","meinem Schwager entführt worden ist.","31","521"
"Justus","Ihr Schwager? Wie kommen Sie denn darauf?","31","2"
"Mrs Fiedler","Weil das alles so zusammenpasst.","31","521"
"Justus","Heißt Ihr Schwager zufällig *Blätterrascheln* Matt Brady? Mrs Fiedler? Hallo?","31","2"
"Justus","Sind Sie noch dran?","31","2"
"Mrs Fiedler","Woher weißt du dass?","31","521"
"Justus","Das tut jetzt nichts zur Sache. Ich muss mich um Bob und Kelly kümmern. Sie","31","2"
"Justus","sind bei ihm! In seiner Wohnung in Los Angeles.","31","2"
"Mrs Fiedler","Oh Gott!","31","521"
"Justus","Glauben Sie, dass Ihr Schwager ihnen etwas antut, wenn er sie in seiner Gewalt","31","2"
"Justus","hat?","31","2"
"Mrs Fiedler","Er ist unberechenbar.","31","521"
"Justus","Diesen Hokuspokus mit der Kugel haben Sie bloß aufgeführt, um uns indirekt auf","31","2"
"Justus","Peters Spur zu bringen, nicht wahr? Und zugleich wollten Sie Ihren Schwager","31","2"
"Justus","nicht verraten.","31","2"
"Mrs Fiedler","So ist es.","31","521"
"Justus","Er hat Andeutungen gemacht, dass er sich für die Monate im Knast rächen würde.","31","2"
"Justus","Richtig?","31","2"
"Mrs Fiedler","Ja.","31","521"
"Justus","Wahrscheinlich hat Ihr Schwager einen Helfer gehabt, als er Peter kidnappte.","31","2"
"Justus","Haben Sie eine Ahnung wer das sein könnte?","31","2"
"Mrs Fiedler","Natürlich. Dafür kommt nur sein ältester Sohn in Frage. Der Dummkopf würde","31","521"
"Mrs Fiedler","aus dem Fenster springen, wenn sein Vater ihm das befiehlt.","31","521"
"Justus","Wie viele Söhne hat Mr Brady denn?","31","2"
"Mrs Fiedler","Zwei. Jeremias und John.","31","521"
"Justus","Und welcher von den beiden, meinen Sie, ist an der Entführung beteiligt?","31","2"
"Mrs Fiedler","Jeremias natürlich.","31","521"
"Justus","Also nicht John?","31","2"
"Mrs Fiedler","John? Niemals. Von dem halt sein Vater nichts. Und umgekehrt. Aus John wird","31","521"
"Mrs Fiedler","niemand schlau.","31","521"
"Justus","Aber er lebt bei seinem Vater?","32","2"
"Mrs Fiedler","Nur weil er den Absprung noch nicht gefunden hat. Er war zwar schon einmal","32","521"
"Mrs Fiedler","weg, ist aber zurückgekommen. Wenn einer mitgemacht hat, dann ist es Jeremias.","32","521"
"Mrs Fiedler","Er hat einen so schönen Namen und ein Spatzenhirn.","32","521"
"Justus","Und wo lebt er?","32","2"
"Mrs Fiedler","In Pasadena. Etwas außerhalb. Ich gebe dir seine Adresse.","32","521"
"REGIE","*Zwischenmusik*","32","0"
"Erzähler","Auf der ganzen Fahrt von Los Angeles nach Pasadena, hatte Bob das Gefühl, es","32","574"
"Erzähler","würde etwas Unvorhergesehenes passieren. Die Spannung im Wagen knisterte,","32","574"
"Erzähler","obwohl niemand ein Wort sprach.","32","574"
"REGIE","*Auto hält an und wird ausgemacht*","32","0"
"Mr Brady","John, was ist los? Warum hältst du?","32","-1"
"John","Es ist vorbei, Dad. Ich fahre nicht weiter.","32","274"
"Mr Brady","*schreit* Du Versager steckst auf der Stelle wieder den Zündschlüssel ins Schloss","32","-1"
"Mr Brady","und fährst weiter.","32","-1"
"John","Du kannst machen, was du willst, ich bleibe hier stehen. Ich hab keine Lust, Jerry","32","274"
"John","zu sehen. Ich habe auch keine Lust, mich in eure dunklen Machenschaften","32","274"
"John","hineinziehen zu lassen. Ich ... ich hab mit der Entführung nichts zu tun. Und was","32","274"
"John","die beiden da hinten angeht, so werde ich nicht zulassen, dass sie von dir und","32","274"
"John","meinem Bruder irgendwo eingesperrt werden. Ich nehme an, ihr wollt","32","274"
"John","verschwinden. Also tut es gleich.","32","274"
"Mr Brady","Du fährst jetzt weiter.","32","-1"
"John","Das werd' ich nicht tun. Ich hab keine Angst mehr vor dir. Damit ist es jetzt aus,","32","274"
"John","Dad. Ich hab nicht umsonst an dieser Stelle gehalten. Da sind noch Leute wach.","32","274"
"John","Die würden in ein paar Minuten hier sein. Und die restlichen zweihundert Meter","32","274"
"John","zu Jerrys Haus kannst du zu Fuß gehen.","32","274"
"Mr Brady","Du stellst dich also gegen mich. Gegen deinen eigenen Vater. Der von diesen","32","-1"
"Mr Brady","Klugscheißern unschuldig ins Gefängnis gebracht worden ist und alles verloren","32","-1"
"Mr Brady","hat.","32","-1"
"John","Verarsch mich doch nicht. Ich weiß, dass in Wirklichkeit dein Partner Charly","32","274"
"John","Ross die ganze Geschichte inszeniert hat. Aber du hast geschwiegen. Mehr noch,","32","274"
"John","du hast sogar gehofft, dass du einen Teil von den 300.000 Dollar abbekommen","32","274"
"John","würdest.","32","274"
"Mr Brady","Woher weißt du das?","32","-1"
"John","Von Charly. Stell dir vor, ich habe nachgeforscht, was dran war an deinem","33","274"
"John","ewigen Predigten über deine Unschuld und wie sehr man dir Unrecht getan hat.","33","274"
"John","Bevor er sich ins Ausland abgesetzt hat, hat mir Charly Ross persönlich erzählt,","33","274"
"John","welche Abmachungen es zwischen euch gab.","33","274"
"Mr Brady","Halt deine Schnauze!","33","-1"
"John","Ich hab keine Angst vor deinem Gewehr, Dad. Ich bin keins dieser Tiere, die du","33","274"
"John","so gern abknallst.","33","274"
"Bob","Gewehr her, Matt Brady!","33","4"
"Mr Brady","Was? Wie habt ihr-?","33","-1"
"Bob","Schauen Sie das nächste Mal genauer hin, wenn ich gefesselt werde.","33","4"
"Mr Brady","Ich habe immer gewusst, dass du nichts taugst. Dein Bruder Jeremias würde so","33","-1"
