"Speaker","Text","Page","speaker_id"
"Mr Brady","etwas nie tun. Der versteht mich.","33","-1"
"John","Das er dir immer Recht gibt und alles tut, was du von ihm verlangst, heißt noch","33","274"
"John","lange nicht, dass er dich besser versteht als ich!","33","274"
"Mr Brady","Dein Bruder und ich, wir brauchen nur noch ein paar Stunden. Dann wirst du nie","33","-1"
"Mr Brady","mehr etwas von uns hören. Wir gehen weit weg. Es ist alles geplant.","33","-1"
"John","Ich werde nichts unternehmen.","33","274"
"Mr Brady","Seit ein paar Stunden ist euer Freund wieder frei. Er konnte sich sozusagen selbst","33","-1"
"Mr Brady","befreien. Er hat-","33","-1"
"REGIE","*Sirenen nähern sich*","33","0"
"Inspektor Cotta","Alles raus hier! Schnell! Schnell! Matt Brady nehmen Sie die Hände hoch.","33","436"
"Bob","*erleichtert* Inspektor Cotta.","33","4"
"Kelly","Da kommt Justus.","33","359"
"Justus","Hallo!","33","2"
"REGIE","*Alle lachen erleichtert und reden durcheinander*","33","0"
"Bob","Inspektor, seien Sie anständig zu John. Er hat nichts verbrochen.","33","4"
"Inspektor Cotta","Ja, ja.","33","436"
"Kelly","Peter ist auch wieder frei! Schon seit einigen Stunden.","33","359"
"Inspektor Cotta","Umstellen Sie die Hütte, Godween!","33","436"
"Godween","Verstanden, Inspektor!","33","-1"
"Bob","*atemlos* Mensch, Chef, wie habt ihr uns bloß gefunden?","33","4"
"REGIE","*Sirene nähert sich*","33","0"
"Justus","Reine Intuition.","33","2"
"Bob","Ah.","33","4"
"Justus","Mit Hilfe der Glaskugel ist alles möglich.","34","2"
"Kelly","Seht doch, sie führen Jeremias aus der Hütte.","34","359"
"Inspektor Cotta","Seht, was wir in seiner Hosentasche gefunden haben.","34","436"
"Bob","""Clint""- Zigaretten. Herr Inspektor, der Fall ist abgeschlossen.","34","4"
"Justus","Wartet Kollegen. Nicht so voreilig.","34","2"
"REGIE","*Auto hält*","34","0"
"Justus","Kommt mit zur Telefonzelle.","34","2"
"REGIE","*Schritte, Telefonzellentür wird geöffnet, Nummer wird gewählt*","34","0"
"Kelly","Was hast du vor? Wen rufst du jetzt an?","34","359"
"Justus","Reine Intuition. *Freizeichen des Telefons* Aber vielleicht haben wir ja Glück.","34","2"
"Peter","Peter Shaw am Apparat.","34","3"
"Justus","Peter? Bist du es wirklich?","34","2"
"Peter","Aber natürlich, Chef. Habe alles heil überstanden.","34","3"
"REGIE","*alle lachen*","34","0"
"Justus","Schön. Peter, ich bin so froh.","34","2"
"REGIE","*Schlussmusik*","34","0"
