"Speaker","Text","Page","speaker_id"
"Peter","Wie bitte? Du machst Witze?","32","3"
"Justus","Erzähl weiter Bob!","32","2"
"Bob","Als ich ihm schilderte was mit euch und Mr. Whitehead geschehen war,","32","4"
"Bob","verloren wir keine Zeit mehr, bepackten seinen Jeep mit Wasservorräten","32","4"
"Bob","und fuhren in die Wüste. Ja und während der Fahrt erfuhr ich von ihm die","32","4"
"Bob","ganze Wahrheit.","32","4"
"REGIE","(Szenenwechsel zum Jeep von Dr. Wright)","32","0"
"Bob","Dr. Wright, nun erzählen sie mir doch endlich was los ist.","32","4"
"Wright","Schon während meiner Studienzeit habe ich mich mit Sekten beschäftigt.","32","-1"
"Bob","Ja.","32","4"
"Wright","Dabei stieß ich zufällig auch auf den Bund des Schwertes. Als ich mich","32","-1"
"Wright","mehr mit diesem Bund befasste, merkte ich, was für eine große Gefahr","32","-1"
"Wright","von ihm ausging. Um mehr über das Innenleben dieser Sekte zu erfahren,","32","-1"
"Wright","schleuste ich mich dort unter falschem Namen ein. Doch ich wurde","32","-1"
"Wright","enttarnt, musste fliehen und täuschte schließlich einen Selbstmord vor, um","32","-1"
"Wright","vor der Sekte sicher zu sein.","32","-1"
"Bob","Moment mal, ja Sie waren der Mann der damals angeblich ein Opfer der","32","4"
"Bob","Sekte geworden ist.","32","4"
"Wright","Ganz recht. Aber ich habe das Interesse an dieser Sekte niemals verloren,","32","-1"
"Wright","also recherchierte ich weiter. Dabei fand ich heraus, dass der Bewahrer,","32","-1"
"Wright","der ja vom Schwertbund verstoßen worden war, unter falschem Namen","32","-1"
"Wright","noch immer hier in der Gegend lebte.","32","-1"
"Bob","Mr. Benjamin Whitehead alias Earnest B. Blank, ja und dann?","32","4"
"Wright","Aus meiner eigenen Zeit beim Bund des Schwertes, wusste ich, dass","32","-1"
"Wright","Earnest Blank die geheimen Schriften des Bundes mitgenommen hatte,","32","-1"
"Wright","als er verschwand. In der Hoffnung diese Dokumente in seinem Haus zu","32","-1"
"Wright","finden, schleuste ich mich bei ihm als Butler ein. Ich entdeckte seine","32","-1"
"Wright","geheime Bibliothek und mir wurde schnell klar, dass sich Benjamin","32","-1"
"Wright","Whitehead keineswegs von der Sekte losgesagt hatte, sondern nur darauf","32","-1"
"Wright","wartete mit Hilfe des Schwertes die Macht an sich zu reißen.","32","-1"
"Bob","Und er wusste, dass sich das Schwert im Besitz von Billy Ford befand,","32","4"
"Bob","nicht wahr?","32","4"
"Wright","Nicht genau, aber er vermutete es.","32","-1"
"Bob","Ach so.","32","4"
"Wright","Er kannte die wahre Identität von Billy Ford. Billy Ford übrigens auch die","33","-1"
"Wright","von Benjamin Whitehead, beide kannten sich schon aus ihrer Zeit in","33","-1"
"Wright","Afrika.","33","-1"
"Bob","Ach so.","33","4"
"Wright","Was Mr. Ford allerdings nicht wusste, war, dass Benjamin Whitehead","33","-1"
"Wright","alias Earnest B. Blank nicht nur ein einfaches Mitglied, sondern der","33","-1"
"Wright","geheime Bewahrer der Sekte war. Als Bewahrer hat sich Blank den","33","-1"
"Wright","anderen Mitgliedern nämlich erst hier in Amerika zu erkennen gegeben.","33","-1"
"Wright","Als sie ihren Anführer verloren hatten, und er selbst Anspruch auf dessen","33","-1"
"Wright","Nachfolge erhob.","33","-1"
"Bob","Also die ganze Geschichte ist wirklich sehr verworren.","33","4"
"Wright","Äh.. so verworren nun auch wieder nicht. Da Billy Ford von der Stellung","33","-1"
"Wright","Benjamin Whiteheads in der Sekte nichts wusste, glaubte er, dieser sei","33","-1"
"Wright","ebenfalls nur ein einfaches Mitglied gewesen, dass sich inzwischen","33","-1"
"Wright","ebenfalls von der Sekte losgesagt hatte. Sein anfängliches Misstrauen","33","-1"
"Wright","verschwand. Und schließlich sah er in Benjamin Whitehead sogar einen","33","-1"
"Wright","Verbündeten im Kampf gegen die Sekte. Sein wichtigstes Ziel war, das","33","-1"
"Wright","Schwert endgültig zu zerstören. Das konnte aber nur bei einer","33","-1"
"Wright","Sonnenfinsternis geschehen.","33","-1"
"Bob","Ja!","33","4"
"Wright","Als er merkte, dass er die nächste nicht mehr erleben würde, vererbte er","33","-1"
"Wright","das Schwert an Benjamin Whitehead, weil er glaubte dieser wüsste, was","33","-1"
"Wright","er zu tun hatte.","33","-1"
"Bob","Das Schwert zu zerstören, wenn Tag und Nacht sich vereinen. Aber das","33","4"
"Bob","hatte Mr. Whitehead natürlich niemals vor.","33","4"
"Wright","Nein! Er wollte vielmehr mit Hilfe des Schwertes den Platz in der Sekte","33","-1"
"Wright","einnehmen, von dem er glaubte, dass er ihm immer zugestanden hat. Er","33","-1"
"Wright","wollte die ganze Macht.","33","-1"
"Bob","Aber dann fand die Sekte heraus, wo sich das Schwert befand und","33","4"
"Bob","überrumpelte uns. Hat denn niemand Mr. Blank wieder erkannt?","33","4"
"Wright","Vermutlich nicht. Viele der heutigen Mitglieder waren damals noch gar","33","-1"
"Wright","nicht dabei. Doch wir werden ihnen einen Strich durch die Rechnung","33","-1"
"Wright","machen. Ich habe herausgefunden wo die Anhänger des Bundes den Tag","33","-1"
"Wright","der Vereinigung zelebrieren werden. Im Tal des Todes - vermutlich haben","33","-1"
"Wright","sie auch deine beiden Freunde dorthin verschleppt.","33","-1"
"Bob","Na dann müssen wir uns aber beeilen. Ein paar Fragen habe ich aber","33","4"
"Bob","noch.","33","4"
"Wright","Schieß los.","34","-1"
"Bob","Waren sie der anonyme Anrufer, der uns zu dem Stein geführt hat?","34","4"
"Wright","Richtig. Und im nach hinein tut es mir sehr leid, ich ahnte wer den Stein","34","-1"
"Wright","gestohlen hatte, ich ahnte wer den Stein gestohlen hatte, und mir lag sehr","34","-1"
"Wright","viel daran ihn wieder zurück zu gewinnen. Also rief ich bei Euch an, denn","34","-1"
"Wright","ihr hattet ja schon Mr. Whitehead eure Dienste angeboten. Mir wurde erst","34","-1"
"Wright","später klar, dass ich euch damit in große Gefahr gebracht hatte und ich","34","-1"
"Wright","war sehr erleichtert als alles gut ging.","34","-1"
"Bob","Ja, es war allerdings äußerst knapp.","34","4"
"Wright","Als du dann bei mir an der Universität aufgetaucht bist und mich nicht","34","-1"
"Wright","erkannt hast, habe ich mir entschlossen dir die ganze Wahrheit über die","34","-1"
"Wright","Sekte zu erzählen. Ich habe gehofft, ich könnte euch dadurch","34","-1"
"Wright","abschrecken, doch da hatte ich euch wohl unterschätzt.","34","-1"
"Bob","Wenn wir heute nicht bei Mr. Whitehead aufgetaucht wären, säßen wir","34","4"
"Bob","jetzt nicht in diesem Schlamassel. Hoffentlich geht es Peter und Justus","34","4"
"Bob","gut. Sagen sie, wie haben sie es eigentlich geschafft neben ihrer Arbeit an","34","4"
"Bob","der Uni bei Mr. Whitehead den Butler zu spielen?","34","4"
"Wright","Jaaa, da kam mir zum Glück Benjamin Whiteheads Lebensstil zu Gute.","34","-1"
"Wright","Obwohl er es eigentlich gar nicht nötig hat, geht er wie jeder seiner","34","-1"
"Wright","Arbeiter jeden Morgen pünktlich ins Büro und kommt erst am späten","34","-1"
"Wright","Nachmittag zurück. So konnte ich morgens zu meinen Vorlesungen","34","-1"
"Wright","erscheinen und war Abends rechtzeitig wieder bei Mr. Whitehead.","34","-1"
"Bob","Ha! Das ist ja erstaunlich.","34","4"
"Wright","Oft blieb mir allerdings nur wenig Zeit um mich mit dem künstlichen Bart","34","-1"
"Wright","und der Perücke in den Diener Ben zu verwandeln. Ich bin froh, dass","34","-1"
"Wright","dieser Stress jetzt endlich ein Ende hat. (Spricht wie Ben) Sehr wohl, Sir!","34","-1"
"Wright","Habe verstanden, Sir!","34","-1"
"Bob","Hahaha! Sehr gut. Ähem, aber warum konnten sie ihr Buch über die","34","4"
"Bob","Sekten unter ihrem richtigen Namen veröffentlichen? Ich meine hatten sie","34","4"
"Bob","den gar keine Angst vor ihrer Rache? Nach ihren Erfahrungen mit dem","34","4"
"Bob","Bund des Schwertes hätten sie doch eigentlich viel vorsichtiger sein","34","4"
"Bob","müssen?","34","4"
"Wright","(zustimmend) Richtig. Aber dieses Buch habe ich erst veröffentlicht, als","34","-1"
"Wright","ich schon ein anerkannter Wissenschaftler und damit quasi eine Figur des","34","-1"
"Wright","öffentlichen Lebens war. Ich wusste, dass der Bund des Schwertes es","34","-1"
"Wright","sich nicht erlauben konnte gegen mich vorzugehen und damit das","34","-1"
"Wright","Interesse der Polizei oder des Geheimdienstes auf sich zu lenken.","35","-1"
"Wright","Jedenfalls nicht so lange sie nicht das Schwert in ihrem Besitz hatten.","35","-1"
"Bob","Ja, dann sind sie ja auch in Gefahr. Was haben sie denn jetzt vor?","35","4"
"Wright","Ich habe eine Imitation des Steins anfertigen lassen, der nicht die","35","-1"
"Wright","strahlende Eigenschaft des Steins besitzt.","35","-1"
"Bob","Ach so.","35","4"
"Wright","Sie befindet sich jetzt in den Händen der Sekte. Den echten Stein habe","35","-1"
"Wright","ich bei mir. Wenn wir rechtzeitig in der Wüste eintreffen, werde ich das","35","-1"
"Wright","Schwert zum brennen bringen und die Herrschaft über den Bund des","35","-1"
"Wright","Schwertes übernehmen. Und dann - darauf könnt ihr euch verlassen -","35","-1"
"Wright","werde ich den Bund von seiner extremistischen Ideologie befreien und ihm","35","-1"
"Wright","einen besseren und friedlicheren Weg zeigen, einen Weg der Freiheit und","35","-1"
"Wright","der Toleranz, der sie dahin führt, andere Menschen leben zu lassen, wie","35","-1"
"Wright","und wo sie wollen. Es ist ein langer Weg, aber mit genügend Ausdauer","35","-1"
"Wright","werde ich es schaffen.","35","-1"
"REGIE","(Szenenübergangsmusik - zurück in die Zentrale, Blacky krächzt)","35","0"
"Peter","Ohh, also man, diese Informationen muss ich erstmal verdauen. Jeder in","35","3"
"Peter","diesem Verwirrspiel hat also eine versteckte Identität gehabt. Erst war es","35","3"
"Peter","Billy Ford, der unter seinem richtigen Namen William Benson in Afrika","35","3"
"Peter","gelebt und dort das Schwert gestohlen hatte, dann gab es Earnest Blank,","35","3"
"Peter","den Bewahrer der Sekte, der seinen Namen in Benjamin Whitehead","35","3"
"Peter","änderte...","35","3"
"Justus","Genau.","35","2"
"Bob","Ja.","35","4"
"Peter","...und untertauchte, um im richtigen Moment wieder an der Oberfläche zu","35","3"
"Peter","erscheinen und schließlich Dr. Wright, der sich als Butler Ben bei","35","3"
"Peter","Whitehead eingeschlichen hatte, um den Bund des Schwertes auf die","35","3"
"Peter","Spur zukommen.... Also Kollegen.... Ich glaube, ich brauche jetzt","35","3"
"Peter","dringend ein Aspirin.","35","3"
"Justus & Bob","- Hahaha!","35","-1"
"REGIE","(hysterisches Abschlusslachen und Schlussmusik)","35","0"
