"Speaker","Text","Page","speaker_id"
"Prof. Steed","dann erkläre mir bitte, wie es Mrs Summer fertig gebracht haben","38","610"
"Prof. Steed","soll, so lange in der Kühltruhe auszuharren und völlig regungslos","38","610"
"Prof. Steed","und unterkühlt eine Leiche zu spielen?","38","610"
"Justus","Bitte? Oh ich ... ich Idiot!","38","2"
"Bob","Was ist denn?","38","4"
"Justus","Ich Esel!","38","2"
"Bob","Was ist denn?","38","4"
"Justus","Aber natürlich! Das ist es!","38","2"
"Prof. Steed","Was ist was?","38","610"
"Justus","Jetzt ist mir vollends klar, was Sie beide hier in der Dunkelheit","38","2"
"Justus","getrieben haben! Ihre lautstarke Auseinandersetzung mit dem","38","2"
"Justus","Elektrizitätswerk hatte einzig und allein den Sinn, Ihr","38","2"
"Justus","tatsächliches Vorgehen zu vertuschen!","38","2"
"Prof. Steed","Also, das ist doch ...","38","610"
"Justus","Ich nahm an, dass der Lärm, den Sie dabei verursachten, daher","38","2"
"Justus","kam, die technischen Apparate wieder einschalteten. In Wahrheit","38","2"
"Justus","jedoch hat in dieser Zeit der Austausch stattgefunden.","38","2"
"Bob","Was denn für'n Austausch, Just?","38","4"
"Justus","Bis uns der Professor mit dem vorgetäuschten Telefonat","38","2"
"Justus","ablenkte, lag eine Puppe in der Kühltruhe.","38","2"
"Prof. Steed","Unsinn!","38","610"
"Peter","Was?","38","3"
"Bob","Eine Puppe?","38","4"
"Justus","Während er laut und erregt sprach, kam Mrs Summer in das","38","2"
"Justus","Labor geeilt und hob ihre Nachbildung aus der Kühltruhe.","38","2"
"Prof. Steed","Blödsinn!","38","610"
"Justus","Als sie sie senkrecht aufstellte, rieselten die Eiskristalle herunter,","38","2"
"Justus","die sogleich auftauten. Wo haben Sie die Puppe versteckt? Viel","38","2"
"Justus","Zeit blieb Ihnen schließlich nicht übrig. Ha! Aber ja doch.","38","2"
"Bob","Was denn?","38","4"
"Prof. Steed","Nimm deine dreckigen Pfoten von meinem Schrank!","38","610"
"Bob","Vorsicht, Justus! Er hat einen Gummiknüppel!","39","4"
"REGIE","*Geräusche von einem Kampf sind zu hören*","39","0"
"Peter","Auf den Boden! Schön liegen bleiben! Nicht bewegen!","39","3"
"Justus","Kollegen, seht euch die an!","39","2"
"Bob","Nicht zu fassen.","39","4"
"Mr Hanson","Das darf doch nicht wahr sein! Eine naturgetreue Wachspuppe!","39","-1"
"REGIE","*fotografiert wieder*","39","0"
"Peter","Unglaublich! Sie ist Mrs Summer wie aus dem Gesicht","39","3"
"Peter","geschnitten.","39","3"
"Peter","Justus:*lacht* Diese Puppe hat vermutlich Mrs Summers befreundeter Künstler","39","3"
"Peter","angefertigt, der auch die lebensechten Mamorskulpturen","39","3"
"Peter","entworfen hat!","39","3"
"Bob","Sie können sich erheben, Madam.","39","4"
"Mrs Summer","Ein Tunnel! Mein Körper löst sich. Ich schwebe durch einen","39","1205"
"Mrs Summer","Tunnel.","39","1205"
"Justus","Ihre schauspielerischen Fähigkeiten waren wirklich Oscar reif.","39","2"
"Justus","Das Drehbuch war auch nicht schlecht. Aber ziemlich","39","2"
"Justus","unrealistisch. Ihrem Liebhaber dagegen sollte man beim","39","2"
"Justus","nächsten Mal lieber nur eine Nebenrolle zuteilen.","39","2"
"Prof. Steed","Blödsinn.","39","610"
"Justus","Seine Rolle als genialer Wissenschaftler, der dem Tod ein","39","2"
"Justus","Schnippchen schlagen konnte, war meiner Meinung nach eine","39","2"
"Justus","Nuance zu übertrieben. Ein bisschen mehr kann manchmal","39","2"
"Justus","schon zu viel sein.","39","2"
"Mr Hanson","Wenn du mir jetzt auch noch erläutern kannst, wie das mit dem","39","-1"
"Mr Hanson","Liebhaber gemeint ist, werden sich die Leser des ""Washington-","39","-1"
"Mr Hanson","Globe-Magazin"" wie ein Schwarm Heuschrecken über meinen","39","-1"
"Mr Hanson","Artikel hermachen. Das wird der Knüller des Jahrhunderts!","39","-1"
"Justus","Dieses Foto hier fand ich in Mrs Summers Pressemappe. Die hat","39","2"
"Justus","sie uns förmlich aufgedrängt. Sehen Sie sich das an.","39","2"
"Mr Hanson","Hm. Die Aufnahme scheint schon älter zu sein. Eine Party. Mrs","40","-1"
"Mr Hanson","Summer steht im Türrahmen und küsst einen Mann.","40","-1"
"Justus","Dessen auffällig große Nase keinen Zweifel aufkommen lässt,","40","2"
"Justus","um wen es sich dabei handelt.","40","2"
"Bob","Ja, natürlich.","40","4"
"Peter","Professor Steed!","40","3"
"Justus","Genau.","40","2"
"Mrs Summer","Ich friere, ihr verdammten Schnüffelnasen. Wo habt ihr meinen","40","1205"
"Mrs Summer","Pelzmantel gelassen? Und dann bringt mir gefälligst ein Glas","40","1205"
"Mrs Summer","Champagner!","40","1205"
"Justus","Madam, Sie haben uns die letzten zwei Tage bestens","40","2"
"Justus","unterhalten. Wir haben eine Menge dazugelernt und ich muss","40","2"
"Justus","gestehen, dass mir und meinen Kollegen so etwas wie Ihr Trio","40","2"
"Justus","noch nie begegnet ist.","40","2"
"Peter","Das stimmt.","40","3"
"Bob","Das kann man wohl sagen.","40","4"
"Justus","Nach wie vor werden wir selbstverständlich absolute Diskretion","40","2"
"Justus","bewahren, da Sie uns als Detektive mit diesem Fall beauftragt","40","2"
"Justus","haben. Doch mit Mr Hanson müssen Sie darüber schon selbst","40","2"
"Justus","verhandeln. Schließlich haben Sie ihn angerufen und ihn auf die","40","2"
"Justus","Story angesetzt. Ich kann mir allerdings nicht vorstellen, dass er","40","2"
"Justus","sich diesen Leckerbissen entgehen lässt!","40","2"
"Mr Hanson","Professor Steed, seien Sie bitte so freundlich und stellen Sie sich","40","-1"
"Mr Hanson","zu Ihrer Geliebten an die Bahre. Bob, du holst die die Wachsfigur","40","-1"
"Mr Hanson","aus dem Spind und stellst sie daneben. Gesellt euch dazu,","40","-1"
"Mr Hanson","Jungs. Und lächelt. Recht freundlich bitte.","40","-1"
"Justus","Die Presse wartet, Madam. Meinen Sie nicht, dass Sie sich für","40","2"
"Justus","das Foto noch etwas zurechtmachen sollten? Ich will ja nicht","40","2"
"Justus","unhöflich sein, aber Sie sehen aus wie eine Leiche!","40","2"
"REGIE","*Schlussmusik*","40","0"
