"Speaker","Text","Page","speaker_id"
"REGIE","Die   drei ???   - Die   Karten   des   Bösen    (82)","1","0"
"REGIE","- Hörspielskript von Haushinka -","1","0"
"REGIE","*Anfangsmusik*","1","0"
"REGIE","*Schrottplatzgeräusche; die ganze Szene über ist Blacky zu hören*","1","0"
"Peter","*lacht* Bob, Justus, hört euch das an! Ihre Wahrnehmung wird auf eine","1","3"
"Peter","harte Probe gestellt. Sollten Sie heute mit Geschehnissen","1","3"
"Peter","konfrontiert werden, die Ihnen auf den ersten Blick seltsam","1","3"
"Peter","erscheinen, zögern Sie nicht sich konsequent damit auseinander","1","3"
"Peter","zu setzen.","1","3"
"Justus","Aha.","1","2"
"Justus","Peter:*lacht immer noch* Soll ich dieses Horoskop nun negativ oder positiv deuten?","1","2"
"Justus","Was meint ihr?","1","2"
"Bob","Wenn dir heute tatsächlich eine übernatürliche Erscheinung","1","4"
"Bob","begegnet, Zweiter, dann solltest du unbedingt Donna Carrington","1","4"
"Bob","- alias Susan Maywood - informieren und ihre hellseherischen","1","4"
"Bob","Fähigkeiten loben. Die hat diesen Blödsinn nämlich verfasst!","1","4"
"Peter","Susan Maywood?","1","3"
"Bob","Mhm.","1","4"
"Peter","Nie gehört. Wer ist'n das?","1","3"
"Bob","Sie absolviert gerade ein Praktikum in der Redaktion meines","1","4"
"Bob","Vaters und schreibt dort die Tageshoroskope für alle zwölf","1","4"
"Bob","Tierkreiszeichen.","1","4"
"Justus","Aha.","1","2"
"Peter","Ja, aber wieso is'n das Foto mit ""Donna Carrington"" untertitelt?","1","3"
"Peter","Ist das Susan Maywoods Künstlername?","1","3"
"Bob","Ja, die Astrologin Donna Carrington existiert in Wirklichkeit gar","1","4"
"Bob","nicht.","1","4"
"Peter","Aha.","1","3"
"Bob","Diesen Namen hat sich vor vielen Jahren ein Redakteur","2","4"
"Bob","ausgedacht und das Foto eines Models dazugesetzt.","2","4"
"Justus","Eine ziemlich gerissene Masche für eine seriöse Zeitung wie die","2","2"
"Justus","""Los Angeles Post""!","2","2"
"Bob","Aber nun hör doch schon auf, Just!","2","4"
"Justus","Ich für meine Person bezweifle, dass sich das Schicksal","2","2"
"Justus","tatsächlich errechnen und somit voraussagen lässt.","2","2"
"Bob","Na dann können wir uns ja glücklich schätzen, nicht an diesen","2","4"
"Bob","Hokuspokus zu glauben","2","4"
"Peter","Ja.","2","3"
"Justus","Ich halte mich ausschließlich an Tatsachen.","2","2"
"Bob","Wie sieht dein Horoskop denn aus, Erster?","2","4"
"REGIE","*Zeitungsrascheln*","2","0"
"Justus","Ein Anruf wird Sie aus der Bahn werfen und Sie in einen Strudel","2","2"
"Justus","nervenaufreibender Ereignisse stürzen, die Sie Kopf und Kragen","2","2"
"Justus","kosten können.","2","2"
"Bob","*lacht* So ein Quatsch.","2","4"
"REGIE","*Peter stimmt lachend mit ein; Telefon klingelt*","2","0"
"Peter","Na, nun heb schon ab, Justus. Oder glaubst du, das Unheil lässt","2","3"
"Peter","sich abwenden, wenn du das Klingeln einfach ignorierst?","2","3"
"Bob","*flüstert* Schalt den Verstärker ein!","2","4"
"Justus","Justus Jonas?","2","2"
"Mrs Summer","Justus Jonas? Wie es auf der Visitenkarte steht, die ich hier in","2","1205"
"Mrs Summer","meinen Händen halte? Ist euer Detektivteam noch immer tätig?","2","1205"
"Justus","Ja ... aber wer spricht denn da?","2","2"
"Mrs Summer","Milva Summer. Dieser Name wird dir sicherlich nicht viel sagen.","2","1205"
"Justus","Von wem haben Sie denn unsere Karte erhalten?","2","2"
"Mrs Summer","Von einer ehemaligen Klientin von euch. Ihr Name ist Abigail","2","1205"
"Mrs Summer","Holligan.","2","1205"
"Justus","Ah.","3","2"
"Mrs Summer","Sie hat mir euer Detektivbüro wärmstens empfohlen. *fängt an","3","1205"
"Mrs Summer","zu weinen* Ich bin am Ende. Ich kann einfach nicht mehr! Ich","3","1205"
"Mrs Summer","habe mir schon die Augen ausgeweint und in der ganzen","3","1205"
"Mrs Summer","Nachbarschaft herumgefragt, aber ""Come In"" ist nicht","3","1205"
"Mrs Summer","zurückgekehrt.","3","1205"
"Justus","""Come in""? Wer oder was ist denn das?","3","2"
"Mrs Summer","Mein Kater. Es zerreißt mir das Herz! Ich muss ihn wiederfinden.","3","1205"
"Mrs Summer","Nehmt ihr den Auftrag an?","3","1205"
"Justus","Äh. . . im Prinzip schon. Doch vorher sollten Sie uns mit mehr","3","2"
"Justus","Informationen versorgen.","3","2"
"Mrs Summer","""Come In"" ist ein Kartäuserkater. Er hat orange-schillernde","3","1205"
"Mrs Summer","Augen und ein stahlblaues Fell. Sein auffälligstes Merkmal ist","3","1205"
"Mrs Summer","allerdings sein buschiger pechschwarzer Schwanz. Er sieht","3","1205"
"Mrs Summer","beinahe so aus, als wäre er in Farbe getaucht worden. Ein","3","1205"
"Mrs Summer","Streich der Natur! Und er ist vielleicht etwas mollig.","3","1205"
"Justus","Und seit wann vermissen Sie ihn?","3","2"
"Mrs Summer","Schon seit sieben Tagen. Aber können wir das nicht persönlich","3","1205"
"Mrs Summer","besprechen? Ich besitze eine Menge Fotos, auf denen ""Come In""","3","1205"
"Mrs Summer","in allen erdenklichen Posen abgelichtet ist.","3","1205"
"Justus","Ausgezeichnet, Mrs Summer. Wann würde es Ihnen denn","3","2"
"Justus","passen?","3","2"
"Mrs Summer","Könnt ihr nicht gleich kommen? Sozusagen umgehend?","3","1205"
"Justus","*zögerlich* Ja, das ließe sich einrichten.","3","2"
"Mrs Summer","Wenn ihr vor meinem Haus eintrefft, müsst ihr am Gartentor","3","1205"
"Mrs Summer","dreimal klingeln. Dann weiß ich, dass ihr es seid. Ich wohne in","3","1205"
"Mrs Summer","Westwood. In der Secondstreet, Hausnummer 34.","3","1205"
"Justus","Einverstanden, Madam. Wir sind in einer Stunde bei Ihnen.","3","2"
"Mrs Summer","Ihr müsst ihn finden! Ich zähl auf euch.","3","1205"
"REGIE","*Hörer wird aufgelegt*","3","0"
"Justus","Voilà - so soll es sein!","3","2"
"REGIE","*Zwischenmusik*","4","0"
"Erzähler","Westwood war ein vom Wilshire-Boulevard durchzogenes","4","574"
"Erzähler","Villenviertel mit zahlreichen Luxusgeschäften. Als Peter mit","4","574"
"Erzähler","seinem MG vor der großen Toreinfahrt von Mrs Summers","4","574"
"Erzähler","Grundstück hielt, erblickten die drei Detektive hinter den","4","574"
"Erzähler","Gitterstäben eine imposante, vierstöckige Villa. Den weitläufigen","4","574"
"Erzähler","Garten zierte ein kleiner See, auf dessen Oberfläche blühende","4","574"
"Erzähler","Seerosen schwammen.","4","574"
"REGIE","*Auto hält; Schritte*","4","0"
"Justus","Mrs Summer scheint recht vermögend zu sein. Dass sie nicht die","4","2"
"Justus","Hausangestellte irgendeines Millionärs ist, beweist das Schild","4","2"
"Justus","dort an der Säule: Milva Summer. Empfang nur nach","4","2"
"Justus","Vereinbarung.","4","2"
"Peter","Wie war das noch? Dreimal klingeln? Na dann.","4","3"
"REGIE","*Klingeln*","4","0"
"Justus","Schaut durch das Tor, Kollegen. Wir werden bereits observiert.","4","2"
"Justus","Dort im Gebüsch ist eine Überwachungskamera installiert!","4","2"
"Bob","Sieh mal einer an.","4","4"
"REGIE","*Lautsprecher knackt*","4","0"
"Mrs Summer","*über Gegensprechanlage* Ja bitte?","4","1205"
"Justus","Wir sind es, Mrs Summer. Die drei Detektive.","4","2"
"Mrs Summer","Ich öffne das Tor. Fahrt euren Wagen bitte oben auf den","4","1205"
"Mrs Summer","Parkplatz.","4","1205"
"Justus","Verstanden.","4","2"
"REGIE","*Tor wird geöffnet; Autotüren schlagen zu; Auto wird gestartet*","5","0"
"Bob","*staunt* Oh, ist da ein riesiger Garten. Seht euch diese Marmorskulpturen","5","4"
"Bob","an. Wahnsinn. *schreit auf*","5","4"
"Peter","Was ist denn in dich gefahren, Bob? Hast du sie noch alle oder","5","3"
"Peter","wie?","5","3"
"REGIE","*Auto hält; Türen klappen*","5","0"
"Peter","Spinnst du? Was machst du denn da?","5","3"
"Justus","Komm, Zweiter! Das sehen wir uns an.","5","2"
"REGIE","*Schritte*","5","0"
"Justus","Stimmt was nicht, Bob?","5","2"
"Bob","Seht euch das an.","5","4"
"Peter","Was ist denn da? *erstarrt* Nein.","5","3"
"Erzähler","Fassungslos und mit weit aufgerissenen Augen starrten Bob und","5","574"
"Erzähler","Peter in den Ginsterbusch. Justus bemerkte ein dünnes","5","574"
"Erzähler","Drahtseil, dann sah er die Katzenpfoten. Sein Blick glitt den","5","574"
"Erzähler","stahlblauen Pelz entlang und blieb entsetzt an dem buschigen,","5","574"
"Erzähler","schwarzen Schwanz haften. Das Tier, das in der Drahtschlinge","5","574"
"Erzähler","vom Abendwind leicht hin und her geschaukelt wurde, war","5","574"
"Erzähler","unverkennbar Mrs Summers vermisster Kater ""Come In""!","5","574"
"Bob","Wer ist zu solch einer grausamen Tat fähig, Freunde?","5","4"
"Peter","Irgendeinem bestialischen Tiermörder ist es offensichtlich","5","3"
"Peter","mühelos gelungen, das Eingangstor zu passieren und den toten","5","3"
"Peter","Kater hier im Gebüsch aufzuhängen.","5","3"
"Bob","Du meinst der Kater war schon tot bevor er gehängt wurde?","5","4"
"Justus","Wahrscheinlich wurde er vergiftet, sein Körper weist nicht die","5","2"
"Justus","geringsten Spuren äußerlicher Gewaltanwendung auf.","5","2"
"Bob","Warum hat man ihn dann hier ins Gebüsch gehängt?","5","4"
"REGIE","*Schritte; die drei erschrecken sich*","6","0"
"Mann","Was lungert ihr hier herum? *erschrickt* Gütiger Himmel!","6","58"
"Mann","""Come In""!","6","58"
"Justus","Augenblick, Sir! Vielleicht wären Sie so liebenswürdig, uns erst","6","2"
"Justus","einmal zu erklären, wer Sie sind und was Sie hier machen und","6","2"
"Justus","ob Sie überhaupt befugt sind Mrs Summers Kater an sich zu","6","2"
"Justus","nehmen.","6","2"
"Bob","Ganz genau.","6","4"
"Mann","Wie redest du denn mit mir, du frecher Lümmel?","6","58"
"Justus","Mrs Summer hat uns zu sich gebeten, da ihr Kater, wie sie","6","2"
"Justus","glaubte, entlaufen war. Sie hat uns den offiziellen Auftrag erteilt,","6","2"
"Justus","das Tier wieder zu finden. Was uns auch schneller gelungen ist,","6","2"
"Justus","als wir zu hoffen wagten.","6","2"
"Mann","Ich bin ihr Bodyguard, Gärtner und Hausmeister. Mein Name ist","6","58"
"Mann","Daniel Art. Und Sicherheit wird hier nun mal großgeschrieben.","6","58"
"Mann","Peter:*lacht* ""Come In"" hat von dieser Sicherheit nicht profitieren können.","6","58"
"Mr Art","Vielleicht wäre es besser, wenn ich diese Angelegenheit allein in","6","-1"
"Mr Art","die Hand nehme.","6","-1"
"Justus","Bedaure, Sir. Wir kommen mit.","6","2"
"REGIE","*Schritte*","6","0"
"Justus","Erstens haben wir den Kater gefunden und zweitens werden wir","6","2"
"Justus","von Mrs Summer erwartet.","6","2"
"Mr Art","Ich vermute eher, dass ihr nur auf eine Belohnung aus seid.","6","-1"
"Peter","Was fällt Ihnen ein! Wir verlangen von unseren Klienten","6","3"
"Peter","grundsätzlich kein Honorar!","6","3"
"Mr Art","Das ist nicht unbedingt dasselbe. Aber tut, was ihr nicht lassen","6","-1"
"Mr Art","könnt. Ich bring das Tier ins Haus.","6","-1"
"Justus","Kommt, Kollegen!","6","2"
"REGIE","*Schritte*","6","0"
"Justus","Da, eine Frau kommt aus dem Haus.","7","2"
"Bob","Das muss Milva Summer sein. Sie läuft zu Mr Art.","7","4"
"REGIE","*Mrs Summer weint*","7","0"
"Peter","Ich möchte jetzt nicht in ihrer Haut stecken.","7","3"
"Bob","Das ist ja schrecklich.","7","4"
"Justus","Kollegen, das Gesicht dieser Frau dort, das habe ich heute","7","2"
"Justus","schon einmal gesehen!","7","2"
"Peter","Was?","7","3"
"Justus","Wir kennen sie bereits alle drei! Von dem Foto in der ""Los","7","2"
"Justus","Angeles Post""! Diese Frau dort ist Donna Carrington, die","7","2"
"Justus","Astrologin, die es eigentlich gar nicht gibt!","7","2"
"Mrs Summer","*weinend* Er ist tot!","7","1205"
"Mr Art","Meinen Sie, es wäre sinnvoll, die Polizei zu verständigen, Mrs","7","-1"
"Mr Art","Summer?","7","-1"
"Mrs Summer","Nicht jetzt, Mr Art. Nicht jetzt. Geben Sie mir ""Come In""! Bitte","7","1205"
"Mrs Summer","lassen Sie uns allein.","7","1205"
"Mr Art","Sehr wohl, Madam.","7","-1"
"Mrs Summer","Kommt mit!","7","1205"
"Justus und Bob","Ja.","7","-1"
"REGIE","*Schritte; Tür wird geöffnet und geschlossen*","7","0"
"Mrs Summer","Hier ins Kaminzimmer. Setzt euch doch.","7","1205"
"Peter","Danke.","7","3"
"Erzähler","Bevor sich Mrs Summer zu den drei Detektiven an den Tisch","7","574"
"Erzähler","setzte, ging sie auf einen Katzenkorb zu, der vor dem Kamin","7","574"
"Erzähler","stand. Vorsichtig bettete sie den Körper von ""Come In"" hinein,","7","574"
"Erzähler","faltete ein weißes Spitzendeckchen auseinander und legte es","7","574"
"Erzähler","sanft über das Tier.","7","574"
"Mrs Summer","Bei mir dreht sich alles. Ich weiß gar nicht, was ich machen soll.","7","1205"
"Bob","Möchten Sie denn vielleicht lieber alleine sein?","8","4"
"Mrs Summer","Nein, nein! Es ist gut, dass ihr da seid.","8","1205"
"Bob","Gut. Gut.","8","4"
"Mrs Summer","Wer auch immer für den Tod meines Lieblings verantwortlich ist,","8","1205"
"Mrs Summer","spürt diese menschliche Bestie auf!","8","1205"
"Justus","Wir werden uns die größte Mühe geben, Madam. Zunächst","8","2"
"Justus","erlauben Sie mir aber bitte eine andere Frage. Sie sehen einer","8","2"
"Justus","Person, deren Gesicht wir bisher nur aus der ""Los Angeles Post""","8","2"
"Justus","kannten, frappierend ähnlich.","8","2"
"Bob","*lachend* Ja.","8","4"
"Justus","Diese Dame nennt sich Donna Carrington und ist laut Aussage","8","2"
"Justus","der Zeitung eine bekannte -","8","2"
"Mrs Summer","- Astrologin. Astrologin. Ich weiß. Und ich sehe dieser Person","8","1205"
"Mrs Summer","nicht nur ähnlich. Milva Summer alias Donna Carrington sitzt vor","8","1205"
"Mrs Summer","euch.","8","1205"
"Alle","Ach!","8","-1"
"Bob","Das ist ja ein Ding.","8","4"
"Peter","Demnach haben Sie sich für ihren Beruf einen Künstlernamen","8","3"
"Peter","zugelegt?","8","3"
"Mrs Summer","So ist es.","8","1205"
"Justus","Ach so.","8","2"
"Mrs Summer","Das war vor vierzehn Jahren.","8","1205"
"Peter","Und seitdem erstellen Sie tagtäglich die Horoskope für die ""Los","8","3"
"Peter","Angeles Post""?","8","3"
"Mrs Summer","Ohne Ausnahme. Allerdings wird meine Tätigkeit als Astrologin","8","1205"
"Mrs Summer","zum Ende des Quartals bei dieser Zeitung eingestellt.","8","1205"
"Bob","Ach. Haben Sie den Vertrag gekündigt?","8","4"
"Mrs Summer","Ganz recht. Die Astrologie hat mich zum Tarot geführt. Die","8","1205"
"Mrs Summer","Karten bedeuten mir mehr als die Sterne, so zu sagen.","8","1205"
"Peter","Tarot? Das Kartenspiel?","8","3"
"Mrs Summer","Für den Laien mag diese Bezeichnung zutreffen. Doch wer sich","8","1205"
"Mrs Summer","ernsthaft mit dem Tarot beschäftigt, wird feststellen, dass die","8","1205"
"Mrs Summer","Bilder und Symbole auf den Karten ein Spiegelbild unseres","9","1205"
"Mrs Summer","Lebens sind.","9","1205"
"Bob","Und was heißt das im Klartext?","9","4"
"Mrs Summer","Dass man die Verbindungen zwischen den Tarot-Symbolen und","9","1205"
"Mrs Summer","den Dingen, die im Leben geschehen, selbst herstellen muss.","9","1205"
"Mrs Summer","Die Tarotkarten offenbarten mir in regelmäßigen Abständen das","9","1205"
"Mrs Summer","Bild des Todes. Ein Skelett mit einer Sense. Doch ich habe","9","1205"
"Mrs Summer","dieses Symbol immer nur auf mich bezogen. Niemals kam mir","9","1205"
"Mrs Summer","der Gedanke, dass das Leben meines Katers bedroht in könnte.","9","1205"
"Justus","Ich für meine Person halte mich an reale Tatsachen, Madam.","9","2"
"Justus","Und deshalb wird es für uns ein Leichtes sein, den Mörder Ihres","9","2"
"Justus","Katers zu überführen. Mit an Sicherheit grenzender","9","2"
"Justus","Wahrscheinlichkeit werden wir schon in wenigen Minuten den","9","2"
"Justus","Täter - im wahrsten Sinne des Wortes - vor Augen haben!","9","2"
"Mrs Summer","Du sprichst in Rätseln, junger Mann.","9","1205"
"Justus","Auf dem gesamten Grundstück sind Überwachungskameras","9","2"
"Justus","installiert. Wenn wir einen Blick auf die Videoaufzeichnungen der","9","2"
"Justus","letzten Stunden werfen, werden wir sicher etwas","9","2"
"Justus","Aufschlussreiches zu sehen bekommen.","9","2"
"Mrs Summer","Das ist leider nicht möglich.","9","1205"
"Bob","Was?","9","4"
"Justus","Wie meinen Sie das?","9","2"
"Mrs Summer","Die gesamte Überwachungsanlage auf meinem Grundstück ist","9","1205"
"Mrs Summer","nicht echt. Die Kameras sind nur Attrappen!","9","1205"
"Justus","Wo liegt da der Witz?","9","2"
"Mrs Summer","Letzte Woche sind in der Nachbarschaft zwei ganze","9","1205"
"Mrs Summer","Straßenblöcke lahmgelegt worden. Die ""radikalen","9","1205"
"Mrs Summer","Atomstromgegner"" hatten mal wieder alle Stromleitungen","9","1205"
"Mrs Summer","zerschnitten. Was meint ihr wohl, weshalb mein Grundstück","9","1205"
"Mrs Summer","bisher von solchen Anschlägen verschont geblieben ist?","9","1205"
"Peter","Ja, dann stehen wir also praktisch wieder bei null und müssen","9","3"
"Peter","Ihnen daher die berühmte Standardfrage stellen. Haben Sie in","9","3"
"Peter","Ihrem Umfeld irgendwelche Feinde?","9","3"
"Bob","Sehr gut, Peter.","10","4"
"Mrs Summer","Du schätzt mich falsch ein, junger Mann. Ich bin eine friedvolle","10","1205"
"Mrs Summer","Person und mit meinem Ich im Einklang. Ich bin mit niemandem","10","1205"
"Mrs Summer","ernsthaft aneinander geraten. Obwohl meine astrologischen","10","1205"
"Mrs Summer","Analysen für manche Personen nicht leicht zu schlucken waren.","10","1205"
"Bob","Deuten Sie auch privat für andere Menschen das Schicksal aus","10","4"
"Bob","den Sternen?","10","4"
"Mrs Summer","Allerdings, allerdings. Draußen dämmert es bereits. Ich zünde","10","1205"
"Mrs Summer","die Kerzen an.","10","1205"
"REGIE","*Schritte; Streichhölzer klappern und werden entzündet*","10","0"
"Justus","Ist es nicht seltsam, dass diese unbekannte Person die","10","2"
"Justus","Unverfrorenheit besaß, sich am helllichten Tag mit ""Come In"" auf","10","2"
"Justus","Ihr Grundstück zu wagen, obwohl überall auf dem Gelände","10","2"
"Justus","Kameras installiert sind?","10","2"
"Mrs Summer","Was willst du damit sagen?","10","1205"
"Justus","Derjenige, der den toten Kater im Gebüsch aufgehängt hat, muss","10","2"
"Justus","darüber Kenntnis gehabt haben, dass es sich bei Ihrer","10","2"
"Justus","Überwachungsanlage lediglich um eine Attrappe handelt und er","10","2"
"Justus","deshalb, quasi unentdeckt, seine Freveltat ausführen konnte!","10","2"
"Mrs Summer","*aufgeregt* Um Himmels willen! Der Frevel ...","10","1205"
"REGIE","*Schritte; eine Schublade wird geöffnet*","10","0"
"Peter","Sind das Tarotkarten?","10","3"
"Mrs Summer","Still! Vorgestern die Karte des Mondes. Gestern das dritte","10","1205"
"Mrs Summer","Schwert. Moment! Der Gehängte! Gütiger Himmel! Und hier:","10","1205"
"Mrs Summer","wieder das Bild des Todes.","10","1205"
"Justus","Was haben Sie?","10","2"
"Mrs Summer","Wir alle müssen einmal sterben ... irgendwann ... auch ihr. Doch","10","1205"
"Mrs Summer","ich werde die Nächste sein. Die Karten lügen nicht. Immer","10","1205"
"Mrs Summer","wieder spielt mir eine unheimliche Macht das Symbol des Todes","10","1205"
"Mrs Summer","in die Hände. Das geht nun schon seit Wochen so! Ich will nicht","11","1205"
"Mrs Summer","sterben!","11","1205"
"Justus","Ich möchte Ihnen nicht zu nahe treten, Madam. Aber die","11","2"
"Justus","Tatsache, dass Sie immer wieder dieselbe Karte aufnehmen,","11","2"
"Justus","könnte doch reiner Zufall sein.","11","2"
"Mrs Summer","Sechsmal hintereinander? Bei achtundsiebzig verschiedenen","11","1205"
"Mrs Summer","Karten? Das wäre mathematisch höchst unwahrscheinlich. Nein,","11","1205"
"Mrs Summer","nein, nein, nein. Mein Schicksal ist vorbestimmt. Der","11","1205"
"Mrs Summer","Sensenmann wird mich aufspüren und holen. Ich stehe auf","11","1205"
"Mrs Summer","seiner Liste. Ich kenne die Karten und weiß, was sie mir sagen","11","1205"
"Mrs Summer","wollen.","11","1205"
"Justus","Ich muss gestehen, dass mir die Symbolsprache des Tarot nicht","11","2"
"Justus","ganz geläufig ist. Zum Beispiel diese Karte.","11","2"
"Mrs Summer","Der Gehängte. Der Galgen, an dem der Mann mit einem Bein","11","1205"
"Mrs Summer","kopfüber aufgehängt ist. Diese Karte gibt mir die Antwort auf","11","1205"
"Mrs Summer","meine Fragen nach der Bedeutung meines Schicksals. Ich habe","11","1205"
"Mrs Summer","Angst vorm Sterben.","11","1205"
"Bob","Und was besagt die Karte des Todes hier? Römisch dreizehn.","11","4"
"Mrs Summer","Das etwas zu Ende geht. Endgültig. Was danach kommt, ist","11","1205"
"Mrs Summer","vielleicht -","11","1205"
"Peter","Und...  und die dritte Karte hier mit dem Engel?","11","3"
"Mrs Summer","Das Gericht. Die letzte Karte der großen Arkana. Umwandlung","11","1205"
"Mrs Summer","und Wiedergeburt. Ich habe Angst.","11","1205"
"Justus","Erlauben Sie mir bitte eine indiskrete Frage, Madam. Gibt es","11","2"
"Justus","einen realen Anlass, an Ihr nahes Ende zu denken oder","11","2"
"Justus","schließen sie das alles nur aus den Tarotkarten?","11","2"
"Mrs Summer","*aufbrausend* Was heißt hier nur? Das Tarot ist keine","11","1205"
"Mrs Summer","Jahrmarktsgaukelei, sondern die Entfaltung der persönlichen","11","1205"
"Mrs Summer","Wahrheit! *weint* ""Come In"", die Karten haben sein Schicksal","11","1205"
"Mrs Summer","angedeutet. Ich hätte ihn nicht einmal davor bewahren können.","11","1205"
"Bob","Werden Sie den Kater im Garten begraben, Madam?","11","4"
"Mrs Summer","Sicher. Doch vorher werde ich ihn untersuchen lassen. Ich muss","11","1205"
"Mrs Summer","mit Professor Steed telefonieren. Er ist Tiermediziner. Sobald er","11","1205"
"Mrs Summer","etwas herausgefunden hat, werde ich mich mit euch in","12","1205"
"Mrs Summer","Verbindung setzen. Ich kann doch davon ausgehen, dass ihr den","12","1205"
"Mrs Summer","Fall weiterverfolgt?","12","1205"
"Justus","Selbstverständlich, Madam.","12","2"
"Bob und Peter","Ja.","12","-1"
"Justus","Sie können sich voll und ganz auf uns verlassen.","12","2"
"Mrs Summer","Gut. Dann bringe ich euch jetzt zum Wagen.","12","1205"
"Justus","Gut. Kommt!","12","2"
"REGIE","*Tür wird geöffnet; Schritte*","12","0"
"Peter","Wow. Von den Scheinwerfern bestrahlt, kommen die","12","3"
"Peter","Marmorskulpturen erst richtig zur Geltung. Ähm, Madam, die","12","3"
"Peter","Figur dort, das ist ja die originalgetreue Nachbildung des Engels","12","3"
"Peter","auf Ihrer Tarotkarte!","12","3"
"Bob","Ja, sieht so aus.","12","4"
"Mrs Summer","Und nicht nur er. Auch die anderen Skulpturen sind den","12","1205"
"Mrs Summer","Symbolen des Tarots nachempfunden. Die Arbeiten stammen","12","1205"
"Mrs Summer","von einem befreundeten Bildhauer. Sind sie nicht wunderschön?","12","1205"
"Mrs Summer","Am meisten fasziniert mich die Skulptur des Eremiten. Mit ihr","12","1205"
"Mrs Summer","fühle ich mich so ... persönlich eng verbunden. ""Jeder Mensch","12","1205"
"Mrs Summer","bringt etwas Neues auf die Welt, das es zuvor nicht gegeben hat","12","1205"
"Mrs Summer","und ohne ihn auch nicht geben wird. Wenn wir dieses vermissen,","12","1205"
"Mrs Summer","fühlen wir uns verlassen."" Das ist seine Botschaft.","12","1205"
"Justus","Ähm, Mrs Summer, wie verhält sich die Sache mit Mr Art. Ist er in","12","2"
"Justus","das Geheimnis der falschen Kameras eingeweiht?","12","2"
"Mrs Summer","Selbstverständlich. Ich sähe auch keinen Sinn darin, Leute aus","12","1205"
"Mrs Summer","meinem nahen Umkreis zu belügen.","12","1205"
"Justus","Dann dürften wir uns jetzt von Ihnen verabschieden, Madam.","12","2"
"Mrs Summer","Ihr müsst mich beschützen... Ich will noch nicht sterben.","12","1205"
"Bob","Ja.","12","4"
"Justus","Wir werden unser Bestes tun.","12","2"
"Peter","Wiedersehen.","12","3"
"Bob","Wiedersehen.","13","4"
"REGIE","*Autotüren klappen; Auto wird gestartet*","13","0"
"REGIE","*Zwischenmusik*","13","0"
"Erzähler","Am nächsten Nachmittag traf Bob Andrews in der Zentrale als","13","574"
"Erzähler","Letzter ein. Er ließ sich in den Sessel plumpsen und wischte sich","13","574"
"Erzähler","den Schweiß von der Stirn.","13","574"
"REGIE","*Tür der Zentrale wird geöffnet und geschlossen; Blacky ist die ganze Szene über im","13","0"
"REGIE","Hintergrund zu hören*","13","0"
"Bob","Also, ich muss gestehen, Kollegen, die gestrige Tarotsitzung","13","4"
"Bob","unserer Astrologin hat mich nachhaltig beeindruckt.","13","4"
"Justus","In diesem Fall sind noch manche Fragen ungeklärt. Und ich","13","2"
"Justus","muss wissen, was dahinter steckt.","13","2"
"Peter","Und wie erklärt ihr euch Mrs Summers innere Überzeugung,","13","3"
"Peter","dass ihre Lebensuhr demnächst ablaufen wird und die Tatsache,","13","3"
"Peter","dass die Karten ihr jedes Mal recht zu geben scheinen?","13","3"
"Bob","Also, tut mir leid, Peter. Ich kann mir darauf keinen Reim","13","4"
"Bob","machen.","13","4"
"Justus","Und noch eine andere Ungereimtheit spukt mir seit gestern im","13","2"
"Justus","Kopf herum.","13","2"
"Bob und Peter","Ja?","13","-1"
"Justus","Wie kann es angehen, dass Milva Summer behauptet, seit","13","2"
"Justus","vierzehn Jahren unter dem Pseudonym ""Donna Carrrington"" die","13","2"
"Justus","Horoskope für die ""Los Angeles Post"" zu erstellen, obwohl wir","13","2"
"Justus","aus sicherer Quelle wissen, dass sie in Wahrheit von einer","13","2"
"Justus","Praktikantin erfunden werden?","13","2"
"Bob","Also, Justus, diese Frage konnte mir mein Vater heute Morgen","13","4"
"Bob","beim Frühstück beantworten.","13","4"
"Justus","Ach?","13","2"
"Peter","Und dann lass dich nicht lange bitten, Bob.","13","3"
"Bob","Ja, also, jetzt pass mal auf. Ganz einfach. Durch ihren Beruf bei","14","4"
"Bob","der ""Los Angeles Post"" wurde Milva Summer zu einer, naja,","14","4"
"Bob","richtigen Berühmtheit. Sie bekam Tausende von Zuschriften.","14","4"
