"Speaker","Text","Page","speaker_id"
"Bob","Sogar von wichtigen Persönlichkeiten, die sich alle von ihr ein","14","4"
"Bob","persönliches Horoskop erstellen lassen wollten.","14","4"
"Justus","Ist ja ein Ding.","14","2"
"Bob","Ja. Es klingt zwar unglaublich, doch ihre Prognosen trafen","14","4"
"Bob","meistens ein. Und innerhalb kürzester Zeit wurde die Dame","14","4"
"Bob","dadurch Millionärin.","14","4"
"Justus","Es sei ihr gegönnt. Und was ist dann schief gelaufen?","14","2"
"Bob","Ja, ganz einfach. *lacht* Sie lieferte nicht mehr pünktlich.","14","4"
"Bob","Peter:*lacht* Zu viele Privataufträge vermutlich. Ja, dann brauchte sie den","14","4"
"Bob","Job bei der ""LA Post"" nicht mehr.","14","4"
"Bob","Ja, genauso war es. Und deshalb läuft ihr Vertrag zum Ende des","14","4"
"Bob","Quartals aus und Susan Maywood macht die Astrospalte.","14","4"
"Justus","Und...und...und  weshalb ist Susan Maywood der Auffassung,","14","2"
"Justus","das Foto von Mrs Summer über der Horoskopspalte sei nur das","14","2"
"Justus","Bild irgendeines Models?","14","2"
"Bob","Tja, auch dafür gibt es eine plausible Erklärung.","14","4"
"Justus","Bitte.","14","2"
"Bob","Susan hat vorher beim ""Daily Telegraph"" gearbeitet. Und, ähm,","14","4"
"Bob","bei dieser Zeitung war es üblich, nicht nur den Namen sondern","14","4"
"Bob","auch ein Foto des Verfassers über die Artikel und Kolumnen","14","4"
"Bob","rüber zusetzen. Ja und wer das nicht wollte, der ließ einfach ein","14","4"
"Bob","Phantomfoto abdrucken.","14","4"
"REGIE","*Telefon klingelt*","14","0"
"Justus","Ja, Justus Jonas von den drei Detektiven.","14","2"
"Mrs Summer","Justus, es ist unglaublich! Ich kann es gar nicht fassen ... Es gibt","14","1205"
"Mrs Summer","Dinge zwischen Himmel und Erde. . . Es muss ein Traum sein.","14","1205"
"Justus","Mrs Summer, langsam. Was ist vorgefallen?","14","2"
"Mrs Summer","Das kann ich am Telefon nicht sagen. Ihr würdet es mir sowieso","15","1205"
"Mrs Summer","nicht glauben! Ihr müsst vorbeikommen und euch persönlich","15","1205"
"Mrs Summer","davon überzeugen, dass ich nicht an Wahnvorstellungen leide!","15","1205"
"Mrs Summer","Beeilt euch!","15","1205"
"Bob","Aufgelegt.","15","4"
"Justus","Einfach aufgelegt.","15","2"
"Peter","Was mag da wieder vorgefallen sein? Was ist das überhaupt für","15","3"
"Peter","'ne Art, einfach den Hörer aufzulegen, ohne 'ne Antwort","15","3"
"Peter","abzuwarten!","15","3"
"Justus","Eine Dreistigkeit ohne Grenzen!","15","2"
"REGIE","*Zwischenmusik*","15","0"
"Erzähler","Als Peter seinen MG auf dem Grundstück von Mrs Summer","15","574"
"Erzähler","parkte, kam sie den drei Detektiven schon aufgeregt entgegen","15","574"
"Erzähler","gelaufen. Ihr Gesicht glühte.","15","574"
"REGIE","*Schritte*","15","0"
"Mrs Summer","Gut, dass ihr da seid! Schnell, kommt rein!","15","1205"
"Alle drei","Ja.","15","-1"
"Mrs Summer","Dies ist der glücklichste Tag meines Lebens! Kommt mit ins","15","1205"
"Mrs Summer","Kaminzimmer.","15","1205"
"REGIE","*Peter lacht*","15","0"
"Bob","Was ist denn da?","15","4"
"Mrs Summer","Bitte, bitte nur flüstern. Wir könnten ihn sonst erschrecken.","15","1205"
"Justus","Was?","15","2"
"Mrs Summer","Seht doch, im Körbchen.","15","1205"
"Bob","Im Körbchen?","15","4"
"Mrs Summer","Ein Wunder ist geschehen.","15","1205"
"Justus","Aber das...","15","2"
"Bob","Das gibt's doch nicht. ""Come In""!","16","4"
"Mrs Summer","Nicht anfassen!","16","1205"
"Bob","Was?","16","4"
"Mrs Summer","Er braucht noch absolute Schonung.","16","1205"
"Bob","Ach so.","16","4"
"Bob","Peter:*fassungslos* Er...er...er...er war doch tot! Das haben wir mit eigenen Augen","16","4"
"Bob","gesehen! Wie...wie kann denn das angehen?","16","4"
"Mrs Summer","Das werde ich euch nebenan erzählen. Wir sollten ""Come In""","16","1205"
"Mrs Summer","jetzt in Ruhe schlafen lassen. Ich musste ihn euch nur unbedingt","16","1205"
"Mrs Summer","zeigen. Ich liebe ihn! Nun hat das Leben für mich wieder einen","16","1205"
"Mrs Summer","Sinn! Darauf stoßen wir mit Champagner an. Kommt mit!","16","1205"
"REGIE","*Tür quietscht; Schritte*","16","0"
"Justus","Für uns bitte nicht! Danke.","16","2"
"Mrs Summer","Ach was. Ein kleines Schlückchen - einen Fingerhut voll. Nur","16","1205"
"Mrs Summer","symbolisch. Wir haben doch etwas zu feiern! Hier. Prost!","16","1205"
"Bob","Danke.","16","4"
"Mrs Summer","Prost!","16","1205"
"Justus","Äh, na schön.","16","2"
"REGIE","*Gläser klirren; Mrs Summer schmettert ausgelassen eine Melodie; die drei ???","16","0"
"REGIE","lachen*","16","0"
"Bob","Sehr schön.","16","4"
"Justus","Madam, Sie...Sie sind sich hundertprozentig sicher, dass der","16","2"
"Justus","Kater nebenan auch wirklich Ihr Kater ""Come In"" ist?","16","2"
"Mrs Summer","Die Zweifel sind berechtigt.","16","1205"
"Justus","Ja.","16","2"
"Mrs Summer","Ich habe ja selbst nicht glauben können, dass dieses","16","1205"
"Mrs Summer","medizinische Wunder möglich ist. Aber als mir Professor Steed","16","1205"
"Mrs Summer","heute Mittag meinen Liebling aus dem Labor zurückbrachte,","16","1205"
"Mrs Summer","wurde ich eines Besseren belehrt. Im ersten Augenblick witterte","16","1205"
"Mrs Summer","ich natürlich genau wie du - einen geschmacklosen Betrug. Ich","17","1205"
"Mrs Summer","nahm an, dass er mir einen frappierend ähnlichen Kater","17","1205"
"Mrs Summer","unterschieben wollte.","17","1205"
"Justus","Ja.","17","2"
"Mrs Summer","Doch es gibt keinen Zweifel: Professor Steed hat ""Come In""","17","1205"
"Mrs Summer","neues Leben eingehaucht!","17","1205"
"Peter","Ja, *lacht* aber wie...wie...wie sollte das funktionieren? Tot ist","17","3"
"Peter","tot. Und Tote kann man schließlich nicht wieder lebendig","17","3"
"Peter","machen.","17","3"
"Mrs Summer","Eben doch. Professor Steed hat der Natur ein Schnippchen","17","1205"
"Mrs Summer","geschlagen. ""Come In"" ist der lebende Beweis! Und mein","17","1205"
"Mrs Summer","Liebling hat unvorstellbares Glück gehabt.","17","1205"
"Justus","Aber-","17","2"
"Mrs Summer","Der Mörder hat ihn mit einer Plastiktüte erstickt anstatt ihn zu","17","1205"
"Mrs Summer","vergiften. Sein Blut und sein Gewebe hatten keinen Schaden","17","1205"
"Mrs Summer","davongetragen, dass ermöglichte ihm ein zweites Leben. Dank","17","1205"
"Mrs Summer","Professor Steed.","17","1205"
"Justus","Die Sache ist zu fantastisch, als dass ich sie so einfach glauben","17","2"
"Justus","könnte. Dürfen wir uns den Kater vielleicht noch einmal ansehen,","17","2"
"Justus","Mrs Summer?","17","2"
"Mrs Summer","Das halte ich für keine so gute Idee.","17","1205"
"Justus","Sind Sie denn wirklich sicher, dass Sie Professor Steed trauen","17","2"
"Justus","können?","17","2"
"REGIE","*Türklingel ertönt*","17","0"
"Mrs Summer","Moment!","17","1205"
"REGIE","*Schritte*","17","0"
"Mrs Summer","Ja bitte?","17","1205"
"Prof. Steed","Entschuldigen Sie die Verspätung, Mrs Summer, aber ich wurde","17","610"
"Prof. Steed","im Labor aufgehalten!","17","610"
"Mrs Summer","Das macht doch nichts. Ich öffne das Tor. Nun könnt ihr euch","18","1205"
"Mrs Summer","persönlich ein Bild davon machen, ob dem Professor zu trauen","18","1205"
"Mrs Summer","ist oder nicht.","18","1205"
"REGIE","*Schritte*","18","0"
"Mrs Summer","Herr Professor!","18","1205"
"Prof. Steed","Sie haben' Besuch, Mrs Summer? Das war nicht vereinbart.","18","610"
"Mrs Summer","Das sind die Jungs, die ""Come In"" im Ginsterbusch entdeckt","18","1205"
"Mrs Summer","haben. Justus, Peter und Bob. Wir haben gerade auf seine","18","1205"
"Mrs Summer","Rückkehr angestoßen. Darf ich Ihnen auch ein Glas","18","1205"
"Mrs Summer","einschenken?","18","1205"
"Prof. Steed","Ich muss noch fahren. Danke. Mrs Summer kann sich glücklich","18","610"
"Prof. Steed","schätzen, euch gerufen zu haben. Wenn der Kater noch länger","18","610"
"Prof. Steed","unentdeckt geblieben wäre, hätte auch ich nichts mehr für ihn tun","18","610"
"Prof. Steed","können. Schließlich bin ich kein Zauberer, sondern nur","18","610"
"Prof. Steed","Mediziner.","18","610"
"Mrs Summer","Nun stellen Sie Ihr Licht aber nicht unter den Scheffel, Professor.","18","1205"
"Mrs Summer","In meinen Augen sind Sie ein Genie. Ein Magier! Die","18","1205"
"Mrs Summer","Weltöffentlichkeit wird Sie mit Auszeichnungen überhäufen,","18","1205"
"Mrs Summer","sobald Sie Ihre Ergebnisse publizieren.","18","1205"
"Prof. Steed","Bis dahin ist es noch ein weiter Weg. ""Come Ins""","18","610"
"Prof. Steed","Wiederbelebung ist erst der Anfang. Wie geht's ihm denn?","18","610"
"Mrs Summer","Er ist noch sehr erschöpft. Hat aber schon ein Schälchen Milch","18","1205"
"Mrs Summer","weggeschlappert.","18","1205"
"Prof. Steed","Dann wollen wir doch mal nach ihm sehen.","18","610"
"Justus","Dürfen wir mitkommen?","18","2"
"Prof. Steed","Wenn ihr euch still verhaltet, dann habe ich nichts einzuwenden.","18","610"
"REGIE","*Schritte; Tür quietscht*","18","0"
"Prof. Steed","Folgt mir. Mal schauen.","18","610"
"Mrs Summer","Und?","18","1205"
"Prof. Steed","Wir können aufatmen. Das Gröbste hat er vermutlich","19","610"
"Prof. Steed","überstanden.","19","610"
"Mrs Summer","Wir müssen umgehend die Presse informieren, Professor! Das","19","1205"
"Mrs Summer","ist der größte Fortschritt, den die Medizin je gemacht hat!","19","1205"
"Prof. Steed","Auf keinen Fall! Dazu ist die Zeit noch nicht reif. Junge, ähm,","19","610"
"Prof. Steed","reich mir doch mal aus dem Arztkoffer die Einwegspritze! Da,","19","610"
"Prof. Steed","neben den Bartiturol.","19","610"
"Justus","Äh, die hier?","19","2"
"Prof. Steed","Ausgezeichnet. Danke. So, jetzt werde ich noch Blut abnehmen.","19","610"
"REGIE","*""Come In"" miaut*","19","0"
"Prof. Steed","Ja, ja, ist schon gut. Braves Tier.","19","610"
"Mrs Summer","*scheint besorgt zu sein*","19","1205"
"Bob","Ähm, Entschuldigung, stimmt irgendetwas nicht, Madam? Sie","19","4"
"Bob","sehen andauernd aus dem Fenster.","19","4"
"Mrs Summer","Das war ein Fehler.... Das hätte ich nicht tun dürfen...","19","1205"
"Prof. Steed","Gibt es irgendwelche Probleme?","19","610"
"Mrs Summer","Ich... ich hab eine törichte Dummheit begangen, Professor. Ich","19","1205"
"Mrs Summer","kann gar nicht erklären, was in mich gefahren ist.","19","1205"
"Prof. Steed","Was haben Sie getan?","19","610"
"Mrs Summer","Nachdem ""Come In"" wieder da war, da hab ich vor Freude","19","1205"
"Mrs Summer","geweint, verstehen Sie? Ich hatte Ihnen so viel zu verdanken.","19","1205"
"Mrs Summer","Sie haben mein Herz wieder zum Schweben gebracht und Sie","19","1205"
"Mrs Summer","haben, mir durch Ihre außergewöhnlichen Fähigkeiten neue","19","1205"
"Mrs Summer","Zuversicht geschenkt. Das musste doch an die Öffentlichkeit!","19","1205"
"Prof. Steed","Wie meinen Sie das? *lauter* Wie meinen Sie das?","19","610"
"Mrs Summer","Ich habe das ""Washington-Globe-Magazin"" informiert ...","19","1205"
"Prof. Steed","Sie haben ... was?","19","610"
"Mrs Summer","...  und den Reporter um siebzehn Uhr zu einem","19","1205"
"Mrs Summer","Exklusivinterview hierher bestellt.","19","1205"
"Prof Steed","Was haben Sie denen erzählt?","19","-1"
"Mrs Summer","Bisher noch gar nichts. Ich habe mich am Telefon recht bedeckt","20","1205"
"Mrs Summer","gehalten. Die Bombe wollte ich erst in Ihrer Gegenwart zum","20","1205"
"Mrs Summer","Platzen bringen.","20","1205"
"Prof. Steed","Ruhig bleiben ... ganz ruhig bleiben. Was machen wir jetzt? Ich","20","610"
"Prof. Steed","muss nachdenken...","20","610"
"Mrs Summer","Ich brauche jetzt dringend noch ein Schlückchen. *gießt sich","20","1205"
"Mrs Summer","etwas ein*","20","1205"
"Prof. Steed","Wir müssen noch über die Todesambulanz sprechen, Mrs","20","610"
"Prof. Steed","Summer. Die Unterlagen dafür habe ich mitgebracht. Sie sollten","20","610"
"Prof. Steed","noch einen Blick auf die Verträge werfen. Doch vielleicht wäre es","20","610"
"Prof. Steed","besser, damit zu warten, bis die drei Jungs gegangen sind.","20","610"
"Bob","Wir, ähm, ...","20","4"
"Justus","Wir sind quasi schon aus dem Haus, Madam. Unsere","20","2"
"Justus","Ermittlungen, die ""Come Ins"" Mörder betreffen, werden wir","20","2"
"Justus","selbstverständlich fortsetzen. Sobald wir etwas herausgefunden","20","2"
"Justus","haben, melden wir uns dann bei Ihnen.","20","2"
"Prof. Steed","Halt, wartet! Ich muss darauf bestehen, dass ihr über die","20","610"
"Prof. Steed","gesamten Vorgänge hier im Haus Stillschweigen bewahrt. Und","20","610"
"Prof. Steed","vor allem: kein Wort über meinen medizinischen Eingriff bei","20","610"
"Prof. Steed","""Come In""! Weder zu euren Eltern noch zu euren Freunden, ist","20","610"
"Prof. Steed","das klar? Und schon gar nicht zu der Presse!","20","610"
"Justus","Wo denken Sie hin? Was uns unsere Klienten anvertrauen,","20","2"
"Justus","behalten wir grundsätzlich für uns. Mrs Summer, da geben wir","20","2"
"Justus","Ihnen Brief und Siegel drauf.","20","2"
"Mrs Summer","Das weiß ich. Professor, Sie können schon nebenan im Salon","20","1205"
"Mrs Summer","Platz nehmen. Ich komme gleich nach. *Schritte* Professor","20","1205"
"Mrs Summer","Steed und ich haben kurz etwas Geschäftliches zu besprechen.","20","1205"
"Mrs Summer","Das dauert aber nicht lange. Mir wäre es eine große Freude,","20","1205"
"Mrs Summer","wenn ihr noch einen Moment bleiben würdet. Ich habe","20","1205"
"Mrs Summer","anschließend noch einen wichtigen Termin in der Stadt, doch","20","1205"
"Mrs Summer","vorher würde ich euch noch gerne die Tarotkarten legen. Statt","20","1205"
"Mrs Summer","eines Honorars. Es nimmt auch nur fünfzehn Minuten in","20","1205"
"Mrs Summer","Anspruch. Höchstens! Sozusagen zum Reinschnuppern. Was","21","1205"
"Mrs Summer","haltet ihr davon?","21","1205"
"Bob","Ja, eine persönliche Séance bei Ihnen? Hört sich gut an!","21","4"
"Mrs Summer","Warten wir es ab! Ihr könnt euch in der Zwischenzeit meinen","21","1205"
"Mrs Summer","Presseordner ansehen. Darin habe ich alle Zeitungsberichte","21","1205"
"Mrs Summer","gesammelt, die in den letzten vierzehn Jahren über mich","21","1205"
"Mrs Summer","erschienen sind.","21","1205"
"Justus","Das ist sicherlich interessant.","21","2"
"Prof. Steed","*aus der Ferne* Ihr Handeln hat mich in gehörigen Zugzwang gebracht,","21","610"
"Prof. Steed","Mrs Summer. *laut und sehr aufgebracht* Das war","21","610"
"Prof. Steed","unverantwortlich. Gerade Sie müssen doch wissen, dass mit der","21","610"
"Prof. Steed","Presse nicht zu spaßen ist.","21","610"
"Mrs Summer","Ich kann mich nur immer wieder bei Ihnen entschuldigen,","21","1205"
"Mrs Summer","Professor.","21","1205"
"Prof. Steed","Hm. Nun ja... vergessen wir die Sache und kommen zum","21","610"
"Prof. Steed","Geschäft. Ich habe bereits alles vorbereitet. Sichern Sie sich mit","21","610"
"Prof. Steed","Ihrer Unterschrift die Rückfahrkarte ins Leben. Ihr Schicksal liegt","21","610"
"Prof. Steed","in Ihrer Hand, Mrs Summer. Für das Einfrieren der Leiche","21","610"
"Prof. Steed","verlange ich 125.000 Dollar. Davon entfallen 40.000 auf das","21","610"
"Prof. Steed","Präparieren der Leiche.","21","610"
"Mrs Summer","Was machen Sie beim Präparieren?","21","1205"
"Prof. Steed","Ihr Leichnam wird im Labor an eine Herz-Lungen-Maschine","21","610"
"Prof. Steed","angeschlossen, damit Ihr Gehirn keinen Schaden nimmt. Dann","21","610"
"Prof. Steed","wird der Körper durch das Auflegen von kleinen Eiskristallen von","21","610"
"Prof. Steed","außen und durch das Einpumpen eines Frostschutzmittels von","21","610"
"Prof. Steed","innen auf 4 Grad abgekühlt. Soll ich fortfahren?","21","610"
"Mrs Summer","Ich bitte darum.","21","1205"
"Prof. Steed","Anschließend werde ich Ihre Leiche in eine Kühltruhe befördern,","21","610"
"Prof. Steed","in der Sie dann etwa vierundzwanzig Stunden ausharren","21","610"
"Prof. Steed","müssen. Wenn Sie sich dann in diesem fast tiefgefrorenen","21","610"
"Prof. Steed","Zustand befinden, werde ich den Frostschutzmittel in","21","610"
"Prof. Steed","Kombination mit einer Salzlösung meine neue Formel","21","610"
"Prof. Steed","hinzusetzen, die Sie beim Auftauen wieder zum Leben erweckt.","21","610"
"Mrs Summer","125.000 Dollar?","22","1205"
"Prof. Steed","Ohne weitere Nebenkosten. Die Hälfte davon wird bei","22","610"
"Prof. Steed","Vertragsabschluss fällig. Mit Ihrer Unterschrift gewähren Sie mir","22","610"
"Prof. Steed","den Zugriff auf ein extra dafür von Ihnen eingerichtetes Konto.","22","610"
"Prof. Steed","Auf dem wird die andere Hälfte der vereinbarten Summe","22","610"
"Prof. Steed","hinterlegt, die ich im Falle Ihres Ablebens erhalte. Sobald Sie mit","22","610"
"Prof. Steed","ihrer Unterschrift dem Einfrieren zugestimmt haben, werde ich","22","610"
"Prof. Steed","Ihnen dann diese Plakette hier ans Handgelenk","22","610"
"Prof. Steed","binden.*Geräusch ertönt, als ob eine Münze auf den Tisch fällt*","22","610"
"Prof. Steed","Aus dieser Metallmarke steht die Nummer der Todesambulanz,","22","610"
"Prof. Steed","die Ihre Leiche so rasch wie möglich in eines der nächsten","22","610"
"Prof. Steed","Labors bringen wird. Meine Substanz kann ich Ihnen auch später","22","610"
"Prof. Steed","noch verabreichen.","22","610"
"Mrs Summer","Gibt es denn noch andere Labors als Ihres in der Walking","22","1205"
"Mrs Summer","Street?","22","1205"
"Prof. Steed","Sicher. In Florida, Michigan und selbst hier in Los Angeles.","22","610"
"Prof. Steed","Sollten Sie wirklich sterben, Madam, und ich nicht in Ihrer Nähe","22","610"
"Prof. Steed","sein, werden Sie in einem dieser Laboratorien zwischengelagert,","22","610"
"Prof. Steed","bis ich wieder zurück bin. Nun, was sagen Sie?","22","610"
"Mrs Summer","Ich werde die Karten befragen. Geben Sie mir eine Minute.","22","1205"
"Mrs Summer","*Karten werden gemischt und ausgelegt* So sei es.","22","1205"
"Prof. Steed","Was ist das für eine Karte?","22","610"
"Mrs Summer","Das ist ""der Wagen"". Der Leitsatz dieser Karte ist: ""Seien Sie","22","1205"
"Mrs Summer","mutig und wagen Sie einen neuen Kurs."" Reichen Sie mir Ihren","22","1205"
"Mrs Summer","Federhalter, Professor. Sie sollen Ihre Unterschrift bekommen.","22","1205"
"REGIE","*Tür wird geöffnet*","22","0"
"Justus","*erschrickt* Mr Art!","22","2"
"Mr Art","Wo sind Mrs Summer und der Professor?","22","-1"
"Peter","Äh, da ... im Salon.","22","3"
"REGIE","*Schritte; Türklopfen*","22","0"
"Mrs Summer","Ja bitte?","23","1205"
"Mr Art","Ich möchte Sie nicht beunruhigen, Madam. Aber vor Ihrem Tor","23","-1"
"Mr Art","lungert schon seit geraumer Zeit ein Reporter herum. Ich habe","23","-1"
"Mr Art","mir seinen Presseausweis zeigen lassen. Er lässt sich nicht","23","-1"
"Mr Art","abwimmeln. Jetzt sitzt er in seinem Wagen. Er scheint eine","23","-1"
"Mr Art","Menge Zeit zu haben.","23","-1"
"Prof. Steed","Wie bitte?","23","610"
"Mrs Summer","Ohne meine Indiskretion wäre das nie passiert. Was mache ich","23","1205"
"Mrs Summer","nur? Ich habe doch gleich ein Termin in der Stadt. Wie soll ich","23","1205"
"Mrs Summer","unbemerkt vom Grundstück kommen?","23","1205"
"Mr Art","Soll ich Sie chauffieren, Madam?","23","-1"
"Mrs Summer","Auf keinen Fall! ""Come In"" darf nicht allein gelassen werden.","23","1205"
"Peter","Wissen Sie was? Wir werden ihn austricksen. Ich ... ich schlüpfe","23","3"
"Peter","einfach in ihren Pelzmantel, Madam.","23","3"
"Mrs Summer","Gut!","23","1205"
"Mrs Summer","Peter:*lacht* Und ich setz mir da den Sonnenhut noch auf.","23","1205"
"Mrs Summer","Sehr gut, sehr gut. Ja, doch, so könnte es klappen. Wenn ich dir","23","1205"
"Mrs Summer","noch eine dunkle Brille verpasse und einen Seidenschal vor das","23","1205"
"Mrs Summer","Gesicht lege, wird sich Mr Hanson sicher hinters Licht führen","23","1205"
"Mrs Summer","lassen. Was sagen Sie zu diesem Jungen, Professor?","23","1205"
"Prof. Steed","Seid ihr mit dem Auto da?","23","610"
"Peter","*mit verstellter Stimme* Das steht vor der Haustür.","23","3"
"Prof. Steed","Dann könnte es klappen. Du solltest dein Gesicht aber trotzdem","23","610"
"Prof. Steed","abwenden. Vor allem, wenn ihr die Ausfahrt passiert!","23","610"
"Bob","*lacht*  Nun, Just, wie findest du unseren Zweiten?","23","4"
"Justus","Er ist Mrs Summer wie aus dem Gesicht geschnitten. *Lachen*","23","2"
"Justus","Die männlichen Fans werden ihm zu Füßen liegen!","23","2"
"Mrs Summer","Das ist ein Designermantel, geht vorsichtig damit um!","23","1205"
"Peter","Ja, ja. Versprochen, Madam.","23","3"
"Mrs Summer","Beeilt euch! Mein Termin! Den darf ich nicht verpassen!","23","1205"
"Peter","*wieder mit verstellter Stimme* Lasst uns aufbrechen.","23","3"
"Mrs Summer","Viel Glück! Ich stehe in eurer schuld! Die versprochene","24","1205"
"Mrs Summer","Tarotsitzung holen wir selbstverständlich nach. Am besten gleich","24","1205"
"Mrs Summer","morgen. Sobald euer Wagen am Tor ist, werde ich öffnen.","24","1205"
"Bob","Alles klar. Los, Peter!","24","4"
"Pete","Ja.","24","2469"
"REGIE","*Zwischenmusik*","24","0"
"Erzähler","Trotz des fülligen Pelzmantels und des breiten Sonnenhuts","24","574"
"Erzähler","bestand der Zweite Detektiv darauf, seinen Wagen selbst zu","24","574"
"Erzähler","lenken. Bob erspähte den Reporter des ""Washington-Globe-","24","574"
"Erzähler","Magazin"" sofort. Er saß versteckt in einer Einfahrt auf der","24","574"
"Erzähler","gegenüberliegenden Straßenseite in einem verrosteten BMW","24","574"
"Erzähler","und wartete. Als der MG die Ausfahrt verließ, wurde er","24","574"
"Erzähler","aufmerksam. Gleich darauf startete er den Motor.","24","574"
"Justus","Hey. Er hat angebissen, Kollegen!","24","2"
"Bob","Jetzt gib Gas, Zweiter! Die Ampel an der Kreuzung schaltet","24","4"
"Bob","gleich auf Rot! Nun mach schon!","24","4"
"Peter","Ja, doch!","24","3"
"REGIE","*Reifen quietschen*","24","0"
"Justus","Das war kirschgrün!","24","2"
"Peter","Wo ist er denn? Ich kann ihn nicht sehen.","24","3"
"Bob","Warte mal! Warte mal! Warte mal! Da kommt er! Da ist er!","24","4"
"Peter","Wo denn?","24","3"
"Bob","Er hat die Kreuzung voll bei Rot erwischt! Na, da! So, Peter, nun","24","4"
"Bob","schneller! Schneller, Zweiter! Nun mach doch! Er holt auf! Drück","24","4"
"Bob","auf die Tube! Fahr schneller!","24","4"
"Peter","Mach mich nicht wahnsinnig!","24","3"
"Bob","Peter!","24","4"
"Justus","Ich frage mich bloß, weshalb der so hartnäckig ist. Er kann doch","25","2"
"Justus","gar nicht wissen, worum es geht. Mrs Summer hat ihm doch gar","25","2"
"Justus","keine Details genannt.","25","2"
"Peter","Was meint ihr, wie lange wollen wir das Spielchen mit dem","25","3"
"Peter","Reporter treiben? Eine Stunde? Zwei?","25","3"
"Justus","Auf jeden Fall so lange, bis wir sicher sein können, dass Mrs","25","2"
"Justus","Summer ihr Grundstück verlassen hat.","25","2"
"REGIE","*Reifen quietschen*","25","0"
"Erzähler","Nach einer Dreiviertelstunde schien der Reporter das Spielchen","25","574"
"Erzähler","satt zu haben. Durch die Heckscheibe konnte Justus ihn noch","25","574"
"Erzähler","einige Zeit erkennen, dann war er aus dem Blickfeld","25","574"
"Erzähler","verschwunden.","25","574"
"Peter","Ich fahr dort auf den Rastplatz, Kollegen. Ich muss diesen Mantel","25","3"
"Peter","loswerden, in diesem Kunstpelz da schwitzt man sich ja zu Tode.","25","3"
"REGIE","*Autotüren klappen*","25","0"
"Justus","War das 'ne Fahrt.","25","2"
"Peter","Also das Ganze ist doch ziemlich verrückt.","25","3"
"Bob","*stimmt zu* Ich für meine Person würde gerne ausspannen und mal fünf","25","4"
"Bob","Minuten nicht über Mrs Summer, ""Come In"" und diesen","25","4"
"Bob","abgefahrenen Professor sprechen. Ein bisschen Musik gefällig?","25","4"
"Justus","Ja, gern.","25","2"
"Bob","So. *Musik erklingt*","25","4"
"Peter","Also in unserer Detektivlaufbahn haben wir ja schon die","25","3"
"Peter","haarsträubendsten Dinge erlebt, aber der Fall ""Milva Summe""","25","3"
"Peter","setzt allem die Krone auf! *lacht* ""Come Ins"" Auferstehung, das","25","3"
"Peter","ist doch paradox. Das glaub ich einfach nicht.","25","3"
"Bob","Was meinst du, warum sich Leute wie Walt Disney, Liv Taylor","25","4"
"Bob","und viele andere, nach ihrem Tod einfrieren lassen wollen? Das","25","4"
"Bob","ist doch ganz klar. Sie glauben an den Fortschritt der","25","4"
"Bob","Wissenschaft und bilden sich ein, mit dem nötigen Kleingeld,","26","4"
"Bob","dem Tot wieder von der Schippe springen zu können.","26","4"
"Peter","Aha. Demnach glaubt Mrs Summer sowohl an die Wissenschaft","26","3"
"Peter","als auch an ihre Tarotkarten. Was solls. Die Hauptsache ist doch,","26","3"
"Peter","dass sie ihren Lebensmut wieder gefunden hat. ""Come In"" ist","26","3"
"Peter","schließlich ihr Ein und Alles! Mann, wie die sich gefreut hat!","26","3"
"REGIE","*ahmt Mrs Sumer nach *","26","0"
"Radiosprecher","Wir unterbrechen unser Klassikprogramm für eine wichtige","26","667"
"Radiosprecher","Durchsage: Soeben wurde gemeldet, dass die berühmte","26","667"
"Radiosprecher","Astrologin Milva Summer, die in der Öffentlichkeit unter dem","26","667"
"Radiosprecher","Namen ""Donna Carrington"" bekannt ist, vor etwa dreißig Minuten","26","667"
"Radiosprecher","auf dem Highway südwestlich von Los Angeles tödlich","26","667"
"Radiosprecher","verunglückt ist. Wie mehrere Zeugen berichteten, war ihr Wagen","26","667"
"Radiosprecher","von der Fahrbahn abgekommen und einen Abhang","26","667"
"Radiosprecher","hinabgestürzt. *die drei ??? flüstern ungläubig im Hintergrund","26","667"
"Radiosprecher","miteinander* Die Astrologin starb noch am Unfallort. Ein Mann,","26","667"
