"Speaker","Text","Page","speaker_id"
"Morton","Richtig. Was ich nicht wusste war, dass er zu diesem Zeitpunkt schon seit","35","12"
"Morton","einigen Stunden in Los Angeles war und mich beobachtete. Er hat mich","35","12"
"Morton","nur gewähren lassen, weil ihm nichts Besseres passieren konnte. Ich","35","12"
"Morton","täuschte meinen Tod vor! Einfacher konnte ich es nicht machen! Ich","35","12"
"Morton","versteckte mich in einem kleinen Motel in Thousand Oaks und wartete ab.","35","12"
"Morton","Für den absoluten Notfall hatte ich euch eine Diskette mit zwei Hinweisen","35","12"
"Morton","in die Zentrale geschmuggelt.","35","12"
"Bob","Ja.","35","4"
"Justus","Und dabei hat MacDunno Sie ebenfalls beobachtet. So ist er also auf uns","35","2"
"Justus","gekommen!","35","2"
"Peter","Das muss ich erst mal verdauen. So viele Informationen auf einmal sind","35","3"
"Peter","zu viel für mich!","35","3"
"Bob","Ja, für mich auch!","35","4"
"Peter","Aber, eins habe ich immer gewusst: Dass Sie unschuldig sind, Morton!","35","3"
"Bob","Ja.","35","4"
"Morton","Na ja. Nicht ganz. Ich habe immerhin zwanzig Jahre lang gestohlenes","35","12"
"Morton","Geld aufbewahrt.","35","12"
"Justus","Weil Sie Ihre Schwester schützen wollten!","35","2"
"Morton","Die Polizei wird das anders sehen.","35","12"
"Bob","Trotzdem...","35","4"
"Morton","Immerhin hat meine Schwester damals vor Gericht gelogen. Dennoch","35","12"
"Morton","werde ich die Polizei über alles informieren. Und mit Susanna rede ich","35","12"
"Morton","auch! Sie wird einsehen müssen, dass es das Beste ist, sich einfach zu","35","12"
"Morton","stellen, anstatt weiterhin versteckt zu leben.","35","12"
"Justus","Vor MacDunno muss sie jedenfalls vorerst keine Angst mehr haben. Der","35","2"
"Justus","wird todsicher wieder in den Knast wandern. Immerhin hat er Ihre","35","2"
"Justus","Schwester bedroht, und Sie entführt. Was steht noch auf der Liste? Ach,","35","2"
"Justus","ja! Unerlaubter Waffenbesitz, mehrfacher Einbruch und noch ein paar","35","2"
"Justus","andere Delikte. Und das alles innerhalb zwei Wochen nach seiner","35","2"
"Justus","Entlassung! (lacht kurz) Inspektor Cotta wird begeistert sein und Tante","36","2"
"Justus","Mathilda wird Luftsprünge machen!","36","2"
"Peter","Tante Mathilda? (belustigt) Was hat die denn mit der ganzen","36","3"
"Peter","Angelegenheit zu tun?","36","3"
"Bob","Was?","36","4"
"Justus","Nächste Woche hat sie Geburtstag! Onkel Titus hatte die Idee, ihr eine","36","2"
"Justus","Fahrt im Rolls Royce zu schenken. Morton soll die beiden zur Oper","36","2"
"Justus","chauffieren. Der Schwanensee wird aufgeführt. Das war doch der Grund,","36","2"
"Justus","weshalb ich bei Mr. Gelbert anrief.","36","2"
"Bob","Das war der Grund?","36","4"
"Justus","Wenn Onkel Titus erfährt, dass Sie von den Toten wieder auferstanden","36","2"
"Justus","sind, wird er sich nicht wieder einkriegen!","36","2"
"REGIE","Lachen der drei ???","36","0"
"REGIE","Schlussmusik","36","0"
