"Speaker","Text","Page"
"REGIE","Die   drei    ???    –  Der    Mann       ohne     Kopf","1"
"REGIE","  Hörspielskript von Janet –","1"
"REGIE","Anmerkung: Monique Carrera spricht die ganze Folge über mit ihrem Akzent. Dadurch ist ihre","1"
"REGIE","Aussprache teilweise eigentlich fehlerhaft; ihr Text hier wurde jedoch leicht abgeändert,","1"
"REGIE","sodass die Wörter und die Grammatik stimmen.","1"
"REGIE","[Titelmusik]","1"
"REGIE","[Geschüttel]","1"
"Bob","So, jetzt pass mal schön auf, Peter!","1"
"Peter","Ja, dann mach mal!","1"
"Bob","Jetzt kommt der Obersechserpasch; was ist das?!","1"
"Peter","[lachend] Das ist kein Sechserpasch!","1"
"Bob","Das ist fast ein Sechserpasch!","1"
"Peter","Ja, oke, fast ist aber nicht… [entrüstet] Heey, hey! Welcher Idiot hämmert","1"
"Peter","denn da gegen unsere Wohnwagentür?","1"
"Bob","Ja, sieh nach, dann weißt du’s!","1"
"Bob","[Tür wird geöffnet]","1"
"Jeffrey","Uuuuuuh!","1"
"Jeffrey","Die drei ???: [erschrocken] Aaaaah!","1"
"Jeffrey","[mit tiefer Stimme] Ich bin Norman Hammley, der Kopflose, und lade euch","1"
"Jeffrey","ein zu einer Audienz ins Planet Evil!","1"
"Peter","[geschockt] Boah, Jeffrey! Mensch, du hast mich ja erschreckt! Hämmerst","1"
"Peter","wie 'n Irrer gegen die Tür und machst hier einen auf Dämon! Hast du sie","1"
"Peter","noch alle?!","1"
"Justus","Peter, willst du unseren Gast nicht erstmal hereinbitten, bevor du ihm den","1"
"Justus","Kopf abreißt?","1"
"Jeffrey","Ein vernünftiger Vorschlag.","1"
"Justus","Apropos Kopfabreißen: Hatte es mit deiner Begrüßung [ahmt Stimme","1"
"Justus","nach] „Ich bin Norman Hammley, der Kopflose“ eine tiefere Bedeutung","1"
"Justus","oder wie darf man deinen spektakulären Auftritt interpretieren?","1"
"Jeffrey","Deiner Frage ist deutlich zu entnehmen, dass das Stadtgespräch, das","1"
"Jeffrey","spätestens seit gestern Nacht ganz Rocky Beach beschäftigt, noch nicht","1"
"Jeffrey","zu euch durchgedrungen ist?!","1"
"Peter","Ne?","2"
"Justus","Wie?","2"
"Bob","Na, dann lass mal die Katze aus dem Sack!","2"
"Jeffrey","Den Planet Evil Club kennt ihr doch sicher, oder?","2"
"Peter","und Bob: Joa… jaaah…","2"
"Justus","Falls du damit die Diskothek meinst, die letztes Jahr in Rocky Beach","2"
"Justus","eröffnet hat; die ist mir ein Begriff. Obwohl ich zugeben muss, die","2"
"Justus","Örtlichkeit noch nicht besucht zu haben; das Tanzen gehört schließlich","2"
"Justus","nicht zu meinen größten Hobbies.","2"
"Peter","[lacht] Ja, kann man wohl sagen!","2"
"Bob","Dem kann ich mich nur anschließen. Ja und außerdem ist mir mal zu","2"
"Bob","Ohren gekommen, dass die ein unverschämt hohes Eintrittsgeld","2"
"Bob","verlangen!","2"
"Peter","[zustimmend] Ja! Dreißig Dollar, wenn mich nicht alles täuscht.","2"
"Bob","Huu! Dreißig Dollar?!","2"
"Peter","Dreißig, ja!","2"
"Jeffrey","Is’ ne Menge Schotter.","2"
"Bob","Ne Frechheit!","2"
"Jeffrey","Und trotzdem hab ich mir den Schuppen letzte Nacht mal angesehen; war","2"
"Jeffrey","sozusagen ein Pflichtbesuch, nachdem mir meine Freunde von dem","2"
"Jeffrey","abgedrehten Discjockey, Norman Hammley, erzählt hatten, der, nach","2"
"Jeffrey","ihren eigenen Aussagen, in der Lage ist, die Gäste des Planet Evil in eine","2"
"Jeffrey","Art magischen Bann zu ziehen.","2"
"Justus","Aha!","2"
"Bob","Ach!","2"
"Justus","Und? Konntest du dem Urteil deiner Freunde zustimmen?","2"
"Jeffrey","Mehr als das! Die tanzwütige Meute in der Disco ist im wahrsten Sinne","2"
"Jeffrey","des Wortes ausgerastet!","2"
"Justus","Ach!","2"
"Jeffrey","Gleich nachdem Norman Hammley die erste Scheibe aufgelegt hatte,","2"
"Jeffrey","waren die Besucher nicht mehr zu halten, sie…sie stürmten auf die mit","2"
"Jeffrey","Trockeneis vernebelte Tanzfläche und gaben sich voll und ganz der Musik","2"
"Jeffrey","hin.","2"
"Bob","Ist ja toll!","2"
"Peter","Das klingt nicht schlecht, ja. Aber was ist daran so außergewöhnlich?","3"
"Jeffrey","Die Leute tanzten wie in Trance! Also: Mandy, 'ne Freundin von mir, war","3"
"Jeffrey","die Erste auf dem Tanzparkett. Je mehr sich der Beat der Musik steigerte,","3"
"Jeffrey","desto mehr verdrehte sie ihre Augen und stieß schrille Laute aus.","3"
"Peter","Was?!","3"
"Jeffrey","Ja, sie, sie schien nicht mehr sie selbst zu sein; schwitzte am ganzen","3"
"Jeffrey","Körper, griff ständig mit ihren in die Höhe gestreckten Händen nach","3"
"Jeffrey","unsichtbaren Sternen.","3"
"Justus","Was?!","3"
"Jeffrey","Ja!","3"
"Bob","Unsichtbaren Sternen? Ja und, und weiter?","3"
"Jeffrey","Die Musik, die Norman Hammley auf seinen beiden Plattentellern","3"
"Jeffrey","abspielte, war der pure Wahnsinn! Den Bass spürte ich im ganzen Körper","3"
"Jeffrey","und während ich tanzte, sah ich, wie der DJ auf dem Podest mit flinken","3"
"Jeffrey","Händen die Scheiben scratchte; ich kann mir nicht erklären, wie er dazu","3"
"Jeffrey","ohne Kopf in der Lage war.","3"
"Alle","drei:  [gleichzeitig] Was?!","3"
"Peter","Wie meinst du das denn?","3"
"Jeffrey","Ihr wisst es also tatsächlich noch nicht!","3"
"Peter","Nein!","3"
"Jeffrey","Hammley ist hinter seinem Mischpult in eine dunkle Kutte mit einem","3"
"Jeffrey","hohen Stehkragen gekleidet.","3"
"Justus","Und?","3"
"Jeffrey","Doch, an der Stelle, an der sich normalerweise sein Kopf befinden","3"
"Jeffrey","müsste, ist nichts zu sehen… Er fehlt, existiert gar nicht!","3"
"Peter","Aber…","3"
"Bob","Jetzt reicht’s aber langsam, hör doch auf, rumzualbern, ein kopfloser DJ,","3"
"Bob","wie hört sich 'n das an?! [verunsichert lachend] Jeder Mensch hat doch","3"
"Bob","nen Kopf auf seinem Hals sitzen!","3"
"Jeffrey","Das musst du mir nun auch nicht extra erklären, aber… ich war ja selbst","3"
"Jeffrey","Zeuge.","3"
"Peter","Jaaa, aber der muss doch etwas sehen können, allein schon, um die","3"
"Peter","Nadeln der zwei Plattenspieler treffsicher in die Rillen der Scheiben zu","3"
"Peter","setzen.","3"
"Jeffrey","Ich hab keine Ahnung, Peter, wirklich. Was weiß ich; darum geht es doch","4"
"Jeffrey","auch gar nicht! Das Unfassbare ist: Der DJ in seiner Teufelskutte auf","4"
"Jeffrey","seinem Podest dirigiert die tanzenden Gäste!","4"
"Justus","Was?!","4"
"Jeffrey","Hammley führt sie mit seiner Musik wie an unsichtbaren Fäden; Mandy","4"
"Jeffrey","war seinem Bann willenlos verfallen. Und… ihr Körper führte exakt jede","4"
"Jeffrey","Bewegung aus, die der DJ mit einem unsichtbaren Taktstock in seiner","4"
"Jeffrey","linken Hand vorgab.","4"
"Bob","Ist ja richtig unheimlich, ja, und dann?","4"
"Jeffrey","Mehr und mehr fiel Mandy beim Tanzen in eine Art Trance, wobei ihre","4"
"Jeffrey","Arme ausschließlich auf Hammley gerichtet waren. Sie schien den DJ","4"
"Jeffrey","beinahe wie eine Gottheit anzuhimmeln – und dann geschah es!","4"
"Peter","Ja, was denn zum Kuckuck?!","4"
"Jeffrey","Plötzlich richtete Hammley seine ausgestreckten Arme in Richtung","4"
"Jeffrey","Mandy, so, als wolle er sie segnen und dann… es war unheimlich. Mandy","4"
"Jeffrey","sackte mitten auf der Tanzfläche ohnmächtig zu Boden. Der","4"
"Jeffrey","Rettungswagen wurde sofort gerufen, aber Mandy, die sich erstaunlich","4"
"Jeffrey","schnell wieder erholt hatte, weigerte sich strikt, von den Sanitätern nach","4"
"Jeffrey","Hause gebracht zu werden. Sie wollte unbedingt weitertanzen! Ja! Und","4"
"Jeffrey","auch die anderen Gäste waren voll am Abhotten. Eine… eine irre","4"
"Jeffrey","Stimmung, sag ich euch. Wie im Hexenkessel! Das müsst ihr euch","4"
"Jeffrey","unbedingt ansehen.","4"
"Justus","Em…  äh… vergiss es! Die dreißig Dollar Eintrittsgeld kann ich nutzvoller","4"
"Justus","investieren!","4"
"Bob","Ich aber auch!","4"
"Peter","[mahnend] Justus!","4"
"Jeffrey","Um den Eintritt braucht ihr euch keine Sorgen zu machen, ihr seid von mir","4"
"Jeffrey","sozusagen… eingeladen.","4"
"Peter","Wie? Hast du etwa im Lotto gewonnen oder, oder eine Erbschaft gemacht","4"
"Peter","oder was?!","4"
"Jeffrey","Quatsch. Mach ich etwa den Eindruck?! [lacht] Aber eine Freundin von","4"
"Jeffrey","meinem Bruder arbeitet im Planet Evil hinter den Tresen… Sie war sofort","4"
"Jeffrey","bereit, gestern kurz vor Mitternacht das Klofenster von innen zu entriegeln.","4"
"Jeffrey","Ja, sie versprach mir, heute Nacht diesen kleinen Freundschaftsdienst","4"
"Jeffrey","noch einmal zu erweisen. Nun, was ist? Auch heute wird DJ Hammley zur","4"
"Jeffrey","Geisterstunde wieder kräftig einheizen; habt ihr Lust, bei diesem Event","4"
"Jeffrey","dabei zu sein?","4"
"Peter","und Bob: Naja… Ja!","4"
"Jeffrey","Und… was ist mit dir, Justus?","4"
"Justus","[entmutigt] Pass ich denn durch dieses Fenster?! [Alle lachen] Die","5"
"Justus","Aussicht auf einen Diskothekenbesuch lässt mich relativ kalt, Jeffrey,","5"
"Justus","aber… einen kopflosen DJ mal eingehend aus der Nähe zu betrachten,","5"
"Justus","weckt meinen angeborenen Spürsinn. Ich bin dabei!","5"
"Justus","[Musik]","5"
"REGIE","Ungeduldig fieberten die drei ??? der kommenden Nacht entgegen. Diese","5"
"REGIE","war sternenklar. Keine Wolke zeigte sich am Himmel. Doch auch Jeffrey","5"
"REGIE","war nirgends zu sehen. Peter hielt immer wieder ungeduldig Ausschau","5"
"REGIE","nach ihm, während er mit Justus und Bob vor dem vereinbarten","5"
"REGIE","Treffpunkt, den beiden Klofenstern auf der Rückseite der Diskothek, auf","5"
"REGIE","ihn wartete. Es war kurz vor Mitternacht.","5"
"Erzähler","[Alle flüstern]","5"
"Erzähler","[Peter stöhnt]","5"
"Bob","Ja, und was machen wir jetzt, wenn Jeffrey nicht kommt?","5"
"Justus","Darauf hoffen, dass uns das Klofenster trotzdem geöffnet wird!","5"
"Peter","Auf Jeffrey kann man sich verlassen, kapiert das endlich!","5"
"Bob","Aber er ist noch nicht da!","5"
"Peter","Ah, da kommt er ja! Hallo!","5"
"Justus","He!","5"
"Jeffrey","Habt ihr vorne am Eingang die lange Schlange von Besuchern registriert?","5"
"Jeffrey","Der Türsteher ist ein eklig-arroganter Schnösel und schickt jeden wieder","5"
"Jeffrey","nach Hause, dessen Gesicht oder Klamotten ihm nicht passen.","5"
"Jeffrey","[Fenster wird geöffnet]","5"
"Jeffrey","Ellen öffnet das Klofenster! Super!","5"
"Peter","Also, du zuerst, Justus, ja? Ich mach dir 'ne Räuberleiter.","5"
"Bob","Peter, ich helf dir, das wird sonst ein bisschen schwer.","5"
"Bob","[Geächze und Gestöhne]","5"
"Justus","Ah, ich bin drin!","5"
"Justus","[erneutes Geächze]","5"
"Peter","Jetzt ich.","5"
"Bob","[stöhnend] Ah, so mach doch…","5"
"Ellen","[sauer] Pssscht, nicht so laut!","5"
"Jeffrey","Ah, Spitze, Ellen. Wahnsinn, dass es auch dieses Mal…","6"
"Ellen","[zischend] Wenn herauskommt, was ich hier mache, dann bin ich meinen","6"
"Ellen","Job los, das ist euch wohl klar!","6"
"Ellen","[Tür wird geöffnet]","6"
"Alle","Jungs: [erschrocken] Aaaah!","6"
"Pam","Was fällt euch denn ein?! Was um alles in der Welt habt ihr hier zu","6"
"Pam","suchen?!","6"
"Pam","[die Jungs stammeln herum]","6"
"Pam","Seid ihr taub, was habt ihr auf der Damentoilette verloren?!","6"
"Peter","ääh… also Bob wollte….","6"
"Bob","… Das Problem war… Peter…. Ähm…","6"
"Ellen","Eine Küchenschabe, Pam!","6"
"Bob","Genau.","6"
"Ellen","Ich wollte mir gerade die Hände waschen, als plötzlich eine daumengroße","6"
"Ellen","Kakerlake aus dem Abfluss krabbelte. Ich schrie wie am Spieß. Da kamen","6"
"Ellen","mir die Jungs zu Hilfe.","6"
"Pam","Du wirst in deinem Leben noch hunderten dieser Schaben begegnen,","6"
"Pam","Ellen. Amerika ist von diesen Krabbeltieren übersät; sie sind nicht","6"
"Pam","auszurotten und werden sogar einen Atomkrieg überleben.","6"
"Ellen","[angewidert] Ah, ich könnte kotzen!","6"
"Pam","Lass mich mal an’s Becken.","6"
"Pam","[Wasserrauschen]","6"
"Ellen","Was machst du denn da?!","6"
"Pam","Die Kreatur mit heißem Wasser abkochen.","6"
"Ellen","Uäh…Ich ekel mich zu Tode!","6"
"Pam","So, raus jetzt, Burschen, hier gibt’s jetzt nichts mehr zu glotzen.","6"
"Justus","Schon verstanden.","6"
"Bob","Peter, komm doch!","6"
"Justus","Kommt, Kollegen.","6"
"Jeffrey","Wir sehen uns auf der Tanzfläche, Ellen.","6"
"Ellen","Ich komm gleich nach! Der erste Tanz gehört uns!","7"
"Ellen","[Musik im Hintergrund]","7"
"Justus","Tja, ganz schön laut!","7"
"Peter","Jaa!","7"
"Bob","Find ich auch. Auf zur Bar, Freunde, ich spendier uns 'nen Drink! Was","7"
"Bob","nehmt ihr?","7"
"Peter","Champagner! Und zwar den edelsten Tropfen!","7"
"Bob","Jaja, sehr witzig, bist du bescheuert? Wir sind hier, um dem DJ auf die","7"
"Bob","Finger zu gucken und das erfordert einen klaren Kopf! [zur Barkeeperin]","7"
"Bob","Ähm, hallo? Vier Cola bitte!","7"
"Peter","[äfft Bob nach] Cola!","7"
"Peter","Barkeeperin: Kommt sofort.","7"
"Jeffrey","Der Satans-DJ tritt pünktlich um Mitternacht auf. Die Stimmung hier ist","7"
"Jeffrey","zwar schon gewaltig am Kochen, aber wartet erst mal ab, bis der Magier","7"
"Jeffrey","persönlich erscheint.","7"
"Jeffrey","Barkeeperin: So, vier Cola, bittesehr.","7"
"Peter","Wisst ihr was? Ich hab jetzt Lust zu tanzen!","7"
"Justus","Also, ich hab Peter noch niemals tanzen sehen. Das wird bestimmt ein","7"
"Justus","Höllenspaß! Ein Jammer, dass keiner von uns eine Videokamera dabei","7"
"Justus","hat!","7"
"Bob","Ja… Sich auf die Tanzfläche zu begeben, halte ich für 'nen klugen","7"
"Bob","Schachzug. In dieser Disco der günstigste Platz, nicht aufzufallen.","7"
"Bob","Deshalb würd’ ich sagen: Ab auf die Tanzfläche!","7"
"Justus","Was?!","7"
"Bob","Äh, natürlich, ein bisschen Bewegung täte gerade deiner fülligen Figur","7"
"Bob","ausgesprochen gut, Justus.","7"
"Justus","Also, ich weiß nicht…","7"
"Bob","Jajaja… Eh, und was ist mit dir, Jeffrey, kommst du mit?","7"
"Jeffrey","Na klar doch!","7"
"Bob","Hi Peter! Du tanzt aber komisch! Mach mal 'n bisschen Platz hier!","7"
"Peter","Woo, yeah. Seht euch die Oma in dem grünen, engen Paillettenkleid an!","7"
"Peter","Hahaha! Die flippt beim Tanzen total aus!","7"
"Peter","[Gekreische von der Frau]","8"
"Jeffrey","Wahnsinn, was? Das ist Amy Scream! Die Verrückte mischt hier jedes","8"
"Jeffrey","Wochenende den Laden auf und ist immer die Erste und Letzte auf der","8"
"Jeffrey","Tanzfläche.","8"
"Peter","Coole Erscheinung. Wenn ich mal so alt bin, strotz ich hoffentlich auch","8"
"Peter","noch so vor Energie.","8"
"Jeffrey","Ihre Power ist aber nicht angeboren, sondern künstlichen Ursprungs.","8"
"Peter","Hä? Wie meinst du denn das?","8"
"Jeffrey","Drogen! Irgendein Aufputschmittel. Die Discoqueen macht daraus auch","8"
"Jeffrey","kein Geheimnis, nach etwa jedem fünften Song wirft sie sich eine Pille ein","8"
"Jeffrey","und dreht danach noch heftiger auf als vorher.","8"
"Jeffrey","[verzerrte Stimme kündigt Norman Hammley an]","8"
"Jeffrey","[die Menge jubelt]","8"
"REGIE","Ein greller Scheinwerfer blitzte auf und bestrahlte das Podest, auf dem","8"
"REGIE","Norman Hammley wie aus dem Nichts in seiner Teufelskutte erschienen","8"
"REGIE","war. Im aufsteigenden Nebel trat der Kopflose ans Mikrofon und hob","8"
"REGIE","beschwörend die Arme.","8"
"Erzähler","Verzerrte Stimme: And now – it’s showtime!","8"
"Erzähler","[erneutes Gejubel]","8"
"Erzähler","[Musik]","8"
"REGIE","Die Besucher schienen beim Tanzen in eine andere Welt einzutauchen.","8"
"REGIE","Über allem wachte Norman Hammley, und obwohl der Discjockey seine","8"
"REGIE","Künste ohne sichtbaren Kopf ausführte, bildete sich Justus ein, ein","8"
"REGIE","überlegenes Grinsen in dem nicht vorhandenen Kopf erkennen zu können.","8"
"REGIE","Peters Blicke wanderten derweil abwechselnd zwischen dem DJ, seinen","8"
"REGIE","Freunden und Amy Scream hin und her. Die ältere Dame hatte aus ihm","8"
"REGIE","unerfindlichen Gründen scheinbar Gefallen an ihm gefunden. Mehrmals","8"
"REGIE","hatte sie dem zweiten Detektiv während des Tanzens verschwörerisch","8"
"REGIE","zugeblinzelt und ihn herausfordernd angelacht, bis sie plötzlich auf ihn","8"
"REGIE","zutanzte und ihn an den Rand der Tanzfläche drängte.","8"
"Amy Scream","Du hast es drauf, Junge! Du gefällst mir!","8"
"Peter","Bitte?","8"
"Peter","Amy:        Ja! Du bist ein guter Tänzer! Komm her! Klink dir auch einen ein! Hier!","8"
"Peter","Was ist denn das?","8"
"Peter","Amy:        Der ultimative Klick oder Kick oder was auch immer. Wer das schluckt,","8"
"Peter","wächst über sich selbst hinaus! Der Mega-Knaller zum Wohlfühlen! Und","8"
"Peter","Abtanzen!","8"
"Peter","Äh, danke, aber… ich… ich brauch keine Drogen, ich, ich bin auch so gut","9"
"Peter","drauf!","9"
"Peter","Amy:        Ooooch, komm schon! Sei clever und sei dabei! Nun, was ist?!","9"
"Peter","[enttäuscht] Na, dann eben nicht! Wie man sich doch täuschen kann. Du","9"
"Peter","sahst mir nicht nach einem Feigling aus.","9"
"REGIE","Bei diesen Worten zuckte Peter unwillkürlich zusammen. Wenn er etwas","9"
"REGIE","hasste, dann war es, als Feigling dazustehen. In seinem Stolz verletzt griff","9"
"REGIE","er nach dem Dragée, welches noch immer in Amy Screams offener Hand","9"
"REGIE","lag und beförderte es mit einer schnellen Bewegung in seinen Mund.","9"
"Erzähler","Amy:        Cool!","9"
"Monique Carrera","[durch die Lautsprecher] Now you can dance ‘til you die!","9"
"Monique Carrera","Amy:        Lass uns jetzt abdancen!","9"
"Monique Carrera","[“Devil-Dancer” wird gespielt]","9"
"Monique Carrera","Amy:        Jaaa, woooh! Juhu… Woohooo!","9"
"REGIE","Grelle Laserblitze, rotierende Scheinwerfer und dichte Rauchschwaden","9"
"REGIE","ließen in Verbindung mit der Musik ein wahres Disco-Inferno entstehen.","9"
"REGIE","Nicht nur Amy Scream geriet jetzt außer Kontrolle; der Satans-DJ","9"
"REGIE","verstand es meisterhaft, wie ein Marionettenspieler die brodelnde Masse","9"
"REGIE","an unsichtbaren Fäden nach seinem Willen tanzen zu lassen.","9"
"Erzähler","[“Devil-Dancer” wird weitergespielt]","9"
"Bob","Just?","9"
"Justus","Hm?","9"
"Bob","Diese, diese, diese Sängerin, diese Stimme…","9"
"Justus","Hä?","9"
"Bob","Diese Stimme…. kommt mir irgendwie bekannt vor!","9"
"REGIE","Amy Scream schwitzte aus allen Poren. Wie ein Cheerleaderin beim","9"
"REGIE","großen Finale wirbelte ihre dünne Gestalt im Zentrum der Tanzfläche. DJ","9"
"REGIE","Hammley gab dieser besonderen Darbietung zusätzlich einen steigernden","9"
"REGIE","Kick, indem er erbarmungslos die Drehzahl des Plattentellers erhöhte und","9"
"REGIE","die alternde Discoqueen damit an ihre Leistungsgrenze katapultierte. In","9"
"REGIE","diesem Moment nahm die bis dahin höchst unterhaltsame Darbietung eine","9"
"REGIE","dramatische Wendung. Wie vom Blitz getroffen, begann Amy Scream","9"
"REGIE","plötzlich zu taumeln und fasste sich mit schmerzverzerrtem Gesicht an","9"
"REGIE","ihre Brust. Mit weit aufgerissenen Augen sackte sie auf den stählernen","9"
"REGIE","Tanzboden, auf dem sie Sekunden später regungslos liegen blieb.","9"
"Erzähler","[die Musik bricht ab]","9"
"Erzähler","[allgemeines Entsetzen]","9"
"REGIE","Bob war der Erste, der sie Situation erfasste. Mit einem Satz hechtete er","10"
"REGIE","auf die am Boden liegende Dame zu und kniete neben ihr nieder.","10"
"Bob","[klatscht immer wieder gegen ihre Wange] Hallo, Madam? Können Sie","10"
"Bob","mich hören? Madam! So wachen Sie doch auf!","10"
"Sanitäter","Lass mich das machen, Junge, ich bin Sanitäter.","10"
"Justus","Und? Wie geht es ihr?","10"
"Sanitäter","[tippt eine Nummer und spricht ins Telefon] Ray? Hier spricht Ron. Ich bin","10"
"Sanitäter","hier in der Diskothek Planet Evil. Schick sofort zwei Leute her, hier gab es","10"
"Sanitäter","einen tragischen Zwischenfall. Eben brach hier eine ältere Dame auf der","10"
"Sanitäter","Tanzfläche zusammen. Sie erlitt einen Herzanfall – und ist tot.","10"
"Sanitäter","[Spannungsaufbauende Musik]","10"
"Sanitäter","[Munkeleien]","10"
"Justus","Seltsam. Äußerst fragwürdig.","10"
"Peter","Wovon sprichst du, Just?","10"
"Justus","Hat eigentlich irgendjemand von euch mitbekommen, wohin Norman","10"
"Justus","Hammley verschwunden ist, nachdem die Dame zusammengebrochen","10"
"Justus","ist?","10"
"Bob","Keine Ahnung, ich bin gleich der Oma zu Hilfe geeilt.","10"
"Justus","Schon klar, Bob, aber… macht es euch nicht stutzig, dass die Gäste und","10"
"Justus","das gesamte Personal sofort herbeigeeilt kamen, während der DJ","10"
"Justus","urplötzlich von der Bildfläche verschwunden ist?","10"
"Bob","Naja…","10"
"Jeffrey","Vielleicht hat er sich ja auch nur schnell seiner Kutte entledigt und befindet","10"
"Jeffrey","sich längst unter uns. Schließlich wissen wir ja nicht, wer sich darunter","10"
"Jeffrey","verbirgt.","10"
"Peter","Äh… Da kommen die Sanitäter. Sie betten Mrs. Scream auf die Bahre.","10"
"Sanitäter","Machen Sie Platz! So gehen Sie doch zur Seite!","10"
"Justus","Was meint ihr, Kollegen? Mir ist der Spaß ziemlich vergangen. Ich halte es","10"
"Justus","für wenig sinnvoll, uns hier und jetzt auf die Spur des ominösen DJ zu","10"
"Justus","heften, der – meines Erachtens – am tragischen Ende der alternden","10"
"Justus","Disco-Lady nicht ganz unbeteiligt war. Die Aussicht, beim","10"
"Justus","Herumschnüffeln ohne gültigen Stempel in diesem Schuppen erwischt zu","10"
"Justus","werden, scheint mir zu riskant. Brechen wir also auf und blasen die Sache","10"
"Justus","vorerst ab. Morgen ist schließlich auch noch ein Tag.","10"
"Peter","und Bob: Ja… ja.","10"
"Peter","[Musik]","10"
"REGIE","Ein alter, ausrangierter Campinganhänger auf dem Schrottplatz von Titus","11"
"REGIE","Jonas diente den drei ??? als Zentrale. Und auch an diesem Nachmittag","11"
"REGIE","hatten sie sich hier versammelt, um über die seltsamen Vorkommnisse","11"
"REGIE","der vergangenen Nacht in der Diskothek Planet Evil zu sprechen.","11"
"Bob","Also, ich muss sagen, die Umstände, die zum Tod der Disco-Oma geführt","11"
"Bob","haben, liegen doch eigentlich klar auf der Hand: Die Lady war schließlich","11"
"Bob","nicht mehr die Jüngste und in der Szene für ihren ausschweifenden","11"
"Bob","Lebensstil bekannt. Also man braucht kein Fachwissen, um sich ausmalen","11"
"Bob","zu können, dass anhaltend übermäßiger Drogenkonsum","11"
"Bob","gesundheitsschädlich ist und häufig sogar, wie wir gestern leider live","11"
"Bob","miterleben mussten, tödlich enden kann.","11"
"Justus","Tja, seh ich genauso. Aber… findet ihr es nicht merkwürdig, dass ein bis","11"
"Justus","dato unbekannter Discjockey über die Fähigkeit verfügt, sein tanzendes","11"
"Justus","Publikum derart in Ekstase zu versetzten, dass dieses wie hypnotisiert","11"
"Justus","seiner Macht unterliegt?","11"
"Bob","Ja, also...","11"
"Justus","Meine Person inbegriffen, Kollegen, ich war bis zum gestrigen Zeitpunkt","11"
"Justus","ein strikter Gegner lächerlicher Tanzversuche auf dem Dancefloor. Doch","11"
"Justus","auch ich konnte DJ Hammleys Mischkünsten in keinster Weise","11"
"Justus","widerstehen.","11"
"Peter","Jaja, ich hab’s gesehen.","11"
"Justus","Vorletzte Nacht erlitt Mandy unter Hamleys Einwirkungen einen","11"
"Justus","Ohnmachtsanfall. Und in der darauf folgenden Nacht war diese alternde","11"
"Justus","Disco-Diva seinem Bann in solchem Ausmaß verfallen, dass es sogar zu","11"
"Justus","einem tödlichen Ende führte, also, Kollegen; wie kann ein DJ in der Lage","11"
"Justus","sein, solche unerklärlichen Kräfte freizusetzen?","11"
"Peter","Also… manches lässt sich eben nicht wissenschaftlich erklären…","11"
"Peter","Vielleicht steckt DJ Hammley ja tatsächlich mit dem… Teufel im Bunde.","11"
"Bob","[ironisch] Natürlich, Peter.","11"
"Justus","Papperlapapp! Wir sind ein ernstzunehmendes Unternehmen, Peter.","11"
"Justus","Geister, Teufel, Hexen und Dämonen gibt es nur zu Halloween. Und wie","11"
"Justus","schon oft in unseren bisherigen Fällen lässt sich alles rational erklären.","11"
"Bob","Tja, aber Justus… Wo gedenkst du, anzusetzen?","11"
"Justus","Hmmm…  Norman Hammley ausfindig machen und hinter sein Geheimnis","11"
"Justus","der Massenmanipulation kommen.","11"
"Bob","und Peter: Hmmm…","11"
"Peter","Über Jeffreys Bruder Brian, dessen Freundin uns gestern","11"
"Peter","freundlicherweise das Klofenster geöffnet hat, konnte ich bereits einige","11"
"Peter","Details in Erfahrung bringen. Ich hab mir alle wichtig erscheinenden","11"
"Peter","Fakten notiert.","11"
"Bob","Lies mal vor!","12"
"Peter","Ja. Also… laut Brians Aussage hat ein gewisser Jim Cowley die","12"
"Peter","Räumlichkeiten des Planet Evil vor etwa einem Jahr auf unbestimmte Zeit","12"
"Peter","gepachtet und darin die besagte Diskothek eröffnet. Cowley ist noch","12"
"Peter","verhältnismäßig jung –","12"
"Bob","Wie alt?","12"
"Peter","So, ja, Mitte zwanzig ungefähr und, und stattet dem gut laufenden Laden","12"
"Peter","selten selber einen Besuch ab.","12"
"Bob","Aha…","12"
"Justus","Und was ist mit Hammley? Was hat Brian dir über den DJ sagen können?","12"
"Peter","Warte mal…Äh, über ihn weiß eigentlich niemand etwas Genaues… Na,","12"
"Peter","eigentlich gar nichts. Weder seinen Vornamen, seine Herkunft, seinen","12"
"Peter","Wohnsitz, geschweige denn, wie er aussieht.","12"
"Bob","Is’ ja interessant.","12"
"Peter","Und… ja und Cowley verhält sich seinen Angestellten gegenüber,","12"
"Peter","zumindest, was Hammley betrifft, äußerst bedeckt. Über seine Freundin","12"
"Peter","Ellen weiß Brian, dass der kopflose DJ zu seinen Auftritten ins Planet Evil","12"
"Peter","immer erst kurz vor Mitternacht in einer schwarzen Limousine vorfährt. Ja,","12"
