"Speaker","Text","Page"
"Bob","Ich hab ihn! Ich hab ihn, Just!","32"
"Alaa Edine","Nicht! Peter retten!","32"
"Bob","(überrascht) Wie...? Wie? Peter retten?","32"
"Alaa Edine","(außer Atem) Peter gefangen! Und ein Mädchen. Ich habe verfolgt","32"
"Alaa Edine","Menschenräuber.","32"
"Bob","Ach so. Deswegen waren Sie so plötzlich verschwunden.","32"
"Alaa Edine","Freunde. Ich euch helfen und ihr mich schnappen? Ich Alaa Edine","33"
"Alaa Edine","Peter da raus holen.","33"
"Bob","Peter da r... Was denn?","33"
"Alaa Edine","Ja, da drinne!","33"
"Bob","Peter soll da drin sein?","33"
"Alaa Edine","Jetzt wir Sargdeckel wegschieben, jalla!","33"
"Justus","OK.","33"
"REGIE","Angestrengtes Stöhnen","33"
"Bob und Justus","(gleichzeitig) Peter!","33"
"Peter","Endlich! Oh Mann! Ja.","33"
"Bob","Peter...","33"
"Peter","Und Layla!","33"
"REGIE","Musik setzt ein","33"
"Bob","Los, kommt! Wir helfen euch da raus!","33"
"Justus","(angestrengt) Komm her.","33"
"Peter","(erleichtert) Mann! Beinahe wären wir in dem Ding erstickt.","33"
"Layla","Danke für unsere Rettung.","33"
"Alaa Edine","Alaa Edine helfen gerne.","33"
"Peter","Danke Alaa...","33"
"Justus","Ja.","33"
"Peter","...Edine.","33"
"Justus","Entschuldigen Sie den Überfall, Mr. Edine. Tut uns Leid.","33"
"Bob","(hustend) Ja.","33"
"REGIE","Musik","33"
"REGIE","Track 13 - Die Königin der Weisheit","34"
"REGIE","Musik","34"
"Erzähler","Die drei Fragezeichen baten Alaa Edine, im Wagen auf sie zu warten,","34"
"Erzähler","da sie mit Layla noch etwas zu besprechen hatten. Bevor sie ihre Neu-","34"
"Erzähler","igkeiten austauschten, verfasste das Mädchen eine SMS an ihre Mut-","34"
"Erzähler","ter, um sie über ihre Rettung zu informieren. Und schon einige Sekun-","34"
"Erzähler","den später erhielt Layla eine Antwort.","34"
"REGIE","Handysignal","34"
"Layla","Meine Mum wird gleich hier sein. Ich habe ihr nämlich die gleiche SMS","34"
"Layla","geschickt, wie euch.","34"
"Peter","Hier... Hier liegen noch ein paar Zettel im Sarg. Sind sie dir aus der","34"
"Peter","Tasche gefallen? Hier. Äh... äh, sag mal, entschuldige meine Neugier,","34"
"Peter","diese Frau auf dem Foto... Ist das deine Mutter?","34"
"Layla","Ja. Meine Mum.","34"
"Peter","Aha...","34"
"Justus","Aha. Die Ähnlichkeit ist nicht zu übersehen. Wer ist denn der Mann","34"
"Justus","neben ihr?","34"
"Layla","Das ist Dick. Dick Vincent. Ihr neuer Freund. Er arbeitet, wie sie, in","34"
"Layla","einer Bank.","34"
"Justus","Aha... Dick Vincent also.","34"
"Layla","Wie weit seid ihr mit dem Rätsel gekommen? Ihr solltet doch auf mich","34"
"Layla","warten.","34"
"REGIE","Peter und Bob stöhnen","34"
"Justus","Ähm... Wir wollten die Zeit nutzen und wir sind auch ein großes Stück","34"
"Justus","weiter gekommen. Aber erzähl uns doch bitte, ob du Rubbish, äh, also,","34"
"Justus","George gefunden hast.","34"
"Layla","Nicht eine einzige Spur.","34"
"Bob","Mhm...","34"
"Peter","Hach...","34"
"Bob","Sag mal, vermutest du, dass George auch auf der Jagd nach der","34"
"Bob","Kammer der Erkenntnis war?","34"
"Layla","Ja. Ohne Zweifel. Eines Tages sagte er, er stände kurz vor der Lö-","34"
"Layla","sung. Ein paar Tage später war er verschwunden. Nach vielen Re-","34"
"Layla","cherchen bin ich dann nach Rocky Beach gefahren.","34"
"Peter","Häh... Wie wollte George die Entdeckung eigentlich zu Geld machen?","34"
"Justus","Na... Peterchen...","34"
"Peter","Hä?","35"
"Justus","Zum einen dürften sich in der Kammer der Erkenntnis so manche alte","35"
"Justus","Kunstschätze befinden. Zum anderen ist die Entdeckung der Kammer","35"
"Justus","ein Ereignis, das man hervorragend vermarkten kann. Ich sehe schon","35"
"Justus","die Bestsellerliste vor meinen Augen - Platz eins: ""Wie wir das Rätsel","35"
"Justus","der Sphinx lösten"" von Justus Jonas, Peter Shaw und Bob Andrews.","35"
"REGIE","Peter lacht","35"
"Bob","Nicht schlecht.","35"
"Layla","Und was ist mit mir? Ohne mich wärt ihr doch gar nicht hier.","35"
"Peter","Tschuldigung.","35"
"Justus","Bevor wir die Autorenfrage klären, müssen wir die Kammer erst einmal","35"
"Justus","finden. Und zwar VOR diesem Dalbello. Sonst erscheint das Buch oh-","35"
"Justus","nehin unter einem ganz anderen Namen.","35"
"Peter","Hm... also, bisher haben wir das Grab des XI. Priesters in der Nähe","35"
"Peter","der Pyramiden gefunden, sind von dort auf den Skarabäus im Kairoer","35"
"Peter","Museum gestoßen, haben dadurch den Hinweis auf die Ali Moschee","35"
"Peter","erhalten, wo wir einen Namen entdeckt haben, der uns zur Kammer er","35"
"Peter","Erkenntnis führen soll.","35"
"Bob","Genauer gesagt zu einem Boten, der uns dort hin bringen wird.","35"
"Justus","Es heißt hier - ähm: (liest vor) ""Den Namen des kleinen und sehr alten","35"
"Justus","Ladens, in dem du fragen musst und der selbst ein Teil der Lösung","35"
"Justus","ist."". Layla, wir haben hier ein paar in eine Mauer eingeritzte arabische","35"
"Justus","Buchstaben fotografiert. Ähm, Hier, sieh mal. Kannst du uns sagen,","35"
"Justus","was das heißt?","35"
"Layla","Es bedeutet ""Königin"".","35"
"Peter","Hah...","35"
"Justus","Königin. Hoh... Wir müssen also nach einem Geschäft mit diesem","35"
"Justus","Namen suchen. Ich hoffe sehr, dass es noch existiert und wir es fin-","35"
"Justus","den. Layla, hast du eine Ahnung, was für ein Laden gemeint sein","35"
"Justus","könnte?","35"
"Layla","Nein. Aber ich kann es herausfinden.","35"
"REGIE","Peter lacht","35"
"Justus","Gut. Also, hier. Im Text heißt es weiter...","35"
"Bob","Ja...","35"
"Justus","(liest vor) ""Geliebte Cathrin, gehe in den Laden und sage den Satz,","35"
"Justus","den ich herausgefunden habe. Er ergibt sich aus drei Begriffen, die du","35"
"Justus","nur sinnvoll zusammensetzen musst. Einer ist dein geheimer Name.","35"
"Justus","Den zweiten kennst du durch den Laden. Der dritte nennt die, um die","35"
"Justus","sich alles dreht. Jetzt brauchst du die Wörter nur ins arabische zu","35"
"Justus","übertragen.""","35"
"Bob","Also, den zweiten Namen von Cathrin den haben wir herausgefunden.","36"
"Bob","Er lautet Sophie.","36"
"Peter","Ja.","36"
"Bob","Das bedeutet Weisheit. Jetzt haben wir ""Königin"" und ""Weisheit"".","36"
"Justus","Genau.","36"
"Bob","Ja, fehlt nur noch das dritte Wort. (zitiert) ""Die, um die sich alles","36"
"Bob","dreht""... (überlegt) Hm... die... ja die... die...","36"
"Justus","(schnippt mit dem Finger) Sphinx!","36"
"Bob","Was?","36"
"Justus","Was sonst? Wir brauchen nur noch einen Satz daraus zu bilden.","36"
"Peter","Aha. Also, die, die, (stottert etwas) die Königin...","36"
"Bob","Königin, ja...?","36"
"Peter","...ist die Weisheit der Sphinx.","36"
"Bob","Königin... Wie bitte?","36"
"Peter","Ach... Also, man könnte auch sagen, die, die, die Weisheit... ist die","36"
"Peter","Königin der... die Sphinx","36"
"Layla","Die Königin der Weisheit ist die Sphinx.","36"
"REGIE","Musik setzt ein","36"
"Justus","Layla, das ist es! Nur so kann es heißen, großartig!","36"
"Bob","Moment mal, da kommt jemand.","36"
"Aisha","Layla! (hastige Schritte) Ach... Och, Layla...","36"
"Aisha","Und Ihr, ihr seid die drei Jungen aus Rocky Beach?","36"
"Justus","So ist es. Ähm - Peter Shaw...","36"
"Peter","Hallo.","36"
"Justus","...Bob Andrews...","36"
"Bob","Hi.","36"
"Justus","Und meine Wenigkeit, Justus Jonas.","36"
"Aisha","Und ich bin Aisha, Laylas Mutter.","36"
"Bob","(ein wenig nervös) Häh... Wir sollten hier langsam verschwinden. Man","36"
"Bob","weiß nicht, wann Dalbello hier wieder auftauchen wird.","36"
"Aisha","Dalbello?","36"
"Bob","Ein Amerikaner, der ebenfalls hinter der geheimen Rätselkammer her","37"
"Bob","ist. Wie auch George, mit dem Sie damals befreundet waren.","37"
"REGIE","Musik klingt langsam aus","37"
"Aisha","Hah... Ja, damals. Mich interessiert das nicht mehr. George ist damals","37"
"Aisha","einfach weg gegangen.","37"
"Peter","Oh...","37"
"Aisha","Er hat sich bei der Bank Geld genommen, und dann waren Geld und","37"
"Aisha","George plötzlich verschwunden. Nun ja, zum Glück hat sich ein Kolle-","37"
"Aisha","ge von George dann um uns gekümmert.","37"
"Layla","Wo ist Dick?","37"
"Aisha","Bei der Arbeit, denke ich. Dick Vincent, das ist der ehemalige Kollege","37"
"Aisha","von George, er wurde mein neuer Freund.","37"
"Peter","Ah, ja...","37"
"Aisha","Aber nun lasst uns gehen, wir sollten die Polizei verständigen.","37"
"Justus","Damit würde ich noch ein wenig warten. Ich denke, wir haben gute","37"
"Justus","Chancen, den Fall zu lösen. Sie wollen doch bestimmt hören, was","37"
"Justus","passiert ist, oder?","37"
"REGIE","Musik","37"
"Erzähler","Laylas Mutter war einverstanden und nannte Alaa Edine, der die gan-","37"
"Erzähler","ze Zeit über in seinem Taxi gewartet hatte, ein ruhiges Café. Dort re-","37"
"Erzähler","deten die drei Detektive ihr entgültig aus, die Polizei zu rufen, die ih-","37"
"Erzähler","nen diese Geschichte ohnehin kaum glauben würde. Layla nutzte die","37"
"Erzähler","Gelegenheit, um mit einigen Textnachrichten, die sie von ihrem Handy","37"
"Erzähler","aus verschickte, mehr über den kleinen Laden herauszufinden. Nach","37"
"Erzähler","der dritten SMS blinzelte das Mädchen den Detektiven verschwöre-","37"
"Erzähler","risch zu.","37"
"Erzähler","Track 14 - Verschleiert","38"
"REGIE","Musikwechsel","38"
"Erzähler","Die Dunkelheit war hereingebrochen. Alaa Edine kämpfte sich auf die","38"
"Erzähler","rechte Fahrspur, und ließ sein Taxi vor einem belebten Basar ausrol-","38"
"Erzähler","len.","38"
"Alaa Edine","Da sind wir, Freunde. Sollen warten auf euch?","38"
"Justus","Ähm, wenn es Ihnen nicht zu spät wird, gern. Kommt, Kollegen. Und","38"
"Justus","auch du, Layla.","38"
"REGIE","Stimmengewirr, Schritte","38"
"Bob","Gut. Wo geht's lang, Layla?","38"
"Layla","Folgt mir.","38"
"Peter","Na dann...","38"
"Bob","OK.","38"
"REGIE","Stimmengewirr","38"
"Erzähler","Bereits nach wenigen Metern waren die Detektive und Layla in dem","38"
"Erzähler","Trubel des Basars eingetaucht. Eine schier überquellende Fülle von","38"
"Erzähler","Wasserpfeifen, Armreifen und Halsketten, Tüchern und Stoffen, von","38"
"Erzähler","nachgebildeten Pyramiden und Statuen bot sich den Passanten dar.","38"
"Erzähler","Der Duft von Kaffee und Gewürzen mischte sich mit dem Stimmenge-","38"
"Erzähler","wirr der Händler. (leise Musik setzt ein) Plötzlich blieb Layla vor einem","38"
"Erzähler","Laden stehen. Und Justus erkannte die arabischen Zeichen für ""Köni-","38"
"Erzähler","gin"", die er an der Moschee fotografiert hatte.","38"
"REGIE","Leise Musik, Schritte","38"
"Justus","(euphorisch) Wir sind am Ziel. Jetzt endlich werden wir den Weg zur","38"
"Justus","geheimen Kammer erfahren.","38"
"Peter","(fällt Justus mit erregter, aber leiser Stimme ins Wort) Just!","38"
"Justus","Hä!?.","38"
"Peter","Da ist Dalbello!","38"
"Justus","(verdutzt) Bitte? Wo denn? Ich sehe nichts.","38"
"Peter","Eben stand er neben dem Gewürzstand. Er ist uns auf den Fersen!","38"
"Justus","OK. Pass auf. Bob und ich werden ihn ablenken.","38"
"Bob","OK.","38"
"Justus","Du gehst mit Layla in den Laden.","38"
"Peter","Hahä... Aber..., aber wir...","38"
"Justus","(fällt Peter energisch fordernd ins Wort) Es bleibt keine Zeit für lange","39"
"Justus","Diskussionen, geh' jetzt rein!","39"
"Justus","Hier!","39"
"Peter","Hä?","39"
"Justus","Falls der Bote nicht auf uns warten will, nimm den Peilsender mit, wir","39"
"Justus","finden euch dann.","39"
"Peter","Ja.","39"
"Justus","Und nun los!","39"
"Peter","Verstanden. Komm, Layla.","39"
"REGIE","Bimmeln, Türknarren, die Musik setzt aus, die Tür fällt zu","39"
"Verkäufer","Guten Abend. Sie wünschen?","39"
"Peter","Äh... wir suchen eine bestimmte Antiquität, ein, ein ganz besonderes","39"
"Peter","Stück. Wir, w... w... w... wir suchen... (kurz zögernd) die Kammer der","39"
"Peter","Weisheit.","39"
"Verkäufer","Ah, ja, die Kammer. Ich hab davon gehört. Einen Moment, bitte.","39"
"Peter","Äh...","39"
"Peter","Und jetzt?","39"
"Erzähler","Ein Perlenvorhang im hinteren Teil des Ladens bewegte sich und eine","39"
"Erzähler","Frau trat hervor. (Musik setzt ein) Sie war mit einem schwarzen Um-","39"
"Erzähler","hang und einer Kopfbedeckung bekleidet, die nichts, als die Augen frei","39"
"Erzähler","ließ. Peter wusste, dass viele islamische Frauen nur verschleiert in die","39"
"Erzähler","Öffentlichkeit gingen, es war normal hier. Das Augenpaar blickte Peter","39"
"Erzähler","so scharf an, dass Peter zu stottern begann.","39"
"Peter","(stotternd) Äh... äh... die... die... die... die... die Weisheit... äh... d... die","39"
"Peter","Königin der Weisheit ist die Sphinx. Wir suchen die Kammer der","39"
"Peter","Sphinx. Äh... ein, ein... B... B... Bo... Bot... Bote soll uns, a... also...","39"
"Peter","der... d... d... der soll uns da hin führen.","39"
"Erzähler","Die Augen der Frau schienen Peter zu prüfen. Dann drehte sich die","39"
"Erzähler","Araberin langsam um, trat zwischen den Vorhang und gab mit der","39"
"Erzähler","Hand ein Zeichen, dass sie folgen sollten. (Schritte) Peter und Layla","39"
"Erzähler","gingen hinterher und fanden sich plötzlich in einem engen, dunklen","39"
"Erzähler","Hof wieder, in dem ein einziges Auto geparkt war. (Musik setzt aus,","39"
"Erzähler","Schritte) Peter sah, wie die Frau die Hecktür des Wagens öffnete, und","39"
"Erzähler","eine Geste machte, dass sie einsteigen sollten. (Autotürgeräusche)","39"
"Erzähler","Der zweite Detektiv zögerte, während Layla kurzentschlossen in den","39"
"Erzähler","Wagen kletterte. Nun blieb ihm keine andere Wahl, er folgte dem Mäd-","39"
"Erzähler","chen. (eine Autotür schlägt zu) Mit einem Ruck warf die Araberin die","39"
"Erzähler","Tür zu und verschloss sie. Der Wagen wurde gestartet und setzte sich","39"
"Erzähler","in Bewegung.","39"
"REGIE","Musik","39"
"REGIE","Track 15 - Im Sendebereich","40"
"REGIE","Musik","40"
"Erzähler","Dalbello war Justus und Bob in dem Menschengewimmel des Basars","40"
"Erzähler","entwischt. (Stimmengewirr) Doch viel größere Sorgen bereitete den","40"
"Erzähler","zwei Detektiven, eine weitaus gefährlichere Tatsache.","40"
"REGIE","Geräusch des Peilsenders","40"
"Justus","(aufgeregt) Bob! Alarmstufe rot!","40"
"Bob","Was ist denn?","40"
"Justus","Der Peilsender ist angesprungen.","40"
"Bob","Hach... und wird jetzt schon leiser.","40"
"Justus","Verflixt! Peter und Layla entfernen sich mit rasanter Geschwindigkeit!","40"
"Justus","Wahrscheinlich fährt man sie schon zur geheimen Kammer. Los, Bob!","40"
"Justus","Wir müssen sofort zu unserem Taxi.","40"
"REGIE","Hektisches Atmen, schnelle Schritte, das Peilgeräusch wird leiser, die","40"
"REGIE","Jungen steigen in das Taxi, Bob hüstelt","40"
"Alaa Edine","So. So schnell Amerikaner wieder zurück?","40"
"Justus","(außer Atem) Äh, wir haben Peter und Layla aus den Augen verloren.","40"
"Justus","Wir müssen sie verfolgen!","40"
"Alaa Edine","OK. Wohin?","40"
"REGIE","das Taxi startet, Motorengeräusche","40"
"Justus","Ähm... Sie befinden sich gerade noch im Sendebereich. Ähm... schräg","40"
"Justus","nach links.","40"
"Alaa Edine","Wohin?","40"
"Justus","Ich zeige Ihnen einfach die Richtung. Wir halten den Abstand. Gut so.","40"
"Justus","Äh... ähm... Und rechts! Jetzt rechts!","40"
"Alaa Edine","OK.","40"
"Justus","Gut so.","40"
"Bob","Schnell!","40"
"Alaa Edine","Amerikaner immer schnell, schnell.","40"
"Bob","Ja.","40"
"Justus","Wir dürfen sie nicht verlieren!","40"
"REGIE","Musik","40"
"Erzähler","(das Peilgeräusch wird lauter, Motorengeräusch) Nach einigen Kilome-","41"
"Erzähler","tern zeigte das Piepen des Peilsenders an, dass Peter und Layla sich","41"
"Erzähler","nicht weiter von ihren Verfolgern entfernten. Justus und Bob wussten,","41"
"Erzähler","dass sie ihr Ziel erreicht hatten und Alaa Edine stoppte den Wagen.","41"
"REGIE","Musik und Motorengeräusch setzen aus, Peilgeräusch deutlich zu hö-","41"
"REGIE","ren","41"
"Justus","Peter und Layla müssen ganz in der Nähe sein.","41"
"Alaa Edine","Aber hier nur Felsen. Wo sein Freunde?","41"
"Bob","Wir werden sie finden. Alaa? Haben Sie eine Taschenlampe, die Sie","41"
"Bob","uns leihen können?","41"
"Alaa Edine","(kramt) Hier. Service von Alaa Edine.","41"
"Bob","Danke.","41"
"Alaa Edine","Amerikaner können Freunde suchen gehen. Ich hier warte bei Auto.","41"
"Justus","Einverstanden.","41"
"Bob","Gut.","41"
"Justus","Komm, Bob.","41"
"REGIE","die Jungen steigen aus dem Taxi aus","41"
"Alaa Edine","Viel Glück.","41"
"Bob","Danke.","41"
"Justus","Ach...","41"
"Justus","Ich schalte das Empfangsgerät jetzt besser aus.","41"
"Bob","Ja.","41"
"REGIE","Das Peilgeräusch verstummt, Wind","41"
"Bob","Hmh... Alaa hatte Recht, erster. Hier sind nur Felsen.","41"
"Justus","Hä... Und was ist das hier?","41"
"Bob","Das... Das gibt's doch nicht. In dem Stein ist ein... ist ein Stahltor.","41"
"Justus","Mhm...","41"
"Bob","Ja, zur Tarnung mit Wüstensand gespritzt. Hah... Alle Achtung.","41"
"Justus","Ich schätze, das Auto, mit dem Peter und Layla gefahren sind, steht","41"
"Justus","direkt dahinter. - Verschlossen!","41"
"Bob","Just! Guck mal da! Da vorn ist ein Lüftungsgitter. Ebenfalls mit Sand","41"
"Bob","gespritzt. Es ist von außen verschraubt.","41"
"Justus","Ja. Bob, hast du dein Taschenmesser dabei?","41"
"Bob","Ja, klar. Du meinst, ich soll hier mit dem Taschenmesser...","42"
"Justus","(fällt Bob ins Wort) Ganz genau. Wir müssen da rein, Bob. Um jeden","42"
"Justus","Preis.","42"
"Bob","OK.","42"
"REGIE","Klappern und quietschende Schraubgeräusche","42"
"Bob","Eine hätten wir schon mal...","42"
"REGIE","Musik","42"
"REGIE","Track 16 - Betäubt","43"
"REGIE","Musik","43"
"Erzähler","Als Bob sechs Schrauben gelöst hatte, ließ sich das Lüftungsgitter","43"
"Erzähler","leicht zur Seite biegen. Dahinter klaffte ein dunkles, tiefes Loch. Ein","43"
"Erzähler","Tunnel. Bob kroch als erster hinein. Dann folgte Justus. Es war ver-","43"
"Erzähler","dammt eng und es ging steil abwärts. Nach einigen Metern endete der","43"
"Erzähler","Schacht in einem Raum. Dahinter lag ein Gang. Schritt für Schritt tas-","43"
"Erzähler","teten sich die beiden vorwärts. Plötzlich endete der Gang. Neben Jus-","43"
"Erzähler","tus und Bob befand sich eine Art Fenster. Von hier blickte man in ei-","43"
"Erzähler","nen schwach beleuchteten Raum mit scheinbar alten Zeichnungen an","43"
"Erzähler","der Wand. Vor einer steinernen Sphinx in der Mitte des Raumes, de-","43"
"Erzähler","ren Augen glühend rot leuchteten, stand Dalbello und neben ihm eine","43"
"Erzähler","schwarz verhüllte Frau. Stimmen ertönten. (leise, hallende Stimmen)","43"
"Erzähler","Aber die Stimmen schienen von direkt unter ihnen zu kommen. Justus","43"
"Erzähler","begriff, dass es sich um eine Spiegelkonstruktion handeln musste,","43"
"Erzähler","durch die man beobachten konnte, was sich in dem Raum unterhalb","43"
"Erzähler","von ihnen tat. Also befanden sich die beiden Detektive über der","43"
"Erzähler","Sphinx. Die zwei Detektive sahen genauer auf das gespiegelte Bild.","43"
"Erzähler","Und ihnen stockte der Atem. Zwei Bündel, zu denen sich Dalbello und","43"
"Erzähler","die verhüllte Frau bückten, waren unverkennbar Peter und Layla. Sie","43"
"Erzähler","waren offensichtlich bewusstlos.","43"
"Mr. Abazza","Wir brauchen den Text! Durchsuchen wir sie!","43"
"Justus","(leise) Wie kommen wir da runter?","43"
"Dick Vincent","Hast du was?","43"
"Mr. Abazza","Nichts! Hach... weitersuchen!","43"
"Bob","(leise) Wir müssen sie aufhalten.","43"
"Justus","(leise) Ja.","43"
"Dick Vincent","Wo hat der verfluchte Junge das Heft versteckt? Egal! Schleppen wir","43"
"Dick Vincent","sie in den Wagen!","43"
"Justus","(mit fester im Raum hallender Stimme) Mr. Dalbello! Was haben Sie","43"
"Justus","mit Peter und Layla gemacht?","43"
"Dick Vincent","Das ist dieser Junge! Wie kommst du hier rein? Und wo bist du?","43"
"Justus","Das tut jetzt nichts zur Sache!","43"
"Dick Vincent","Wo ist der vierte von euch?","43"
"Justus","Der wartet draußen. Was haben Sie mit Peter und Layla gemacht?","43"
"Dick Vincent","Sie waren zu neugierig. Also habe ich sie mit Betäubungsspray außer","43"
"Dick Vincent","Gefecht gesetzt.","43"
"Mr. Abazza","Und dich bekommen wir auch noch! Du bist der Nächste!","43"
"Justus","Guten Abend, Mr. Abazza!","43"
"Mr. Abazza","Hä...?","44"
"Justus","Sie stecken doch unter dem Schleier, nicht wahr? Ich erkenne Ihre","44"
"Justus","Stimme wieder. Einen Mitarbeiter aus dem Museum kann man natür-","44"
"Justus","lich gut gebrauchen, wenn man fanatische Schatzsucher auf eine fal-","44"
"Justus","sche Fährte setzten will. Es gab nie einen Leonard Dempsey. Zumin-","44"
"Justus","dest hat er nie einen Brief an Cathrin geschrieben. Sie haben alles","44"
"Justus","sehr geschickt erfunden, um Ihre Opfer glauben zu lassen, sie seien","44"
"Justus","auf der Fährte eines Schatzes. Aber dann erschienen wir, die drei Fra-","44"
"Justus","gezeichen mit Rubbish Georges Rätselbrief in den Händen um seine","44"
"Justus","Geschichte aufzuklären. Hmh - Das wurde gefährlich für Sie. Sie fä-","44"
"Justus","delten uns trickreich in das Rätsel ein. Nicht etwa, um uns Geld abzu-","44"
"Justus","nehmen, sondern um uns kalt zu stellen und an das Beweisstück zu","44"
"Justus","gelangen. Die Rätselgeschichte...","44"
"Dick Vincent","(lacht) Und? Wie weit bist du mit der Aufklärung hä?","44"
"Justus","Ich bin am Ende, Mr. Frank Dalbello, alias Mr. Dick Vincent! Sie sind","44"
"Justus","der neue Freund von Laylas Mutter und dürften auch Rubbish George","44"
"Justus","in die Falle gelockt haben. Pech für Sie, dass ich Sie auf einem Foto","44"
"Justus","erkannt habe, das Layla uns gezeigt hat, auch wenn die darauf keinen","44"
"Justus","Vollbart tragen.","44"
"Mr. Abazza","Ah, jetzt weiß ich, wo der Junge steckt. Dort oben im Maul der Sphinx.","44"
"Mr. Abazza","Der entkommt uns nicht!","44"
"Bob","(leise und energisch) Just! Just! Hier ist ein Knopf mit einem Toten-","44"
"Bob","kopf. KO.-Spray. Aha. Damit aktiviert man ein Betäubungsspray. Wir","44"
"Bob","müssen Vincent und Abazza ausschalten. Pass auf. Halt die Luft an.","44"
"Bob","Ich drücke. Auf drei. Eins... zwei... drei!","44"
"REGIE","Justus und Bob atmen tief ein, halten die Luft an, ein Zischen ertönt","44"
"Mr. Abazza","(hustend) Der dicke hat den Knopf gedrückt! Halte dir dein T-Shirt vors","44"
"Mr. Abazza","Gesicht!","44"
"REGIE","Musik, Dick Vincent und Mr. Abazza röcheln","44"
"Justus","(hustend) Raus hier Bob!","44"
"Bob","(hustend) Ja!","44"
"Justus","Schnell! Wir müssen die Polizei verständigen! Peter und Layla sind in","44"
"Justus","größter Gefahr!","44"
"Bob","Verstanden! Los, komm!","44"
"Erzähler","Als Justus und Bob sich aus dem Lüftungsschacht nach draußen quäl-","44"
"Erzähler","ten, kamen ihnen ein Dutzend Polizisten entgegen gelaufen. Innerhalb","44"
"Erzähler","von Sekunden brachen sie das schwere Stahltor auf, und stürmten das","44"
"Erzähler","geheime Quartier. Minuten später wurden Peter und Layla ins Freie","44"
"Erzähler","getragen. (hektische Schritte) Mr. Abazza und Mr. Vincent wurden in","44"
"Erzähler","Handschellen abgeführt.","44"
"Bob","Kann mir einer mal erklären, äh... wie die Polizei hier plötzlich her","44"
"Bob","kommt?","44"
"Alaa Edine","Meine Amerikaners!","45"
"Justus","Alaa Edine!","45"
"Bob","Ah...","45"
"Alaa Edine","Ich Kommissar gerufen.","45"
"Bob","Ha...","45"
"Alaa Edine","Er seit Monaten jagen Männer, die Schatzsucher überfallen.","45"
"Justus","Ach...","45"
"Alaa Edine","Ich gesehen, dass ihr auf heiße Spur seid. Nicht wahr, Kommissar?","45"
"Kommissar","So ist es. Alaa Edine hat uns den Hinweis gegeben.","45"
"Justus","Ich glaube, wir können Ihre Ermittlungen zu einem entgültigen Ab-","45"
"Justus","schluss bringen. Darf ich ein wenig spekulieren? Sie erhielten immer","45"
"Justus","wieder Hinweise von Menschen, die glaubten, einem großen Geheim-","45"
"Justus","nis und einem lohnenden Schatz auf der Spur zu sein. Mit einer Rät-","45"
"Justus","selgeschichte wurden sie auf die Fährte gesetzt. Vermutlich mussten","45"
"Justus","die Opfer dem Boten, der sie in die Schatzkammer fahren sollte, eine","45"
"Justus","hohe Geldsumme zahlen. Die Opfer wurden in diese auf alt getrimmte","45"
"Justus","Höhle gebracht, dort betäubt, ihnen wurde das Geld abgenommen und","45"
"Justus","dann wurden sie irgendwo in Kairo wieder auf die Straße gesetzt. Und","45"
"Justus","keins der Opfer wusste, wo diese angebliche Schatzkammer war, weil","45"
"Justus","sie in dem geschlossenen Lieferwagen hinterher hier hergebracht","45"
"Justus","worden waren. Daher hatten Sie für Ihre Polizeiarbeit keinen Anhalts-","45"
"Justus","punkt. Denn auch die jeweilige Rätselgeschichte, der einzige halbwegs","45"
"Justus","vernünftige Beweis, wurde den Opfern abgenommen und schätzungs-","45"
"Justus","weise immer wieder verändert.","45"
"Kommissar","Ich habe zwar nichts verstanden, aber bestimmt hast du Recht. Ameri-","45"
"Kommissar","kaner wollen immer Recht haben.","45"
"Justus","(beschwichtigend) Das nicht, Kommissar, aber diesmal...","45"
"Bob","(flüsternd) Manchmal...","45"
"REGIE","Alaa Edine lacht","45"
"REGIE","Musik","45"
"REGIE","Track 17 - Letzte Fragen","46"
"REGIE","Musikwechsel","46"
"Erzähler","Die drei Detektive flogen zurück in die USA. Layla und ihre Mutter, die","46"
