"Speaker","Text","Page"
"Erzähler","sich mit Rubbish George versöhnen wollten, begleiteten sie. Als sie","46"
"Erzähler","zwei Tage später in Los Angeles landeten, überraschte sie Onkel Titus","46"
"Erzähler","mit der Mitteilung, dass Rubbish George längst wieder in seiner Hütte","46"
"Erzähler","hauste. Als die fünf ihn besuchten, hatte der Stadtstreicher eine Kanne","46"
"Erzähler","ägyptischen Tee gekocht und lud seine Besucher ein, sich zu ihm vor","46"
"Erzähler","die Hütte in die Sonne zu setzen. Dann berichteten sie, was sie in Kai-","46"
"Erzähler","ro alles herausgefunden hatten.","46"
"REGIE","Geschirr klimpert","46"
"Rubbish George","Da bin ich ja prächtig reingelegt worden. Wenn ich geahnt hätte, dass","46"
"Rubbish George","Dick und Abazza hinter all dem steckten.","46"
"Bob","Ja. Die beiden haben einen militärischen Bunker zu diesem alten Grab","46"
"Bob","umgebaut. Seit Jahren setzten sie durch die Rätselgeschichte immer","46"
"Bob","wieder reiche Leute auf die Schatzsuche an. Nja, von Station zu Stati-","46"
"Bob","on verloren die Opfer ihre Zweifel, na wenn sie denn überhaupt welche","46"
"Bob","hatten. Ja und nebenbei konnten die Gangster prüfen, ob ihnen die","46"
"Bob","Kandidaten so richtig auf den Leim gingen.","46"
"Peter","Hm...","46"
"Justus","Ja.","46"
"Peter","Die Opfer mussten eine hohe Summe zahlen, damit sie der Bote zu","46"
"Peter","der angeblichen Grabanlage brachte. Dort bekamen sie das K.O.-","46"
"Peter","Spräy verabreicht und ihnen wurde das Geld abgenommen.","46"
"Justus","Tja...","46"
"Bob","Ja, und George, du hattest das Pech, das Geld vorher bei der Bank","46"
"Bob","illegal besorgt zu haben. Ausgerechnet mit Hilfe von Dick, der dich","46"
"Bob","dann später hat auffliegen lassen.","46"
"Rubbish George","Der Kerl hat mir die Kohle bereits im Lieferwagen abgenommen. Die","46"
"Rubbish George","Anlage bekam ich gar nicht zu Gesicht.","46"
"Aisha","Hach... Oh, George, hätte ich das gewusst?","46"
"Layla","Und danach bist du aus Ägypten verschwunden.","46"
"Rubbish George","Tja, ich wurde wegen Unterschlagung des Geldes gesucht und hatte","46"
"Rubbish George","nichts in der Hand.","46"
"Justus","Ja. Wir haben den Fall gelöst, weil wir wissen wollten, wer deine Hütte","46"
"Justus","verwüstet hat und was mit dir geschehen war.","46"
"Rubbish George","Für, für das Durcheinander bin ich selbst verantwortlich. Das habe ich","46"
"Rubbish George","eingefädelt.","46"
"Layla","Aber warum?","46"
"Rubbish George","Ich hatte mit Ägypten abgeschlossen. Dann sagte mir plötzlich jemand","47"
"Rubbish George","von der Verwaltung von Rocky Beach, dass eine gewisse Layla nach","47"
"Rubbish George","mir gefragt hätte und nach mir suchte. Ich wusste, du würdest keine","47"
"Rubbish George","Ruhe geben, Layla. Und wenn ich dich schon nicht davon abhalten","47"
"Rubbish George","konnte, dich für meine Vergangenheit zu interessieren, dann solltest","47"
"Rubbish George","du das wenigstens nicht alleine tun. Ich sagte dem Mann von der Ver-","47"
"Rubbish George","waltung eine Uhrzeit, wann du mich antreffen würdest, und Peter be-","47"
"Rubbish George","stellte ich zur selben Zeit hier her.","47"
"Peter","Ha, dann wolltest du also, dass wir uns hier begegnen?","47"
"Rubbish George","So ist es. Ich fürchtete, ohne die Unterstützung der besten Detektive","47"
"Rubbish George","Kaliforniens...","47"
"Justus","Ach, na ja...","47"
"Rubbish George","...würde Layla das Rätsel nicht lösen können. Zumal ich mir selbst","47"
"Rubbish George","nicht erklären konnte, was damals passiert war. Ich mag Layla zu sehr,","47"
"Rubbish George","als dass ich hätte zulassen können, sich alleine in solch ein Abenteuer","47"
"Rubbish George","zu stürzen.","47"
"Aisha","Danke, George. Das vergesse ich dir nie.","47"
"Peter","Und wer hat mir in der Hütte eins auf die Mütze gegeben?","47"
"Rubbish George","Smashing Joe. Ein alter Kumpel von mir. Kostete mich eine Dose Bier.","47"
"Rubbish George","Man lebt ja hier schließlich auf kleinem Fuß.","47"
"REGIE","Gelächter","47"
"REGIE","Titelmusik","47"
