"Speaker","Text","Page","speaker_id"
"Lloyd Scavenger","Natürlich, ja! Ach, wie ist das furchtbar, wie ist das schrecklich. I... i... ich kann","31","970"
"Lloyd Scavenger","mich gar nicht beruhigen. (alle Reden und Murmeln durcheinander)","31","970"
"REGIE","Zwischenmusik","31","0"
"Erzähler","Als das Boot im Hafen anlegte gingen sie gemeinsam zum Parkplatz, wo sich","31","574"
"Erzähler","Scavenger niedergedrückt verabschiedete. (Abschiedsformeln aller Beteiligten)","31","574"
"Erzähler","Dann wandte er sich um und ging zu seinem Auto. (Schritte)","31","574"
"Justus","Ach, äh, Mister Scavenger!","31","2"
"Lloyd Scavenger","Ja?","31","970"
"Justus","Wenn sie noch eine Minute Zeit hätten kann ich ihr Bild vielleicht","31","2"
"Justus","wiederbeschaffen.","31","2"
"Lloyd Scavenger","A... du kannst was?","31","970"
"Officer Wood","Wie meinst du das Junge?","32","978"
"Justus","Ähm, ich denke ich weiß wo Mister Scavengers Bild ist Officer. Und ich ahne","32","2"
"Justus","auch wer es gestohlen hat.","32","2"
"Lloyd Scavenger","Nei... (lacht) und, äh, wer war es?","32","970"
"Justus","Langsam! Eins nach dem anderen. Das erste was mich stutzig gemacht hat war","32","2"
"Justus","ihre Aussage Mister Scavenger, dass ihre Begegnung mit dem Geist vielleicht","32","2"
"Justus","wieder nur so ein Spukeffekt gewesen sei.","32","2"
"Lloyd Scavenger","Wieso?","32","970"
"Justus","Wieder, wohlgemerkt. Der einzige Effekt, der vorher stattgefunden hatte war der","32","2"
"Justus","Schrei, den Mister Lowell mit seinem Schlüssel beim Eintritt ins Haus","32","2"
"Justus","hervorgerufen hat.","32","2"
"Bob","Genau!","32","4"
"Justus","Wenn ich mich recht erinnere hat sie im Gegensatz zu allen anderen der Schrei","32","2"
"Justus","in keinster Weise erschreckt. Das sie diese kleine Einlage kannten weist nun","32","2"
"Justus","aber für mich darauf hin, dass sie schon einmal an einem der Spiele","32","2"
"Justus","teilgenommen haben. (Nebelhorn; Vogelgezwitscher) Liege ich da richtig?","32","2"
"Lloyd Scavenger","Ja, das... das stimmt. Worauf willst du hinaus?","32","970"
"Justus","Einen Moment noch! Dann diese Karteikarte über ihren Vorfahren. Ein Mord in","32","2"
"Justus","New Mexico, wo die amerikanischen Pokermeisterschaften ausgetragen","32","2"
"Justus","wurden und ihr Vorfahre kam dann ins Bundesgefängnis. Das alles","32","2"
"Justus","achtzehnhundertdreiundneunzig. Hm! Nur damals gehörte New Mexico noch","32","2"
"Justus","gar nicht zu den USA Mister Scavenger. Das war doch erst ab","32","2"
"Justus","neunzehnhundertzwölf der Fall. Demnach konnte der Mann also in kein","32","2"
"Justus","Bundesgefängnis eingeliefert werden und die amerikanischen","32","2"
"Justus","Pokermeisterschaften hätte man da wahrscheinlich auch nicht ausgetragen.","32","2"
"Officer Wood","Nun, jetzt komm mal zur Sache!","32","978"
"Bob","Ihr Auto, ja? Gestern Abend parkten sie so, dass ich nicht mehr in meinen Käfer","32","4"
"Bob","hätte einsteigen können. Das war da drüben, ja? Jetzt aber steht der Wagen","32","4"
"Bob","dort.","32","4"
"Justus","Genau! Schließlich noch etwas sehr skurriles möchte ich sagen. Der","32","2"
"Justus","Geheimgang, den Bob und ich entdeckt haben, endet bekanntlich in dem","32","2"
"Justus","Pavillon. Und, äh, wenn sie sich nun bitte mal auf den Kopf fassen Mister","32","2"
"Justus","Scavenger,...","32","2"
"Lloyd Scavenger","Wie bitte?","32","970"
"Justus","...äh, ziemlich genau auf den Wirbel, dann werden sie feststellen, dass sich","32","2"
"Justus","genau dort oben ein Klecks Vogelkot befindet, den ich bemerkt habe bevor wir","32","2"
"Justus","das Haus verließen. (Lloyd Scavenger angeekelter Laut) Da im Marriott-Haus","32","2"
"Justus","keine Vögel herumfliegen kann das nur heißen, dass sie in der Nacht in dem","32","2"
"Justus","Pavillon waren, wo ihnen ein Huhn - entschuldigen sie meine deutlichen Worte","32","2"
"Justus","- auf den Kopf gekackt hat.","32","2"
"Officer Wood","(lachend) Jawohl! (Bob und Peter lachen; Möwen kreischen)","32","978"
"Justus","Mister Scavenger! Sie haben heute Nacht das Marriott-Haus verlassen und ich","33","2"
"Justus","glaube auch zu wissen wieso.","33","2"
"Lloyd Scavenger","Das ist doch Blödsinn, absoluter Blödsinn!","33","970"
"Peter","Aber... aber wir haben ihn doch gehört Justus, die ganze Zeit über.","33","3"
"Justus","Alles was wir gehört haben kam aus diesen Teilen hier. CD-Player, externer","33","2"
"Justus","Lautsprecher, Fernsteuerungsrelais, gefunden im ersten Stock hinter der","33","2"
"Justus","Holzverkleidung. Mit diesen technischen Tricks hat er uns durchs Haus gehetzt","33","2"
"Justus","und uns glauben lassen er wäre die ganze Zeit anwesend.","33","2"
"Peter","Das gibt's nicht!","33","3"
"Bob","Das is' ja 'n Ding!","33","4"
"Lloyd Scavenger","Und warum bitte sollte ich das Haus verlassen haben?","33","970"
"Justus","Um ihr eigenes Bild zu stehlen und die Versicherung zu betrügen. Als sie das","33","2"
"Justus","erste Mal an dem Krimi-Spiel teilgenommen hatten entdeckten sie zufällig den","33","2"
"Justus","Geheimgang zum Pavillon. Und von der Zeit an reifte ihr Plan.","33","2"
"Lloyd Scavenger","Junge, du fantasierst.","33","970"
"Justus","Nicht doch! Sie sind so oft unbemerkt über den Geheimgang ins Haus","33","2"
"Justus","eingedrungen bis sie sich gut genug darin auskannten. Kurz vor unserem Spiel","33","2"
"Justus","haben sie an geeigneten Orten ihre diversen Abspielgeräte versteckt, und","33","2"
"Justus","obendrein die leider fehlerhaften Karteikarten im Archiv deponiert. Sie nahmen","33","2"
"Justus","Bob das Handy ab,...","33","2"
"Bob","Hm!","33","4"
"Justus","...verklebten das Schloss,...","33","2"
"Peter","He!","33","3"
"Justus","...hinterließen hier und da ein paar Blutspuren und verschwanden schließlich","33","2"
"Justus","spektakulär.","33","2"
"Lloyd Scavenger","Ist doch lachhaft! Also wirklich!","33","970"
"Officer Wood","Soso!","33","978"
"Justus","Nach einer bühnenreifen Showeinlage in der Küche unter dem Bodenfenster","33","2"
"Justus","stahlen sie sich über den Geheimgang aus dem Haus. Sie ruderten über den","33","2"
"Justus","See, fuhren zu ihrem Haus und entwendeten ihr eigenes Bild. Beim Verlassen","33","2"
"Justus","ihres Hauses lösten sie noch die Alarmanlage aus damit der Diebstahl genau","33","2"
"Justus","zu dem Zeitpunkt stattfand, für den sie dachten ein Alibi zu haben.","33","2"
"Justus","Anschließend fuhren sie zurück zum Marriott-Haus.","33","2"
"Peter","Justus!","33","3"
"Lloyd Scavenger","Sei froh, dass du noch minderjährig bist sonst würde ich dich wegen","33","970"
"Lloyd Scavenger","Verleumdung verklagen bis dir die... die... die Socken qualmen.","33","970"
"Bob","Moment mal!","33","4"
"Justus","Sicher! Öffnen sie doch mal den Kofferraum von Mister Scavengers Wagen","34","2"
"Justus","Officer. Ich gehe jede Wette ein, dass der Tobrero da drin versteckt ist.","34","2"
"Officer Wood","Geben sie mir die Wagenschlüssel Mister Scavenger.","34","978"
"Lloyd Scavenger","Ne..., i... i... ich mach das schon. (Schritte; Kofferraum wird aufgeschlossen","34","970"
"Lloyd Scavenger","und geöffnet) Leer! Da drin ist nichts.","34","970"
"Justus","Äh, darf ich mal? (Kramgeräusche; staunende Laute der Beteiligten) Meine","34","2"
"Justus","Herren! Was haben wir denn hier unter der Bodenverkleidung? (angestrengte","34","2"
"Justus","Laute) Bitte sehr! (Peter entdeckender Laut)","34","2"
"Bob","Der Tobrero!","34","4"
"Officer Wood","Nicht zu fassen!","34","978"
"Bob","Just! (lacht) Du hattest mal wieder in allen Punkten recht.","34","4"
"Justus","Ihr habt doch wohl nichts anderes erwartet, oder?","34","2"
"Peter","Äh, eigentlich nicht.","34","3"
"Bob","Nein! (Musik setzt ein)","34","4"
"Peter","Aber es wäre zumindest mal was Neues gewesen. (Alle drei lachen)","34","3"
"REGIE","Abschlussmusik","34","0"
