"Speaker","Text","Page"
"Mr. Chester","Wie ich sehe, sind es fünf oder sechs. Es käme allerdings auch darauf","32"
"Mr. Chester","an, wie es mit der Standfestigkeit und eventuellen Unebenheiten aus-","32"
"Mr. Chester","sieht. Also der gesamte statische Bereich.","32"
"Mr. Chester","res zu berücksichtigen.","32"
"Mr. Chester","Und unter den gegebenen Umständen und bei dieser Größenordnung","32"
"Mr. Chester","würde ich Ihnen den Peak Drifter empfehlen.","32"
"Felicity","Ah.","32"
"Bob","[leise] Peak Drifter? Was ist das denn?","32"
"Justus","[leise und bestimmt] Still, Bob!","32"
"Mr. Chester","Der passt sowohl vom Leistungsniveau, als auch vom Format her ge-","32"
"Mr. Chester","nau in Ihr Schema. Allerdings müsste ich dafür erst die Hydraulik und","32"
"Mr. Chester","das Equipment prüfen.","32"
"Felicity","[vergnügt] Perfekt!","32"
"Skinny Norris","Was schätzen Sie denn, wann wir ihn abholen können?","32"
"Mr. Chester","Nun, ich denke gegen halb sechs müsste ich ihn auf Vordermann ge-","32"
"Mr. Chester","bracht haben.","32"
"REGIE","[Bob schreckt auf, Musik setzt ein]","32"
"Bob","Just! Ich glaube, da hinten bei dem Bagger da hat sich gerade was","32"
"Bob","bewegt!","32"
"Justus","Wo denn?","32"
"Justus","Das sind Revolver!","32"
"Bob","Er kommt direkt auf uns zu!","32"
"Bob","- 32 -","32"
"Bob","Los, weg hier!","33"
"Justus","Ja!","33"
"Riese","Churchill – Fass!","33"
"REGIE","[hastige Schritte]","33"
"REGIE","[ein Auto rast heran]","33"
"Justus","Ein Auto!","33"
"Bob","Das ist Peter!","33"
"Justus","Ja!","33"
"Bob","Oh!","33"
"Justus","Schnell rein!","33"
"Peter","Kommt rein! Los!","33"
"REGIE","[Bob und Justus stammeln hastig durcheinander, Peter lässt den Mo-","33"
"REGIE","tor an]","33"
"Justus","Danke, Peter! Das war knapp.","33"
"Peter","Ich hab den Cowboy gesehen und bin sofort in meinen Wagen ge-","33"
"Peter","sprungen.","33"
"Bob","Spitzenreaktion, zweiter!","33"
"Peter","Da könnt ihr mal sehen, wie gut es ist, wenn jemand den Rückweg","33"
"Peter","sichert.","33"
"REGIE","[Musik]","33"
"REGIE","- 33 -","33"
"REGIE","Track 10 – Im Zeichen der Schlangen","34"
"REGIE","[Musikwechsel, die Jungen betreten die Zentrale, Schrottplatzgeräu-","34"
"REGIE","sche im Hintergrund, Blacky krächzt hin und wieder]","34"
"Bob","Freunde, es gibt Neuigkeiten.","34"
"Justus","Dann lass mal hören, Bob.","34"
"Bob","Also, ich hab mir heute beim Frühstück den Wälzer meines Vaters","34"
"Bob","vorgenommen und da bin ich tatsächlich fündig geworden.","34"
"Justus","Ach ja? Etwas neues über die Schießerei in Tombstone?","34"
"Bob","Haha, viel besser! Ich hab herausgefunden, welchem mysteriösen","34"
"Bob","Stern unser Riese hinterher jagt.","34"
"Peter","Ach!","34"
"Bob","Ja. Zunächst mal gab es nach der Schießerei mehrere Gerichtsver-","34"
"Bob","handlungen. Ein kleines Detail ist dabei besonders beachtenswert.","34"
"Bob","Ja doch. Also. Im Verlauf der Verhandlungen wurde von einem der","34"
"Bob","befragten Zeugen ein merkwürdiger Vorwurf erhoben.","34"
"Justus","Ja?","34"
"Bob","Wyatt Earp soll sich nach der Schießerei wiederrechtlich einen Ge-","34"
"Bob","genstand aus dem Besitz des toten Frank McLaury angeeignet haben.","34"
"Bob","Und zwar ein Amulett aus massivem Gold, dass McLaury an einem","34"
"Bob","Lederband um den Hals getragen haben soll.","34"
"Peter","Aha.","34"
"Justus","Lass mich raten. Dieses Amulett hatte nicht zufällig die Form eines","34"
"Justus","Sterns?","34"
"Bob","Mhm, voll ins schwarze getroffen, Chef. Genauer gesagt, ein Stern,","34"
"Bob","der aus mehreren kunstvoll gearbeiteten Schlangen bestand, die im","34"
"Bob","Zentrum ineinander verschlungen waren. Laut eines Zeitungsartikels","34"
"Bob","soll dieser Schlangenstern im sechzehnten Jahrhundert aus der Peru-","34"
"Bob","anischen Inkastadt Cajas geraubt worden sein.","34"
"Peter","Sagenhaft.","34"
"Justus","Ja.","34"
"Peter","Meine Güte, ’n so altes Inkaamulett ist heute sicher einiges wert.","34"
"Bob","Na, vermutlich auch damals schon, Peter. Obwohl Earp nichts nach-","34"
"Bob","gewiesen werden konnte, blieb der Schlangenstern verschwunden und","34"
"Bob","ist wohl nie wieder aufgetaucht.","34"
"Bob","- 34 -","34"
"Peter","Und hinter diesem Stern ist nun der Riese her.","35"
"Peter","sind, ist euch nicht aufgefallen, wie groß auch der bewaffnete Cowboy","35"
"Peter","gestern Nacht war?","35"
"Peter","Wie, du meinst, es könnte unser Auftraggeber, Mr. McLaury gewesen","35"
"Peter","sein?","35"
"Bob","Na ja, schon möglich. Vielleicht wollte er uns damit unmissverständlich","35"
"Bob","klar machen, dass wir gefälligst nur an seinem Fall arbeiten sollen.","35"
"Justus","Na ja, noch fehlt uns aber ein neuer Hinweis für unsere nächste Etap-","35"
"Justus","pe. Auf jeden Fall sehr gute Arbeit, Bob.","35"
"Bob","Danke. Wir dürfen aber nicht vergessen, dass wir auch mit Skinny","35"
"Bob","noch was offen haben.","35"
"Justus","Ja.","35"
"Bob","Dieses nächtliche Treffen bei Chester & Company, das hörte sich ja","35"
"Bob","sehr verdächtig an.","35"
"Peter","Da fällt mir übrigens noch was ein. Ähm, nach der Fluchtaktion gestern","35"
"Peter","hatte ich das ganz verschwitzt, aber als ihr zum Büro geschlichen","35"
"Bob","Ja?","35"
"Justus","Und?","35"
"Peter","Auf dem Beifahrersitz lag ein gefalteter Prospekt. Viel konnte ich nicht","35"
"Peter","erkennen, aber die Überschrift lautete „Green Cabinett“. Darauf war","35"
"Peter","mit Kugelschreiber eine Uhrzeit notiert – 0:30 Uhr.","35"
"Bob","Warte mal, Green Cabinett? Irgendwie sagt mir das was.","35"
"REGIE","[das Telefon klingelt]","35"
"Justus","Moment.","35"
"Peter","Ich schalte den Verstärker ein.","35"
"Justus","Hier Justus Jonas von den drei Detektiven.","35"
"Sheila","Masters: [durchs Telefon] Hi Justus, Sheila hier.","35"
"Justus","Sheila. Schön, dass du anrufst. Darf man fragen, wie euer Treffen ver-","35"
"Justus","laufen ist?","35"
"Justus","merkwürdige Momente.","35"
"Justus","- 35 -","35"
"Justus","Ach ja? Inwiefern denn?","36"
"Sheila","Masters: Am Anfang war alles noch ganz normal. Seanford war witzig und ga-","36"
"Sheila","lant, wie immer. Aber dann verlagerte sich das Gespräch komplett auf","36"
"Sheila","die Galerie von Mr. Mitchum und unsere aktuelle Ausstellung.","36"
"Justus","Aha, und was ist das für eine Ausstellung?","36"
"Sheila","Masters: Eine Werkschau über Objektkunst der Moderne. Eine wirklich tolle","36"
"Sheila","Ausstellung mit vielen Museumsleihgaben aus ganz Amerika, zum","36"
"Sheila","Beispiel Werke von Louise Nevelson und Edward Kienholz.","36"
"Justus","Und dieses plötzliche Interesse von Seanford hat dich überrascht?","36"
"Sheila","Masters: Na ja, es freut mich natürlich, dass er sich für meine Arbeit interessiert,","36"
"Sheila","er war nur von dem Thema gar nicht mehr wegzukriegen.","36"
"Justus","Vielleicht will sich Seanford ja einfach mehr in deine Arbeitswelt ein-","36"
"Justus","fühlen, Sheila. Ich bin sicher, das klärt sich alles beim nächsten Mal.","36"
"Sheila","Masters: Unser nächstes Treffen ist aber frühestens Anfang kommender Wo-","36"
"Sheila","che. Übers Wochenende hat er nämlich mit FunDango bei einer gro-","36"
"Sheila","ßen Veranstaltung zu tun. Mit seiner Agentur scheint es wirklich gut zu","36"
"Sheila","laufen.","36"
"Bob","[flüsternd] Hach, dieser verlogene Mistkerl!","36"
"Justus","Ja, also, da kann man ja nur gratulieren. Dann erst mal vielen Dank für","36"
"Justus","den Anruf. Wir melden uns, sobald es etwas neues gibt.","36"
"Sheila","Masters: Alles klar. Bis dann!","36"
"Justus","Ja. Bis dann.","36"
"REGIE","[Justus legt auf]","36"
"Bob","[verärgert] Das ist ja wohl das aller letzte! Dieser Lügenbaron will in die","36"
"Bob","Ausstellung bei Mitchum & Ferguson einbrechen, nur darum ging es","36"
"Bob","die ganze Zeit.","36"
"Justus","Mhm. Es sieht tatsächlich so aus.","36"
"Bob","Moment mal. Moment mal, jetzt fällt mir auch wieder ein, woher ich","36"
"Bob","den Namen „Green Cabinett“ kenne. Natürlich aus der Zeitung.","36"
"Justus","Ja?","36"
"Bob","Lass mich mal an den Rechner, Just.","36"
"Justus","Ja.","36"
"Bob","Die Ausstellung läuft ja noch. [gibt etwas in den Rechner ein] Da","36"
"Peter","Was denn?","36"
"Peter","- 36 -","36"
"Bob","Moment mal, Moment mal… So, da hab ich’s. Mitchum & Ferguson","37"
"Bob","Galerie der Moderne, so.","37"
"Justus","Ja?","37"
"Justus","um eine Spezialvitrine aus Panzerglas, in der die kostbarsten Ausstel-","37"
"Justus","lungsstücke mit einem Versicherungswert von über zwei Millionen Dol-","37"
"Justus","lar präsentiert werden. Die Sicherheitsvorkehrungen in der Galerie","37"
"Justus","entsprechen jedenfalls den höchsten Qualitätsstandards, allein um den","37"
"Justus","Ausstellungsraum im zweiten Stock zu erreichen, müssen mehrere","37"
"Justus","Sicherheitsschleusen passiert werden.","37"
"Peter","Na, also, ich traue Skinny ja einiges zu, aber das ja wohl ne Nummer","37"
"Peter","zu groß für ihn, oder? In diesen Laden käme er doch niemals rein.","37"
"Bob","[fällt Justus ins Wort] Wartet mal, wartet mal! [gibt etwas in den Rech-","37"
"REGIE","ner ein]","37"
"Peter","Wonach suchst du denn jetzt?","37"
"Bob","Ja, nach dem Begriff, den Mr. Chester gestern Nacht erwähnt hat,","37"
"Bob","„Peak Drifter“.","37"
"Justus","Erstklassiges Gedächtnis, Bob.","37"
"Justus","Und?","37"
"Bob","Bingo! [liest] Das gibt’s ja gar nicht, haltet euch fest, Freunde!","37"
"Justus","Sag schon!","37"
"Peter","Was denn?","37"
"Bob","Skinny Norris fährt wirklich schweres Geschütz auf! Na, laut dieser","37"
"Bob","Infoseite über Bau- und Spezialfahrzeuge handelt es sich beim „Peak","37"
"Bob","Drifter“ um einen Installateurtruck mit hydraulischer Hebebühne für Ar-","37"
"Bob","beiten an Leitungsmasten.","37"
"Peter","[flüstert geschockt] Das gibt’s doch nicht.","37"
"Justus","Das nenne ich wirklich kaltschnäuzig. Skinny hat gar nicht vor, all die","37"
"Justus","Sicherheitsbereiche im Inneren des Gebäudes zu überwinden. Er will","37"
"Justus","durch die Fensterfront im zweiten Stock einbrechen.","37"
"Bob","Ja, ja.","37"
"Bob","Monica.","37"
"Bob","Und er war ja auch ganz wild darauf, dass wir bis Samstag den Mund","37"
"Bob","halten.","37"
"Bob","- 37 -","37"
"Justus","Daraus schließe ich, dass der Beutezug für heute geplant ist. Und","38"
"Justus","zwar punkt halb eins.","38"
"Peter","Und wie kommst du darauf?","38"
"Justus","Denk mal an die Uhrzeit, die auf dem Prospekt notiert war.","38"
"REGIE","[Bob schreckt auf]","38"
"Peter","0:30 Uhr, ich verstehe.","38"
"Justus","Nach dem derzeitigen Kenntnisstand ist das zumindest die logischste","38"
"Justus","Hypothese. Zusammengefasst bedeutet das, heute um halb sechs","38"
"Justus","Abholen des Trucks. Sieben Stunden später Einbruch in der Galerie.","38"
"Bob","Unglaublich.","38"
"Justus","Die Dimension dieses Plans ist in der Tat beachtlich. Ja, allerdings","38"
"Justus","wissen wir nicht, wer in dieser Sache noch mit drin steckt. Momentan","38"
"Justus","Und um solch eine heiße Ware abzusetzen, braucht Skinny dazu noch","38"
"Justus","die entsprechenden Kontakte. Deshalb wird er wohl bereits einen oder","38"
"Justus","mehrere private Auftraggeber in Wartestellung haben.","38"
"Peter","Lass mich raten. Um all das herauszufinden willst du dich heute Nacht","38"
"Peter","auf die Lauer legen und Skinny auf frischer Tat ertappen.","38"
"Bob","Und was ist mit Sheila?","38"
"Justus","Die klären wir erst am Samstag auf, wenn alles vorbei ist.","38"
"Bob","Hä?","38"
"Peter","Also, vielleicht sehe ich ja Gespenster, aber der Riese hat uns doch","38"
"Peter","auch eine Frist bis Samstag gesetzt. Ein merkwürdiger Zufall, findet ihr","38"
"Peter","nicht?","38"
"Justus","Oder alles andere als ein Zufall. Mensch, Peter. Ich glaube, du bist","38"
"Justus","tatsächlich auf der richtigen Spur.","38"
"Justus","Erinnern wir uns. McLaury tauchte so ziemlich zum selben Zeitpunkt","38"
"Justus","auf, als die ganze Skinny-Geschichte ins Rollen kam.","38"
"Bob","Ja.","38"
"Bob","- 38 -","38"
"Bob","schachtel.","39"
"Bob","Die Streichholzschachtel? Wie du willst.","39"
"Justus","Mach schon!","39"
"Bob","Ja, hier. Aber die Schachtel haben wir doch schon gründlich unter-","39"
"Bob","sucht, da war nichts.","39"
"Justus","[raschelt mit der Streichholzschachtel] Wenn meine Theorie stimmt,","39"
"Justus","muss da aber etwas sein.","39"
"Peter","Na, sag uns doch erst mal, wie deine Theorie überhaupt aussieht.","39"
"Bob","Ja.","39"
"Justus","Wir sind bis jetzt davon ausgegangen, dass dieser Riese tatsächlich","39"
"Justus","ein Uraltes Inkaamulett aus dem Besitz seines von Wyatt Earp er-","39"
"Justus","schossenen Vorfahren wiederfinden will.","39"
"Bob","Ja.","39"
"Justus","Und das auch noch rein zufällig direkt hier in Rocky Beach. Stattdes-","39"
"Justus","sen hätten wir auch einfach auf die Idee kommen können, dass diese","39"
"Justus","ganze absurde Story nichts als ein Ablenkungsmanöver ist.","39"
"Peter","Aber, was hat Skinny denn mit dem Riesen zu tun?","39"
"Justus","Nach meiner derzeitigen Überlegung war Skinny der Urheber dieser","39"
"Justus","ganzen Rätselgeschichte. Ich denke mir das so: – Irgendwie hat unser","39"
"Justus","Lieblingsfeind in den vergangenen Tagen mitbekommen, dass Sheila","39"
"Justus","ihm gegenüber misstrauisch geworden war. Darüber hinaus hat er ge-","39"
"Justus","wusst, dass seine Freundin seit einiger Zeit wegen der Auktion Kontakt","39"
"Justus","zu uns hatte. Vermutlich hat er befürchtet, dass sie uns in ihre Zweifel","39"
"Justus","einweihen könnte, was dann ja auch tatsächlich geschehen ist.","39"
"Bob","Ja, und deshalb hat Skinny diesen Riesen auf uns gehetzt?","39"
"Justus","Eine ziemlich simple Rechnung. McLaury sollte uns zunächst orden-","39"
"Justus","tlich einschüchtern und dann mit dieser abgedrehten Rätselgeschichte","39"
"Justus","auf Trab halten. Eine bessere Ablenkung ist doch kaum vorstellbar.","39"
"Justus","Cowboyhut verkauft hat, in die Sache eingeweiht sein.","39"
"Justus","Ganz sicher sogar. [schleift kratzend mit einem Papiermesser an der","39"
"REGIE","Streichholzschachtel]","39"
"Bob","OK. OK, aber was hat das alles mit dieser Streichholzschachtel zu tun","39"
"Bob","erster?","39"
"Peter","Ja, das wüsste ich auch gern.","39"
"Justus","Ich suche die letzte Bestätigung für meine Theorie.","39"
"Justus","- 39 -","39"
"Justus","Na, wer sagt’s denn? Ein doppelter Boden!","40"
"Peter","Ich fasse es nicht!","40"
"Justus","Da steht „eins drei null eins, El Camino Real, Freitag um Mitternacht“.","40"
"Bob","Eine Adresse, Moment. [gibt etwas am Rechner ein] Hier. „Hills Of","40"
"Bob","Eternity“ Ein Friedhof in Colma. Dort liegt Wyatt Earp begraben.","40"
"Justus","Jetzt besteht also kein Zweifel mehr. Der Riese handelt im Auftrag von","40"
"Justus","Skinny mit dem einzigen Ziel, uns heute Abend möglichst weit weg zu","40"
"Justus","locken.","40"
"Peter","Während wir um Mitternacht auf dem Friedhof von Colma auf die gro-","40"
"Peter","ße Erleuchtung gewartet hätten, wäre Skinny in aller Ruhe bei Mit-","40"
"Peter","chum & Ferguson eingebrochen.","40"
"Bob","Na, dann wollen wir diesem Einbrecherkönig mal ordentlich die Suppe","40"
"Bob","versalzen.","40"
"REGIE","[Musik]","40"
"REGIE","- 40 -","40"
"REGIE","Track 11 – Fahrt ins Ungewisse","41"
"REGIE","[Musik]","41"
"Erzähler","Vier Stunden später befanden sich die drei Detektive in Peters MG auf","41"
"Erzähler","dem Highway in Richtung Santa Monica.","41"
"REGIE","[Fahrgeräusche, Musik kling langsam aus]","41"
"Bob","Sag mal Justus, äh, mit Inspektor Cotta hat alles geklappt?","41"
"Justus","Ja. Er ist informiert. Sobald Skinny anrückt und die Sache los geht,","41"
"Justus","sagen wir Bescheid.","41"
"Bob","OK.","41"
"Justus","Dann dauert es keine zwei Minuten, bis die Polizei da ist.","41"
"Peter","Gut zu wissen. Ich hatte schon befürchtet, du willst mal wieder alles","41"
"Peter","alleine durchziehen.","41"
"Justus","Das wäre angesichts dieser Größenordnung selbst in meinen Augen","41"
"Justus","einen Tick zu riskant.","41"
"Peter","Ja.","41"
"Peter","Zeit, einer weiteren Sache auf den Grund zu gehen.","41"
"Bob","Ja?","41"
"Justus","Skinny hat uns doch erzählt, dass die Bezeichnung S-61 für übergroße","41"
"Justus","Buffetplatten stehen würde.","41"
"Peter","Mhm.","41"
"Bob","Das kam mir auch schon so komisch vor.","41"
"Justus","Ja, ihr werdet staunen. Bei S-61 und S-63 handelt es sich um zwei","41"
"Justus","Modelle von Hochleistungsglasschneidern.","41"
"Bob","Glasschneider?","41"
"Justus","Mhm. Irgendwie muss der liebe Skinny ja durch das Sicherheitsglas im","41"
"Justus","zweiten Stock. So ergibt nun auch die Gradzahl einen Sinn. Je dicker","41"
"Justus","die Glasscheibe, desto größer muss nämlich der Schneidewinkel sein.","41"
"Peter","Hä. So fügt sich ein Puzzleteil zum anderen.","41"
"Bob","Ja. Und das in einer Nacht, die so schwarz ist, wie Skinnys Seele. Da","41"
"Bob","spart er sich heute auch noch die Tarnklamotten.","41"
"Bob","- 41 -","41"
"Bob","Ja?","42"
"Justus","Onkel Titus hat mich gefragt, wo ich seine geliebte Mütze gelassen","42"
"Justus","hätte.","42"
"Bob","Äh, dieser, dieser Cordalbtraum? Hoch, gut möglich, dass das Ding","42"
"Bob","noch irgendwo in meinem Käfer liegt.","42"
"Bob","Oh man.","42"
"Peter","Was ist denn jetzt?","42"
"Bob","Oh, man!","42"
"Peter","Was ist denn jetzt los? Geht’s dir nicht gut?","42"
"Bob","Leute, ich glaub, wir sollten ganz schnell umdrehen.","42"
"Justus","Wieso das denn? Wir müssen doch den Einbruch in der Galerie ver-","42"
"Justus","hindern.","42"
"Bob","Ich glaube, dieser Einbruch findet überhaupt nicht statt!","42"
"Peter","[überrascht] Was?","42"
"Bob","Ja, weißt du noch, wie Skinny uns, äh, in seinem Garten überrascht","42"
"Bob","hat?","42"
"Justus","Natürlich, ich war ja schließlich dabei.","42"
"Bob","Er hat mich „Mützenclown“ genannt.","42"
"Justus","Ich erinnere mich.","42"
"Bob","Ja, aber als Skinny auftauchte, da hatte ich die Mütze gar nicht mehr","42"
"Bob","auf dem Kopf! Die hattest du da längst wieder eingesteckt, Just. Wenn","42"
"Bob","entdeckt hatte.","42"
"Peter","Ich verstehe kein einziges Wort!","42"
"Bob","Du warst ja auch gar nicht dabei. Wenn Skinny uns von Anfang an","42"
"Bob","beobachtet hat, dann hat er auch gesehen, dass wir zu seinem Fens-","42"
"Bob","ter geschlichen sind. Und dieses Gespräch mit Felicity hat er also ganz","42"
"Bob","gezielt extra für uns geführt.","42"
"Justus","Im Wissen, dass wir zuhören und unsere Schlüsse aus diesem Telefo-","42"
"Justus","nat ziehen würden.","42"
"Bob","Ja.","42"
"Justus","Dafür spricht auch, dass er sein Fenster genau in dem Moment geöff-","42"
"Justus","net hat, als wir nach einer Lauschmöglichkeit Ausschau gehalten ha-","42"
"Justus","ben.","42"
"Justus","- 42 -","42"
"Bob","Das war ja eine regelrechte Einladung.","43"
"Bob","Company nur eine Inszenierung.","43"
"Justus","Alles war eine Inszenierung!","43"
"Bob","Genau!","43"
"Justus","Vom Riesen mit seinen Rätseln und dem Verkäufer in Gizmo’s Castle,","43"
"Justus","bis hin zur Eventfirma und dem angeblich geplanten Einbruch bei Mit-","43"
"Justus","chum & Ferguson. Einfach alles! Auch der offen herumliegende Pros-","43"
"Justus","pekt in Felicitys Wagen war nur eine falsche Fährte.","43"
"Bob","Ach die haben sich gestern Nacht mit Sicherheit köstlich darüber amü-","43"
"Bob","siert, wie gut ihr Theater mit dem Geistercowboy und Churchill ge-","43"
"Bob","klappt hat.","43"
"Peter","Aber, woher weißt du, dass wir nach Rocky Beach und nicht wo an-","43"
"Peter","ders hin müssen?","43"
"Bob","Weil Skinny diese ganze Show von Anfang an nur geplant hat um uns","43"
"Bob","heute Nacht so weit wie möglich vom Schrottplatz wegzulocken.","43"
"Justus","Es muss ihm also um irgendetwas gehen, was die ganze Zeit vor un-","43"
"Justus","serer Nase liegt.","43"
"Peter","Ja, OK, OK, ich hab’s begriffen. Also dann Kommando zurück.","43"
"Justus","Und zwar mit Vollgas.","43"
"Peter","Ähä.","43"
"REGIE","[Peter beschleunigt]","43"
"Bob","Just.","43"
"Justus","Hä?","43"
"Bob","Just. Wenn die ganze Sache ’n riesiges Ablenkungsmanöver war,","43"
"REGIE","[Musik setzt ein]","43"
"Justus","Sheila Masters. Ja, Bob. Ich befürchte, daran besteht kein Zweifel.","43"
"Bob","[enttäuscht, leise, in der lauter werdenden Musik untergehend] Ach","43"
"REGIE","[Musik]","43"
"REGIE","- 43 -","43"
"REGIE","Track 12 – Showdown","44"
"REGIE","[Musik]","44"
"Erzähler","In den folgenden Minuten benachrichtigte Justus Inspektor Cotta von","44"
"Erzähler","ihrer Vermutung. Danach versuchte er zu Hause anzurufen, um Tante","44"
"Erzähler","Mathilda und Onkel Titus zu warnen. Doch die Leitung war tot. Als die","44"
"Erzähler","drei Detektive gegen halb eins ihr Ziel erreicht hatten, parkte Peter den","44"
"Erzähler","Wagen ein wenig abseits. Und die Jungs schlichen sich vorsichtig an","44"
"Erzähler","das Schrottplatzgelände heran.","44"
"Bob","[flüsternd] Da drüben steht der grüne Honda.","44"
"REGIE","[Musik klingt aus]","44"
"Justus","[flüsternd] Ja.","44"
"Bob","Sie sind also schon da.","44"
"Justus","Und da hinten steht wieder der blaue Kleinlaster.","44"
"Bob","Ja, aber wo ist Cotta?","44"
"Peter","[flüsternd] Seht doch! Die Telefonleitungen sind durchgeschnitten.","44"
"Peter","Deswegen konntest du niemanden erreichen, Just.","44"
"Bob","Pssst! Seit mal leise.","44"
"REGIE","[leises Gerumpel, Musik setzt ein]","44"
"Justus","Och, die Kisten! Sie sind in den Lagerschuppen eingebrochen!","44"
"Peter","Wir müssen etwas unternehmen, bevor sie mit der Beute abhauen.","44"
"Justus","Los! Näher ran!","44"
"REGIE","[vorsichtige Schritte]","44"
"Sheila","Masters: [gedämpft, energisch] Nun beeil dich schon! Öffne die nächste!","44"
"Bob","Das ist Sheila!","44"
"Riese","Hey! Ich hab was gehört, Moment.","44"
"REGIE","[Schritte nähern sich, etwas wird zu Seite geschoben, Musikwechsel,","44"
"REGIE","die Jungen erschrecken]","44"
"Peter","[erschrocken] Der Riese!","44"
"Riese","[drohend] So, und jetzt breche ich euch jede Gräte einzeln!","44"
"Inspektor Cotta","[fordernd] Stehen bleiben und Hände hinter den Kopf!","44"
"Justus","[erleichtert] Inspektor Cotta! Endlich.","44"
"Riese","Nicht schießen! Bitte nicht schießen!","44"
"Riese","- 44 -","44"
"Inspektor Cotta","Godween, sichern Sie die Rückseite!","45"
"Godween","Verstanden, Inspektor!","45"
"REGIE","[Schritte]","45"
"Peter","Da ist ja auch Sheila Masters.","45"
"Inspektor Cotta","[streng] So, ihr Herren Detektive. Jetzt will ich Klartext hören! Erst soll","45"
"Inspektor Cotta","ich meine Kollegen in Santa Monica wegen eines geplanten Einbruchs","45"
"Inspektor Cotta","bei Mitchum & Ferguson alarmieren, und dann heißt es plötzlich, alles","45"
"Inspektor Cotta","ein Irrtum! Einsatz beim Gebrauchtwarenhandel Titus Jonas in Rocky","45"
"Inspektor Cotta","Beach! Also, was geht hier vor?","45"
"Justus","So ganz haben wir das auch noch nicht durchschaut, Sir, aber mit der","45"
"Justus","freundlichen Unterstützung unserer nächtlichen Besucher hier werden","45"
"Justus","wir das sicher aufklären können.","45"
"Skinny Norris","[überrumpelt] Das alles sollte doch bloß ’n kleiner Denkzettel sein. Wir","45"
"Skinny Norris","wussten ja, dass hier morgen eine wichtige Auktion über die Bühne","45"
"Skinny Norris","geht. Na ja und da wollten wir die Versteigerungsstücke vorher ein","45"
"Skinny Norris","bisschen verschönern.","45"
"Inspektor Cotta","Was soll das heißen?","45"
"Skinny Norris","Wir wollten einen kleinen Farbanschlag verüben um Mr. Jonas und vor","45"
"Skinny Norris","allem dem Dicken eins auszuwischen.","45"
"Bob","Und dafür dieser riesige Aufwand mit zig falschen Fährten?","45"
"Skinny Norris","Nja, musste ja so sein, um euch ordentlich aufs Glatteis zu führen.","45"
"Peter","Ja, aber warum haben die beiden sich an der Sache beteiligt? Und","45"
"Peter","Gizmo, Felicity und dieser Mr. Chester?","45"
"Skinny Norris","Herje. Wir sind nun mal miteinander bekannt und da haben sie bei","45"
"Skinny Norris","dem Streich eben mitgemacht. Ist ja wohl kein Grund hier gleich mit","45"
"Skinny Norris","einem Sondereinsatzkommando anzurücken.","45"
"REGIE","[Schritte]","45"
"Peter","Hier! Hier im Schuppen stehen wirklich mehrere große Eimer mit","45"
"Peter","schwarzer Farbe. Die Ausstellungsstücke scheinen aber noch unver-","45"
"Peter","sehrt zu sein.","45"
"Riese","Na also, alles halb so wild! Ein Farbeimer ist ja wohl keine Bombe,","45"
"Riese","oder? Hier ist doch sonst nichts passiert.","45"
"Riese","bisher nicht angerührt. Und das obwohl ihr weit über die Hälfte der Kis-","45"
"Riese","ten bereits aufgebrochen habt. Außerdem wäre für so eine Aktion si-","45"
"Riese","cher nicht die Anwesenheit von Sheila Masters nötig.","45"
"Riese","- 45 -","45"
"Justus","Was haben Sie denn da für ein Etui an Ihrem Gürtel hängen? Dürfte","46"
"Justus","ich es mir mal ansehen?","46"
"Inspektor Cotta","[streng] Händigen Sie Justus das Etui aus, Miss!","46"
"Sheila","[verärgert] Also schön. Da!","46"
"Justus","Danke!","46"
"Justus","Ah. So etwas dachte ich mir. Hier Inspektor, sehen Sie.","46"
"Inspektor Cotta","Ist das ein Skalpell?","46"
"Bob","Sag mir, wenn ich mich irre, erster, aber ich glaub, Restauratoren be-","46"
"Bob","nutzen solche feinen Messer bei der Arbeit, oder?","46"
"Justus","Du irrst dich keineswegs, Bob. Und genau dieses Messer muss hier","46"
