"Speaker","Text","Page"
"Justus","und heute einem bestimmten Zweck gedient haben. Kommt mal mit in","46"
"Justus","den Schuppen.","46"
"REGIE","[Schritte, Justus schiebt etwas zur Seite]","46"
"Justus","[angestrengt] Na bitte. Das hab ich mir doch gedacht.","46"
"Inspektor Cotta","Was hast du da, Justus?","46"
"Justus","Hinter der Kiste hier lag dieser Bilderrahmen. Und die Leinwand wurde","46"
"Justus","feinsäuberlich herausgeschnitten.","46"
"Peter","Verstehe. Und gefunden haben Sie es erst, nachdem Sie schon die","46"
"Peter","Hälfte der Kisten aufgebrochen hatten. Wenn alles nach Plan gelaufen","46"
"Peter","wäre, hätten Sie hinterher die ganze Aktion mit dem Farbanschlag","46"
"Peter","verschleiert. So wäre der Diebstahl vermutlich nie aufgeflogen.","46"
"REGIE","[Gemurmel]","46"
"Justus","Ganz genau. Als wir das Trio überrascht haben, hat Sheila geistesge-","46"
"Justus","genwärtig noch schnell den Rahmen hier hinter die Kiste geschoben,","46"
"Justus","damit wir ihn nicht sofort bemerken. Mitnehmen konnte sie ihn ja nicht","46"
"Justus","mehr.","46"
"Bob","Ja, und äh, wo ist nun das Bild, das in dem Rahmen gesteckt hat?","46"
"Justus","Kommt mit raus.","46"
"REGIE","[Schritte]","46"
"Justus","Sag mal, Skinny – entweder hast du dir seit unserem letzten Treffen","46"
"Justus","durch intensives Bodybuilding erheblich breitere Schultern antrainiert","46"
"Justus","oder du trägst unter deiner Jacke einen schmalen Rucksack.","46"
"Skinny Norris","Ich weiß nicht, wovon du sprichst.","46"
"Skinny Norris","- 46 -","46"
"Inspektor Cotta","Ziehen Sie die Jacke aus, Norris!","47"
"Skinny Norris","Na schön. Aber nur unter Protest.","47"
"Peter","Hö – War wohl nichts mit Bodybuilding, wie?","47"
"Inspektor Cotta","Geben Sie mir den Rucksack.","47"
"Skinny Norris","[übergibt den Rucksack] Da!","47"
"Inspektor Cotta","Na, da bin ich doch mal gespannt, was Sie da in Sicherheit bringen","47"
"Inspektor Cotta","wollten. [packt etwas aus]","47"
"Peter","Wow!","47"
"Inspektor Cotta","[streng] Nun, Miss – was hat es mit diesem Gemälde auf sich?","47"
"Skinny Norris","[gedämpft, drohend] Du hältst die Klappe, Sheila!","47"
"Sheila","Masters: Also schön, jetzt ist die Sache ohnehin gelaufen. [atmet noch einmal","47"
"Sheila","durch] Bei den Vorbereitungen für die Auktion war ich für die Katalogi-","47"
"Sheila","sierung der einzelnen Objekte zuständig.","47"
"Justus","Aha.","47"
"Sheila","Masters: Und dabei entdeckte ich dieses unsignierte Ölgemälde. Es handelt","47"
"Sheila","sich mit hoher Wahrscheinlichkeit um „La Belleza de la Mentira“, ein","47"
"Sheila","legendäres als verschollen geltendes Frühwerk von Diego Velázquez.","47"
"Bob","[erstaunt] Was, Velázquez? Ja, das war einer der bedeutendsten","47"
"Bob","Portraitkünstler des siebzehnten Jahrhunderts und Hofmaler des Kö-","47"
"Bob","nigs von Spanien. Ein Original von dem, das, das muss ein Vermögen","47"
"Bob","wert sein.","47"
"Justus","Ja.","47"
"Sheila","Masters: Das war mir natürlich auch klar. Und entsprechend aufgeregt war ich.","47"
"Sheila","Schließlich war bisher offensichtlich weder der Künstler, noch der un-","47"
"Sheila","glaubliche Wert des Gemäldes jemandem aufgefallen.","47"
"Peter","Na logisch, sonst wär’ das Bild bestimmt nicht im Räumungsverkauf","47"
"Peter","eines Antiquitätenladens gelandet.","47"
"Sheila","Masters: Irgendwann habe ich es nicht mehr ausgehalten und meiner Cousine","47"
"Sheila","Felicity von der Sache erzählt.","47"
"Peter","Wie? Felicity ist deine Cousine?","47"
"Sheila","Masters: Ja. Ach, aber keine besonders verlässliche. Sie hatte nichts besseres","47"
"Sheila","zu tun, als sofort ihren Freund Skinny einzuweihen, obwohl ich ihr ein-","47"
"Sheila","geschärft hatte, den Mund zu halten!","47"
"Sheila","Masters: Sehe ich vielleicht so aus?","47"
"Sheila","- 47 -","47"
"Skinny Norris","Na, na!","48"
"Sheila","Masters: Wie auch immer. Skinny war jedenfalls sofort Feuer und Flamme. Er","48"
"Sheila","wollte unbedingt dieses Ding drehen und später über private Kanäle","48"
"Sheila","das Bild absetzen.","48"
"Inspektor Cotta","Ich nehme an, Ihre Cousine wartet momentan zu Hause auf die Rück-","48"
"Inspektor Cotta","kehr des famosen Trios.","48"
"Sheila","Masters: Ja.","48"
"Bob","Da hast du dich ja diesmal echt ins Zeug gelegt, Skinny. Falsche Lieb-","48"
"Bob","schaften, böse Riesen, Westernrätsel, Scheinfirma und Kranwagen?","48"
"Bob","Wer hätte da gedacht, dass dir ausgerechnet ne olle Cordmütze zum","48"
"Bob","Verhängnis wird?","48"
"REGIE","[Sheila Masters atmet noch mal durch, die Jungen und der Inspektor","48"
"REGIE","lachen]","48"
"REGIE","[Titelmusik]","48"
"REGIE","- 48 -","48"
