"Speaker","Text","Page"
"Blacky","BOB             Ja, Justus hat Recht!","25"
"Blacky","PETER           Sehr witzig. Aber… ich mach’s.","25"
"REGIE","Autotür wird geöffnet und wieder geschlossen, Schritte.","25"
"Blacky","ERZÄHLER        So unauffällig wie möglich schlenderte der zweite Detektiv auf den roten","25"
"REGIE","Cadillac zu, sah sich noch einmal um und warf dann einen Blick durch die","25"
"REGIE","Seitenscheibe. Am Rückspiegel baumelte eine kleine Schachfigur. Plötzlich","25"
"REGIE","zwitscherte ganz in der Nähe ein Vogel.","25"
"REGIE","Vogelgezwitscher","25"
"Blacky","PETER           Der Rotbauchfliegenschnäpper! Unser Alarmzeichen!","25"
"REGIE","Kampfgeräusche","25"
"REGIE","Musik","25"
"Blacky","BRADLEY         Hab ich‘s mir doch gedacht! Was soll das hier werden, hä? Autoradio klauen","25"
"Blacky","oder Sprit abzapfen? Antworte, Junge, oder ich breche dir alle Knochen!","25"
"Blacky","PETER           (angestrengt) Nichts… nichts davon! Ich wollte nur einen Blick in Ihr Auto","25"
"Blacky","werfen!","25"
"Blacky","BRADLEY         (abschätziges Lachen) Erzähl doch keinen Mist!","25"
"Blacky","JUSTUS          (abgehetzt) Hey, lassen Sie ihn los!","25"
"Blacky","BRADLEY         Legt euch nicht mit mir an, Jungs! Ich werde locker mit euch fertig!","25"
"Blacky","JUSTUS          Ja, ja, ohne Zweifel, aber dann würden wir Sie wegen Körperverletzung","25"
"Blacky","anzeigen, und ich weiß nicht, ob Ihnen das recht wäre, Bradley!","25"
"Blacky","BRADLEY         Hä? Was? Woher kennst du meinen Namen?","25"
"Blacky","JUSTUS          Lassen Sie Peter los, und ich erkläre es Ihnen.","25"
"Blacky","PETER           (ächzt)","25"
"Blacky","BOB             Was ist hier los?","25"
"Blacky","BRADLEY         Moment mal, dich kenne ich doch! Du bist der Junge, der gestern bei der","25"
"Blacky","Versteigerung auf dem Schrottplatz war!","25"
"Blacky","BOB             Ja, Bob Andrews.","25"
"Blacky","JUSTUS          Sie haben gestern versucht, ein Schachspiel zu ersteigern, wurden aber von","25"
"Blacky","einem Mann namens Bishop Blake überboten und haben dann das Gelände","25"
"Blacky","ziemlich schnell verlassen.","25"
"Blacky","BRADLEY         Ja, und?","26"
"Blacky","JUSTUS          Nachdem Mr. Blake wenige Minuten später auf die Straße getreten war, ist","26"
"Blacky","er von einem Auto angefahren und schwerverletzt ins Krankenhaus gebracht","26"
"Blacky","worden. Wir haben in diesem Fall ermittelt und eine Zeit lang gemutmaßt,","26"
"Blacky","Sie seien der Täter. Aber… wir haben uns getäuscht.","26"
"Blacky","BOB             Just, wieso bist du da so sicher?","26"
"Blacky","JUSTUS          Weil Bradleys Cadillac einen kaputten Auspuff hat. Und genau der war zu","26"
"Blacky","hören, kurz nachdem Bradley den Schrottplatz verlassen hatte und zwar","26"
"Blacky","bevor Bishop Blake das Gelände verließ. In Zusammenhang mit dem Unfall","26"
"Blacky","war der Cadillac wiederum nicht zu hören.","26"
"Blacky","BRADLEY         Äh… Ich verstehe trotzdem überhaupt nichts.","26"
"Blacky","JUSTUS          Wir sind Detektive. Und wir haben Ihren Wagen lediglich genauer in","26"
"Blacky","Augenschein nehmen wollen, um mehr über Sie und Ihre Beweggründe","26"
"Blacky","herauszufinden, fast 7.000 Dollar für ein augenscheinlich wertloses","26"
"Blacky","Schachspiel zu bezahlen.","26"
"Blacky","BRADLEY         Ach.","26"
"Blacky","JUSTUS          Ja, aber nun, da wir wissen, dass Sie nicht der Unfallfahrer sind, können wir","26"
"Blacky","Sie auch direkt fragen: Warum waren Sie bereit, so viel Geld für dieses","26"
"Blacky","Schachspiel auszugeben?","26"
"Blacky","BOB             Ja!","26"
"Blacky","BRADLEY         (seufzt) Also schön. Kommt mit ins Studio, und dann erkläre ich euch alles.","26"
"Blacky","JUSTUS          Genau das wollten wir hören. Kommt, Kollegen!","26"
"Blacky","PETER           Ja.","26"
"Blacky","BOB             Los!","26"
"REGIE","Musik","26"
"Blacky","BRADLEY         So, kommt, setzt euch dort.","26"
"Blacky","JUSTUS          Ja.","26"
"Blacky","BOB             Danke.","26"
"Blacky","BRADLEY         Also, ich erzähle euch, wie das war.","26"
"Blacky","JUSTUS          Ja.","26"
"Blacky","BRADLEY         Ich bin Schachfan. Außerdem auch Sammler. Ich sammle Andenken rund um","26"
"Blacky","Weltklasse-Schach. Mein wertvollstes Stück ist eine Original-Notation von","26"
"Blacky","Garri Kasparow aus einer Partie der Weltmeisterschaft von 1985.","27"
"Blacky","JUSTUS          Ui!","27"
"Blacky","PETER           Was?","27"
"Blacky","BRADLEY         (stolz) Ja!","27"
"Blacky","JUSTUS          Das ist ein Zettel, auf dem die Spieler die Züge aufschreiben, um die","27"
"Blacky","Übersicht zu behalten.","27"
"Blacky","PETER           (ungläubig) Aha.","27"
"Blacky","BRADLEY         Genau! Und letzte Woche entdeckte ich eine Todesanzeige in der Rocky","27"
"Blacky","Beach Today. ","27"
"Blacky","JUSTUS          Die Todesanzeige von Irene Hammontree.","27"
"Blacky","BRADLEY         Irene Hammontree, geborene Lansky.","27"
"Blacky","JUSTUS          (staunend) Ach!","27"
"Blacky","BOB             (staunend) Lansky?","27"
"Blacky","BRADLEY         (triumphierend) Ha, ich wusste, dass ihr davon keine Ahnung habt! Sonst","27"
"Blacky","hättet ihr das Spiel nicht einfach so versteigert. Was für ein Glück, dass","27"
"Blacky","dieser Blake und ich überhaupt da waren, sonst wäre es womöglich für 20","27"
"Blacky","Dollar an irgendwen verkauft worden und nie wieder wieder aufgetaucht.","27"
"Blacky","Der alte Mann wusste sehr genau, wofür er da bietet.","27"
"Blacky","PETER           Äh, bin ich der Einzige, der immer noch nicht begreift, worum es eigentlich","27"
"Blacky","geht?","27"
"Blacky","BOB             Mir geht’s genauso.","27"
"Blacky","BRADLEY         Ihr habt wirklich keine Ahnung.","27"
"Blacky","BOB             Nein!","27"
"Blacky","JUSTUS          Eine Ahnung schon. Hat Irene Lansky zufällig etwas mit Gregor Lansky zu tun,","27"
"Blacky","dem ehemaligen Weltklasse-Schachspieler?","27"
"Blacky","BRADLEY         Bingo! Sie war seine Schwester!","27"
"Blacky","JUSTUS          Gregor Lansky war in den Siebzigerjahren ein Star in der internationalen","27"
"Blacky","Schachszene. Nach ihm wurde sogar ein Eröffnungszug benannt, mit dem er","27"
"Blacky","nahezu jede Partie begann, die Lansky-Eröffnung. Springer B1 nach C3.","27"
"Blacky","BRADLEY         Ja, ja, genauso ist es. Ein ungewöhnlicher erster Zug und eine Art","27"
"Blacky","Markenzeichen von Lansky. Gregor Lansky wurde damals schon als","27"
"Blacky","zukünftiger Weltmeister gehandelt, bis er eines Tages spurlos verschwand.","27"
"Blacky","Ja, und mit ihm auch sein Schachbrett.","27"
"Blacky","BOB             Moment, was soll das heißen, „er verschwand“?","28"
"Blacky","BRADLEY         Er verschwand, er war einfach weg. War ein großer Skandal damals, und","28"
"Blacky","jahrelang gab es die wildesten Gerüchte","28"
"Blacky","JUSTUS          Ja, davon habe ich gelesen. Verschwörungstheorien, viele glaubten, der","28"
"Blacky","russische Geheimdienst hätte Lansky verschwinden lassen, weil er den","28"
"Blacky","amtierenden russischen Weltmeister zu schlagen drohte.","28"
"Blacky","BRADLEY         Es gab noch andere Geschichten, die mit dem Geheimdienst zu tun hatten,","28"
"Blacky","aber die glaube ich alle nicht. Jedenfalls war Lansky verschwunden, und das","28"
"Blacky","ist er bis heute.","28"
"Blacky","JUSTUS          Und wenn er noch leben sollte, wäre er heute ein alter Mann.","28"
"Blacky","BRADLEY         Ja, genau. Na ja, wie auch immer, von Lanskys Schwester Irene wissen","28"
"Blacky","natürlich nur Leute, die sich ein bisschen auskennen.","28"
"Blacky","JUSTUS          Verstehe.","28"
"Blacky","BRADLEY         Dass sie die letzten Jahre Irene Hammontree hieß, wissen nur ganz wenige.","28"
"Blacky","Ich las also die Todesanzeige und bin sofort zu ihrem Haus gefahren, weil ich","28"
"Blacky","wissen wollte, was mit ihrem Nachlass passiert.","28"
"Blacky","BOB             Aha, und dann?","28"
"Blacky","BRADLEY         Hat mir so eine komische Nachbarin erzählt, dass das Haus schon leer sei","28"
"Blacky","und das ganze Zeug bei einem Titus Jonas auf der Müllkippe gelandet wäre.","28"
"Blacky","Da bin ich dann auch hingefahren und bin gerade rechtzeitig zur","28"
"Blacky","Versteigerung gekommen.","28"
"Blacky","PETER           Etwas muss hinter diesem Schachspiel stecken. Mr. Blake hat mir gesagt,","28"
"Blacky","sein Leben hinge von dem Spiel ab.","28"
"Blacky","JUSTUS          Ja, das ist dem sehr ähnlich, was Lansky damals der Presse gegenüber","28"
"Blacky","behauptete, dass er „ohne das Spiel verloren“ sei. Können Sie sich einen","28"
"Blacky","Reim darauf machen, Bradley?","28"
"Blacky","BRADLEY         Nein. Lansky hat damals wahrscheinlich einfach rumgesponnen. Und was","28"
"Blacky","dieser alte Mann damit meinte… Keine Ahnung. Aber der kann sich jetzt ja","28"
"Blacky","auch entspannen, er hat mich ja schließlich überboten.","28"
"Blacky","PETER           Hm.","28"
"Blacky","JUSTUS          Schon, aber… Das Spiel wurde gestohlen.","28"
"Blacky","BRADLEY         Gestohlen?","28"
"Blacky","PETER           (zustimmend) Hm.","28"
"Blacky","JUSTUS          Das Schachspiel war weg, als wir die Straße erreichten und Mr. Blake auf","28"
"Blacky","dem Boden liegen sahen. Der Dieb ist vermutlich die gleiche Person, die","29"
"Blacky","auch Mr. Blake angefahren hat.","29"
"Blacky","PETER           Ja.","29"
"Blacky","BRADLEY         (pfeift anerkennend) Das ist ja heftig.","29"
"Blacky","JUSTUS          Ja. Aber wir werden den Täter und das Schachspiel finden.","29"
"REGIE","Musik","29"
"REGIE","Automotorengeräusche","29"
"Blacky","JUSTUS          An der Kreuzung geradeaus, Zweiter!","29"
"Blacky","PETER           Fahren wir denn nicht zum Schrottplatz zurück, Erster?","29"
"Blacky","JUSTUS          Nein, wir fahren zu den Kretschmers!","29"
"Blacky","PETER & BOB     (unisono) Och…","29"
"Blacky","BOB             Ach so, wegen des Tagebuchs, verstehe. Aber du hast uns immer noch nicht","29"
"Blacky","gesagt, wieso Chastity und Charity uns dabei helfen sollen, es in die Finger zu","29"
"Blacky","bekommen.","29"
"Blacky","JUSTUS          Das werdet ihr ja dann sehen, Kollegen.","29"
"Blacky","PETER           Hm.","29"
"Blacky","BOB             (gedehnt) Okay…","29"
"REGIE","Musik","29"
"REGIE","Automotorengeräusche","29"
"REGIE","Vogelgezwitscher. Ein Auto fährt vor, der Motor wird gestoppt und die Autotür","29"
"REGIE","geöffnet.","29"
"Blacky","CHASTITY        He, da ist wieder der Junge von der Müllkippe!","29"
"Blacky","JUSTUS          Hallo!","29"
"Blacky","CHARITY         Wir dürfen mit niemandem reden. Wenn man mit Fremden redet, kann das","29"
"Blacky","böse enden!","29"
"Blacky","JUSTUS          Aber ihr habt heute schon mal mit mir geredet!","29"
"Blacky","CHARITY         Das war Chastity, nicht ich.","29"
"Blacky","JUSTUS          Du hast mir ein Geheimnis verraten, dass nicht ein Mann nach dem","29"
"Blacky","Schachspiel gefragt hat, sondern zwei. Und von dem zweiten Mann weiß","29"
"Blacky","eure Mutter nichts. Richtig?","29"
"Blacky","CHASTITY & CHARITY Äh… also… ähh…","30"
"Blacky","JUSTUS          Letzten Freitag habt ihr mit einem Fremden geredet, und dann ist etwas","30"
"Blacky","Schlimmes passiert. Der Fremde hat nach dem Schachspiel und Mrs.","30"
"Blacky","Hammontrees Haus gefragt, und am nächsten Tag hat eure Mutter","30"
"Blacky","festgestellt, dass dort eingebrochen worden war.","30"
"Blacky","CHASTITY        Das stimmt nicht.","30"
"Blacky","JUSTUS          Doch, es stimmt. Und ihr habt es eurer Mutter nicht erzählt, richtig? Weil die","30"
"Blacky","euch nämlich verboten hat, mit Fremden zu sprechen. Und jetzt habt ihr ein","30"
"Blacky","Problem, denn ich weiß es, und ich könnte es eurer Mutter verraten.","30"
"Blacky","CHASTITY & CHARITY (erschrockener Laut)","30"
"Blacky","JUSTUS          Es sei denn, ihr helft uns. Eure Mutter hat irgendwo das Tagebuch von Mrs.","30"
"Blacky","Hammontree versteckt. Da stehen sehr wichtige Sachen drin, die uns helfen","30"
"Blacky","könnten, den Einbrecher zu fangen.","30"
"Blacky","CHARITY         Ich weiß, wo!","30"
"Blacky","CHASTITY        Wir sind gleich wieder da!","30"
"REGIE","Schnelle Schritte","30"
"Blacky","BOB             Na, die scheinen sich in den Privatsachen ihrer Mutter ja gut auszukennen.","30"
"Blacky","PETER           Hm. Na, da sind sie ja schon wieder.","30"
"REGIE","Schnelle Schritte","30"
"Blacky","CHASTITY        Seht ihr? Aber wir geben euch die Sachen nicht. Mama merkt das sofort, und","30"
"Blacky","dann kriegen wir doch noch Schimpfe. Ihr dürft nur reingucken.","30"
"Blacky","CHARITY         Und nur kurz! Damit Papa nichts merkt. Der guckt Football.","30"
"Blacky","BOB             Keine Sorge, das dauert nur ein paar Minuten. Ich mache Fotos von den","30"
"Blacky","Seiten. So. (Klicken der Kamera) Noch mal. Jetzt. (Klicken)","30"
"Blacky","JUSTUS          Sagt mal, ihr beiden, der Mann, der nach Mrs. Hammontrees Haus gefragt","30"
"Blacky","hat, war der alt?","30"
"Blacky","CHASTITY        Ja, mindestens 100, und der hatte einen Spazierstock.","30"
"Blacky","CHARITY         Die Haarfarbe weiß ich nicht. Er trug einen Hut.","30"
"Blacky","CHASTITY        Und eine Harry-Potter-Brille!","30"
"Blacky","JUSTUS          Oh!","30"
"Blacky","PETER           Das klingt nicht nach unserem falschen Arzt.","30"
"Blacky","BOB             Nein, das klingt nach jemand ganz anderem.","31"
"REGIE","Musik","31"
"Blacky","krächzt.","31"
"Blacky","PETER           Hm… Bishop Blake war also bei den Kretschmers.","31"
"Blacky","BOB             Ja. Könnte es denn sein, dass er am Ende in Mrs. Hammontrees Haus","31"
"Blacky","eingebrochen ist?","31"
"Blacky","PETER           Aber Blake ist ein alter Mann…","31"
"Blacky","JUSTUS          Das hat nichts zu sagen. Wir sollten ihn zumindest mit einem kleinen","31"
"Blacky","Fragezeichen versehen.","31"
"Blacky","PETER           (zustimmend) Hm.","31"
"Blacky","BOB             So, ich habe inzwischen die Fotos von dem Tagebuch auf unserem Rechner,","31"
"Blacky","Freunde.","31"
"Blacky","JUSTUS          Ja?","31"
"Blacky","BOB             Interessant, es gibt hier ein paar Stellen, die sehr, sehr aufschlussreich sind.","31"
"Blacky","PETER           Wie meinst du das?","31"
"Blacky","BOB             Na ja, hier steht zum Beispiel: (liest vor) „Neuerdings erzählt mir Gregor","31"
"Blacky","immer, ich soll auf mich aufpassen. Darauf achten, ob ich vielleicht","31"
"Blacky","beobachtet werde und ihm dann sofort Bescheid sagen, aber dazu in eine","31"
"Blacky","Telefonzelle gehen. Er glaubt, er wird verfolgt.“","31"
"Blacky","JUSTUS          Hm.","31"
"Blacky","PETER           Ach!","31"
"Blacky","BOB             Ja. Oder hier: (liest vor) „Früher hat er ein paar unglückliche Dinge in","31"
"Blacky","Interviews gesagt, über den Kommunismus und wie viel besser man sich in","31"
"Blacky","der Sowjetunion um den Schachsport kümmert. Wird er etwa beschattet?“","31"
"Blacky","PETER           Das verstehe ich nicht. Wer soll ihn denn damals beschattet haben und","31"
"Blacky","warum? Und was hat das mit Kommunismus zu tun.","31"
"Blacky","JUSTUS          (belehrend) Der Kommunismus ist eine politische Idee, und um dir jetzt die","31"
"Blacky","Details zu ersparen, Zweiter, es ist die Ideologie, der die Politik der","31"
"Blacky","osteuropäischen Staaten unter Führung der Sowjetunion früher folgte.","31"
"Blacky","BOB             (genervt) Justus!","31"
"Blacky","PETER           Das weiß ich! Die Kommunisten sind die Bösen, richtig?","31"
"Blacky","JUSTUS          Gut und böse gibt’s im Märchen, aber nicht im echten Leben. Aber die","32"
"Blacky","Sowjetunion war jahrzehntelang der erklärte Erzfeind der Vereinigten","32"
"Blacky","Staaten, ja. Deshalb war es früher nicht ratsam, sich öffentlich positiv über","32"
"Blacky","den Kommunismus zu äußern. Früher wurden Kommunisten hier regelrecht","32"
"Blacky","verfolgt und als Landesverräter bestraft.","32"
"Blacky","BOB             Aber dass ein Mann wie Gregor Lansky für die Russen etwas übrig hatte, das","32"
"Blacky","kann ich mir allerdings gut vorstellen. Russische Schachspieler wurden in","32"
"Blacky","ihrem Land, ähnlich wie Sportler, stark gefördert. Die waren echte Stars,","32"
"Blacky","während Schach in der westlichen Welt damals nicht sehr wichtig","32"
"Blacky","genommen wurde.","32"
"Blacky","JUSTUS          Tatsächlich änderte sich das erst ein wenig mit Lansky selbst, weil er der","32"
"Blacky","erste Amerikaner war, der mit den russischen Weltklasse-Spielern mithalten","32"
"Blacky","konnte. Plötzlich bot sich eine Chance, Russland beim ewigen Wettstreit","32"
"Blacky","zwischen Ost und West in einer weiteren Disziplin zu schlagen: im Schach.","32"
"Blacky","BOB             Ja, und da war es natürlich doppelt blöd, wenn der einzige Mann, der das","32"
"Blacky","vielleicht schaffen konnte, auch noch öffentlich erklärte, dass er die Politik","32"
"Blacky","der Russen eigentlich ganz gut findet.","32"
"Blacky","PETER           (zustimmend) Jaja…","32"
"Blacky","BOB             So, und jetzt kommt hier ein wirklich spannender Teil aus dem Tagebuch,","32"
"Blacky","hört euch das mal an: (liest vor, begleitende Musik setzt ein) „Gregor ist","32"
"Blacky","schon wieder umgezogen, zum zweiten Mal in diesem Jahr. Er fühlt sich","32"
"Blacky","nicht mehr sicher in seiner Wohnung, sagt er und glaubt, dass auch das neue","32"
"Blacky","Appartement verwanzt ist. Außerdem trägt er sein verdammtes Schachbrett","32"
"Blacky","ständig mit sich herum. Er sagt, es trägt ein Geheimnis, und sein Leben hängt","32"
"Blacky","von diesem Brett ab. Und wenn ihm je etwas zustoßen sollte, müsste ich ihm","32"
"Blacky","versprechen, es an mich zu nehmen und es niemals aus der Hand zu geben.","32"
"Blacky","Ich glaube, er leidet immer mehr an Wahnvorstellungen. Ich halte es nicht","32"
"Blacky","mehr aus, deshalb ist es neulich passiert. Ich war mit Gregor zum Essen","32"
"Blacky","verabredet, wir waren allein im Lokal. Gregor hatte wie immer sein","32"
"Blacky","Schachbrett dabei. Irgendwann ging er auf die Toilette, ließ das Brett liegen","32"
"Blacky","und schärfte mir ein, es nicht aus den Augen zu lassen. Ich handelte ohne","32"
"Blacky","nachzudenken. Ich nahm das Brett an mich und versteckte es. Gregor kam","32"
"Blacky","zurück, und ich behauptete, ein Fremder sei hereingestürzt und habe sich","32"
"Blacky","das Brett geschnappt und wäre wieder verschwunden. Gregor war außer","32"
"Blacky","sich vor Wut und Angst. ‚Jetzt ist alles aus‘, sagte er. Sie würden ihn","32"
"Blacky","schnappen und wegsperren. Er müsse fliehen, dann küsste er mich und war","32"
"Blacky","auf und davon. Ich weiß nicht, in welchen Schwierigkeiten Gregor steckt, ich","32"
"Blacky","weiß nur, dass sie etwas mit diesem verfluchten Schachbrett zu tun haben,","32"
"Blacky","und entweder hört es auf, wenn das Brett verschwindet, oder ich löse eine","32"
"Blacky","Katastrophe aus. Aber ich gehe das Risiko ein, sonst werde ich meinen","32"
"Blacky","Bruder für immer verlieren.“","32"
"Blacky","PETER           Mann, das ist ja richtig dramatisch!","32"
"Blacky","JUSTUS          So kam das Schachbrett also in Irenes Besitz. Und Gregor Lansky verschwand","33"
"Blacky","von der Bildfläche. Ich nehme an, er tauchte bei seiner Schwester nie wieder","33"
"Blacky","auf?","33"
"Blacky","BOB             Falsch angenommen, Just. Nach Lanskys Verschwinden machte Irene eine","33"
"Blacky","schwere Zeit durch. Die Presse bekam schnell Wind davon , dass der","33"
"Blacky","berühmte Schachspieler verschwunden war, und belästigte sie. Irene machte","33"
"Blacky","sich schreckliche Vorwürfe. Sie glaubte, dass sich ihr Bruder umgebracht","33"
"Blacky","hätte. Sie untersuchte das Schachspiel, aber sie fand nichts. Eines Tages","33"
"Blacky","tauchte ihr Bruder plötzlich wieder auf.","33"
"Blacky","PETER           Und dann?","33"
"Blacky","BOB             Er war die ganze Zeit auf der Flucht gewesen und lebte nun unter falschem","33"
"Blacky","Namen. Sie war erleichtert, erzählte ihm aber nicht, dass sie die Diebin war.","33"
"Blacky","Denn er hatte sich sehr verändert, zum Positiven, er war viel ruhiger","33"
"Blacky","geworden. Wartet, da war so ne Stelle… Ah hier, genau: (liest vor) „Ich muss","33"
"Blacky","dieses Geheimnis bewahren, ihm zuliebe. Irgendwann wird er begreifen,","33"
"Blacky","dass ihn in Wirklichkeit niemand verfolgt. Er wird aufhören zu fliehen und","33"
"Blacky","ein ganz normales Leben führen.“","33"
"REGIE","Das Telefon klingelt.","33"
"Blacky","JUSTUS          Wer ist denn das jetzt? Moment.","33"
"Blacky","PETER           Verstärker!","33"
"Blacky","JUSTUS          Ist schon geschehen. (am Telefon) Justus Jonas von… (wird unterbrochen)","33"
"Blacky","INSPECTOR COTTA (am Telefon, gereizt) Erreiche ich euch endlich! Wo habt ihr denn den","33"
"Blacky","ganzen Tag gesteckt?","33"
"Blacky","JUSTUS          Inspector Cotta! Wir waren unterwegs und… (wird unterbrochen)","33"
"Blacky","INSPECTOR COTTA (am Telefon) Heute nachmittag ist eine Anzeige bei mir eingegangen. Ein","33"
"Blacky","Einbruch in einem Haus nördlich von Malibu. Es gibt eine","33"
"Blacky","Personenbeschreibung, die haargenau auf Bob passt. Und darüber hinaus","33"
"Blacky","das Autokennzeichen seines gelben Käfers. Sitzt er gerade zufällig neben dir?","33"
"Blacky","JUSTUS          Ja! Ja, so ist es.","33"
"Blacky","INSPECTOR COTTA (am Telefon) Dann gib ihn mir!","33"
"Blacky","JUSTUS          Verstanden. Hier, Bob.","33"
"Blacky","BOB             Ja… Inspector Cotta?","33"
"Blacky","INSPECTOR COTTA (am Telefon) Ich nehme an, Bob, du hast alles mitgehört.","33"
"Blacky","BOB             Ja, habe ich.","33"
"Blacky","INSPECTOR COTTA (am Telefon) Dann erklär dich!","34"
"Blacky","BOB             Ich bin nirgendwo eingebrochen, ich habe jemanden besucht. Ja, und diese","34"
"Blacky","Person hat mich in ihr Haus gelassen. Vorher wurde eingebrochen.","34"
"Blacky","INSPECTOR COTTA (am Telefon) Wen hast du besucht?","34"
"Blacky","BOB             Sam Chiccarelli.","34"
"Blacky","INSPECTOR COTTA (am Telefon, lacht ungläubig auf) Davon hätte sie der Polizeit etwas gesagt,","34"
"Blacky","nehme ich an.","34"
"Blacky","BOB             Wie bitte, „sie“? Nein, ich meine ihn, Sam Chiccarelli!","34"
"Blacky","INSPECTOR COTTA (am Telefon) Bob, Sam Chiccarelli ist eine Frau.","34"
"Blacky","BOB             Was?","34"
"Blacky","INSPECTOR COTTA (am Telefon) Sie hat eine Jogging-Runde durch die Berge gedreht, auf dem","34"
"Blacky","Rückweg einen verdächtigen gelben Käfer in der Nähe ihres Grundstücks","34"
"Blacky","bemerkt, sich das Kennzeichen notiert und dich in ihrem Haus überrascht.","34"
"Blacky","JUSTUS          Oh Mann! Ich bin so blöd! Gib mir den Hörer, Bob!","34"
"Blacky","BOB             Ja, hier…","34"
"Blacky","JUSTUS          Schnell, schnell! (am Telefon) Inspector Cotta? Mir ist gerade unser","34"
"Blacky","Denkfehler aufgefallen. Es bleibt aber dabei, dass Bob nirgendwo","34"
"Blacky","eingebrochen ist, sondern jemand anders. Bob hat den Einbrecher","34"
"Blacky","überrascht und ihn für Sam Chiccarelli gehalten, da wir alle davon","34"
"Blacky","ausgegangen waren, dass es sich bei Sam um einen Mann handelt.","34"
"Blacky","BOB             Ja!","34"
"Blacky","JUSTUS          In Wahrheit aber dürfte er derjenige gewesen sein, der die Tür aufgebrochen","34"
"Blacky","hat.","34"
"Blacky","INSPECTOR COTTA (am Telefon) Soso…","34"
"Blacky","BOB             Inspector! Er hat so getan als sei er dort zu Hause, um sich nicht verdächtig","34"
"Blacky","zu machen. Er hat mich hereingebeten, und dann wurden wir beide von der","34"
"Blacky","Bewohnerin des Hauses überrascht, nämlich von der echten Sam Chiccarelli,","34"
"Blacky","die natürlich keine Ahnung hatte, dass es sich um einen Einbrecher und","34"
"Blacky","einen Unschuldigen handelte.","34"
"Blacky","INSPECTOR COTTA (am Telefon) Also schön. Ich glaube dir die Geschichte.","34"
"Blacky","JUSTUS          Das freut uns, Inspector, aber wer ist denn nun eigentlich Sam Chiccarelli?","34"
"Blacky","INSPECTOR COTTA (am Telefon) Ich hätte lieber gewusst: Wer war der Einbrecher?","34"
"Blacky","JUSTUS          Das wissen wir leider nicht. Er hat mit dem Fall des gestohlenen Schachspiels","35"
"Blacky","zu tun, der heute in der Zeitung stand, aber mehr wissen wir auch noch","35"
"Blacky","nicht.","35"
"Blacky","INSPECTOR COTTA (am Telefon) Den Artikel habe ich gelesen. Aber wie passt eine ehemalige","35"
"Blacky","Geheimdienstmitarbeiterin in diese Geschichte?","35"
"Blacky","JUSTUS          Geheimdienst?","35"
"Blacky","INSPECTOR COTTA (am Telefon) Sam Chiccarelli. Sie war bis vor zwei Jahren bei der CIA.","35"
"Blacky","Wusstet ihr das etwa noch nicht?","35"
"Blacky","BOB             Wir wussten gar nichts über sie und haben bis eben gedacht, sie wäre ein","35"
"Blacky","Mann! Aber dass sie beim CIA war, erklärt zumindest ihre bemerkenswerte","35"
"Blacky","Nahkampftechnik.","35"
"Blacky","INSPECTOR COTTA (am Telefon) Die hat ihr leider nichts genützt. Der Einbrecher konnte","35"
"Blacky","entkommen. Aber schön, (eindringlich) dann haltet euch einfach zurück bei…","35"
"Blacky","was auch immer ihr tut! Ich mache jetzt Feierabend. (legt auf)","35"
