"Speaker","Text","Page"
"Blacky","JUSTUS          Aufgelegt. (legt auch auf)","35"
"Blacky","PETER           Geheimdienst. Toll. Ging’s nicht ne Nummer kleiner?","35"
"Blacky","JUSTUS          Faszinierend, nicht wahr?","35"
"Blacky","BOB             Na ja…","35"
"Blacky","JUSTUS          Zumal es nicht das erste Mal ist, dass uns das Stichwort „Geheimdienst“ in","35"
"Blacky","diesem Fall begegnet. Und deshalb machen wir uns jetzt gleich noch mal auf","35"
"Blacky","den Weg nach Malibu.","35"
"Blacky","BOB             Wieso das denn?","35"
"Blacky","JUSTUS          Wir statten Sam Chiccarelli einen Besuch ab.","35"
"Blacky","BOB             Und warum rufen wir sie nicht einfach an?","35"
"Blacky","JUSTUS          Weil sie dann einfach auflegen könnte.","35"
"Blacky","PETER & BOB     (seufzen)","35"
"REGIE","Musik","35"
"REGIE","Nachtgeräusche","35"
"REGIE","Schritte, Türklingeln, kurz darauf wird die Tür geöffnet.","35"
"Blacky","BOB             Guten Abend, Madam! Wir wollten… (wird unterbrochen)","35"
"Blacky","SAM CHICCARELLI (aufgebracht) Du schon wieder? Was soll das? Verschwindet von meinem","35"
"Blacky","Grundstück oder ich… (wird unterbrochen)","36"
"Blacky","JUSTUS          Mrs. Chiccarelli, wir sind in friedlicher Absicht hier und wollen Ihnen nur ein","36"
"Blacky","paar Fragen stellen. Hier ist unsere Karte.","36"
"Blacky","SAM CHICCARELLI (misstrauisch) Hm.","36"
"Blacky","JUSTUS          Hat Inspector Cotta nicht mit Ihnen gesprochen?","36"
"Blacky","SAM CHICCARELLI Doch, er hat irgendwas von Detektiven gefaselt und… (wird unterbrochen)","36"
"Blacky","BOB             Mrs. Chiccarelli. Ich bin wirklich nicht in Ihr Haus eingebrochen. Ich habe den","36"
"Blacky","Einbrecher überrascht und nicht erkannt, dass es einer war.","36"
"Blacky","SAM CHICCARELLI Und warum bist du dann geflohen?","36"
"Blacky","BOB             Weil ich nicht begriffen habe, dass Sie die Bewohnerin dieses Hauses sind.","36"
"Blacky","SAM CHICCARELLI Hm. Ja, und was wollt Ihr jetzt von mir?","36"
"Blacky","JUSTUS          Wir ermitteln in einem Fall, in dem es um ein Schachspiel geht, hinter dem","36"
"Blacky","einige Leute her sind. Inzwischen haben wir herausgefunden, dass es einmal","36"
"Blacky","dem berühmten Schachspieler Gregor Lansky gehört hat. Sagt Ihnen das","36"
"Blacky","etwas?","36"
"Blacky","SAM CHICCARELLI Natürlich sagt mir das was. Und?","36"
"Blacky","JUSTUS          Wir wissen von Inspector Cotta, dass Sie früher beim Geheimdienst","36"
"Blacky","gearbeitet haben, es gibt außerdem Vermutungen, nach denen Lansky vom","36"
"Blacky","Geheimdienst bespitzelt wurde. Klingelt da was bei Ihnen?","36"
"Blacky","SAM CHICCARELLI (lacht) Ich war beim Geheimdienst, in der Tat. Aber glaubt ihr, ich werde die","36"
"Blacky","Erfahrungen meines Berufslebens jetzt mit drei Grünschnäbeln teilen?","36"
"Blacky","PETER           Also wurde Lansky überwacht.","36"
"Blacky","SAM CHICCARELLI Eine Menge Leute wurden damals überwacht. Lansky gehörte als","36"
"Blacky","Sympathisant der Russen sicherlich dazu. Aber das ist ja vorbei. War das","36"
"Blacky","alles?","36"
"Blacky","JUSTUS          Nein, wir haben noch zwei Fragen. Der Einbrecher, den Sie überrascht","36"
"Blacky","haben. Kannten Sie ihn?","36"
"Blacky","SAM CHICCARELLI Nein. Und die letzte Frage?","36"
"Blacky","JUSTUS          Die betrifft unseren Auftraggeber, Mr. Bishop Blake.","36"
"Blacky","SAM CHICCARELLI Ihr arbeitet für Bishop Blake? Soll das ein Scherz sein? Wenn ihr für meinen","36"
"Blacky","lieben ehemaligen Kollegen arbeitet, warum kommt ihr dann zu mir? Er kann","36"
"Blacky","euch doch alle Zusammenhänge erläutern.","36"
"Blacky","PETER           Moment mal. Er… er war Ihr Kollege?","36"
"Blacky","SAM CHICCARELLI Bishop Blake war einer von denen, die die Zeit der Überwachung und","37"
"Blacky","Bespitzelung so unangenehm gemacht haben. Ihr haltet euch besser von ihm","37"
"Blacky","fern.","37"
"Blacky","BOB             Warum?","37"
"Blacky","JUSTUS          Mrs. Chiccarelli. Bishop Blake wurde auf der Straße von einem Auto","37"
"Blacky","angefahren. Bevor er das Bewusstsein verlor, hat er Ihren Namen genannt.","37"
"Blacky","Warum hat er das getan?","37"
"Blacky","SAM CHICCARELLI Meinen Namen?","37"
"Blacky","JUSTUS          Ja. Wir wissen nicht, warum er das getan hat, aber wir vermuten, dass es als","37"
"Blacky","Hinweis gedacht war. Oder als Hilferuf.","37"
"Blacky","SAM CHICCARELLI Das war kein Hilferuf. Das war eine Warnung.","37"
"REGIE","Musik","37"
"REGIE","Automotorengeräusche","37"
"Blacky","PETER           Ich bin ratlos. Vollkommen ratlos und verstehe überhaupt nichts mehr.","37"
"Blacky","JUSTUS          Bishop Blake war ebenfalls beim Geheimdienst. Und Gregor Lansky wurde","37"
"Blacky","tatsächlich überwacht. Von Blake? Oder von Sam Chiccarelli? Sie hätte uns","37"
"Blacky","alle Zusammenhänge erklären können, da bin ich sicher, aber sie wollte","37"
"Blacky","nicht. So oder so, solange wir das Schachspiel nicht haben… (wird","37"
"Blacky","unterbrochen)","37"
"Blacky","BOB             Hey! Hey, hey, hey, ich habe was gefunden, Freunde!","37"
"Blacky","PETER           Was?","37"
"Blacky","JUSTUS          Was denn?","37"
"Blacky","BOB             Hier auf meinem Handy. Da ist ein Eintrag von einer der letzten Seiten aus","37"
"Blacky","dem Tagebuch. Fünf Jahre, nachdem Irene das Schachspiel hatte","37"
"Blacky","verschwinden lassen.","37"
"Blacky","PETER           Lass mal hören!","37"
"Blacky","BOB             Passt auf! (liest vor, begleitende Musik setzt ein) „Gregor ist auf der Hut, lebt","37"
"Blacky","in Deckung vor einer unbekannten Gefahr, von der ich bis heute nicht genau","37"
"Blacky","weiß, ob sie eingebildet ist oder nicht. Das weiß vielleicht nicht einmal","37"
"Blacky","Ruth.“ – Das ist die Frau, die er in der Zwischenzeit kennengelernt und","37"
"Blacky","geheiratet hat. – „Aber abgesehen davon ist Gregor ein liebevoller Ehemann","37"
"Blacky","und seit gestern Vater. Ich bin Tante geworden! Ruth und er haben ihren","37"
"Blacky","Sohn Griffin genannt. Griffin Silverman, er trägt Ruths Nachnamen, weil","37"
"Blacky","Gregor immer noch Angst hat, dass seine falsche Identität auffliegt. Der","37"
"Blacky","Kleine ist wohlauf, und…“ – Achtung, jetzt kommt’s! – „er ist mit einer","37"
"Blacky","Hasenscharte zur Welt gekommen, aber sie ist nicht stark ausgeprägt und","38"
"Blacky","kann bestimmt bald operiert werden.“ – Na, Freunde? Ist jemand bereit, an","38"
"Blacky","einen Zufall zu glauben?","38"
"Blacky","JUSTUS          Nein! Das Alter kommt auch ungefähr hin! Unser geheimnisvoller falscher","38"
"Blacky","Arzt und Einbrecher ist also Gregor Lanskys Sohn!","38"
"Blacky","PETER           Wahnsinn!","38"
"REGIE","Handyklingeln","38"
"Blacky","BOB             Nanu, wer mag denn das sein? Das ist Derek!","38"
"Blacky","JUSTUS          Gib mir das Handy, Bob! Gib her! Ich drücke auf die Lautsprechertaste, dann","38"
"Blacky","könnt ihr mithören. (am Telefon) Derek? Hier spricht Justus, was gibt’s?","38"
"Blacky","DEREK           (am Telefon) Sag mal, ihr ermittelt doch in diesem Schachfall, richtig? Ich","38"
"Blacky","habe da nämlich ein Auto beobachtet.","38"
"Blacky","JUSTUS          Was für ein Auto?","38"
"Blacky","DEREK           (am Telefon) So’n himmelblaues altes Teil. Das steht schon den ganzen Tag","38"
"Blacky","an der Straßenecke, wo der Unfall passiert ist. Und jetzt sitzt jemand drin","38"
"Blacky","und starrt zu euch rüber.","38"
"Blacky","JUSTUS          Was soll das heißen, „er starrt zu uns rüber“?","38"
"Blacky","DEREK           (am Telefon) Na, zum Schottplatzeingang. Ich glaube, ihr werdet beobachtet!","38"
"Blacky","JUSTUS          Kannst du von deinem Fenster aus den Fahrer erkennen?","38"
"Blacky","DEREK           (am Telefon) Nee, dafür ist es schon zu dunkel.","38"
"Blacky","JUSTUS          Danke, Derek. Da hast du uns zum zweiten Mal sehr geholfen. Gute Nacht","38"
"Blacky","dann.","38"
"Blacky","DEREK           (am Telefon) Gute Nacht. (legt auf)","38"
"Blacky","JUSTUS          Kollegen, ihr habt es gehört. Wir müssen etwas unternehmen!","38"
"Blacky","BOB             Ja, aber was schlägst du vor?","38"
"Blacky","JUSTUS          Wir fahren sofort zum Schrottplatz zurück, parken aber in einer Nebenstraße","38"
"Blacky","und observieren das Fahrzeug.","38"
"Blacky","PETER           Schön. Dann drücke ich mal auf die Tube.","38"
"Blacky","JUSTUS          Ja.","38"
"REGIE","Musik","38"
"REGIE","Schritte","38"
"Blacky","JUSTUS          Da steht der Wagen.","39"
"Blacky","PETER           Ja, aber es sitzt niemand am Steuer.","39"
"Blacky","BOB             Ach, der Schatten des Baumes fällt genau auf den Fahrersitz. Aus der Ferne","39"
"Blacky","sieht es tatsächlich so aus als würde da jemand drin sitzen.","39"
"Blacky","JUSTUS          Derek hat sich also geirrt. (plötzlich eifrig) Aber…","39"
"Blacky","PETER           Just? Was ist denn?","39"
"Blacky","JUSTUS          Ich habe den Wagen bereits heute morgen auf dem Weg zu Mrs. Kretschmer","39"
"Blacky","bemerkt.","39"
"Blacky","BOB             Ach! Ja, das stimmt! Und gestern hat er auch schon hier gestanden. Ich habe","39"
"Blacky","direkt neben ihm gehockt, während wir uns um Mr. Blake gekümmert","39"
"Blacky","haben.","39"
"Blacky","PETER           Könnte das vielleicht der Wagen von Bishop Blake sein?","39"
"Blacky","JUSTUS          Hm. Blake war bestimmt mit dem Wagen hier. Die Frage ist nur: Weshalb","39"
"Blacky","befinden sich hier auf der Fahrbahn Bremsspuren?","39"
"Blacky","PETER           Weil da jemand gebremst hat?","39"
"Blacky","JUSTUS          Ja, exakt. Bevor es gestern geknallt hat, haben Bremsen gequietscht. Da hat","39"
"Blacky","jemand versucht, sein Auto zum Stehen zu bringen, aber warum sollte","39"
"Blacky","jemand bremsen, wenn er einen Menschen überfahren will?","39"
"Blacky","PETER           Aber Mr. Blake wurde doch überfahren.","39"
"Blacky","JUSTUS          Aber nicht mit Absicht! Der Fahrer hat versucht, den Zusammenstoß zu","39"
"Blacky","verhindern. Dass er danach trotzdem abgehauen ist, steht auf einem","39"
"Blacky","anderen Blatt. Aber wenn Bishop Blake nicht absichtlich angefahren worden","39"
"Blacky","ist, dann…","39"
"Blacky","BOB             Dann war der Fahrer womöglich auch nicht der Schachspieldieb. Und das","39"
"Blacky","hieße wiederum…","39"
"Blacky","JUSTUS          Dass das Schachspiel eventuell gar nicht gestohlen wurde! Kollegen, hat","39"
"Blacky","jemand von euch eine Taschenlampe dabei?","39"
"Blacky","BOB             Ich nicht.","39"
"Blacky","PETER           Hier, ich!","39"
"Blacky","JUSTUS          Gib her! Oh! Da, seht euch das an. In dem Fußraum des Beifahrersitzes liegt","39"
"Blacky","Bishop Blakes Spazierstock. Moment. Auf der Auktion hatte Blake seinen","39"
"Blacky","Spazierstock noch bei sich. Also muss er, bevor er angefahren worden ist,","39"
"Blacky","den Stock noch in seinen Wagen gelegt haben.","39"
"Blacky","BOB             Ja!","40"
"Blacky","JUSTUS          Er schließt also die Beifahrertür auf und legt den Stock hinein. Dann geht er","40"
"Blacky","um seinen Wagen herum, um die Fahrertür aufzuschließen, …","40"
"Blacky","PETER           Ja…","40"
"Blacky","JUSTUS          … und die ist unverschlossen! (Autotür wird geöffnet) Was verrät uns diese","40"
"Blacky","Tatsache, Kollegen?","40"
"Blacky","BOB             Dass Blake gerade einsteigen wollte, als er angefahren wurde.","40"
"Blacky","JUSTUS          Genau! Und deshalb hatte er seinen Autoschlüssel in der Hand, denn er","40"
"Blacky","wollte ja jeden Moment losfahren. Also wird er ihn kaum wieder in die","40"
"Blacky","Manteltasche gesteckt haben. Habt ihr einen Schlüssel gesehen, als Blake","40"
"Blacky","auf der Straße lag?","40"
"Blacky","BOB             Nee…","40"
"Blacky","PETER           Nein… Aber vielleicht liegt er ja unter dem… Justus, gib mir mal die","40"
"Blacky","Taschenlampe!","40"
"Blacky","JUSTUS          Hier!","40"
"Peter","ächzt und kramt unter dem Auto.","40"
"Peter","PETER           Leute, ta-daaa! (lacht, Schlüssel klimpert)","40"
"Peter","BOB             Nein!","40"
"Peter","PETER           Da ist er.","40"
"Peter","JUSTUS          Schnell, Zweiter, schließ den Kofferraum auf!","40"
"Peter","PETER           Ja, bin schon dabei.","40"
"REGIE","Kofferraum wird aufgeschlossen und geöffnet.","40"
"Peter","JUSTUS          Oh! Kollegen, das gibt es doch nicht!","40"
"Peter","PETER           Der Kasten mit dem Schachspiel!","40"
"Peter","BOB             Ja, ist es denn zu fassen! Die ganze Zeit suchen wir nach falschen Ärzten,","40"
"Peter","Sportlehrern und anderen Personen, und dabei liegt das Schachspiel die","40"
"Peter","ganze Zeit direkt vor unserer Haustür!","40"
"Peter","PETER           Mr. Blake hat nur geglaubt, dass das Spiel gestohlen wurde, weil ich ihm","40"
"Peter","erzählt habe, dass es verschwunden ist! Er konnte sich ja nicht mehr","40"
"Peter","erinnern. Was ich aber nicht verstehe: Warum wurde es nicht gestohlen.","40"
"Peter","JUSTUS          Dafür gibt es nur eine logische Erklärung. Der Unfallfahrer hatte absolut","40"
"Peter","nichts mit dem Schachspiel zu tun.","41"
"Peter","PETER           Okay, dann schlage ich vor, dass wir jetzt herausfinden, was das Brett so","41"
"Peter","wertvoll macht. Und dann ist der Fall gelöst.","41"
"Peter","JUSTUS          Einverstanden. Los, gehen wir zurück in die Zentrale.","41"
"Peter","PETER           Ja!","41"
"Peter","BOB             Okay.","41"
"REGIE","Kofferraum wird zugeklappt, Schritte","41"
"REGIE","Musik","41"
"Peter","ERZÄHLER        In der Zentrale machten sich die drei Detektive sogleich daran, das","41"
"REGIE","Schachspiel genauestens zu untersuchen. Justus entdeckte schließlich, dass","41"
"REGIE","die einzelnen Schachfelder offenbar nicht miteinander verleimt, sondern","41"
"REGIE","irgendwie ineinander gesteckt waren. Sie ließen sich mit der Handfläche","41"
"REGIE","gegen einander verschieben. Plötzlich löste sich ein Teil, und Justus hatte das","41"
"REGIE","Feld C3 in der Hand.","41"
"Peter","JUSTUS          Oh! Also, unter dem Feld befindet sich nichts.","41"
"Peter","PETER           Und was ist mit den anderen Feldern?","41"
"REGIE","Knirschen","41"
"Peter","JUSTUS          Die sitzen alle fest.","41"
"Peter","BOB             Ist ja auch logisch, sonst würden ja alle Felder herausfallen, wenn man das","41"
"Peter","Brett auf den Kopf stellt.","41"
"Peter","PETER           So wie ich dich kenne, Erster, wirst du den Rest der Nacht in der Zentrale","41"
"Peter","verbringen und weitersuchen. Aber es ist schon ein Uhr, und ich muss","41"
"Peter","dringend ins Bett, also ich bin raus aus der Nummer, Leute.","41"
"Peter","BOB             Ich komm auch gleich mit. Wartest du noch fünf Minuten, Peter? Ich fahr","41"
"Peter","nur noch schnell den Rechner runter, ja?","41"
"Peter","PETER           Ach sorry, Bob, aber ich kann wirklich nicht mehr. Komm jetzt mit oder bis","41"
"Peter","morgen.","41"
"Peter","BOB             Dann vergiss es, bis morgen, ja?","41"
"Peter","PETER           Ja, bis morgen, schlaft gut!","41"
"Peter","BOB             Ciao!","41"
"Peter","JUSTUS          Gute Nacht!","41"
"REGIE","Tür wird geöffnet und wieder geschlossen. Tippen am Rechner. Bob seufzt.","41"
"Peter","JUSTUS          Das ist ja… Hey, Bob!","42"
"Peter","BOB             Ja?","42"
"Peter","JUSTUS          Sieh dir das mal an!","42"
"Blacky","krächzt.","42"
"Blacky","BOB             Hast du was gefunden, Erster?","42"
"Blacky","JUSTUS          In den Rändern der umliegenden Felder sind schmale Führungsschienen","42"
"Blacky","eingeschnitzt. (Kratzen) Auf diese Weise sind die Felder ineinander verankert","42"
"Blacky","und können nicht herausfallen, aber man kann sie verschieben. Komm mal","42"
"Blacky","her! Man kann die Felder bewegen wie bei einem Schiebepuzzle. Mal sehen.","42"
"Blacky","Wenn ich die Lansky-Eröffnung mit den Feldern spiele, also das Feld B1 auf","42"
"Blacky","die freie Fläche von C3 schiebe, dann… (Klicken)","42"
"Blacky","BOB             Da hat es doch ganz deutlich im Inneren des Schachbretts geklickt oder…","42"
"Blacky","JUSTUS          Nichts. Und wenn man das Brett herumdreht… (Klackern) Was ist das denn?","42"
"Blacky","Das halbe Brett bleibt auf dem Tisch liegen! Die Bodenplatte hat einen","42"
"Blacky","Hohlraum!","42"
"Blacky","BOB             Just! Du hast ein Versteck gefunden! Was ist denn da drin?","42"
"Blacky","JUSTUS          Ein kleiner Umschlag.","42"
"Blacky","BOB             Und da ist noch was. Das sieht aus wie ein Farbband für eine alte","42"
"Blacky","Schreibmaschine.","42"
"Blacky","JUSTUS          Das ist ein Mikrofilm!","42"
"Blacky","BOB             Und was bedeutet das?","42"
"Blacky","JUSTUS          Das bedeutet, dass Gregor Lansky damals wirklich überwacht wurde und","42"
"Blacky","zwar zu Recht. Er war nämlich ein Spion!","42"
"Blacky","BOB             Ja, das… (erschrockener Laut)","42"
"Blacky","JUSTUS          (erschrockener Laut)","42"
"REGIE","Gepolter. Musik setzt ein. Blacky krächzt.","42"
"Blacky","GRIFFIN SILVERMAN Da habt ihr es also doch herausgefunden!","42"
"Blacky","PETER           (ächzt)","42"
"Blacky","BOB             Peter!","42"
"Blacky","JUSTUS          Was…?","42"
"Blacky","BOB             Mr. Silverman!","43"
"Blacky","JUSTUS          Nehmen Sie die Pistole runter und lassen Sie ihn los!","43"
"Blacky","PETER           (verzweifelt) Ich… ich konnte nichts machen! Er hat mich draußen","43"
"Blacky","überwältigt!","43"
"Blacky","GRIFFIN SILVERMAN Gebt mir mein Schachbrett, und lasst euch danach nie wieder blicken! Na,","43"
"Blacky","wird’s bald!","43"
"REGIE","Ein Kampfschrei ertönt. Kampfgeräusche, Stöhnen. Blacky krächzt aufgeregt.","43"
"Blacky","JUSTUS          Mrs. Chiccarelli!","43"
"Blacky","SAM CHICCARELLI Los, Jungs! Gebt mir irgendwas, womit ich diesen Kerl fesseln kann!","43"
"Blacky","BOB             Ja, äh… Ja, hier, warten Sie, hier, das Paketklebeband!","43"
"Blacky","SAM CHICCARELLI Wickelt es schön stramm um seine Hände und Füße. Halt still!","43"
"REGIE","Geräusch von abreißendem Klebeband","43"
"Blacky","GRIFFIN SILVERMAN (stöhnt auf) Sagt mal, spinnt ihr!","43"
"Blacky","SAM CHICCARELLI Fester! So, das reicht.","43"
"Blacky","JUSTUS          (keucht) Mrs. Chiccarelli, was machen Sie denn hier?","43"
"Blacky","SAM CHICCARELLI Nachdem ihr eben bei mir wart, hat mir die ganze Geschichte keine Ruhe","43"
"Blacky","gelassen. Also bin ich hierher gefahren, um herauszufinden, wer ihr","43"
"Blacky","eigentlich seid und was ihr treibt. Ich hatte ja eure Visitenkarte.","43"
"Blacky","JUSTUS, PETER & BOB (unisono) Aha!","43"
"Blacky","PETER           Verstehe.","43"
"Blacky","SAM CHICCARELLI Aber dann habe ich gesehen, wie dieser Kerl euren Freund überfallen hat.","43"
"Blacky","Also bin ich ihm nachgeschlichen. Und jetzt wüsste ich endlich gern, was hier","43"
"Blacky","überhaupt gespielt wird.","43"
"Blacky","PETER           Ja, da sind Sie nicht die Einzige…","43"
"Blacky","JUSTUS          Also: Gregor Lansky war ein Spion für den russischen Geheimdienst. Ich habe","43"
"Blacky","das Geheimfach in dem Schachbrett entdeckt und diesen Mikrofilm darin","43"
"Blacky","gefunden. Und das beweist, dass Gregor Lansky nicht unter","43"
"Blacky","Verfolgungswahn litt. Die Gerüchte stimmten: Er war ein Spion. Und das","43"
"Blacky","wollte sein Sohn mit aller Macht geheimhalten, vor allem vor Bishop Blake,","43"
"Blacky","der auch mit der Geschichte zu tun hatte. Ich vermute, er wollte Lansky","43"
"Blacky","enttarnen. Habe ich Recht, Mrs. Chiccarelli?","43"
"Blacky","SAM CHICCARELLI Das stimmt. Blake hat nach feindlichen Spionen gefahndet.","43"
"Blacky","GRIFFIN SILVERMAN Bishop Blake ist ein Monster. Er hat das Leben meines Vaters zerstört. Blake","44"
"Blacky","hat ihn immer noch gejagt, nachdem mein Vater längst aufgehört hatte für","44"
"Blacky","den russischen Geheimdienst zu arbeiten.","44"
"Blacky","PETER           Können Sie das etwas genauer erklären?","44"
"Blacky","GRIFFIN SILVERMAN Mein Vater war ein weltberühmter Schachspieler, bis er eines Tages aus der","44"
"Blacky","Öffentlichkeit verschwand. Aber die ganze Wahrheit erfuhr ich erst vor drei","44"
"Blacky","Jahren, als er im Sterben lag.","44"
"Blacky","BOB             Was? Ihr Vater ist tot?","44"
"Blacky","GRIFFIN SILVERMAN Ja. Als junger Mann war er vom politischen System in der Sowjetunion sehr","44"
"Blacky","angetan. Die Welt dort schien ihm gerechter zu sein, und es gefiel ihm auch,","44"
"Blacky","dass Schach dort einen sehr viel höheren Stellenwert hatte als hier. Viele","44"
"Blacky","Turniere fanden in der Sowjetunion statt, und dort hatte man","44"
"Blacky","mitbekommen, dass er mit dem Kommunismus sympathisierte.","44"
"Blacky","PETER           Ja, und dann?","44"
"Blacky","GRIFFIN SILVERMAN Wurde er angesprochen, ob er für den sowjetischen Geheimdienst arbeiten","44"
"Blacky","wolle. Mein Vater sagte ja und betätigte sich als Kurier. Zu diesem Zweck ließ","44"
"Blacky","er sich ein spezielles Schachbrett bauen. In dem Geheimfach transportierte","44"
"Blacky","er Dokumente von Ost nach West und von West nach Ost.","44"
"Blacky","BOB             Aber dann ist man ihm auf die Schliche gekommen.","44"
"Blacky","GRIFFIN SILVERMAN Ja. Ich kenne die Einzelheiten nicht, aber irgendwie war ihm Bishop Blake auf","44"
"Blacky","der Spur. Blake hatte eine Ahnung, aber keine Beweise. Doch mein Vater","44"
"Blacky","fürchtete ihn und lebte jahrelang in der Angst entdeckt zu werden.","44"
"Blacky","krächzt kurz.","44"
"Blacky","SAM CHICCARELLI Weiter!","44"
"Blacky","GRIFFIN SILVERMAN Eines Tages wurde sein Schachspiel am helllichten Tag aus einem Restaurant","44"
"Blacky","gestohlen. Mein Vater war sicher, dass Bishop Blake der Dieb war. Und so","44"
"Blacky","rechnete er fest damit, dass man ihn sofort festnehmen und anklagen und","44"
"Blacky","einsperren würde. Also tauchte er unter und nie wieder auf. Denn von","44"
"Blacky","diesem Tag an wurde er von Bishop Blake gejagt. (atmet tief) Er musste seine","44"
"Blacky","Schachkarriere beenden, um seine Freiheit zu retten. All das habe ich erst","44"
"Blacky","am Ende seines Lebens erfahren.","44"
"Blacky","JUSTUS          Sie wollten seinen Ruf und seinen Namen retten. Wenn ich das alles richtig","44"
"Blacky","verstehe, dann hatten weder Sie noch Ihr Vater eine Ahnung, wo das","44"
"Blacky","Schachspiel die ganze Zeit war.","44"
"Blacky","GRIFFIN SILVERMAN Nein. Wir dachten immer, dass Blake es damals gestohlen hätte und mein","44"
"Blacky","Vater ihm nur knapp entkommen wäre. Aber dann habe ich die Geschichte","44"
"Blacky","mit der Versteigerung und dem Schachspiel und dem Unfall in der Zeitung","44"
"Blacky","gelesen. Bishop Blakes Name wurde erwähnt, sonst wäre ich gar nicht erst","45"
"Blacky","hellhörig geworden.","45"
"Blacky","BOB             Und da ist Ihnen klar geworden, dass es um das Schachspiel Ihres Vaters","45"
"Blacky","gehen musste. Warum sonst hätte Blake so viel dafür gezahlt.","45"
"Blacky","GRIFFIN SILVERMAN Wo es allerdings die ganze Zeit tatsächlich war, wenn Blake es nicht hatte,","45"
"Blacky","und warum es dann so plötzlich wieder aufgetaucht ist, davon habe ich keine","45"
"Blacky","Ahnung.","45"
"Blacky","JUSTUS          Das können wir Ihnen später noch alles erzählen und Ihnen auch die","45"
"Blacky","Tagebuchaufzeichnungen Ihrer Tante zeigen. Dann werden Sie alles","45"
"Blacky","verstehen.","45"
"Blacky","GRIFFIN SILVERMAN Aha.","45"
"Blacky","SAM CHICCARELLI (scharf) Und warum sind Sie in mein Haus eingedrungen?","45"
"Blacky","GRIFFIN SILVERMAN Weil Blake mir im Krankenhaus gesagt hat, dass Sie das Schachspiel hätten.","45"
"Blacky","SAM CHICCARELLI (lacht ungläubig auf)","45"
"Blacky","JUSTUS          Er hatte Ihren Namen erwähnt, nachdem er angefahren worden war, Mrs.","45"
"Blacky","Chiccarelli.","45"
"Blacky","PETER           Und mir gegenüber hat er behauptet, er hätte den Namen Sam Chiccarelli","45"
"Blacky","noch nie gehört! Ich verstehe überhaupt nichts mehr.","45"
"Blacky","JUSTUS          Wie wäre es, Mrs. Chiccarelli, wenn Sie uns nun Ihre Version der ganzen","45"
"Blacky","Geschichte erzählen.","45"
"Blacky","SAM CHICCARELLI Das sind Regierungsgeheimnisse. Das geht euch gar nichts an.","45"
"REGIE","Rascheln von Papier","45"
"Blacky","SAM CHICCARELLI Was machst du denn da?","45"
"Blacky","JUSTUS          Ich sehe mir die Fotos an, die ebenfalls in dem Schachbrett versteckt waren.","45"
"Blacky","Und ich glaube, ich verstehe jetzt ein bisschen besser, was wirklich","45"
"Blacky","geschehen ist.","45"
"Blacky","BOB             Aber… was denn, Justus? Was ist auf den Bildern zu sehen?","45"
"Blacky","PETER           Ja!","45"
"REGIE","Musik setzt ein.","45"
"Blacky","JUSTUS          Bishop Blake in jungen Jahren. Und zwar irgendwo im Ostblock, wie mir das","45"
"Blacky","Straßenschild in kyrillischer Schrift verrät. Er wurde heimlich dabei","45"
"Blacky","fotografiert, wie er sich mit einem Mann trifft und ihm ein Päckchen gibt.","45"
"Blacky","SAM CHICCARELLI (lacht abschätzig auf) Habe ich’s doch gewusst.","45"
"Blacky","JUSTUS          „Mein Leben hängt von diesem Schachspiel ab.“ – Das hat nicht nur Ihr Vater","46"
"Blacky","immer wieder behauptet, Mr. Silverman, sondern auch Bishop Blake. Und","46"
