"Speaker","Text","Page"
"REGIE","MÄNNLICHE STIMME Vergiss es! Over!","26"
"REGIE","WEIBLICHE STIMME (über Skype) Robert! Hallo! Robert, bist du noch ON?","26"
"REGIE","Kauz ruft","26"
"REGIE","PETER           Das darf ja wohl nicht wahr sein! Raven also!","26"
"REGIE","Musik","26"
"REGIE","ERZÄHLER        Früh am nächsten Morgen wollten sich die drei Detektive Raven vornehmen,","26"
"REGIE","doch gerade, als sie auf das Wohnhaus zugingen, kam ihnen Dusty","26"
"REGIE","entgegengelaufen. Sein Gesicht glühte.","26"
"REGIE","DUSTY           Jungs!","26"
"REGIE","BOB             Dusty!","26"
"REGIE","DUSTY           Gut, dass ich euch noch erwische! Habt ihr Raven gesehen?","26"
"REGIE","JUSTUS          Nein, ist denn etwas passiert?","26"
"REGIE","DUSTY           Diesen Zettel habe ich gerade vor meiner Tür gefunden!","26"
"REGIE","JUSTUS          Darf ich mal? (liest vor) „Hallo Opa Dusty, ich muss heute dringend mit","26"
"REGIE","einem Freund reden. Bin später wieder da. Bitte halte Abstand von den drei","26"
"REGIE","Jungen. Sie sind mir nicht geheuer.“","26"
"REGIE","BOB             Wie bitte?","26"
"REGIE","DUSTY           Warum soll ich denn Abstand von euch halten?","26"
"REGIE","JUSTUS          Was immer Raven oder Holly glauben: Wir sind keine Verbrecher. Darf ich","26"
"REGIE","Ihnen unsere Karte geben, Dusty?","26"
"REGIE","DUSTY           Danke. (liest vor) „Die drei Detektive. Wir übernehmen jeden Fall. Drei","26"
"REGIE","Fragezeichen. Erster Detektiv: Justus Jonas. Zweiter Detektiv: Peter Shaw.","26"
"REGIE","Recherchen und Archiv: Bob Andrews.“ – Und?","26"
"REGIE","BOB             Sagen Sie, Dusty, Sie haben doch gestern vormittag mit einem gewissen","26"
"REGIE","Dr. Hardwick telefoniert, oder?","26"
"REGIE","DUSTY           Mit wem soll ich telefoniert haben?","26"
"REGIE","BOB             Mit Dr. Hardwick, gestern vormittag. Kurz bevor Mr. Sobek ausgebrochen ist.","27"
"REGIE","DUSTY           Nein, daran könnte ich mich doch erinnern.","27"
"REGIE","BOB             Das gibt’s doch nicht!","27"
"REGIE","DUSTY           Ruhig, Sniffer, ganz ruhig, diese Jungs tun dir doch gar nichts!","27"
"REGIE","JUSTUS          Aber Sie kennen den Doktor, richtig?","27"
"REGIE","DUSTY           Ich sehe ihn manchmal, wenn er Miles besucht. Er ist sein langjähriger","27"
"REGIE","Hausarzt.","27"
"REGIE","BOB             Ich habe das Gespräch mitbekommen, und der Mann am Telefon, der klang","27"
"REGIE","genau wie Sie!","27"
"REGIE","DUSTY           Seltsam, dass du das sagst!","27"
"REGIE","BOB             Seltsam, warum?","27"
"REGIE","DUSTY           Es ist schon ein paar Mal vorgekommen, dass meine Stimme mit der von","27"
"REGIE","Miles verwechselt wurde.","27"
"REGIE","BOB             Das ist ja interessant!","27"
"REGIE","DUSTY           Oft halten die Anrufer mich für Miles und Miles für mich! (lacht)","27"
"REGIE","JUSTUS          Miles kann es jedoch auch nicht gewesen sein, denn der ist ja noch im","27"
"REGIE","Urlaub.","27"
"REGIE","DUSTY           Ja, auf Barbados.","27"
"REGIE","JUSTUS          Nicht vielleicht auf den Bahamas? Oder den Bermudas?","27"
"REGIE","DUSTY           Ach, ich bin mir gar nicht so sicher…","27"
"REGIE","JUSTUS          Hat er Ihnen denn nicht von seiner geplanten Reise erzählt?","27"
"REGIE","DUSTY           Nein.","27"
"REGIE","JUSTUS          Aber woher wissen Sie, wohin er wollte?","27"
"REGIE","DUSTY           Von Barclay oder Holly, ich weiß das nicht mehr so genau.","27"
"REGIE","JUSTUS          Sein Neffe Brian, der gestern morgen kurz vorbeikam, ging davon aus, dass","27"
"REGIE","sein Onkel wieder zurück sei. Was in Verbindung mit dem Telefonat den","27"
"REGIE","Verdacht aufkommen lässt, dass Miles überhaupt nicht mehr verreist ist,","27"
"REGIE","sondern sich bereits wieder auf Desert View befindet.","27"
"REGIE","DUSTY           Was? Nein, das kann doch nicht sein! Ich wäre ihm doch längst über den","27"
"REGIE","Weg gelaufen.","27"
"REGIE","PETER           Ja, aber… Wer hat dann mit Dr. Hardwick gesprochen, wenn Sie es nicht","28"
"REGIE","waren?","28"
"REGIE","BOB             Das möchte ich auch gern wissen!","28"
"REGIE","DUSTY           Och, das lässt sich ja leicht herausfinden. Wartet mal, Jungs. Ja, Sniffer, ja,","28"
"REGIE","fein! Herrchen will ja nur mit dem Handy den lieben Onkel Doktor anrufen.","28"
"REGIE","Ich drücke auf die Lautsprechertaste, dann könnt ihr mithören.","28"
"REGIE","BOB             Das ist toll.","28"
"REGIE","Freizeichen ertönt","28"
"REGIE","DR. HARDWICK    (am Telefon) Hardwick?","28"
"REGIE","DUSTY           Guten Morgen, Doktorchen! Dusty hier.","28"
"REGIE","DR. HARDWICK    (am Telefon) Guten Morgen! Na, was gibt’s denn so früh?","28"
"REGIE","DUSTY           Ähm, also, ähm… Sag mal, hast du zufällig gestern mit Miles telefoniert?","28"
"REGIE","DR. HARDWICK    (am Telefon) Ja, ich habe ihn angerufen und war froh, ihn endlich mal an die","28"
"REGIE","Strippe zu kriegen. Du weißt ja, wie es um seine Gesundheit steht.","28"
"REGIE","DUSTY           Ach, jaja, die Herz-Rhythmus-Störungen…","28"
"REGIE","DR. HARDWICK    (am Telefon) Ganz genau. Ich habe bei seiner letzten Untersuchung","28"
"REGIE","festgestellt, dass sein Medikament inzwischen viel zu schwach dosiert ist.","28"
"REGIE","Aber ich habe ihn nie erreicht. Schließlich habe ich Brian angerufen und ihn","28"
"REGIE","gebeten, seinem Onkel die neue Dosierung durchzugeben.","28"
"REGIE","DUSTY           Aha, verstehe. Aber gestern hast du doch mit Miles telefoniert?","28"
"REGIE","DR. HARDWICK    (am Telefon) Ja, ich wollte mich noch mal persönlich bei ihm vergewissern,","28"
"REGIE","aber Brian hatte ihm schon Bescheid gesagt. Stimmt denn etwas nicht?","28"
"REGIE","DUSTY           Nein, nein, alles in bester Ordnung. Du hörst von mir! Und grüß deine Frau.","28"
"REGIE","DR. HARDWICK    (am Telefon) Mache ich.","28"
"REGIE","PETER           (aufgeregt) Sie… sie halten ihn gefangen! Barclay und Holly halten Miles in","28"
"REGIE","seinem eigenen Haus gefangen! Es hätte nie jemand bemerkt, aber","28"
"REGIE","dummerweise hat Dr. Hardwick angerufen, und Barclay musste befürchten,","28"
"REGIE","dass der irgendwann misstrauisch wird und auf Desert View aufkreuzt.","28"
"REGIE","BOB             Ja! Also holte er Miles aus seinem Gefängnis und zwang ihn, mit","28"
"REGIE","Dr. Hardwick zu sprechen und so zu tun als wäre alles in bester Ordnung.","28"
"REGIE","Und jetzt braucht er auch noch dringend Medikamente!","28"
"REGIE","JUSTUS          Was ist, wenn Miles nicht gefangengehalten wird, sondern sich versteckt?","28"
"REGIE","DUSTY           Sich versteckt? Ja, aber warum denn?","29"
"REGIE","JUSTUS          Das entzieht sich leider meiner Kenntnis. Aber wenn es stimmt, dann","29"
"REGIE","versteckt er sich vor Holly, vor Miranda, vorseinem Neffen Brian und vor","29"
"REGIE","Ihnen, Dusty. Nicht jedoch vor Barclay! Dafür muss es einen Grund geben!","29"
"REGIE","Und ich könnte mir vorstellen, dass Raven diesen Grund kennt.","29"
"REGIE","DUSTY           Wovon redet ihr denn da?","29"
"REGIE","JUSTUS          Das erklären wir Ihnen gleich. Wir werden herausfinden, was hier gespielt","29"
"REGIE","wird. Dazu werden wir heute offiziell von hier abreisen. Aber heute Nacht","29"
"REGIE","kommen wir wieder, und Sie, Dusty, müssen bitte die Alarmanlage","29"
"REGIE","ausschalten.","29"
"REGIE","DUSTY           Hä?","29"
"REGIE","Musik","29"
"REGIE","ERZÄHLER        Am späten Abend, als auf Desert View alle Lichter erloschen waren,","29"
"REGIE","kletterten Justus, Bob und Peter auf die Mauerkrone direkt über dem","29"
"REGIE","Krokodilgehege und balancierten auf ihr entlang bis zum Pool.","29"
"REGIE","JUSTUS          (flüstert) Wir machen’s wie besprochen, Kollegen! Peter und ich gehen ins","29"
"REGIE","Haus, während du hier Wache hältst, Bob.","29"
"REGIE","BOB             (flüstert) Okay!","29"
"REGIE","JUSTUS          (flüstert) Wenn irgendwo das Licht angeht oder sich sonst etwas","29"
"REGIE","Verdächtiges tut, warnst du uns über Funk.","29"
"REGIE","BOB             (flüstert) Alles klar. Ich bleibe hier oben auf Posten. Von hier aus habe ich die","29"
"REGIE","beste Übersicht.","29"
"REGIE","PETER           (flüstert) Aber fall bloß nicht zu Mr. Sobek ins Gehege!","29"
"REGIE","BOB             (flüstert) Ich geb mir Mühe! Na los, haut schon ab, ihr zwei!","29"
"REGIE","Angestrengte Laute beim Herabspringen von der Mauer. Schritte","29"
"Justus","(flüstert) Los, ins Haus! (Türknarren) Dusty meinte, die einzige Möglichkeit","29"
"Justus","für einen geheimen Raum wäre im Keller, und der Kellereingang ist hinter","29"
"Justus","der Treppe.","29"
"Justus","PETER           (flüstert) Okay. Da ist die Tür! Du zuerst, aber lass das Licht aus! Wir nehmen","29"
"Justus","besser die Taschenlampen.","29"
"REGIE","Schritte","29"
"Justus","PETER           So, jetzt mache ich aber Licht. Hier ist ein Schalter.","29"
"Justus","JUSTUS          (erstaunter Laut) Ein Vorratskeller! Alles voller Lebensmittel. Und da an der","29"
"Justus","Wand lehnt ein Betäubungsgewehr.","30"
"Justus","PETER           Ja. Aber sonst ist hier nichts Auffälliges zu entdecken. Keine Geheimtür,","30"
"Justus","keine Bodenklappe… Nur diese große Kühltruhe in der Ecke.","30"
"Justus","JUSTUS          Merkwürdig. Sie ist mit einem Vorhängeschloss gesichert. Für dich doch eine","30"
"Justus","deiner leichtesten Übungen, oder, Zweiter?","30"
"Justus","PETER           Na klar! Warte. (Schlüsselklirren) Ach, geschafft!","30"
"Justus","JUSTUS          Dann mal hoch mit dem Deckel!","30"
"Justus","JUSTUS & PETER  (angestrengte Laute, Erschrecken)","30"
"Justus","JUSTUS          M-Miles Kendall! D-Das muss Miles Kendall sein!","30"
"Justus","PETER           Mach den Deckel wieder zu, Justus! (Deckel poltert)","30"
"Justus","PETER           Sie… sie haben ihn umgebracht! Barclay oder Holly oder beide zusammen","30"
"Justus","haben Miles Kendall umgebracht! Just, wir haben es hier mit Mördern zu","30"
"Justus","tun. Wir müssen sofort die Polizei verständigen!","30"
"Justus","JUSTUS          (unterbricht) Lass mich nachdenken, Zweiter!","30"
"Justus","PETER           Nachdenken? Wir müssen sofort abhauen! Sonst sind wir womöglich auch","30"
"Justus","noch dran.","30"
"Justus","JUSTUS          Raven muss es gewusst haben, und sie wollte nicht, dass Miranda von Miles‘","30"
"Justus","Tod erfährt, was früher oder später unweigerlich passiert wäre. Also hat sie","30"
"Justus","versucht, Miranda zu vertreiben.","30"
"Justus","HOLLY           (ruft aus einiger Entfernung) Bob! Er ist im Gehege von Mr. Sobek!","30"
"Justus","PETER           Das ist Holly!","30"
"Justus","HOLLY           (ruft aus einiger Entfernung) Das Tier wird ihn zerfetzen, wenn wir nichts","30"
"Justus","unternehmen! Ich hole das Betäubungsgewehr.","30"
"Justus","JUSTUS & PETER  (Erschrecken)","30"
"Justus","HOLLY           Was macht ihr denn hier?","30"
"Justus","JUSTUS          Das ist doch jetzt völlig unwichtig! Was ist mit Bob?","30"
"Justus","HOLLY           Er ist im Krokodilgehege!","30"
"Justus","JUSTUS          Peter, schnapp dir das Gewehr! Kannst du damit umgehen?","30"
"Justus","PETER           Das werden wir ja sehen. Los, komm!","30"
"REGIE","Eilige Schritte","30"
"Justus","JUSTUS          Bob! Da ist er, oben im Baum.","31"
"Justus","BOB             Oh Mann, gut, dass ihr kommt! Ich konnte mich hier rauf retten, aber","31"
"Justus","Mr. Sobek, der gibt keine Ruhe!","31"
"Justus","PETER           Das haben wir gleich!","31"
"Justus","BOB             Warte mal, Peter, du willst doch nicht etwa das Tier erschießen?","31"
"Justus","PETER           Nein, nur betäuben!","31"
"Justus","BOB             Ach so!","31"
"Justus","PETER           Hoffen wir, dass das Ding geladen ist.","31"
"REGIE","Gewehrschuss, Krokodil knurrt","31"
"Justus","BOB             Ja, wunderbar, ich glaube, du hast ihn wirklich getroffen!","31"
"Justus","JUSTUS          Wie bist du überhaupt da reingekommen, Bob? Bist du von der Mauer","31"
"Justus","gestürzt?","31"
"Justus","BOB             Ganz genau! Ausgerechnet Miranda hat mich für einen Einbrecher gehalten.","31"
"Justus","Sie hat irgendwas nach mir geworfen, und dann bin ich abgestürzt. Als sie","31"
"Justus","gesehen hat, dass ich es bin, da hat sie Barclay und Holly alarmiert.","31"
"Justus","PETER           So, Leute, Mr. Sobek scheint jetzt zu pennen.","31"
"Justus","BOB             Hoffentlich! Gut, dann mache ich mich jetzt mal ans Runterklettern. (ächzt)","31"
"Justus","Warte mal, gleich bin ich unten. (ächzt) Ihr glaubt ja gar nicht, worauf ich","31"
"Justus","beim Sturz ins Gehege gefallen bin. Seht euch das mal an, Freunde! Na?","31"
"Justus","JUSTUS & PETER  (unisono) Ein Koffer?!?","31"
"Justus","BOB             Ja, da guckt ihr, was? Aber jetzt lasst mich erst mal ganz schnell raus hier,","31"
"Justus","bevor Mr. Sobek wieder aus seinen Träumen erwacht. Los!","31"
"REGIE","Gehegegitter klappert","31"
"REGIE","Musik","31"
"Justus","ERZÄHLER        Eine Viertelstunde später versammelten sich die drei Detektive und alle","31"
"REGIE","anwesenden Mitbewohner in der geräumigen Wohnhalle.","31"
"Justus","JUSTUS          (räuspert sich) So. Gut. Und jetzt rufe ich die Polizei.","31"
"Justus","BARCLAY         Ich glaube nicht, dass das nötig ist.","31"
"Justus","JUSTUS          Barclay. Wir haben die Gefriertruhe im Keller geöffnet. Sie haben","31"
"Justus","wortwörtlich eine Leiche im Keller! Dieser Umstand liegt weit außerhalb","31"
"Justus","unseres selbst gesteckten Kompetenzbereichs als Detektive. Es ist daher","31"
"Justus","unbedingt vonnöten… (bricht ab)","32"
"Justus","DUSTY           (unterbricht) Leiche im Keller? Barclay, wovon redet der Junge?","32"
"Justus","HOLLY           (seufzt) Es ist Miles. Er ist tot, Dusty.","32"
"Justus","DUSTY           Wie bitte?","32"
"Justus","HOLLY           Er liegt unten im Keller in der Tiefkühltruhe.","32"
"Justus","DUSTY           Aber wie… (bricht ab)","32"
"Justus","PETER           (unterbricht) Sie haben ihn umgebracht!","32"
"Justus","DUSTY           Wer?","32"
"Justus","PETER           Holly! Barclay! Beide, was weiß ich? Jedenfalls war es Mord!","32"
"Justus","RAVEN           Nein! Nein, das war es nicht.","32"
"Justus","DUSTY           Raven, da bist du ja wieder! Dem Himmel sei Dank! Was geht hier nur vor?","32"
"Justus","RAVEN           Opa Dusty, bitte verzeih mir! (schluchzt)","32"
"Justus","DUSTY           (leise) Ja, ist ja gut…","32"
"Justus","BARCLAY         (räuspert sich) Also… Ich werde euch die Geschichte erzählen. Die ganze","32"
"Justus","Wahrheit. Es war vor einer Woche. Dusty war einkaufen, Holly schlief noch,","32"
"Justus","Raven besuchte einen Freund. Und ich war in der Werkstatt. Und Miles","32"
"Justus","drehte seine morgendlichen Runden im Pool. Und plötzlich trieb er im","32"
"Justus","Wasser, das Gesicht nach unten. Ich tippe auf einen Herzinfarkt. Miles war","32"
"Justus","nicht mehr der Jüngste und auch nicht gerade der Gesündeste. Gemeinsam","32"
"Justus","mit Holly habe ich Miles aus dem Wasser gezogen.","32"
"Justus","HOLLY           Er war eindeutig tot. Ich wollte sofort den Notarzt und die Polizei anrufen.","32"
"Justus","BARCLAY         Ja, das stimmt, aber ich habe sie zurückgehalten, denn ich war in Gedanken","32"
"Justus","schon einen Schritt weiter.","32"
"Justus","JUSTUS          Sie hatten Angst, dass Desert View nach dem Tod Ihres Freundes direkt an","32"
"Justus","seinen Neffen Brian geht. Und dass der sämtliche Bewohner ohne zu zögern","32"
"Justus","rauswerfen würde, ist wohl relativ sicher.","32"
"Justus","BARCLAY         Hm, ganz genau.","32"
"Justus","JUSTUS          Und da haben Sie sich gedacht, dass niemand von Miles‘ Tod erfahren muss.","32"
"Justus","HOLLY           Nur solange, bis wir Gewissheit über das Testament haben. Aber wir haben","32"
"Justus","es noch nicht gefunden.","32"
"Justus","PETER           Und da haben Sie Ihren Freund einfach in eine Tiefkühltruhe gepackt, ich","32"
"Justus","fasse es nicht!","32"
"Justus","HOLLY           Du hast keine Ahnung, wie schwer uns das gefallen ist. Ich wollte das nicht","33"
"Justus","tun. Und Barclay auch nicht! Wir wollten ein anständiges Begräbnis für ihn,","33"
"Justus","und das wollen wir auch immer noch. Aber es wäre Miles‘ Wunsch gewesen,","33"
"Justus","dass wir so lange auf Desert View wohnen bleiben können wie wir wollen.","33"
"Justus","BARCLAY         Ja, das hat er oft genug gesagt. Er wollte, dass wir für immer hierbleiben.","33"
"Justus","HOLLY           Ihn in diese Truhe zu legen, war das Schlimmste, was ich jemals tun musste.","33"
"Justus","Ich habe ihm noch seinen Bademantel angezogen, (schluchzt) damit er nicht","33"
"Justus","friert! (schluchzt)","33"
"Justus","DUSTY           Warum habt ihr mir denn nichts gesagt? Miles war doch auch mein Freund!","33"
"Justus","BARCLAY         Wir hätten es dir gesagt, Dusty, bestimmt, aber wir hatten solche Angst, dass","33"
"Justus","du es nicht verkraften würdest. Also haben wir dir erzählt, dass Miles","33"
"Justus","spontan verreist ist.","33"
"Justus","JUSTUS          Und in diesem Schockzustand kann man die Bermudas, Barbados und die","33"
"Justus","Bahamas natürlich leicht durcheinanderbringen.","33"
"Justus","BOB             Aber was war denn ihr Plan gewesen? Nach Miles‘ letztem Willen zu suchen,","33"
"Justus","und dann? Wenn er sein Testament nicht zu Ihren Gunsten gemacht hätte,","33"
"Justus","dann hätten Sie ihn in der Kühltruhe gelassen?","33"
"Justus","BARCLAY         Wir hatten keinen Plan. Wir mussten von Tag zu Tag reagieren.","33"
"Justus","HOLLY           Und dann seid auch noch ihr drei Jungs aufgetaucht. Für einen Plan war","33"
"Justus","überhaupt keine Zeit.","33"
"Justus","JUSTUS          Trotzdem gab es noch jemanden, der in das Geheimnis eingeweiht war.","33"
"Justus","Nämlich Raven! Wie hast du es herausbekommen?","33"
"Justus","RAVEN           Ich habe alles belauscht, jedes Wort mitbekommen. Auch, dass sie Opa","33"
"Justus","Dusty erst mal nichts sagen wollten. Und Miranda auch nicht.","33"
"Justus","JUSTUS          Und dann hast du beschlossen, dass Miranda niemals etwas erfahren darf.","33"
"Justus","RAVEN           Ja. Sie ist neu hier, sie hätte das Geheimnis niemals für sich behalten. Und","33"
"Justus","dann hätte dieser Brian Desert View bekommen, und Opa Dusty hätte seinen","33"
"Justus","Koffer packen müssen.","33"
"Justus","JUSTUS          Also hast du versucht, sie zu vertreiben, mithilfe deines Freundes Robert. Und","33"
"Justus","als wir dann auch noch aufgetaucht sind, hast du zunächst versucht, uns wie","33"
"Justus","Einbrecher aussehen zu lassen, indem du nachts den Alarm ausgelöst hast.","33"
"Justus","BOB             Ja, aber Barclay hat uns geglaubt, dass wir unschuldig waren. Also hast du","33"
"Justus","dann auch noch das Krokodil freigelassen.","33"
"Justus","RAVEN           Das stimmt nicht! Alles andere ja, aber das mit dem Einbruch und Mr. Sobek","33"
"Justus","war ich nicht!","33"
"Justus","BOB             Ach, wie auch immer. Ich verstehe an dieser ganze Geschichte aber eins","34"
"Justus","überhaupt nicht: Das Telefonat mit dem Arzt. Wer hat vorgestern morgen","34"
"Justus","mit Dr. Hardwick gesprochen, ich habe das Gespräch nämlich zufällig","34"
"Justus","mitbekommen. Barclay, Sie sind rangegangen, und dann haben Sie","34"
"Justus","jemanden ans Telefon geholt. Wer war das?","34"
"Justus","BARCLAY         Der Mann am Telefon, das war ich!","34"
"Justus","BOB             Was?","34"
"Justus","BARCLAY         Ich bin Schauspieler! (räuspert sich und spricht mit Dustys Stimme) Früher","34"
"Justus","bin ich auf kleinen Bühnen aufgetreten und habe Politiker nachgemacht.","34"
"Justus","BOB             Das ist ja unglaublich!","34"
"Justus","BARCLAY         Ja, es fällt mir ziemlich leicht Miles nachzuahmen. Immerhin habe ich lange","34"
"Justus","Jahre mit ihm zusammengewohnt. Und die Tatsache, dass Miles und Dusty","34"
"Justus","stimmlich so ähnlich klingen, hat mir das Ganze noch leichter gemacht. Es","34"
"Justus","gab am Telefon eh immer Verwechslungen.","34"
"Justus","PETER           Unglaublich!","34"
"Justus","JUSTUS          Verstehe… Sie haben eine Menge Leute täuschen können. Aber das","34"
"Justus","Testament haben Sie nicht gefunden.","34"
"Justus","BARCLAY         Nee. Miles hat mal gesagt, er hätte die wirklich wichtigen Papiere an einem","34"
"Justus","sehr sicheren Ort untergebracht. Ja, wir wissen aber nicht, wo!","34"
"Justus","JUSTUS          Ein „sehr sicherer Ort“? Kollegen, denkt ihr das gleiche wie ich?","34"
"Justus","PETER           Und ob!","34"
"Justus","BOB             Ja, da würde mir was einfallen.","34"
"Justus","JUSTUS          Ein Krokodilgehege ist ein ziemlich sicherer Ort, möchte ich meinen,","34"
"Justus","zumindest, wenn man kein Krokodilbändiger ist.","34"
"Justus","BOB             Dieser Koffer hier war darin versteckt. In einem Strauch. So, dann wollen wir","34"
"Justus","doch mal sehen. (öffnet den Koffer) Papiere… Lebensversicherung…","34"
"Justus","Wertpapiere… Grundstücksurkunden… Und hier: ein Testament.","34"
"Justus","HOLLY           Und, was steht drin?","34"
"Justus","BOB             (liest leise für sich)","34"
"Justus","DUSTY           Psst, ruhig, Sniffer! Mach Platz!","34"
"Justus","BOB             Hier steht, dass im Falle seines Ablebens das gesamte Vermögen von Miles","34"
"Justus","Kendall inklusive seines Anwesens Desert View an seinen einzigen noch","34"
"Justus","lebenden Verwandten vererbt wird, seinen Neffen Mr. Brian Kendall. Das","34"
"Justus","Testament wurde aufgesetzt und unterzeichnet vor zwei Jahren. Ja, es ist","34"
"Justus","notariell beglaubigt.","35"
"Justus","BARCLAY         Hm, ja, das war’s. Aus und Ende.Wir werden unsere Sachen packen und","35"
"Justus","Desert View verlassen müssen.","35"
"REGIE","Musik","35"
"Justus","ERZÄHLER        Um Mitternacht erschien die Polizei auf dem Anwesen. Kurz darauf betrat","35"
"REGIE","Brian Kendall die Szenerie, der erste Detektiv hatte ihn ebenfalls verständigt.","35"
"Justus","BRIAN           Barclay! Ist das wahr? Mein Onkel ist tot?","35"
"Justus","BARCLAY         Ja, leider. Er ist im Pool ertrunken, vor einer Woche.","35"
"Justus","BRIAN           Was, vor einer Woche? Und das erfahre ich erst jetzt? Vorgestern war ich","35"
"Justus","noch hier, und Sie sagten, mein Onkel wäre auf den Bahamas!","35"
"Justus","JUSTUS          Äh… Mr. Kendall? Wann haben Sie das letzte Mal mit Dr. Hardwick","35"
"Justus","gesprochen?","35"
"Justus","BRIAN           Was, wie bitte?","35"
"Justus","JUSTUS          Dr. Hardwick. Ein alter Freund Ihrer Familie. Aber ich helfe Ihrer Erinnerung","35"
"Justus","gern auf die Sprünge: Es ist erst ein paar Tage her. Dr. Hardwick bat Sie, sich","35"
"Justus","mit Ihrem Onkel in Verbindung zu setzen, da er ihn selbst nicht erreichen","35"
"Justus","konnte. Sie sollten ihm dringend die neue Medikamentendosierung durch-","35"
"Justus","geben, um einem Herzinfarkt vorzubeugen.","35"
"Justus","BRIAN           Ja, ja, das mag sein.","35"
"Justus","JUSTUS          Das haben Sie jedoch nicht einmal in Erwägung gezogen! Stattdessen haben","35"
"Justus","Sie sich überlegt, dass nun ein guter Zeitpunkt wäre, das Testament Ihres","35"
"Justus","Onkels zu Ihren Gunsten zu ändern.","35"
"Justus","BRIAN           Was?","35"
"Justus","JUSTUS          Monatelang haben Sie versucht, Ihren Onkel dazu zubewegen, sein Geld","35"
"Justus","gewinnbringend anzulegen, anstatt es für seine Freunde auszugeben. Doch","35"
"Justus","immer hatte er davon gesprochen, denen sein Vermögen zu hinterlassen.","35"
"Justus","Trotzdem heißt es in seinem letzten Willen, dass Sie der Alleinerbe sind. Wie","35"
"Justus","erklären Sie uns das?","35"
"Justus","BRIAN           Äh… ich…","35"
"Justus","JUSTUS          (unterbricht) Das war nur eine rhetorische Frage. Ich kann es Ihnen sagen:","35"
"Justus","Das Testament ist gefälscht. Sie wussten, dass das Original im","35"
"Justus","Krokodilgehege versteckt war und haben es gegen eine Fälschung","35"
"Justus","ausgetauscht. Der erste Versuch vorletzte Nacht ist fehlgeschlagen, weil die","35"
"Justus","Alarmanlage losging. Also kamen Sie am nächsten Morgen wieder.","35"
"Justus","PETER           Als wir alle auf der Terrasse beim Frühstück saßen, sind Sie schließlich","35"
"Justus","reingeschlichen. Sie haben das Krokodilgehege betreten, den Koffer","36"
"Justus","gefunden und das Testament ausgetauscht.","36"
"Justus","BARCLAY & HOLLY (empörte Laute)","36"
"Justus","PETER           Dann wurde Mr. Sobek wach, und Sie konnten gerade noch fliehen. Zum","36"
"Justus","Schließen der Gehegetür war jedoch keine Zeit mehr.","36"
"Justus","HOLLY           Das glaube ich nicht…","36"
"Justus","POLIZIST        Nun, was sagen Sie dazu, Mr. Brian Kendall?","36"
"Justus","BRIAN           Das ist doch ausgemachter Blödsinn! Bitte, ich erfahre gerade, dass mein","36"
"Justus","Onkel gestorben ist und werde hier von drei neunmalklugen Burschen auf","36"
"Justus","schändliche Weise und vollkommen haltlos beschuldigt! Das müsst ihr mir","36"
"Justus","erst mal beweisen!","36"
"Justus","JUSTUS          Aber Mr. Kendall! Das ganze Geschehen wurde doch vollständig von","36"
"Justus","mehreren Kameras auf diesem Grundstück aufgezeichnet. Sind Sie denn","36"
"Justus","tatsächlich so naiv?","36"
