"Speaker","Text","Page"
"REGIE","Eilige Schritte, Keuchen","36"
"Justus","PETER           Er will abhauen, halt!","36"
"Justus","POLIZIST        Der kommt nicht weit, draußen am Tor stehen unsere Kollegen.","36"
"Justus","BRIAN           (entfernt) He, was soll das? Lassen Sie mich los! Sie haben kein Recht, mich","36"
"Justus","hier so grob anzufassen!","36"
"Justus","JUSTUS          Was so ein kleiner Bluff doch bewirken kann…","36"
"Justus","ALLE            (Lachen)","36"
"Justus","BARCLAY         Jetzt wird alles klar!","36"
"Justus","JUSTUS          Außerdem: Ich bin sicher, dass es nicht lange dauern wird, bis das Testament","36"
"Justus","als Fälschung identifiziert werden kann.","36"
"Justus","HOLLY           Würde das bedeuten, dass wir hierbleiben können?","36"
"Justus","BARCLAY         Ja?","36"
"Justus","JUSTUS          Es sieht ganz so aus. Das echte Testament muss noch gefunden werden,","36"
"Justus","aber vermutlich müssen Sie nur Miles‘ Notar ausfindig machen.","36"
"Justus","BOB             Also, äh… den echten!","36"
"Justus","JUSTUS          Stimmt!","36"
"Justus","BOB             Nicht den, der auf der Fälschung angegeben ist.","36"
"Justus","HOLLY           Oh danke, danke, danke, danke! Ich kann’s noch gar nicht fassen! (lacht)","37"
"Justus","DUSTY           (lacht) Seht nur, wie Sniffer sich freut!","37"
"Justus","BOB             Er wedelt sogar mit dem Schwanz!","37"
"Justus","ALLE            (Abschlusslacher)","37"
"REGIE","Abschlussmusik","37"
