"Speaker","Text","Page"
"REGIE","BARCLAY         … was ihr bestimmt leidtut, nicht wahr?","14"
"REGIE","HOLLY           Gar nichts tut mir Leid. Gute Nacht.","14"
"REGIE","BARCLAY         Es tut ihr Leid, Bob. Ganz sicher!","14"
"REGIE","BOB             Davon merke ich aber nichts.","14"
"REGIE","BARCLAY         Und wir sollten auch alle wieder ins Bett gehen. Aber kommt doch morgen","14"
"REGIE","zum Frühstück vorbei als kleine Wiedergutmachung.","14"
"REGIE","JUSTUS          Gern. Das machen wir, Barclay. Gute Nacht. Aber vergessen Sie nicht, die","14"
"REGIE","Alarmanlage wieder einzuschalten.","14"
"REGIE","BARCLAY         Ich habe sie gar nicht ausgeschaltet. Die Sirene hört nach zwei Minuten von","14"
"REGIE","alleine auf. (gähnt) Gute Nacht.","14"
"REGIE","JUSTUS, PETER & BOB Gute Nacht.","14"
"REGIE","JUSTUS          Kommt, Kollegen. Und nun zu dir, Zweiter.","14"
"REGIE","PETER           Ja, ich weiß, ich bin eingeschlafen, sorry! Ich war einfach müde!","14"
"REGIE","JUSTUS          Das war überaus unprofessionell von dir!","14"
"REGIE","PETER           Ich weiß! Aber ändern lässt es sich sowieso nicht mehr.","14"
"REGIE","JUSTUS          Darüber werden wir morgen noch mal reden!","14"
"REGIE","Musik","14"
"REGIE","ERZÄHLER        Am nächsten Morgen waren die drei Detektive auf dem Weg zu ihrer","14"
"REGIE","Frühstückseinladung. Auf dem Pfad zum Eingangstor suchten sie den Boden","14"
"REGIE","nach Spuren des nächtlichen Einbrechers ab, fanden jedoch nichts. Als sie um","14"
"REGIE","die Mauerecke kamen, trat gerade Dusty aus dem Tor und ging zu seinem","14"
"REGIE","Range Rover.","14"
"REGIE","DUSTY           Morgen, Jungs! Ich fahre nach Oro Valley zum Einkaufen, aber in zwei","14"
"REGIE","Stunden bin ich ja wieder da.","14"
"REGIE","BOB             Alles klar!","14"
"REGIE","DUSTY           Bei Fuß, Sniffer! Nun komm schon!","15"
"REGIE","JUSTUS          (lacht)","15"
"REGIE","PETER           Ein kauziger Typ…","15"
"REGIE","JUSTUS          Ja!","15"
"REGIE","BOB             Unglaublich.","15"
"REGIE","Auto fährt weg","15"
"REGIE","BOB             Seht mal, Freunde. Steht da unten nicht jemand? Da! Im Schatten des","15"
"REGIE","Felsens.","15"
"REGIE","JUSTUS          Ja! Ein Mann im Anzug. Jetzt hat er uns gesehen und kommt hier hoch.","15"
"REGIE","Schritte","15"
"REGIE","BRIAN KENDALL   Wer seid ihr denn?","15"
"REGIE","JUSTUS          Guten Morgen, Sir! Wir sind Freunde von Miranda Kramer und gerade hier","15"
"REGIE","zu Besuch. Können wir Ihnen helfen?","15"
"REGIE","BRIAN           (ärgerlich) Ihr mir helfen? Das wüsste ich. Nein, danke, ich kenne mich hier","15"
"REGIE","aus. Ihr wohnt hier? Auf Mirandas Kosten, nehme ich an, die hier auch","15"
"REGIE","bereits auf Miles‘ Kosten wohnt. Jedes Mal, wenn ich bei meinem Onkel","15"
"REGIE","vorbeischaue, leben hier mehr Leute!","15"
"REGIE","PETER           Wir leben nicht hier, wir sind lediglich…","15"
"REGIE","BRIAN           (unterbricht) Hier herrschen Zustände wie in einer Hippie-Kommune.","15"
"REGIE","BARCLAY         Ach, was, Brian.","15"
"REGIE","BRIAN           Mr. Ward! Es ist 9 Uhr, ich wusste gar nicht, dass auch Sie mal vor 12","15"
"REGIE","aufstehen! Ich bin um diese Zeit immer wach, denn ich gehöre zur","15"
"REGIE","arbeitenden Bevölkerung, ganz im Gegensatz zu Ihnen und Ihren","15"
"REGIE","Mitbewohnern, die hier umsonst wohnen und sich alles von meinem","15"
"REGIE","gutmütigen und zahlungswilligen Onkel finanzieren lassen.","15"
"REGIE","BARCLAY         (seufzt) Das ist nicht Ihr Bier, Brian.","15"
"REGIE","BRIAN           Ich möchte jetzt meinen Onkel sehen.","15"
"REGIE","BARCLAY         Der ist nicht da!","15"
"REGIE","BRIAN           Wo ist er?","15"
"REGIE","BARCLAY         Auf den Bahamas.","15"
"REGIE","BRIAN           Was, immer noch?","16"
"REGIE","BARCLAY         Ja, er hat seinen Aufenthalt verlängert. Vielleicht will Miles dir ja aus dem","16"
"REGIE","Weg gehen. Bevor du das nächste Mal den weiten Weg auf dich nimmst,","16"
"REGIE","könntest du ihn auf dem Handy anrufen.","16"
"REGIE","BRIAN           Das habe ich doch, er geht nie dran!","16"
"REGIE","BARCLAY         (lacht) Komisch, bei mir schon!","16"
"REGIE","BRIAN           Ihnen wird das Lachen noch vergehen! Sagen Sie meinem Onkel, er soll mich","16"
"REGIE","anrufen. Guten Tag.","16"
"REGIE","BARCLAY         (lacht) Guten Morgen, Jungs!","16"
"REGIE","JUSTUS, PETER & BOB Hi! Morgen!","16"
"REGIE","JUSTUS          War das der Neffe von Miles Kendall?","16"
"REGIE","BARCLAY         Ja, Miles‘ einziger lebender Verwandter. Er ist Anlageberater und eine","16"
"REGIE","Nervensäge ohnegleichen.","16"
"REGIE","BOB             Anlageberater. Na, dann ist ja alles klar.","16"
"REGIE","BARCLAY         (lacht) Jahrelang hatte er überhaupt keinen Kontakt zu Miles. Aber jetzt","16"
"REGIE","taucht er alle paar Wochen hier auf und versucht seinen Onkel zu","16"
"REGIE","überreden, sein Geld zu investieren anstatt es auszugeben. Naja. Egal, jetzt","16"
"REGIE","ist er ja wieder weg. Kommt rein, Jungs, das Frühstück ist fast fertig!","16"
"REGIE","JUSTUS          Schön, danke!","16"
"REGIE","BOB             Das ist nett!","16"
"REGIE","Schritte. Tor wird geöffnet","16"
"REGIE","JUSTUS          Ach, ich soll Sie übrigens herzlich von meinem Onkel grüßen und, bevor ich","16"
"REGIE","es vergesse, Mr. Sobek auch!","16"
"REGIE","BARCLAY         Den werdet ihr heute bestimmt noch kennenlernen. Dann kannst du die","16"
"REGIE","Grüße persönlich ausrichten. So, kommt mit auf die Terrasse!","16"
"REGIE","PETER           Wow! Was für ein Pool!","16"
"REGIE","BARCLAY         Ganz nett, nicht? Ihr könnt schon mal Platz nehmen, Jungs.","16"
"REGIE","PETER           Ja, danke!","16"
"REGIE","BOB             Barclay? Könnte ich noch mal kurz das Bad benutzen?","16"
"REGIE","BARCLAY         Na klar, komm mit!","16"
"REGIE","Schritte. Tür wird geöffnet.","17"
"REGIE","BARCLAY         Das Klo ist am Ende des Flurs.","17"
"REGIE","Telefonklingeln","17"
"REGIE","BARCLAY         Ich gehe mal kurz ran. – Hallo? Ah, Dr. Hardwick! Hier spricht Barclay Ward.","17"
"REGIE","Jaja, einen Augenblick, bitte. Ja, ich hole ihn ans Telefon.","17"
"REGIE","ERZÄHLER        Als Bob die Gästetoilette eine Minute später wieder verließ, hörte er aus dem","17"
"REGIE","Nebenzimmer nun eine andere Stimme am Telefon.","17"
"REGIE","DUSTY           Das ist nett von dir, Carver, und es war absolut in Ordnung ihn anzurufen.","17"
"REGIE","Aber mir geht es gut.","17"
"REGIE","BOB             (für sich) Das ist doch Dustys Stimme! Aber… der ist doch vorhin","17"
"REGIE","weggefahren…","17"
"REGIE","DUSTY           Ja, ich werde zu einem Arzt in Oro Valley gehen wegen der Medikamente,","17"
"REGIE","einverstanden? Wir sehen uns dann, wenn ich das nächste Mal in San Diego","17"
"REGIE","bin. Bis dann.","17"
"REGIE","BOB             (für sich) Schnell nach draußen, bevor er mich sieht.","17"
"REGIE","Schritte","17"
"REGIE","BOB             (räuspert sich) Da bin ich wieder, Freunde! Hmm, das sieht ja lecker aus!","17"
"REGIE","JUSTUS          Ja!","17"
"REGIE","BARCLAY         So, hier, der Orangensaft. Jetzt wird ordentlich gefrühstückt! Jungs, jetzt","17"
"REGIE","erzählt doch mal. Was führt euch zu Miranda?","17"
"REGIE","JUSTUS          Naja, Miranda hat in den letzten Nächten einige merkwürdige Dinge","17"
"REGIE","beobachtet und uns gebeten, mehr herauszufinden. Deshalb sind wir hier.","17"
"REGIE","BARCLAY         Was denn für merkwürdige Dinge?","17"
"REGIE","JUSTUS          Jemand treibt sich hier nachts herum. Und wir fragen uns, ob Sie oder Ihre","17"
"REGIE","Mitbewohner ebenfalls etwas Ungewöhnliches bemerkt haben.","17"
"REGIE","BARCLAY         Der versuchte Einbruch war natürlich ungewöhnlich. Aber sonst ist mir","17"
"REGIE","nichts aufgefallen.","17"
"REGIE","Auto fährt vor","17"
"REGIE","BARCLAY         Nanu, ist Dusty schon wieder zurück? Er war doch erst vor ein paar Minuten","17"
"REGIE","losgefahren! Ah, da hat er wohl gemerkt, dass der Einkaufszettel noch in der","17"
"REGIE","Küche liegt.","17"
"REGIE","PETER           Da kommt Holly mit einem Mann. Den kennen wir noch nicht.","17"
"REGIE","BARCLAY         Das ist Manolo, unser neuer Gärtner.","18"
"REGIE","HOLLY           Barclay! Was treibst du denn so früh hier draußen?","18"
"REGIE","BARCLAY         Guten Morgen, Holly!","18"
"REGIE","HOLLY           Ich habe fürchterlich geschlafen. Diese Aufregung letzte Nacht. Und wie ich","18"
"REGIE","sehe, öffnest du der kriminellen Jugend jetzt auch noch freiwillig Tür und Tor.","18"
"REGIE","BOB             (räuspert sich)","18"
"REGIE","HOLLY           Ach, Manolo, Darling! Die Agaven brauchen Wasser!","18"
"REGIE","MANOLO          Ich geh schon.","18"
"REGIE","HOLLY           Barclay, wir sollten uns dringend nach einem neuen Gärtner umsehen, bevor","18"
"REGIE","Manolo uns noch sämtliche Pflanzen ruiniert. Hattet ihr überhaupt","18"
"REGIE","Referenzen, als wir ihn eingestellt haben?","18"
"REGIE","BARCLAY         Hm-mm. Du hast ihn eingestellt, Holly. Und seine Referenzen waren sein","18"
"REGIE","Waschbrettbauch und sein feuriger Blick.","18"
"REGIE","PETER           (lacht)","18"
"REGIE","HOLLY           Ich geh wieder rein. Und beschwer dich nicht bei mir, wenn die Burschen dir","18"
"REGIE","hinter deinem Rücken die Bude ausräumen. Ich habe dich gewarnt!","18"
"REGIE","JUSTUS, PETER & BOB (Unmutsäußerungen)","18"
"REGIE","BARCLAY         Einfach nicht hinhören, Jungs! Sie meint es nicht so. Naja; ich muss es","18"
"REGIE","wissen, ich war schließlich sieben Monate mit ihr verheiratet.","18"
"REGIE","JUSTUS & BOB    (lachen)","18"
"REGIE","PETER           Sie tun mir Leid.","18"
"REGIE","DUSTY           (schreit) Hilfe!","18"
"REGIE","BOB             Das ist Dusty!","18"
"REGIE","DUSTY           Hilfe! Schnell! Alles raus! Schnell! Nun macht doch! Alle raus, schnell!","18"
"REGIE","Kommt, na, kommt jetzt!","18"
"REGIE","JUSTUS, PETER & BOB (Erschrecken)","18"
"REGIE","PETER           Ein Krokodil!","18"
"REGIE","BOB             Oh nein!","18"
"REGIE","BARCLAY         Los, Jungs, lauft! Das Viech ist gefährlich!","18"
"REGIE","PETER           Dusty und Barclay rennen ins Haus! Und das Krokodil hinterher!","19"
"REGIE","BOB             Das schaffen wir nicht mehr!","19"
"REGIE","JUSTUS          Wir bleiben hier in Deckung.","19"
"REGIE","Gerumpel. Krokodil faucht","19"
"REGIE","JUSTUS, PETER & BOB (Schreie)","19"
"REGIE","BOB             Es versucht, die Terrassentür einzudrücken!","19"
"REGIE","JUSTUS          Kollegen, die Scheibe hält nicht mehr lange! Wenn sie bricht, kann das Tier","19"
"REGIE","ins Haus!","19"
"REGIE","PETER           Wir müssen das Viech ablenken! Ich werf meinen Schuh nach ihm. Moment.","19"
"REGIE","BOB             Mach das, los! Na, los!","19"
"REGIE","Poltern, dumpfer Aufschlag","19"
"REGIE","PETER           Getroffen!","19"
"REGIE","JUSTUS          Das Krokodil verharrt. Es blickt hierher! Jetzt kommt es auf uns zu!","19"
"REGIE","BOB             Oh nein!","19"
"REGIE","PETER           Leute, rauf auf den Tisch! Ich lenke es ab.","19"
"REGIE","Wasserplatschen","19"
"REGIE","BOB             Peter ist in den Pool gesprungen! Ist er wahnsinnig geworden? Krokodile","19"
"REGIE","können doch schwimmen!","19"
"REGIE","PETER           Los! Verzieh dich, du blöde Echse!","19"
"REGIE","RAVEN           Mr. Sobek! Fresschen!","19"
"REGIE","BOB             Justus! Justus! Da am Fenster ist eine Frau!","19"
"REGIE","RAVEN           Hier, du Vielfraß!","19"
"REGIE","BOB             Was macht sie denn da?","19"
"REGIE","JUSTUS          Sie hat dem Krokodil rohes Fleisch vor die Schnauze geworfen!","19"
"REGIE","RAVEN           Und hier! Und hier!","19"
"REGIE","JUSTUS          Gut! Sie lockt es von uns weg.","19"
"REGIE","RAVEN           Gleich um die Ecke ist das Gehege, Jungs! Ich werfe jetzt vom anderen","19"
"REGIE","Fenster aus das Fleisch hinter das Tor. Sobald Mr. Sobek dahinter ist, müsst","19"
"REGIE","ihr es schließen!","20"
"REGIE","BOB             Ich übernehm das, Just.","20"
"REGIE","JUSTUS          Sehr gut.","20"
"REGIE","Schritte","20"
"REGIE","RAVEN           Und hier das letzte Stück!","20"
"REGIE","Tor fällt ins Schloss","20"
"REGIE","BOB             So, mein Freund!","20"
"REGIE","Krokodil knurrt","20"
"REGIE","BOB             (erleichtertes Stöhnen)","20"
"REGIE","Musik","20"
"REGIE","ERZÄHLER        Zehn Minuten später saßen die drei Detektive gemeinsam mit Barclay, Dusty","20"
"REGIE","und dessen Enkelin Raven auf der Terrasse. Allen stand der Schock noch immer","20"
"REGIE","ins Gesicht geschrieben. Nur Holly hatte sich nicht mehr blicken lassen.","20"
"REGIE","JUSTUS          Also, ihr Einsatz mit den Fleischstücken hat uns vermutlich das Leben","20"
"REGIE","gerettet, Raven!","20"
"REGIE","RAVEN           Eine Selbstverständlichkeit.","20"
"REGIE","DUSTY           Wie konnte Mr. Sobek nur ausbrechen? Das ist doch noch nie passiert.","20"
"REGIE","JUSTUS          Wieso um alles in der Welt haben Sie ein ausgewachsenes Nil-Krokodil in","20"
"REGIE","Ihrem Garten?","20"
"REGIE","BARCLAY         Es gehört Miles, er hat es, seit es ein Baby war.","20"
"REGIE","DUSTY           Aber wie konnte es ausbrechen?","20"
"REGIE","BOB             Die Tür hat einen Schließmechanismus, den das Krokodil unmöglich selbst","20"
"REGIE","öffnen kann.","20"
"REGIE","JUSTUS          Dann hat also entweder jemand die Tür geöffnet oder sie versehentlich","20"
"REGIE","offen gelassen. Wann wurde das Gehege denn zum letzten Mal betreten?","20"
"REGIE","DUSTY           Betreten? Niemals! Wir werfen Mr. Sobek sein Futter über den Zaun!","20"
"REGIE","PETER           Aber das Gehege muss doch mal gereinigt werden!","20"
"REGIE","BARCLAY         Das macht immer Miles.","20"
"REGIE","BOB             Und wann zuletzt?","20"
"REGIE","DUSTY           Jedenfalls nicht in der letzten Woche.","21"
"REGIE","BARCLAY         Solange ist er nämlich schon auf Barbados.","21"
"REGIE","JUSTUS          Dann muss jemand das Krokodil freigelassen haben. Womit sich der Fall","21"
"REGIE","Miranda Kramer möglicherweise auf ganz Desert View ausdehnt.","21"
"REGIE","DUSTY           Was hat Miranda damit zu tun?","21"
"REGIE","PETER           Mrs. Kramer ist in den letzten Nächten von einem Unbekannten bedroht","21"
"REGIE","worden, deswegen sind wir hier!","21"
"REGIE","JUSTUS          Ich mag mich irren, aber den Ausbruch eines Krokodils, das seit Jahrzehnten in","21"
"REGIE","einem sicheren Gehege lebt, halte ich zu diesem Zeitpunkt für keinen Zufall.","21"
"REGIE","HOLLY           Natürlich ist es kein Zufall! Ihr habt die Tür geöffnet.","21"
"REGIE","BARCLAY         Holly!","21"
"REGIE","BOB             Was?","21"
"REGIE","PETER           Das haben wir nicht! Wir wussten ja nicht einmal, dass es hier ein Krokodil","21"
"REGIE","gibt.","21"
"REGIE","HOLLY           Ich lebe hier seit Jahren, und Mr. Sobek ist noch nie ausgebrochen. Das","21"
"REGIE","passiert ausgerechnet an dem Tag, an dem ihr zum ersten Mal hier auftaucht.","21"
"REGIE","BOB             Wir haben nichts damit zu tun!","21"
"REGIE","HOLLY           Und jetzt verschwindet von hier, bevor ich mich vergesse!","21"
"REGIE","PETER           (aufgebracht) Also…","21"
"REGIE","JUSTUS          Kommt, Kollegen.","21"
"REGIE","DUSTY           Komm, Sniffer! Wir machen einen schönen Spaziergang.","21"
"REGIE","RAVEN           Ich komme mit, Dusty!","21"
"REGIE","BARCLAY         Holly!","21"
"REGIE","HOLLY           (äfft ihn nach) Holly, Holly! Und jetzt raus mit euch!","21"
"REGIE","PETER           Also!","21"
"REGIE","BOB             Meinetwegen…","21"
"REGIE","PETER           Äußerst liebenswürdig, diese Holly!","21"
"REGIE","BOB             Wartet mal, Freunde. Ich muss euch etwas Merkwürdiges berichten.","21"
"REGIE","JUSTUS          Was denn?","21"
"REGIE","BOB             Als ich da drin, in dem Haus, auf Toilette war, ist Barclay ans Telefon","22"
"REGIE","gegangen und hat dann Dusty an den Apparat geholt.","22"
"REGIE","PETER           Hä?","22"
"REGIE","BOB             Ja! Also, zumindest klang er wie Dusty. Ich hab ja nur seine Stimme gehört,","22"
"REGIE","aber Dusty war ja gar nicht da, sondern zum Einkaufen auf dem Weg nach","22"
"REGIE","Oro Valley!","22"
"REGIE","PETER           Ja aber… Dusty kam ja zurück!","22"
"REGIE","BOB             Schon, aber das war doch viel später!","22"
"REGIE","PETER           Warum war er eigentlich so schnell wieder da? Wollte er nicht zwei Stunden","22"
"REGIE","weg sein?","22"
"REGIE","JUSTUS          Vielleicht wollte er tatsächlich seinen Einkaufszettel holen.","22"
"REGIE","BOB             Aber er kam erst zurück, nachdem ich ihn am Telefon gehört hatte! Was","22"
"REGIE","keinen Sinn ergibt.","22"
"REGIE","JUSTUS          Er kann also nicht am Telefon gewesen sein. Sonst wäre Barclay nicht","22"
"REGIE","überrascht gewesen, als Dusty schon zurückkam. Oder aber Barclay hat uns","22"
"REGIE","etwas vorgemacht. Kollegen, wir werden sie beide mit einem Fragezeichen","22"
"REGIE","versehen. Und Holly ebenfalls.","22"
"REGIE","PETER           Und den Gärtner Manolo.","22"
"REGIE","BOB             Im Grunde genommen sind alle verdächtig. Auch Dustys Enkelin Raven. Von","22"
"REGIE","der wissen wir nämlich gar nicht, wo sie war, als Mr. Sobek auf die Terrasse lief.","22"
"REGIE","RAVEN           Ich war in der Küche und hab mir Cornflakes gemacht!","22"
"REGIE","JUSTUS, PETER & BOB (Erschrecken)","22"
"REGIE","BOB             Raven! Wir haben… wir haben… gar nicht bemerkt, wie du…","22"
"REGIE","RAVEN           (unterbricht) Schon klar! „Der Lauscher an der Wand hört seine eigene","22"
"REGIE","Schand‘“. Aber ich habe Mr. Sobek nicht freigelassen, ich wär‘ ja schön blöd!","22"
"REGIE","Und Opa Dusty war es auch nicht. Der hätte viel zu viel Angst um Sniffer.","22"
"REGIE","PETER           Sniffer? Den Hund, den gibt’s doch gar nicht.","22"
"REGIE","RAVEN           Na und? Er hätte trotzdem Angst um ihn gehabt!","22"
"REGIE","BOB             Aha.","22"
"REGIE","JUSTUS          Wer hat denn deiner Meinung nach das Krokodil freigelassen?","22"
"REGIE","RAVEN           (seufzt) Kennt ihr die Geschichte von John Dewey?","22"
"REGIE","BOB             (genervt, stöhnt) Schon wieder…","23"
"REGIE","JUSTUS          Ja, kennen wir. Willst du darauf hinaus, dass der Geist von John Dewey hier","23"
"REGIE","sein Unwesen treibt?","23"
"REGIE","RAVEN           Dass es hier im Canyon spukt, weiß jeder, der in dieser Gegend lebt. Vor ein","23"
"REGIE","paar Tagen erst habe ich im Internet gelesen, dass John Dewey wieder","23"
"REGIE","gesichtet wurde. Es gab sogar ein Foto.","23"
"REGIE","JUSTUS          Tatsächlich? Weißt du noch, auf welcher Seite das war?","23"
"REGIE","RAVEN           Hier! Ich zeige es euch auf meinem Display. Hier, eine Seite, die sich mit","23"
"REGIE","Spukerlebnissen und Geistererscheinungen beschäftigt, da, im Forum.","23"
"REGIE","Moment… Da ist es!","23"
"REGIE","JUSTUS          Darf ich mal? Hm! Der User moonchild66 hat nachts ein Foto gemacht.","23"
"REGIE","Angeblich hat sich die Gestalt danach in Luft aufgelöst. User Robert schreibt","23"
"REGIE","dazu: „Ich würde mich an deiner Stelle nicht mehr dort herumtreiben, es","23"
"REGIE","heißt, wer den Geist von John Dewey dreimal sieht, ist dem Tod geweiht.“","23"
"REGIE","PETER           Na toll. Ja, und wo ist nun das Foto?","23"
"REGIE","JUSTUS          Moment… Da haben wir’s. Sehr aufschlussreich!","23"
"REGIE","BOB             Was hast du entdeckt, Erster?","23"
"REGIE","PETER           Ja, zeig doch mal!","23"
"REGIE","JUSTUS          Hier, Zweiter.","23"
"REGIE","PETER           (keucht) Das ist ja… Hundertprozentig, das ist der Typ von gestern abend!","23"
"REGIE","RAVEN           Du hast ihn gesehen?","23"
"REGIE","PETER           Ja! An der Straße! Danach bin ich in einen Kaktus gekracht. Siehst du, Justus,","23"
"REGIE","ich hab’s dir ja gesagt!","23"
"REGIE","JUSTUS          Peter, ich…","23"
"REGIE","PETER           Und was ist mit Miranda? Wie oft hat sie John Dewey gesehen? Zweimal?","23"
"REGIE","Oder sogar schon dreimal? Wir müssen sie unbedingt warnen!","23"
"REGIE","RAVEN           Miranda hat ihn auch gesehen? War es das, wovon ihr vorhin auf der","23"
"REGIE","Terrasse gesprochen habt?","23"
"REGIE","JUSTUS          Raven, ich glaube nicht an Geister. Und was immer sich hier in den Nächten","23"
"REGIE","Merkwürdiges tut, wir werden es herausfinden.","23"
"REGIE","RAVEN           Na dann, viel Erfolg. Ich muss jetzt los, bin noch verabredet.","23"
"REGIE","JUSTUS          Okay…","23"
"REGIE","BOB             Tschau.","24"
"REGIE","Schritte, die sich entfernen","24"
"REGIE","JUSTUS          Kollegen, die Sache wird immer interessanter.","24"
"REGIE","BOB             Inwiefern, Erster?","24"
"REGIE","JUSTUS          Das Foto, das moonchild66 ins Netz gestellt hat, ist eine erbärmliche","24"
"REGIE","Fälschung!","24"
"REGIE","BOB             Wieso?","24"
"REGIE","PETER           Wie kommst du denn darauf?","24"
"REGIE","JUSTUS          Ganz einfach: Ich habe es eben auf dem Display vergrößert, und da war trotz","24"
"REGIE","der dunklen Aufnahme ganz deutlich zu erkennen, dass der angebliche Geist","24"
"REGIE","von John Dewey Turnschuhe trägt!","24"
"REGIE","PETER           Na und?","24"
"REGIE","JUSTUS          Nach John Deweys Tod sind grob geschätzt 100 Jahre vergangen, bevor","24"
"REGIE","Turnschuhe überhaupt erfunden wurden, Zweiter!","24"
"REGIE","Musik","24"
"REGIE","ERZÄHLER        Als die drei Detektive kurze Zeit später zu ihrer Unterkunft zurückkamen,","24"
"REGIE","war Miranda nicht da. Und als sie nach einer halben Stunde in die Hütte","24"
"REGIE","zurückkehrte, wirkte sie vollkommen aufgelöst.","24"
"REGIE","Tür wird geöffnet","24"
"REGIE","JUSTUS          Miranda! Was ist mit Ihnen?","24"
"REGIE","MIRANDA         (atmet aufgeregt) Ich komme gerade von Raven. Wisst ihr, was sie mir","24"
"REGIE","erzählt hat?","24"
"REGIE","JUSTUS          Ich kann’s mir denken…","24"
"REGIE","MIRANDA         Es gibt John Dewey wirklich! Ich bin nicht die Einzige, die ihn gesehen hat.","24"
"REGIE","Und wer ihn dreimal zu Gesicht bekommt… Deswegen habe ich eine","24"
"REGIE","Entscheidung getroffen.","24"
"REGIE","BOB             Sie wollen doch nicht etwa…","24"
"REGIE","MIRANDA         Und ob. Ich kann hier nicht bleiben. Ich werde zu meiner Schwester gehen.","24"
"REGIE","Noch heute!","24"
"REGIE","JUSTUS          Aber Miranda…","24"
"REGIE","BOB             Warten Sie doch!","24"
"REGIE","JUSTRUS         Miranda, bitte, wir werden uns hier heute nacht auf die Lauer legen und den","25"
"REGIE","Geist von John Dewey auf frischer Tat ertappen.","25"
"REGIE","MIRANDA         So?","25"
"REGIE","JUSTUS          Die Voraussetzung ist allerdings, dass Sie sich dafür entscheiden, nun doch","25"
"REGIE","noch hier zu bleiben, denn ohne Ihre Anwesenheit wäre ein drittes","25"
"REGIE","Erscheinen seinerseits ja vollkommen sinnlos!","25"
"REGIE","MIRANDA         (seufzt) Also, ich weiß nicht…","25"
"REGIE","Musik","25"
"REGIE","ERZÄHLER        Als auf Desert View die Lichter erloschen waren, legten sich die drei Detektive","25"
"REGIE","auf die Lauer. Peter huschte bis zum Parkplatz, dem besten Beobachtungs-","25"
"REGIE","posten für das Tor und die Straße, während Bob und Justus sich in der Nähe","25"
"REGIE","von Mirandas Haus versteckten. Über Funk blieben die drei Jungen in","25"
"REGIE","Kontakt.","25"
"REGIE","JUSTUS          (über Funk) Peter und Bob, bitte kommen!","25"
"REGIE","PETER           Hier Peter! Was gibt es, Erster?","25"
"REGIE","JUSTUS          (über Funk) Verdächtige Gestalt nähert sich dem Haus. Sie trägt einen","25"
"REGIE","Cowboyhut und… (bricht ab)","25"
"REGIE","BOB             (schreit) (Verbindung wird mit einem Piepen beendet)","25"
"REGIE","PETER           Was ist da los, Erster? Justus, das war doch Bob, der da geschrien hat! Bob!","25"
"REGIE","Bob, bitte melde dich! Bob!","25"
"REGIE","BOB             (über Funk) (stöhnt) Verdammt, ich bin ausgerutscht und auf einen Kaktus","25"
"REGIE","gefallen! Aua. (Verbindung wird mit einem Piepen beendet)","25"
"REGIE","JUSTUS          (über Funk) Der Geist flüchtet. Geh in Deckung, Zweiter, er müsste gleich bei","25"
"REGIE","dir sein! Ich kümmere mich um Bob! (Verbindung wird mit einem Piepen","25"
"REGIE","beendet)","25"
"REGIE","PETER           Verstanden! (flüstert) Da kommt er schon. Ein Junge. Er bleibt stehen. Er hat","25"
"REGIE","ein Smartphone. Er drückt aufs Display, und jetzt scheint er mit jemandem","25"
"REGIE","zu skypen. Ich geh mal näher ran. Ende.","25"
"REGIE","MÄNNLICHE STIMME (unverständlich)","25"
"REGIE","WEIBLICHE STIMME (über Skype) Du bist schon wieder zurück? Wie ist es gelaufen?","25"
"REGIE","MÄNNLICHE STIMME Gar nicht gut ist es gelaufen! Die hätten mich fast erwischt! Die haben voll","25"
"REGIE","auf der Lauer gelegen. Ich konnte gerade noch abhauen. War echt knapp!","25"
"REGIE","WEIBLICHE STIMME (über Skype) Mist.","25"
"REGIE","PETER           (flüstert) Diese Stimme…","26"
"REGIE","MÄNNLICHE STIMME Du, ich mach das nicht mehr. Nicht, dass ich noch erwischt und angezeigt","26"
"REGIE","werde!","26"
"REGIE","WEIBLICHE STIMME (über Skype) Das kannst du nicht machen. Du hast es mir versprochen. Du","26"
"REGIE","hast gesagt, du hilfst mir.","26"
